#CODE;ENGLISH;FRENCH;GERMAN;;SPANISH;;;;;;;;;x
EVTOPTA105007;But [From.GetTitledFirstName] did not change her mind;Mais [From.Get_le_TitledFirstName] n'a pas changé d'avis;Doch [From.GetTitledFirstName] hat ihre Meinung nicht geändert ;;Pero [From.GetTitledFirstName] no cambió de opinión;;;;;;;;;x
EVTOPTA105010;I should suggest one of my courtiers!;Je devrais proposer l'un de mes courtisans !;Ich sollte einen meiner Höflinge vorschlagen!;;¡Debería sugerir uno de mis cortesanos!;;;;;;;;;x
EVTOPTA105011;Yes, that courtier would be perfect;C'est vrai, ce courtisan est le candidat idéal;Ja, dieser Höfling wäre perfekt ;;Sí, ese cortesano sería perfecto;;;;;;;;;x
EVTOPTA105012;Thank you, [FromFrom.GetTitledFirstName]!;Merci, [FromFrom.GetTitledFirstName] !;Habt Dank, [FromFrom.GetTitledFirstName]!;;¡Gracias, [FromFrom.GetTitledFirstName]!;;;;;;;;;x
EVTOPTA105013;[Root.Liege.GetSheHeCap] accepted my candidate as Chief Qadi!;[Root.Liege.GetIlElleCap] a choisi le candidat que j'ai proposé pour devenir nouveau Cadi !;[Root.Liege.GetSheHeCap] akzeptiert meinen Kandidaten für den Posten des Ober-Kadi! ;;¡Aceptó a mi candidato como Cadí jefe!;;;;;;;;;x
EVTOPTA105014;I am the new Chief Qadi! Fear my justice!;Je suis le nouveau Cadi ! La justice, c'est moi !;Ich bin der neue Ober-Kadi! Fürchtet meine Gerechtigkeit!;;¡Soy el nuevo Cadí jefe! ¡Temed mi justicia!;;;;;;;;;x
EVTOPTA105020;Even this courtier would be better as Chief Qadi!;Même ce modeste courtisan ferait un meilleur Cadi !;Sogar dieser Höfling wäre besser als Ober-Kadi geeignet! ;;¡Hasta este cortesano sería mejor Cadí jefe!;;;;;;;;;x
EVTOPTA105021;You are right, your courtier would be a better choice;Vous avez raison, votre courtisan serait plus à même d'occuper cette fonction;Ihr habt Recht, Euer Höfling wäre die bessere Wahl;;Tienes razón, tu cortesano sería una mejor opción;;;;;;;;;x
EVTOPTA105023;[From.GetTitledFirstName] is the new Chief Qadi! Praise Allah!;[From.Get_Le_TitledFirstName] est le nouveau Cadi ! Allah est Grand !;[From.GetTitledFirstName] ist der neue Ober-Kadi! Gepriesen sei Allah! ;;¡[From.GetTitledFirstName] es el nuevo Cadí Jefe! ¡Alabado sea Alá!;;;;;;;;;x
EVTOPTA105025;May Allah destroy [FromFrom.GetTitledFirstName]'s house!;Que la colère d'Allah s'abatte sur la maison [FromFrom.Get_du_TitledFirstName] ! ;Möge Allah [FromFrom.GetTitledFirstName]s Haus zerstören! ;;¡Que Alá destruya la casa de [FromFrom.GetTitledFirstName]!;;;;;;;;;x
EVTOPTA105030;Eighty lashes for that drunkard!;80 coups de fouet pour cet ivrogne !;Achtzig Peitschenhiebe für den Trunkenbold! ;;¡Ochenta latigazos a ese borracho!;;;;;;;;;x
EVTOPTA105031;The lashes made me cry out in pain...;J'ai pleuré de douleur sous cette pluie de coups de fouet...;Die Peitschenhiebe ließen mich vor Schmerz aufschreien... ;;Los latigazos me hicieron chillar del dolor...;;;;;;;;;x
EVTOPTA105032;I promised but all I could think of was a can of wine to cure my headache;J'ai promis mais je ne pensais qu'à engloutir une carafe de vin pour faire passer ma migraine !;Ich habe es versprochen, doch ich konnte an nichts anderes denken als an eine Karaffe Wein, um meine Kopfschmerzen zu kurieren ;;Lo prometí, pero lo único en lo que podía pensar era en el vino para curarme el dolor de cabeza;;;;;;;;;x
EVTOPTA105035;The Chief Qadi would know what to do!;Le Cadi souhaiterait savoir ce que vous feriez à sa place !;Der Ober-Kadi wüsste, was zu tun ist!;;¡El Cadí jefe sabría qué hacer!;;;;;;;;;x
EVTOPTA105036;Confront the accused one;Confronter l'accusé;Konfrontiert den Beschuldigten ;;Enfrentar al acusado;;;;;;;;;x
EVTOPTA105037;Try to bribe [From.GetTitledFirstName] to keep quiet;Tenter de soudoyer [From.Get_le_TitledFirstName] pour qu'il garde le silence;Versucht [From.GetTitledFirstName] zu bestechen, um ihn ruhigzustellen;;Intenta sobornar a [From.GetTitledFirstName] para mantenerlo callado;;;;;;;;;x
EVTOPTA105038;You have no witnesses, only rumors and they are false!;Il n'y a aucun témoin, seulement des rumeurs, et elles sont fausses !;Ihr habt keine Zeugen, nur Gerüchte, und diese sind falsch! ;;¡No tienes testigos, solo rumores y todos ellos son falsos!;;;;;;;;;x
EVTOPTA105039;But then [From.GetTitledFirstName] told me [From.GetSheHe] wouldn't do something about it!;Mais ensuite [From.Get_le_TitledFirstName] m'a assuré qu'[From.GetIlElle] ne ferait rien concernant ce problème !;Doch dann berichtete [From.GetTitledFirstName] mir, nichts dagegen zu unternehmen!;;¡Pero luego, [From.GetTitledFirstName] me dijo que no haría nada al respecto!;;;;;;;;;x
EVTOPTA105041;I believe [From.GetTitledFirstName];Je crois [From.Get_le_TitledFirstName];Ich glaube [From.GetTitledFirstName];;Creo a [From.GetTitledFirstName];;;;;;;;;x
EVTOPTA105042;I do not believe you but there's nothing I can do;Je ne vous crois pas mais malheureusement, je ne peux rien faire;Ich glaube dir nicht, aber es gibt nichts, was ich tun könnte ;;No te creo, pero no puedo hacer nada para remediarlo.;;;;;;;;;x
EVTOPTA105043;I... I don't know what to do...;Je... Je ne sais pas quoi faire...;Ich...ich weiß nicht, was ich tun soll... ;;No... No sé qué hacer...;;;;;;;;;x
EVTOPTA105044;The hundred lashes only wounded me, not my soul nor my love!;Les cent coups de fouet ne feront que me blesser, mais ni mon amour ni mon âme ne s'en verront affectés !;Die einhundert Peitschenhiebe verletzten nur mich, weder meine Seele noch meine Liebe! ;;¡Los cien latigazos solo hirieron mi cuerpo, pero ni mi alma ni mi amor!;;;;;;;;;x
EVTOPTA105050;With the Court Calligrapher's help, the mosque should look wonderful!;Grâce à l'aide du Calligraphe de la Cour, la mosquée sera bientôt magnifique !;Dank des Hofkalligraphen wird die Moschee wunderschön!;;Con la ayuda del calígrafo de la corte, ¡la mezquita debería quedar fantástica!;;;;;;;;;x
EVTOPTA105051;I would be more than honored to create designs for the decoration;Je serais plus qu'honoré de créer des motifs pour décorer la mosquée;Ich wäre mehr als geehrt, Entwürfe für das Dekor zu erstellen;;Sería para mí todo un honor crear diseños para la decoración;;;;;;;;;x
EVTOPTA105052;[From.GetSheHeCap] has outdone [From.GetHerselfHimself]! Bravo, [From.GetTitledFirstName]!;[From.GetIlElleCap] a fait un travail fantastique ! Bravo, [From.GetTitledFirstName] !;[From.GetSheHeCap] hat sich selbst übertroffen! Bravo, [From.GetTitledFirstName]!;;¡Se ha superado con creces! ¡Bravo, [From.GetTitledFirstName]!;;;;;;;;;x
EVTOPTA105053;'No' was the answer I got!;'Non !' Voilà la réponse à laquelle j'ai eu droit.;Die Antwort, die ich erhielt, war "Nein"!;;¡Todo lo que me respondió fue 'No'!;;;;;;;;;x
EVTOPTA105054;[From.GetSheHeCap] loved it! Time to start working seriously on this!;[From.GetIlElleCap] a adoré ! Bien, il est grand temps de commencer à travailler sérieusement sur ce projet.;[From.GetSheHeCap] liebte es! Zeit, ernsthaft daran zu arbeiten! ;;¡Le han encantado! ¡Es hora de comenzar a trabajar en esto seriamente! ;;;;;;;;;x
EVTOPTA105055;[From.GetTitledFirstName] was most pleased with the designs;[From.Get_Le_TitledFirstName] a beaucoup aimé les motifs;[From.GetTitledFirstName] war sehr zufrieden mit den Entwürfen ;;A [From.GetTitledFirstName] le parecieron perfectos los diseños;;;;;;;;;x
EVTOPTA105060;I should send the hilya to the [Root.Religion.GetName] Caliph!;Je devrais envoyer cette calligraphie au Calife [Root.Religion.GetName] !;Ich sollte die Hilya an den [Root.Religion.GetName]en Kalifen senden!;;¡Debería enviar la hilya al Califa [Root.Religion.GetName]!;;;;;;;;;x
EVTOPTA105061;Beautiful! Many thanks to you, [From.GetTitledFirstName];Magnifique ! Mille mercis, [From.GetTitledFirstName];Wunderschön! Habt vielen Dank, [From.GetTitledFirstName];;¡Perfecto! Muchísimas gracias, [From.GetTitledFirstName];;;;;;;;;x
EVTOPTA105065;Ask [Root.Liege.GetTitledFirstName] to pay for the 'whole book';Demander [Root.Liege.Get_au_TitledFirstName] de payer pour 'la totalité du livre';Bittet [Root.Liege.GetTitledFirstName], das "ganze Buch" zu bezahlen;;Pedir a [Root.Liege.GetTitledFirstName] que pague el 'libro completo';;;;;;;;;x
EVTOPTA105066;To pay for all the materials? Yes, of course!;De payer la totalité des matériaux ? Oui, bien sûr !;Für das gesamte Material zu zahlen? Ja, natürlich! ;;¿Que pagara todos los materiales?... ¡Sí, por supuesto!;;;;;;;;;x
EVTOPTA105067;[From.GetTitledFirstName] agreed to pay for whatever I might need!;[From.Get_Le_TitledFirstName] a accepté de payer pour tout ce dont j'aurai besoin !;[From.GetTitledFirstName] stimmte zu, zu bezahlen, egal was ich brauchen würde! ;;¡[From.GetTitledFirstName] aceptó pagar todo lo que necesitara!;;;;;;;;;x
EVTOPTA105068;Imprison Court Calligrapher [From.GetTitledFirstName];Emprisonner le maître-calligraphe [From.GetTitledFirstName];Nehmt den Hofkalligraphen [From.GetTitledFirstName] gefangen;;Encarcelar al calígrafo de la corte [From.GetTitledFirstName];;;;;;;;;x
EVTOPTA105069;...being thrown into [From.GetHerHis] dungeons!;... d'aller croupir au fin fond de sa prison !;...ich in [From.GetHerHis] Verlies geworfen werde!;;... arrojándome a las mazmorras!;;;;;;;;;x
EVTOPTA105075;I will dedicate this to [Root.Liege.Spouse.GetTitledFirstName]!;Je vais la dédier [Root.Liege.Spouse.Get_au_TitledFirstName] !;Ich widme dies [Root.Liege.Spouse.GetTitledFirstName]!;;¡Se la dedicaré a [Root.Liege.Spouse.GetTitledFirstName]!;;;;;;;;;x
EVTOPTA105076;Wonderful! Our court would be less beautiful without your voice;Magnifique ! Notre Cour serait bien triste sans le timbre de votre voix;Wunderbar! Unserem Hof würde ohne Eure Stimme etwas fehlen;;¡Maravilloso! Nuestra corte sería menos bella sin tu voz;;;;;;;;;x
EVTOPTA105077;Here, a small token of mine and [From.GetTitledFirstName]'s appreciation...;Tenez, voici un gage de notre admiration, de ma part ainsi que de celle [From.Get_du_TitledFirstName]...;Hier, ein kleines Zeichen der Anerkennung von mir und [From.GetTitledFirstName]...;;Acepta este pequeño obsequio como muestra de mi gratitud y de la de [From.GetTitledFirstName];;;;;;;;;x
EVTOPTA105078;[From.GetTitledFirstName] was as touched by the song as I were;Ma ballade a autant ému [From.Get_le_TitledFirstName] qu'elle m'a ému, moi;[From.GetTitledFirstName] war von meinem Lied so ergriffen, wie ich es war ;;A [From.GetTitledFirstName] le conmovió la canción tanto como a mí;;;;;;;;;x
EVTOPTA105100;I find inspiration in [Root.Liege.GetTitledFirstName] and read her the poem;J'ai puisé mon inspiration dans le regard [Root.Liege.Get_du_TitledFirstName] puis je lui ai lu mon poème;In [Root.Liege.GetTitledFirstName] finde ich Inspiration und lese ihr mein Gedicht vor ;;Encuentro inspiración en [Root.Liege.GetTitledFirstName] y le leo el poema;;;;;;;;;x
EVTOPTA105101;Not exactly appropriate, but very sweet;Ce n'est pas très approprié, mais le poème est très joli;Nicht unbedingt schicklich, aber sehr süß;;No muy adecuado, pero sí muy dulce.;;;;;;;;;x
EVTOPTA105102;Good work my dear poet, good work!;Bon travail, cher Poète, très bon travail !;Gute Arbeit, mein lieber Dichter, gute Arbeit! ;;¡Buen trabajo, mi querido poeta, buen trabajo!;;;;;;;;;x
EVTOPTA105103;Seems as [From.GetTitledFirstName] liked it...;Il semble que [From.Get_le_TitledFirstName] l'a beaucoup aimé...;Sieht so aus, als hätte [From.GetTitledFirstName] es gemocht...;;Parece que a [From.GetTitledFirstName] le ha gustado...;;;;;;;;;x
EVTOPTA105150;Poison the wine [Root.Liege.GetTitledFirstName] will drink;Empoisonner le vin que [Root.Liege.Get_le_TitledFirstName] va boire;Vergiftet den Wein, den [Root.Liege.GetTitledFirstName] trinken wird;;Envenenar el vino que [Root.Liege.GetTitledFirstName] beberá;;;;;;;;;x
EVTOPTA105151;Imprison that [From.GetManWoman]! Obey my voice!;Emprisonnez cet individu ! Obéissez-moi !;Kerkert diesen [From.GetManWoman] ein! Gehorcht meiner Stimme! ;;¡Encarceladle! ¡Obedeced mis palabras!;;;;;;;;;x
EVTOPTA105152;At least the bastard is sick as a dog!;Au moins, cette enflure est malade comme un chien !;Wenigstens geht es dem Bastard hundeelend! ;;¡Al menos el bastardo está enfermo como un perro!;;;;;;;;;x
EVTOPTA105200;[Root.Liege.GetTitledFirstName] must approve these changes!;[Root.Liege.Get_Le_TitledFirstName] doit approuver ces changements !;[Root.Liege.GetTitledFirstName] muss diese Veränderungen absegnen! ;;¡[Root.Liege.GetTitledFirstName] debe aprobar estos cambios!;;;;;;;;;x
EVTOPTA105201;Whatever you need, just make these buildings sturdy!;Vous aurez tout ce que vous voulez, tout ce que je demande, ce sont des bâtiments solides !;Was immer Ihr benötigt, Hauptsache diese Gebäude sind robust! ;;Lo que necesites, ¡pero haz que los edificios sean inquebrantables!;;;;;;;;;x
EVTOPTA105202;'No money for improvements', [From.GetTitledFirstName] said;Pas d'argent pour des améliorations', telle fut la réponse [From.Get_du_TitledFirstName];"Kein Geld für Verbesserungen", sagte [From.GetTitledFirstName];;'No hay dinero para mejoras', dijo [From.GetTitledFirstName];;;;;;;;;x
EVTOPTA105203;Imprison Chief Architect [From.GetTitledFirstName];Emprisonner le maître-architecte [From.GetTitledFirstName];Kerkert Chef-Architekt [From.GetTitledFirstName] ein;;Encarcelar al arquitecto jefe [From.GetTitledFirstName];;;;;;;;;x
EVTOPTA105204;Imprisonment!;La prison !;Gefangenschaft!;;¡Prisión!;;;;;;;;;x
EVTOPTA105250;If [Root.Liege.GetTitledFirstName] would die because I am immune, even better!;Si [Root.Liege.Get_le_TitledFirstName] venait à mourir parce que je suis immunisé, eh bien tant pis !;Sollte [Root.Liege.GetTitledFirstName] sterben, weil ich immun bin, umso besser! ;;¡Si [Root.Liege.GetTitledFirstName] muriera porque yo soy inmune, aún mejor!;;;;;;;;;x
EVTOPTA105253;[From.GetTitledFirstName] became gravely ill by the poisoned food;La nourriture empoisonnée a rendu [From.Get_le_TitledFirstName] grièvement malade;[From.GetTitledFirstName] wurde von dem vergifteten Essen sehr krank ;;[From.GetTitledFirstName] enfermó gravemente debido a la comida envenenada;;;;;;;;;x

EVTOPTB105000;I cannot make this decision now...;Il m'est impossible de prendre une décision, pour le moment...;Ich kann diese Entscheidung gerade nicht treffen...;;No puedo tomar la decisión en estos instantes...;;;;;;;;;x
EVTOPTB105001;No, I cannot justify granting you a divorce;Non, je ne peux pas vous autoriser à divorcer;Nein, ich kann keine Scheidung gewähren;;No, no hay justificación para concederte un divorcio;;;;;;;;;x
EVTOPTB105002;Until this child is born, then;J'attendrai la naissance de notre enfant, alors;Bis das Kind geboren ist, dann ;;Así que hasta que nazca el niño;;;;;;;;;x
EVTOPTB105004;During the iddah period I have changed my mind, I don't want a divorce;J'ai changé d'avis pendant la période d'Iddah, je ne souhaite plus divorcer;Während der Iddah-Zeit habe ich meine Meinung geändert und möchte nun doch keine Scheidung ;;Durante el período de iddah he cambiado de opinión, no quiero el divorcio;;;;;;;;;x
EVTOPTB105005;NO! I won't allow it!;Non ! Je ne le permettrai pas !;NEIN! Das werde ich nicht erlauben!;;¡NO! ¡No lo permitiré!;;;;;;;;;x
EVTOPTB105006;Fine, but then things are going to have to change!;Très bien mais dans ce cas, les choses vont devoir changer !;Gut, aber dann werden sich einige Dinge ändern müssen! ;;Vale, ¡pero las cosas tendrán que cambiar entonces!;;;;;;;;;x
EVTOPTB105007;[From.GetTitledFirstName] promised not to leave me!;[From.Get_Le_TitledFirstName] a promis de ne pas me quitter !;[From.GetTitledFirstName] hat versprochen, mich nicht zu verlassen! ;;¡[From.GetTitledFirstName] me prometió que no me dejaría!;;;;;;;;;x
EVTOPTB105010;I would be the best candidate!;Je suis le meilleur candidat !;Ich wäre der beste Kandidat! ;;¡Sería el mejor candidato!;;;;;;;;;x
EVTOPTB105011;No, he won't do;Non, il ne fera pas l'affaire;Nein, er passt nicht;;No, imposible;;;;;;;;;x
EVTOPTB105013;[Root.Liege.GetTitledFirstName] dismissed my suggestion...;[Root.Liege.Get_Le_TitledFirstName] a rejeté ma proposition...;[Root.Liege.GetTitledFirstName] lehnte meinen Vorschlag ab... ;;[Root.Liege.GetTitledFirstName] rechazó mi sugerencia...;;;;;;;;;x
EVTOPTB105014;[From.GetTitledFirstName] did not want me as Chief Qadi;[From.Get_Le_TitledFirstName] n'a pas voulu de moi en tant que Cadi;[From.GetTitledFirstName] wollte mich nicht als Ober-Kadi ;;[From.GetTitledFirstName] no me quería como Cadí jefe;;;;;;;;;x
EVTOPTB105020;Why, even I would make a better Chief Qadi!;Même moi, je ferais un meilleur Cadi !;Warum, selbst ich wäre ein besserer Ober-Kadi! ;;¡Por qué, hasta yo haría mejor trabajo como Cadí jefe!;;;;;;;;;x
EVTOPTB105021;I see no reason to dismiss the current Chief Qadi;Je ne vois aucune raison de renvoyer l'actuel Cadi;Ich sehe keinen Grund, den derzeitigen Ober-Kadi zu entlassen;;No veo ninguna razón para despedir al actual Cadí jefe;;;;;;;;;x
EVTOPTB105023;I was dismissed and told not to interfere in this matter again;J'ai été renvoyé et on m'a demandé de ne plus jamais me mêler des affaires de justice;Ich wurde entlassen und mir wurde gesagt, ich solle mich in diese Angelegenheit nicht mehr einmischen ;;Descartó mi opinión y me dijo que no volviera a meterme en el asunto.;;;;;;;;;x
EVTOPTB105030;Show mercy and the drunkard may repent;Faisons preuve de clémence et l'ivrogne se repentira peut-être;Seid gnädig und der Trunkenbold möge Reue tun ;;Muestra piedad y el borracho se arrepentirá;;;;;;;;;x
EVTOPTB105031;I will never drink again, may Allah be my witness!;Je ne boirai plus une goutte, que Dieu m'en soit témoin !;Ich werde nie wieder trinken, möge Allah mein Zeuge sein! ;;¡Nunca más beberé, que Ala sea mi testigo!;;;;;;;;;x
EVTOPTB105032;May Allah be my witness, I promise to never drink again!;Qu'Allah m'en soit témoin, je promets de ne plus jamais boire d'alcool !;Möge Allah mein Zeuge sein, ich verspreche, nie wieder zu trinken! ;;¡Que Alá sea mi testigo, prometo no volver a beber jamás!;;;;;;;;;x
EVTOPTB105035;I should confront him myself, make him repent to Allah!;Je devrais le défier moi-même, pour qu'il se repente devant Allah !;Ich sollte ihn persönlich konfrontieren, er sollte vor Allah Buße tun! ;;¡Debo hacerle frente yo mismo y hacer que se arrepienta ante Alá!;;;;;;;;;x
EVTOPTB105036;If you care so much about this, why don't you confront him yourself?;Si cette histoire vous préoccupe tant, pourquoi ne réglez-vous pas ce problème vous-même ?;Wenn es Euch so sehr interessiert, warum konfrontiert Ihr ihn nicht persönlich? ;;Si te importa tanto este asunto, ¿por qué no lo enfrentas tú mismo?;;;;;;;;;x
EVTOPTB105037;I promise I will never see her again!;Je promets de ne plus jamais la revoir !;Ich verspreche, dass ich sie niemals wiedersehen werde! ;;¡Prometo que nunca más la volveré a ver!;;;;;;;;;x
EVTOPTB105038;Promise to break it up with lover;Promettre de rompre avec la maîtresse;Versprecht, mit Eurem Liebhaber zu brechen ;;Promete romper con su amante;;;;;;;;;x
EVTOPTB105039;I am free to confront the accused, but without [From.GetTitledFirstName]'s assistance!;Je suis libre de confronter l'accusé mais sans l'assistance [From.Get_du_TitledFirstName] !;Ich habe die Möglichkeit, den Beschuldigten zu konfrontieren, aber ohne [From.GetTitledFirstName]s Hilfe!;;¡Soy libre de enfrentarme al acusado, pero sin la ayuda de [From.GetTitledFirstName]!;;;;;;;;;x
EVTOPTB105041;I doubt [From.GetTitledFirstName] is sincere, but I can't do anything;Je doute de la sincérité [From.Get_du_TitledFirstName] mais je ne peux rien y faire;Ich glaube nicht, dass [From.GetTitledFirstName] aufrichtig ist, aber ich kann nichts tun ;;Dudo de la sinceridad de [From.GetTitledFirstName], pero no puedo hacer nada al respecto;;;;;;;;;x
EVTOPTB105042;Your words are false, the punishment will be brought upon you;Vous mentez, et vous devrez subir votre châtiment !;Eure Worte sind falsch, die Bestrafung wird über Euch kommen ;;Recibirás el castigo, pues tus palabras son falsas;;;;;;;;;x
EVTOPTB105043;Your punishment will be a hundred lashes!;Cent coups de fouet, tel sera votre châtiment !;Eure Bestrafung beträgt einhundert Peitschenhiebe! ;;¡Tu castigo serán cien latigazos!;;;;;;;;;x
EVTOPTB105044;The merciful Chief Qadi [From.GetTitledFirstName] decided to spare me the punishment!;Le Cadi [From.GetTitledFirstName], dans sa grande bonté, a décidé de m'épargner le châtiment !;Der gnädige Ober-Kadi [From.GetTitledFirstName] sah von einer Bestrafung ab!;;El misericordioso Cadí jefe, [From.GetTitledFirstName], decidió eximirme de mi castigo.;;;;;;;;;x
EVTOPTB105050;I should not disturb the Court Calligrapher with such a petty task;Je ne devrais pas déranger le maître-calligraphe au beau milieu d'une tâche si complexe;Ich sollte den Hofkalligraphen nicht mit belanglosen Aufgaben belästigen.;;No debería molestar al calígrafo de la corte con una tarea tan insignificante.;;;;;;;;;x
EVTOPTB105051;My work would only be spoiled in a mosque of such petty calibre;Ce serait un réel gâchis que de produire des calligraphies pour orner une mosquée si peu fréquentée;Meine Arbeit wäre in einer Moschee eines so kleinen Kalibers ruiniert;;Solo una mezquita de tan miserable rango podría despreciar mi trabajo;;;;;;;;;x
EVTOPTB105052;The design looks as if a three-year-old has smeared ink over the pergament!;On dirait qu'un gamin de 3 ans s'est contenté de barbouiller un parchemin d'encre !;War bei dem Entwurf ein 3-Jähriger am Werk? Scheußlich!;;¡Parece que un niño de tres años ha desparramado tinta sobre el pergamino!;;;;;;;;;x
EVTOPTB105054;[From.GetSheHeCap] thought the designs was terrible!;[From.GetIlElleCap] a trouvé mes ornements horribles !;[From.GetSheHeCap] meinte, die Entwürfe seien fürchterlich! ;;¡Cree que los diseños eran terribles!;;;;;;;;;x
EVTOPTB105055;[From.GetTitledFirstName] did not share my opinion...;[From.Get_Le_TitledFirstName] ne partage pas le même avis que moi quant aux ornements...;[From.GetTitledFirstName] war nicht meiner Meinung... ;;[From.GetTitledFirstName] no compartió mi opinión...;;;;;;;;;x
EVTOPTB105060;I should honor my liege [Root.Liege.GetTitledFirstName] and send [Root.Liege.GetHerHim] the hilya;Je devrais faire honneur à m[Root.Liege.GetOnA] [Root.Liege.GetLordLady] lige et lui envoyer la calligraphie;Mein Lehnsherr [Root.Liege.GetTitledFirstName] wäre bestimmt geehrt, die Hilya zu erhalten;;Debería honrar a mi señor [Root.Liege.GetTitledFirstName] y enviarle la hilya;;;;;;;;;x
EVTOPTB105061;Accept this small token of my appreciation for the hilya;Acceptez ceci en gage de ma reconnaissance pour la calligraphie;Nehmt dieses Zeichen meiner Wertschätzung für die Hilya;;Acepta este pequeño obsequio como muestra de mi gratitud por la hilya;;;;;;;;;x
EVTOPTB105065;Ask [Root.Liege.GetTitledFirstName] to pay for part of it;Demander [Root.Liege.Get_au_TitledFirstName] de payer une partie des matériaux;Bittet [Root.Liege.GetTitledFirstName], für einen Teil zu bezahlen ;;Pedir a [Root.Liege.GetTitledFirstName] que pague una parte;;;;;;;;;x
EVTOPTB105066;To help pay for some of the materials? As long as that is all you need...;De payer une partie des matériaux ? Tant que vous ne demandez rien d'autre...;Ich soll Teile des Materials bezahlen? Wenn es nur daran scheitert...;;¿Que ayudara a pagar parte de los materiales?... Bueno, mientras todo sea eso...;;;;;;;;;x
EVTOPTB105067;My plan worked, [From.GetTitledFirstName] agreed to pay for some of the 'materials'!;Mon plan a fonctionné, [From.Get_le_TitledFirstName] a accepté de financer l'achat d'une partie des 'matériaux' !;Mein Plan funktionierte, [From.GetTitledFirstName] stimmte zu, meine "Materialien" zu bezahlen!;;Mi plan funcionó, ¡[From.GetTitledFirstName] aceptó pagar algunos de los 'materiales'!;;;;;;;;;x
EVTOPTB105068;Banish Court Calligrapher [From.GetTitledFirstName];Bannir le maître-calligraphe [From.GetTitledFirstName];Verbannt den Hofkalligraphen [From.GetTitledFirstName];;Desterrar al calígrafo de la corte [From.GetTitledFirstName];;;;;;;;;x
EVTOPTB105069;...banished from [From.GetHerHis] court!;... d'être banni de la Cour !;...ich von [From.GetHerHis]em Hof verbannt werde!;;... desterrándome de su corte!;;;;;;;;;x
EVTOPTB105075;[Root.Liege.GetTitledFirstName] will be the first to hear it!;[Root.Liege.Get_Le_TitledFirstName] sera le premier à l'entendre !;[Root.Liege.GetTitledFirstName] wird es zuerst hören! ;;¡[Root.Liege.GetTitledFirstName] será el primero en oírla!;;;;;;;;;x
EVTOPTB105076;It is not proper for a [court_musician.GetManWoman] to court a married woman!;Il est fort inconvenant pour un[court_musician.Get_E] [court_musician.GetManWoman] de courtiser une femme mariée !;Es ist nicht angemessen, einer verheirateten Frau den Hof zu machen!;;¡No es propio de un hombre cortejar a una mujer casada!;;;;;;;;;x
EVTOPTB105077;How dare you court my wife with this song!?;Comment osez-vous courtiser ma femme avec cette ballade ?!;Wie könnt Ihr es wagen, meine Ehefrau mit diesem Lied zu umwerben!?;;¡¿Cómo te atreves a cortejar a mi esposa con esta canción?!;;;;;;;;;x
EVTOPTB105078;Both [From.GetTitledFirstName] and [From.Spouse.GetTitledFirstName] appreciated my song;[From.Get_Le_TitledFirstName] et [From.Spouse.Get_le_TitledFirstName] ont tous deux apprécié ma ballade;Beide, [From.GetTitledFirstName] und [From.Spouse.GetTitledFirstName], schätzten mein Lied;;Tanto [From.GetTitledFirstName] como [From.Spouse.GetTitledFirstName] apreciaron mi canción;;;;;;;;;x
