#CODE;ENGLISH;FRENCH;GERMAN;;SPANISH;;;;;;;;;x

EVTDESC105000;It is a dire decision, to ask the Chief Qadi to grant me divorce from my husband [Root.Spouse.GetTitledFirstName]. I must be certain this is what I want before I make this decision...;Demander au Cadi l'autorisation de divorcer de mon mari, [Root.Spouse.Get_le_TitledFirstName], est une décision très difficile à prendre. Je dois être sûre que c'est bien ce que je veux...;Es ist eine schreckliche Entscheidung, den Ober-Kadi um eine Scheidung von meinem Ehemann [Root.Spouse.GetTitledFirstName] zu bitten. Ich muss sicher sein, dass es wirklich das ist, was ich möchte, bevor ich meine Entscheidung treffe...;;Pedirle al Cadí jefe que me conceda el divorcio de mi esposo [Root.Spouse.GetTitledFirstName] es una decisión extrema. Debo estar segura de que eso es lo que quiera antes de tomar la decisión...;;;;;;;;;x
EVTDESC105001;[From.GetTitledFirstName] came to me to ask to be granted a divorce from her husband [From.Spouse.GetTitledFirstName]. I reminded [From.GetTitledFirstName] about the iddah period, the month she would have to wait before the divorce came through, and asked if her husband [From.Spouse.GetTitledFirstName] would demand compensation and the return of the mahr, the wedding gift her husband gave her when they married.;[From.Get_Le_TitledFirstName] est venue me voir pour que je lui accorde le divorce de son époux, [From.Spouse.Get_le_TitledFirstName]. Je lui ai rappelé qu'elle devait respecter la période de Iddah, un délai règlementaire d'un mois, et lui ai demandé si son mari, [From.Spouse.Get_le_TitledFirstName], pensait demander une compensation financière ainsi que la récupération du Mahr, le cadeau que fait l'époux à sa femme au moment du mariage.;[From.GetTitledFirstName] kam zu mir und bat mich, einer Scheidung von ihrem Ehemann [From.Spouse.GetTitledFirstName] zuzustimmen. Ich erinnerte [From.GetTitledFirstName] an die Iddah-Zeit, den Monat, den sie warten müsse, bevor eine Scheidung rechtens sein würde, und fragte, ob ihr Ehemann [From.Spouse.GetTitledFirstName] eine Entschädigung und die Herausgabe des Mahr, dem Hochzeitsgeschenk, das ihr Ehemann ihr zur Hochzeit geschenkt hatte, verlangen könne.;;[From.GetTitledFirstName] se acercó a mí para solicitarme que le concediera el divorcio de su marido, [From.Spouse.GetTitledFirstName] Le recordé a [From.GetTitledFirstName] sobre el período de iddah, el mes que ella tendría que esperar antes de que se consume el divorcio, y le pregunté si su esposo, [From.Spouse.GetTitledFirstName], le pedirá una compensación y la restitución del mahr, el presente de bodas que su esposo le regaló cuando se casaron. ;;;;;;;;;x
EVTDESC105002;The Chief Qadi [From.GetTitledFirstName] asked me what if my husband [Root.Spouse.GetTitledFirstName] demanded compensation and the return of my mahr, the gift he gave me at the wedding and told me what would happen to any child of our union. [From.GetSheHeCap] also told me I must wait a month, the iddah period, before I could be divorced or, if I was pregnant, until the child was born.;[From.GetLeLaCap] Cadi, [From.Get_le_TitledFirstName], m'a demandé ce que je comptais faire si mon époux, [Root.Spouse.Get_le_TitledFirstName], exigeait une compensation et la récupération du mahr, le cadeau qu'il m'avait fait au moment de nos fiançailles, et ce qu'il adviendrait des enfants nés de notre union. De plus, le divorce ne pourra être prononcé que dans un mois, au terme de la période d'Iddah, ou, si je suis enceinte, après la naissance de l'enfant.;Der Ober-Kadi [From.GetTitledFirstName] fragte mich, was wäre, wenn mein Mann [Root.Spouse.GetTitledFirstName] eine Entschädigung und die Rückgabe meines Mahr, dem Geschenk, das er mir zu unserer Hochzeit überreichte, verlangte, und erklärte mir, was mit den Kindern unserer Verbindung geschehen werde. [From.GetSheHeCap] sagte mir auch, dass ich einen Monat warten müsse, die Iddah-Zeit, bevor ich mich scheiden lassen könne oder, sollte ich schwanger sein, bis das Kind geboren sei.;;El Cadí jefe, [From.GetTitledFirstName], me preguntó si mi esposo, [Root.Spouse.GetTitledFirstName], me pidió compensación y la restitución del mahr, el regalo que me dio en la boda y me dijo lo que pasaría con cualquier hijo de nuestra unión. También me dijo que tenía que esperar un mes, el período de iddah, antes de poderme divorciar, o, si estaba embarazada, hasta que el niño naciera.;;;;;;;;;x
EVTDESC105003;The Chief Qadi [From.GetTitledFirstName] did not grant me a divorce and told me that from what I told [From.GetHerHim] [From.GetSheHe] saw no reason to grant me a divorce from [Root.Spouse.GetTitledFirstName].;[From.GetLeLaCap] Cadi, [From.Get_le_TitledFirstName], a refusé ma demande de divorce car d'après [From.GetLuiElle], aucun de mes arguments ne justifie de mettre un terme à mon union avec [Root.Spouse.Get_le_TitledFirstName].;Der Ober-Kadi [From.GetTitledFirstName] gewährte mir keine Scheidung und sagte mir, dass [From.GetSheHe] von dem, was ich [From.Getihmihr] erzählt hätte, keinen Grund für eine Scheidung von [Root.Spouse.GetTitledFirstName] erkennen könne.;;El Cadí jefe, [From.GetTitledFirstName], no me concedió el divorcio y me dijo que en lo que le dije no veía ninguna razón para divorciarme de [Root.Spouse.GetTitledFirstName].;;;;;;;;;x
EVTDESC105004;The iddah period has gone and if I am truly certain I want a divorce from [Root.Spouse.GetTitledFirstName] I will have it.;La période d'Iddah est terminée et si je suis toujours décidée à divorcer [Root.Spouse.Get_du_TitledFirstName], alors ma demande sera accordée.;Die Iddah-Zeit ist vorüber und ich bin mir wirklich sicher, dass ich eine Scheidung von [Root.Spouse.GetTitledFirstName] möchte und diese auch haben werde. ;;El período de iddah ha terminado y estoy totalmente segura de que quiero divorciarme de [Root.Spouse.GetTitledFirstName], y así lo haré.;;;;;;;;;x
EVTDESC105005;My wife [Root.Spouse.GetTitledFirstName] has gone to Chief Qadi [From.GetTitledFirstName] and asked for a divorce! If she still wants it after the iddah period, a month, then our marriage will be no more...;Ma femme, [Root.Spouse.Get_le_TitledFirstName], est allée voir le Cadi, [From.Get_le_TitledFirstName], pour lui demander de prononcer notre divorce ! Si elle ne change pas d'avis au terme de sa période d'Iddah, c'est-à-dire un mois, alors notre mariage sera de l'histoire ancienne...;Meine Frau [Root.Spouse.GetTitledFirstName] ist zum Ober-Kadi [From.GetTitledFirstName] und bat ihn um eine Scheidung! Sollte sie diese auch nach der Iddah-Zeit, einem Monat, noch verlangen, wird unsere Ehe nicht mehr sein... ;;Mi esposa [Root.Spouse.GetTitledFirstName] ha ido al Cadí jefe, [From.GetTitledFirstName], y ha solicitado el divorcio si continúa queriendol después del período de iddah, es decir, un mes, entonces nuestro matrimonio habrá finalizado...;;;;;;;;;x
EVTDESC105006;I was on my way home, thinking of ways to tell my husband [From.GetTitledFirstName] that I had asked the Chief Qadi for a divorce, when [From.GetTitledFirstName] caught up with me and asked me why I wanted a divorce! I told [From.GetTitledFirstName] my reasons and [From.GetSheHe] pleaded that I should reconsider, told me he did not want me to divorce [From.GetHerHim]...;Sur le chemin du retour, alors que je réfléchissais à la façon d'annoncer à mon mari, [From.Get_le_TitledFirstName], que je m'étais rendue auprès du Cadi pour demander le divorce, [From.GetTitledFirstName] m'a rattrapée et m'a demandé pourquoi je voulais divorcer ! J'ai expliqué à mon mari mes motivations mais il m'a suppliée de réfléchir car lui ne souhaitait pas divorcer.;Ich war auf meinem Weg nach Hause, dachte über Möglichkeiten nach, wie ich meinem Ehemann [From.GetTitledFirstName] beibringen soll, dass ich den Ober-Kadi um die Scheidung gebeten habe, als [From.GetTitledFirstName] aufholte und mich fragte, warum ich eine Scheidung wolle! Ich nannte [From.GetTitledFirstName] meine Gründe und [From.GetSheHe] flehte mich an, es mir noch einmal zu überlegen, da [From.GetSheHe] nicht wolle, dass ich mich von ihm scheiden lasse...;;Iba rumbo a mi casa, pensando en la manera de decirle a mi esposo, [From.GetTitledFirstName], que le había pedido el divorcio al Cadí jefe, cuando [From.GetTitledFirstName] me interceptó y me preguntó porqué quería el divorcio. Le expliqué a [From.GetTitledFirstName] mis razones y él me rogó que lo reconsiderare, y me dijo que no quería que me divorciara de él...;;;;;;;;;x
EVTDESC105007;I pleaded with [From.GetTitledFirstName], promised her all she would want if only she wouldn't leave me! She told me about her reasons and I told her I would change, that I would do anything, anything!;J'ai supplié [From.Get_le_TitledFirstName], je lui ai promis qu'elle aurait tout ce qu'elle souhaitait si elle acceptait de rester avec moi ! Elle m'a expliqué ses motivations et je lui ai promis de changer et que je ferai tout pour la rendre heureuse.;Ich flehte [From.GetTitledFirstName] an, versprach ihr alles, was sie sich wünschte, solange sie mich nur nicht verlässt! Sie nannte mir ihre Gründe und ich sagte ihr, dass ich mich ändern werde, dass ich alles tun würde, alles! ;;Le supliqué a [From.GetTitledFirstName], le prometí todo lo que ella pudiera desear sino me dejaba. Me dio sus razones y le dije que cambiaría, que haría lo que fuera, ¡lo que fuera!;;;;;;;;;x
EVTDESC105010;I grow more worried for every day no Chief Qadi has been selected. It is as if [Root.Liege.GetTitledFirstName] does not care if just judgement is brought to those who deserve it!;Cela m'inquiète car les jours passent mais aucun Cadi n'a été désigné. C'est comme si [Root.Liege.Get_le_TitledFirstName] n'avait pas envie qu'un jugement juste et équitable puisse être rendu à ceux qui le méritent !;Mit jedem Tag, an dem noch kein Ober-Kadi gewählt worden war, stieg meine Besorgnis. Es schien so, als interessiere es [Root.Liege.GetTitledFirstName] gar nicht, ob die Gerechtigkeit bekommen, die es verdienen! ;;Cada día me preocupa más que no se haya elegido un Cadí jefe. Es como si a [Root.Liege.GetTitledFirstName] no le importará si que solo recibieran buen juicio quienes lo merecen;;;;;;;;;x
EVTDESC105011;[From.GetTitledFirstName] worries that the people of my realm lacks just judgement when I still haven't chosen a Chief Qadi to take care of all legal matters. To ease [From.GetHerHis] worry, [From.GetTitledFirstName] came to me and suggested someone who [From.GetSheHe] believe would make an excellent Chief Qadi.;[From.Get_Le_TitledFirstName] craint que mon peuple ne souffre de jugements inéquitables parce que je n'ai toujours pas désigné de Cadi pour s'occuper des affaires de justice. Afin de résoudre ce problème qui l'inquiète, [From.Get_le_TitledFirstName] m'a soumis le nom d'une personne qui ferait un excellent Cadi.;[From.GetTitledFirstName] fürchtet, dass es den Menschen meines Reichs an Gerechtigkeit mangeln würde, wenn ich weiterhin keinen Ober-Kadi wählen würde, der sich um alle rechtlichen Dinge kümmere. Um [From.GetHerHis]e Sorgen zu lindern, kam [From.GetTitledFirstName] zu mir und schlug mir jemanden vor, von dem [From.GetSheHe] überzeugt war, dass er einen exzellenten Ober-Kadi abgeben würde.;;A [From.GetTitledFirstName] le preocupa que la gente del reino carezca de juicios justos ya que aún no he elegido un Cadí jefe que se ocupe de todos los asuntos legales. Para calmar sus preocupaciones, [From.GetTitledFirstName] se presentó ante mí y me sugirió a alguien que cree que puede ser un Cadí jefe excelente.;;;;;;;;;x
EVTDESC105012;I had no idea [FromFrom.GetTitledFirstName] would suggest me as [From.GetTitledFirstName]'s new Chief Qadi! The letter congratulating me to my new position and the order to appear before [From.GetTitledFirstName] as soon as possible was bewildering, I almost did not believe it at first.;J'ignorais totalement que [FromFrom.Get_le_TitledFirstName] soumettrait mon nom pour le poste de Cadi [From.Get_du_TitledFirstName] ! La lettre de félicitations me demandant de me présenter au plus tôt chez [From.Get_le_TitledFirstName] m'a abasourdi, j'ai même cru à une blague, au début !;Ich hatte keine Ahnung, dass [FromFrom.GetTitledFirstName] mich als [From.GetTitledFirstName]s neuen Ober-Kadi vorschlagen würde! Das Gratulationsschreiben zu meiner neuen Position und die Anweisung, so schnell wie möglich vor [From.GetTitledFirstName] zu erscheinen, war verwirrend und ich konnte es zuerst gar nicht glauben.;;No tenía la menor idea de que [FromFrom.GetTitledFirstName] me sugeriría como el nuevo Cadí jefe de [From.GetTitledFirstName]. La carta en que se me felicitaba por mi nueva posición y la orden de comparecer ante [From.GetTitledFirstName] lo antes posible me dejaron perplejo, casi no lo podía creer.;;;;;;;;;x
EVTDESC105013;I suggested that [target_suggested_qadi.GetTitledFirstName] would be [Root.Liege.GetTitledFirstName]'s new Chief Qadi and waited with bated breath as [Root.Liege.GetTitledFirstName] pondered this.;J'ai proposé que [target_suggested_qadi.Get_le_TitledFirstName] devienne le nouveau Cadi [Root.Liege.Get_du_TitledFirstName] et retenu mon souffle pendant que [Root.Liege.Get_le_TitledFirstName] réfléchissait à la question.;Ich schlug vor, dass [target_suggested_qadi.GetTitledFirstName] [Root.Liege.GetTitledFirstName]s neuer Ober-Kadi werden solle, und wartete gespannt, während [Root.Liege.GetTitledFirstName] darüber nachdachte.;;Le sugerí que [From.GetTitledFirstName] fuera el nuevo jefe de los cadíes de [Root.Liege.GetTitledFirstName], y esperé con el aliento contenido mientras [Root.Liege.GetTitledFirstName] lo pensaba.;;;;;;;;;x
EVTDESC105014;It felt preposterous, almost insulting, to suggest myself as the new Chief Qadi for [From.GetTitledFirstName] but there were no better candidate I could have thought of than myself.;Je trouve grotesque, même insultant, d'avoir soumis mon nom pour le poste de Cadi auprès [From.Get_du_TitledFirstName], mais j'avoue être le meilleur candidat possible.;Es war grotesk, beinahe beleidigend, mich als neuen Ober-Kadi für [From.GetTitledFirstName] vorzuschlagen, aber es gab keine besseren Kandidaten außer mir, die mir eingefallen wären.;;Fue ridículo y hasta casi un insulto sugerirme a mí mismo como el nuevo Cadí jefe para [From.GetTitledFirstName], pero no pude pensar en ningún otro candidato mejor que yo. ;;;;;;;;;x
EVTDESC105020;[Root.Liege.GetTitledFirstName]'s choice for the Chief Qadi position is disastrous! The [old_qadi.GetManWoman]'s judgement is severely distorted and there will be no justice as long as [old_qadi.GetSheHe] holds the post!;La personne qu'a choisie [Root.Liege.Get_le_TitledFirstName] pour le rôle de Cadi est une vraie calamité ! Ses sentences sont gravement faussées et tant qu'elle occupera ce poste, Justice ne sera jamais rendue.;[Root.Liege.GetTitledFirstName]s Wahl für den Posten des Ober-Kadi ist desaströs! Die Urteile dieses Menschen sind fürchterlich verdreht und es wird keine Gerechtigkeit geben, solange [old_qadi.GetSheHe] den Posten innehat!;;¡La elección de [Root.Liege.GetTitledFirstName] para el puesto de Cadí jefe es desastrosa! ¡Su juicio está severamente distorsionado y no habrá justicia mientras se mantenga en el puesto!;;;;;;;;;x
EVTDESC105021;Fuming with anger at what [From.GetTitledFirstName] called 'another disastrous judgement of your Chief Qadi!', [From.GetTitledFirstName] suggested I would choose another person for the very important position as Chief Qadi.;Fou de colère suite à ce que [From.Get_le_TitledFirstName] a qualifié de 'nouvelle sentence désastreuse de votre Cadi', [From.Get_le_TitledFirstName] a proposé que je nomme quelqu'un d'autre au poste, très important, de Cadi.;Schäumend vor Wut über das, was [From.GetTitledFirstName] "eine weitere desaströse Entscheidung Eures Ober-Kadi!" nannte, schlug mir [From.GetTitledFirstName] vor, dass ich eine andere Person für diese sehr wichtige Position des Ober-Kadi wählen sollte.;;Lleno de rabia por lo que [From.GetTitledFirstName] llamó 'otra decisión desastrosa de tu Cadí jefe', [From.GetTitledFirstName] sugirió que eligiera a otra persona para el impoortante cargo de Cadí jefe.;;;;;;;;;x
EVTDESC105023;The current Chief Qadi is such a disastrous choice, with [old_qadi.GetHerHis] arbitrary judgements and insufficient knowledge of the laws, that I had to suggest a new candidate for this position. [From.GetTitledFirstName] would make a much better Chief Qadi and so I told [Root.Liege.GetTitledFirstName] and waited with bated breath as [Root.Liege.GetTitledFirstName] pondered this.;Notre cadi est un désastre ambulant, ses jugements partiaux et sa méconnaissance des lois m'ont poussé à suggérer un nouveau candidat pour occuper cette fonction. [From.Get_Le_TitledFirstName] ferait un bien meilleur cadi, j'en ai donc parlé [Root.Liege.Get_au_TitledFirstName] et j'ai attendu avec angoisse que [Root.Liege.Get_le_TitledFirstName] prenne une décision.;Der derzeitige Ober-Kadi ist so eine desaströse Wahl, mit [old_qadi.GetHerHis]en willkürlichen Urteilen und [old_qadi.GetHerHis]em unzureichenden Wissen über die Gesetze, dass ich einen neuen Kandidaten für diese Position vorschlagen musste. [From.GetTitledFirstName] würde einen viel besseren Ober-Kadi abgeben, und so schlug ich es [Root.Liege.GetTitledFirstName] vor und wartete gespannt, als [Root.Liege.GetTitledFirstName] darüber nachdachte.;;El actual Cadí jefe es una elección tan desastrosa, con decisiones tan arbitrarias y un insuficiente conocimiento de las leyes, que he debido sugerir un nuevo candidato para el cargo. [From.GetTitledFirstName] sería un Cadí jefe mucho mejor y así se lo hice saber a [Root.Liege.GetTitledFirstName] y esperé conteniendo el aliento mientras [Root.Liege.GetTitledFirstName] lo pensaba.;;;;;;;;;x
EVTDESC105024;I inadvertently insulted the old Chief Qadi when I suggested that I would make better judgements than [old_qadi.GetHerHim] and knew the laws much better than [old_qadi.GetHerHim], but I saw no other way to get rid of [old_qadi.GetHerHim]. After all, it was [From.GetTitledFirstName] who would judge if I was a better person for the position than the hopefully soon former Chief Qadi.;J'ai malencontreusement offensé notre cadi, déjà d'un certain âge, en affirmant que je serais capable de faire mieux à son poste par ma meilleure connaissance de la loi, mais c'était le seul moyen de m'en débarrasser. Après tout, c'est [From.Get_le_TitledFirstName] qui a émis l'idée que je serais parfait[Root.Get_E] pour cette fonction.;Ich beleidigte den alten Ober-Kadi versehentlich, als ich vorschlug, dass ich bessere Urteile als [old_qadi.GetSheHe] fällen würde und auch die Gesetze besser kennen würde, aber ich sah keine andere Möglichkeit, [From.GetHerHim] loszuwerden. Schließlich war es [From.GetTitledFirstName], der entscheiden würde, ob ich für diese Position besser wäre als der hoffentlich bald ehemalige Ober-Kadi.;;Insulté sin querer al viejo Cadí jefe cuando le sugerí que yo tomaría mejores decisiones que él y que conocía las leyes mucho mejor, pero no vi otra forma de librarme de él. Después de todo, será [From.GetTitledFirstName] quien decida si soy mejor para el puesto que el futuro, esperemos, excadí jefe.;;;;;;;;;x
EVTDESC105025;May [FromFrom.GetTitledFirstName] be hit with sixty shoes! That son of a dog coaxed [From.GetTitledFirstName] into revoking my title as Chief Qadi!;Que [FromFrom.Get_le_TitledFirstName] soit maudit ! Ce fils de chien a réussi à convaincre [From.GetTitledFirstName] de me renvoyer du poste de Cadi !;Möge [FromFrom.GetTitledFirstName] mit sechzig Schuhen getreten werden! Dieser Hundesohn hat [From.GetTitledFirstName] dazu gebracht, mir meinen Titel als Ober-Kadi abzuerkennen! ;;¡Que [FromFrom.GetTitledFirstName] sea golpeado con sesenta zapatos! ¡Ese hijo de perra engatusó a [From.GetTitledFirstName] para que me revocara el título de Cadí jefe!;;;;;;;;;x
EVTDESC105030;The Qur'an says: 'O you who believe! Intoxicants and games of chance and sacrificing to stones set up and dividing by arrows are only an uncleanness, the Shaitan's work, shun it therefore that you may be successful.' It is said that those who indulge in wine and other intoxicants will be punished by eighty lashes so they may know the wrongness of their path.;Le Coran dit : 'Ô les croyants ! Le vin, le jeu de hasard, les pierres dressées, les flèches de divination ne sont qu'abominations, oeuvres du Diable. Écartez-vous en, afin que vous réussissiez.' Cela signifie que ceux qui cèdent à la tentation de l'alcool et autres substances illicites seront punis de 80 coups de fouet afin qu'ils comprennent leur erreur.;Der Koran sagt: "O ihr, die ihr glaubt! Berauschendes, Glücksspiel, Opfersteine und Lospfeile sind ein Gräuel, das Werk Satans. So meidet sie, auf dass ihr erfolgreich seid." Es heißt, dass diejenigen, die dem Wein oder anderen Rauschmitteln frönen, mit achtzig Peitschenhieben bestraft werden, sodass ihnen die Falschheit ihres Weges klar wird.;;El Corán dice: '¡Oh, creyentes! ¡Bebidas intoxicantes, juegos de azar, prácticas idólatras y adivinación del futuro no son sino abominaciones, obra de Shaitán;¡Evitadlos, pues, para que así prosperéis! Está escrito que quien ceda ante el vino y otros venenos será castigado con ochenta latigazos para que vean lo errado de su camino.;;;;;;;;;x
EVTDESC105031;I stumbled drunkenly into Chief Qadi [From.GetTitledFirstName] who smelled the wine I had drunk on my breath and ordered my arrest. The next day I got my punishment: eighty lashes!;Alors que je déambulais ivre dans la rue, j'ai bousculé le Cadi [From.GetTitledFirstName] qui, en sentant mon haleine avinée, a aussitôt ordonné mon arrestation. Le lendemain, je recevais mon châtiment : 80 coups de fouet !;Ich stolperte betrunken in den Ober-Kadi [From.GetTitledFirstName], der den Wein roch, den ich getrunken hatte, und ordnete meine Haft an. Am nächsten Tag erhielt ich meine Bestrafung: achtzig Peitschenhiebe! ;;Me tropecé borracho con el Cadí jefe, [From.GetTitledFirstName], quien olió el vino que bebí vino en el aliento y mandó arrestarme. Al día siguiente recibí mi castigo: ¡ochenta latigazos!;;;;;;;;;x
EVTDESC105032;The wine was aplenty and when I left my company I was more than unsteady on my feet. I must have drunk enough to become unconscious, for when I woke up it was in Chief Qadi [From.GetTitledFirstName]'s room, who told me that if I donated a small sum of money to charity and promised to never drink again [From.GetSheHe] would let me go without punishment.;Le vin coulait à flot et en quittant mes amis, je tenais à peine debout. Apparemment, j'ai bu jusqu'à en perdre conscience car à mon réveil, je me trouvais dans le bureau du Cadi [From.GetTitledFirstName]. Celui-ci m'a dit que si j'acceptais de donner l'aumône et que je promettais de ne plus jamais boire, alors cette affaire serait oubliée.;Der Wein floss in Strömen und als ich meine Begleitung verließ, war ich unsicher auf meinen Füßen unterwegs. Ich muss genug getrunken haben, um bewusstlos zu werden, denn als ich aufwachte, war ich im Raum des Ober-Kadi [From.GetTitledFirstName], der mir sagte, dass [From.GetSheHe] mich ohne Bestrafung gehen lassen würde, wenn ich der Wohlfahrt eine kleine Summe spende und versprechen würde, nie wieder etwas zu trinken.;;El vino abundaba, y cuando dejé a mi compañía no me sentía estable sobre mis pies. Debí caer inconsciente por la borrachera, pues cuando me desperté vi que estaba en la habitación del Cadí jefe, [From.GetTitledFirstName], quien me dijo que si donaba una pequeña suma de dinero a la caridad y prometía no volver a beber, me dejaría ir sin castigo.;;;;;;;;;x
EVTDESC105035;There have been rumors circling the court that a vassal of [Root.Liege.GetTitledFirstName] is sleeping with a woman other than his wives. The man cannot be a true Muslim if he has committed zina!;Une rumeur circule à la Cour voulant qu'un vassal [Root.Liege.Get_du_TitledFirstName] partage la couche d'une femme qui n'est pas une des siennes ! Cet homme ne peut être un vrai musulman s'il se rend coupable de zina !;Gerüchte machen am Hof die Runde, dass ein Vasall von [Root.Liege.GetTitledFirstName] mit einer Frau schläft, die nicht die seine ist. Dieser Mann kann kein wahrer Moslem sein, wenn er Ehebruch begeht!;;Ha habido rumores en la corte de que un vasallo de [Root.Liege.GetTitledFirstName] yace con una mujer que no es su esposa. Es realmente terrible, pues ese hombre no puede ser un verdadero musulmán si ha cometido zina.;;;;;;;;;x
