#CODE;ENGLISH;FRENCH;GERMAN;;SPANISH;;;;;;;;;x
EVTDESC105068;It has been six months since I agreed to help my Court Calligrapher [From.GetTitledFirstName] with [From.GetHerHis] dream of creating a Golden Qur'an and I am starting to become suspicious. I have heard no word of progress, nor seen any sign of the Golden Qur'an or its design and I am starting to believe my Court Calligrapher might have deceived me for money!;Voilà six mois, j'acceptais d'aider mon maître-calligraphe [From.GetTitledFirstName] à réaliser son rêve de créer un 'Coran d'Or', et j'avoue que je commence à avoir des doutes. Je ne sais rien de l'avancée du projet et je n'ai même pas aperçu un petit bout du fameux Coran. Je commence à croire que le maître-calligraphe de la Cour m'a tout simplement trompé !;Es waren sechs Monate vergangen, seitdem ich zugestimmt hatte, meinem Hofkalligraphen [From.GetTitledFirstName] mit [From.GetHerHis]em Traum von der Erschaffung eines Goldenen Korans behilflich zu sein, und ich wurde langsam misstrauisch. Ich hatte weder ein Wort zum Fortschritt gehört noch ein Zeichen des Goldenen Korans oder von seinem Dekor gesehen, und begann zu glauben, dass mein höfischer Kalligraph mich meines Geldes wegen beschwindelt haben könnte!;;Han pasado seis meses desde que decidí ayudar al calígrafo de la corte [From.GetTitledFirstName] en su sueño de crear un Corán de oro y estoy empezando a sospechar. No he visto ningún progreso ni visto signo alguno del Corán de oro ni de su diseño. ¡Estoy empezando a pensar que mi calígrafo de la corte podría haberme timado!;;;;;;;;;x
EVTDESC105069;The Golden Qur'an I promised [From.GetTitledFirstName] I would create for the money [From.GetSheHe] gave me to pay for the materials is of course a figment of imagination, a scheme to lure my liege of some money. Somehow [From.GetTitledFirstName] have found out about my scheme and I am being punished by...;Le Coran d'Or que j'ai promis [From.Get_au_TitledFirstName] en échange de l'argent qu'[From.GetIlElle] m'a donné pour l'achat des matériaux est évidemment une pure invention de mon imagination, un prétexte pour délester mon seigneur d'un peu de son argent. Cependant, [From.Get_le_TitledFirstName] a découvert le pot aux roses et mon châtiment sera...;Der Goldene Koran, den ich [From.GetTitledFirstName] von dem Geld, dass [From.GetSheHe] mir gegeben hatte, um für das Material zu bezahlen, versprochen hatte, ist natürlich nur eine Erfindung - ein Plan, um etwas Geld von meinem Lehnsherren zu bekommen. Irgendwie hat [From.GetTitledFirstName] von dem Plan Wind bekommen und ich werde bestraft, indem...;;El Corán de oro que prometí a [From.GetTitledFirstName] que crearía con el dinero que me dió para pagar los materiales tan solo es producto de la imaginación, una astucia para sablear algo de dinero a mi señor. ¡De alguna forma, [From.GetTitledFirstName] ha descubierto la estafa y va a castigarme...;;;;;;;;;x
EVTDESC105075;The ghazal's poetic expression of both the pain of separation and the beauty of love in spite of that pain is the perfect poetic form for my next song!;Le genre littéraire appelé ghazal, expression de la douleur et de la séparation, ainsi que de la beauté de l'amour, est un style poétique parfait pour ma prochaine chanson !;Der poetische Ausdruck des Ghazal, sowohl des Trennungsschmerzes als auch der Schönheit der Liebe ungeachtet des Schmerzes, ist die perfekte poetische Form für mein nächstes Lied! ;;El ghazal, por su expresión poética, es la forma perfecta para mi próxima canción. Refleja tanto el dolor de la separación como la belleza del amor a pesar del sufrimiento.;;;;;;;;;x
EVTDESC105076;My husband's Court Musician [From.GetTitledFirstName] has a wonderful voice and I could barely keep from blushing as I heard [From.GetHerHim] sing [From.GetHerHis] ghazal song about the pain of separation and the beauty of love in spite of that pain...;[From.Get_Le_TitledFirstName], le Poète de mon époux, a une voix formidable et il m'a été difficile de ne pas rougir en entendant son ghazal, évoquant la douleur de la séparation et la beauté de l'amour...;Der Hofmusiker meines Ehemannes, [From.GetTitledFirstName], hat eine wunderschöne Stimme und ich konnte mein Erröten kaum verhindern, als ich [From.GetHerHim] [From.GetHerHis] Ghazal-Lied, über Trennungsschmerz und die Schönheit der Liebe trotz des Schmerzes, singen hörte... ;;[From.GetTitledFirstName], el músico de la corte de mi marido, tiene una voz maravillosa. Apenas pude evitar sonrojarme cuando le escuché cantar su ghazal sobre el dolor de la separación y la belleza del amor a pesar del sufrimiento...;;;;;;;;;x
EVTDESC105077;The Court Musician's words and [court_musician.GetHerHis] singing brought justice to the poetic form ghazal, a poetic expression of both the pain of separation and the beauty of love in spite of that pain.;Les mots du Poète et sa ballade rendent parfaitement justice au genre du ghazal, une forme d'expression poétique de la douleur et de la séparation, ainsi que de la beauté de l'amour.;Die Worte und der Gesang des Hofmusikers wurden der poetischen Form des Ghazals, ein poetischer Ausdruck sowohl über Trennungsschmerz als auch über die Schönheit der Liebe trotz des Schmerzes, gerecht.;;Las palabras y melodías del músico de la corte cumplen con las expectativas de la forma poética ghazal, expresión del dolor de la separación y de la belleza del amor a pesar del sufrimiento.;;;;;;;;;x
EVTDESC105078;As I sang my song, I started to feel true pain of separation from my love and still see the beauty of love. The ghazal was my masterpiece and as I let the last few notes die away I felt tears streaming down my face...;Alors que je chantais ma ballade, j'ai physiquement ressenti la douleur d'être séparé de mon amour, cependant, la beauté de notre amour n'en est pas moins grande. Ce ghazal est mon chef-d'oeuvre et en jouant les dernières notes, j'ai senti des larmes couler sur mon visage...;Als ich mein Lied sang, begann ich den wahren Schmerz wegen der Trennung von meiner Liebe zu fühlen und dennoch die Schönheit der Liebe sehen. Das Ghazal war mein Meisterstück und als ich die letzten Noten verklingen ließ, fühlte ich die Tränen mein Gesicht herunterlaufen...;;A medida que cantaba mi canción, podía sentir el auténtico dolor de separación del ser amado y aún así ver la belleza del amor. El ghazal es mi obra maestra. Durante las últimas notas, sentí como me brotaban las lágrimas...;;;;;;;;;x
EVTDESC105100;'Through my veins both love and blood flows\nMy beloved fills me as love empties me of myself...'\nAs I struggle with my poem I searched through the garden for an inspiration of some sort...;Dans mes veines coulent l'amour et le sang,\nMa bien-aimée me comble tandis que la solitude me détruit...'\nAlors que je me débattais avec les paroles de mon poème, j'ai cherché dans le jardin une source d'inspiration...;Durch meine Adern fließt beides, Liebe und Blut\nMeine Geliebte füllt mich wie Liebe mich von mir selbst entleert..."\nWährend ich mit meinem Gedicht kämpfe, durchsuchte ich den Garten nach irgendeiner Form der Inspiration...;;Por mis venas corren el amor y la sangre\nMi amada me llena pero el amor me vacía de mí mismo...'\nMientras lucho por crear mi poema, busco inspiración de algún tipo en el jardín...;;;;;;;;;x
EVTDESC105101;My husband's garden is an easy place to find inspiration within, and I was slowly walking through it when the Court Poet [From.GetTitledFirstName] startled me. [From.GetSheHeCap] asked my forgiveness and recited a poem [From.GetTitledFirstName] claimed to have gotten inspiration to when [From.GetSheHe] saw me walking.;Le jardin de mon époux est un endroit paisible où il est facile de trouver l'inspiration. Tandis que je m'y promenais, le Poète de la Cour [From.GetTitledFirstName] m'a fait sursauter. [From.GetIlElleCap] m'a demandé pardon avant de me réciter un poème. [From.Get_Le_TitledFirstName] prétend que c'est en me voyant déambuler dans le jardin qu'[From.GetIlElle] a trouvé l'inspiration.;Der Garten meines Ehemannes ist ein Ort, an dem man einfach Inspiration finden kann, und so spazierte ich langsam durch den Garten, als mich der Hofdichter [From.GetTitledFirstName] erschreckte. [From.GetSheHeCap] bat mich um Vergebung und rezitierte ein Gedicht. [From.GetTitledFirstName] behauptete, die Inspiration dafür gefunden zu haben, als [From.GetSheHe] mich spazierengehen sah.;;El jardín de mi marido es un buen lugar para inspirarse. Estaba paseando tranquilamente en él cuando me abordó [From.GetTitledFirstName], el poeta de la corte. Solicitó mi perdón y me recitó un poema. [From.GetTitledFirstName] afirmó haberse inspirado en mí al verme pasear.;;;;;;;;;x
EVTDESC105102;The poem did not rhyme, why did it not rhyme? Shouldn't every poem rhyme? I was assured by the Court Poet that not all poetry rhymed and I did like the two first sentences:\n\n'Through my veins both love and blood flows\nMy beloved fills me as love empties me of myself...';Mais il n'y a pas de rime dans votre poème ! Pour quelle raison ? Un poème ne doit-il pas comporter de rimes, normalement ? Le Poète a répondu à cette dernière question par la négative et j'avoue que j'ai fort apprécié les deux premiers vers : \n\n'Dans mes veines coulent l'amour et le sang,\nMa bien-aimée me comble tandis que la solitude me détruit...';Das Gedicht reimte sich nicht, warum reimte es sich nicht? Sollte sich nicht jedes Gedicht reimen? Der Hofdichter versicherte mir, dass sich nicht alle Gedichte immer reimen. Und tatsächlich, ich mochte die ersten beiden Zeilen:\n\n"Durch meine Adern fließt beides, Liebe und Blut\nMeine Geliebte füllt mich wie Liebe mich von mir selbst entleert...";;El poema no rima. ¿Por qué no rima? ¿No deberían rimar todos los poemas? El poeta de la corte me dijo que no todos los poemas riman y yo compuse estos dos versos iniciales:\n\n'Por mis venas corren el amor y la sangre\nMi amada me llena pero el amor me vacía de mí mismo...';;;;;;;;;x
EVTDESC105103;My new poem was clearly appreciated, people were asking me to make copies of it or just hear me recite it for them. I tried to do this as inconspicuously as possible, I did not want any jealous wife or husbands try to harm me just for a sweet poems sake...;Mon nouveau poème a connu un franc succès et les gens m'ont même demandé de leur en faire des copies ou de le leur réciter encore une fois. J'ai fait ça le plus discrètement possible, je ne tenais pas à ce qu'une épouse ou un mari jaloux ne m'agresse à cause d'un malheureux poème...;Mein neues Gedicht wurde eindeutig geschätzt. Leute baten mich um Kopien oder einfach, dass ich es für sie noch einmal rezitiere. Ich versuchte dem so unauffällig wie möglich nachzukommen, da ich es verhindern wollte, dass eine eifersüchtige Ehefrau oder ein eifersüchtiger Ehemann mir etwas anzutun versuchten, nur wegen eines süßen Gedichtes...;;Mi nuevo poema ha gustado de verdad. La gente me pedía copias o que se lo recitara. He tratado de hacerlo con la mayor discreción posible, no quería que ningún marido ni mujer celoso tratara de hacerme daño por culpa de un dulce poema...;;;;;;;;;x
EVTDESC105150;As the Cupbearer I shall serve drinks at the table, guard against poison in my [Root.Liege.GetTitle]'s cup and sometimes test the wine by tasting it to make sure no one has poisoned it. Too bad I do not like my liege and might accidentally serve bad wine...;En tant qu'échanson, je suis chargé de servir à boire à la table de m[Root.Liege.GetOnA] [Root.Liege.GetLordLady] lige, de surveiller sa coupe pour éviter toute tentative d'empoisonnement et parfois de goûter le vin pour m'assurer qu'il ne présente aucun danger. Quel dommage pour m[Root.Liege.GetOnA] [Root.Liege.GetLordLady] lige que je ne l'aime pas et que je lui ai servi du mauvais vin...;Als Mundschenk soll ich Getränke an den Tischen servieren, darauf achten, dass niemand Gift in den Kelch meines [Root.Liege.GetTitle] gibt, und manchmal den Wein testen, um sicherzustellen, dass er nicht vergiftet war. Zu dumm, dass ich meinen Lehnsherren nicht leiden kann - ich könnte ihm ausversehen schlechten Wein servieren... ;;Como copero, debo servir la bebida en la mesa, preservar la copa de mi señor [Root.Liege.GetTitle] de toda droga y, en ocasiones, probarla para comprobar que no ha sido envenenada. Es una lástima que no me guste mi señor y pueda servirle mal vino por accidente...;;;;;;;;;x
EVTDESC105151;My trustworthy Cupbearer [From.GetTitledFirstName] served the wine as always and even though it did taste a bit strange I did not reflect upon it until it was too late! The wine must have been poisoned, why else would I feel this way?;Mon fidèle échanson [From.GetTitledFirstName] a servi le vin, comme d'habitude, et même si le breuvage avait un goût étrange, je ne m'en suis pas soucié avant qu'il ne soit trop tard ! Le vin a dû être empoisonné, sinon comment expliquer que je me sente aussi mal ? ;Mein vertrauenswürdiger Mundschenk [From.GetTitledFirstName] servierte den Wein wie immer und auch wenn er etwas seltsam schmeckte, dachte ich nicht weiter darüber nach, bis es zu spät war! Der Wein muss vergiftet gewesen sein, weshalb sollte ich mich sonst so fühlen? ;;Mi estimado copero [From.GetTitledFirstName] sirvió el vino como de costumbre y, aunque noté un sabor un tanto extraño, ¡no le presté atención hasta que fue demasiado tarde! El vino tenía que estar envenenado, ¿por qué si no me sentiría así?;;;;;;;;;x
EVTDESC105152;It seems my treason reached the wrong ears! The poison in the wine, why did I trust it to kill [From.GetTitledFirstName]? I should have done it with my own two hands!;Il semble que mon acte de trahison est arrivé jusqu'aux oreilles de la mauvaise personne... Comment ai-je pu penser que cela suffirait à tuer [From.Get_le_TitledFirstName] ? J'aurais dû l'étriper de mes propres mains !;Mein Verrat scheint die falschen Ohren erreicht zu haben! Das Gift im Wein, warum habe ich darauf vertraut, dass es [From.GetTitledFirstName] töten würde? Ich hätte es mit meinen eigenen zwei Händen tun sollen! ;;¡Parece que mi traición ha llegado a los oídos equivocados! El veneno del vino, ¿por qué confié en que mataría a [From.GetTitledFirstName]? ¡Debería haberlo hecho con mis propias manos!;;;;;;;;;x
EVTDESC105200;I took a look at some of the architecture plans for the buildings being built in [Root.Liege.GetTitledFirstName]'s realm and what I saw chilled my blood. There were so many things that could be improved, so many small faults that could be solved if only [Root.Liege.GetTitledFirstName] would listen to me and provide the money necessary for these changes.;J'ai jeté un oeil aux plans des bâtiments en construction dans le Royaume [Root.Liege.Get_du_TitledFirstName] et ce que j'ai vu m'a glacé le sang. De nombreux points mériteraient d'être améliorés, de nombreuses petites erreurs pourraient être résolues si seulement [Root.Liege.Get_le_TitledFirstName] daignait m'écouter et acceptait de verser la somme nécessaire à ces modifications.;Ich warf einen Blick auf die Blaupläne für das Gebäude, das in [Root.Liege.GetTitledFirstName]s Reich gebaut werden sollte, und mir gefror das Blut in den Adern. Es gab dort so viele Dinge, die man verbessern könnte, so viele kleine Fehler, die nur behoben werden könnten, wenn [Root.Liege.GetTitledFirstName] doch nur auf mich hören und mir das Geld für die nötigen Veränderungen geben würde. ;;Eché un vistazo a algunos de los planos arquitectónicos de las nuevas construcciones en los dominios de [Root.Liege.GetTitledFirstName] y lo que vi me heló la sangre. Podrían mejorarse tantas cosas, tantos pequeños errores podrían subsanarse tan solo con que [Root.Liege.GetTitledFirstName] me escuchara y dispusiera el dinero necesario para ello.;;;;;;;;;x
EVTDESC105201;'You see, this small change might mean five years more without repairs, and this is just absurd, what were they thinking? Let me have the money needed to do these changes and I promise you...'\nThe Chief Architect pointed out several flaws and faults with the building plans and asked for money to prevent them.;Voyez-vous, avec cette petite modification, on pourrait avoir un batiment exempt de réparations durant 5 années de plus. C'est totalement absurde, à quoi pensaient-ils ? Procurez-moi l'argent nécessaire à ces changements et je vous promets...'\nLe maître-architecte a souligné plusieurs défauts dans les plans des bâtisses et demande de l'argent pour y remédier.;"Seht Ihr, diese kleine Veränderung würde schon ohne Reparaturen fünf Jahre extra dauern, und das ist einfach absurd, was habt Ihr Euch dabei gedacht? Gebt mir das Geld, das ich für diese Veränderungen benötige, und ich verspreche Euch..."\nDer Chef-Architekt deutete auf viele Fehler und Schwachstellen auf dem Bauplan und bat um Geld, um diese zu vermeiden.;;Ves, este pequeño cambio podría suponer cinco años más sin reparaciones. Esto es simplemente absurdo, ¿en qué estarían pensando? Déjame disponer del dinero necesario para las modificaciones y te prometo que...'\nEl arquitecto jefe señaló varios defectos y errores en los planos de los edificios y solicitó dinero para solucionarlos.;;;;;;;;;x
EVTDESC105202;I saw before me how the buildings would stand tall and beautiful, without the flaws I had found in the building plans. Before me stood the [From.GetManWoman] who held this in [From.GetHerHis] hand and I waited for [From.GetTitledFirstName] decision, eager to get out there and make the buildings flawless.;J'imaginais déjà des bâtiments solides, sans les nombreux défauts que j'avais repérés sur les plans. Devant moi, se tenait la personne qui avait tout le pouvoir entre ses mains et j'attendais que [From.Get_le_TitledFirstName] me fasse part de sa décision, impatient de sortir et de m'occuper de ces bâtiments.;Vor mir sah ich, wie die Gebäude aufrecht und schön stehen würden, ohne die Fehler, die ich auf den Bauplänen gefunden hatte. Vor mir stand der [From.GetManWoman], der dies in [From.GetHerHis]en Hand hatte, und ich wartete auf [From.GetTitledFirstName]s Entscheidung, erpicht darauf, zu ihm durchzudringen und die Gebäude fehlerlos zu machen.;;Vi ante mí la belleza y majestuosidad de los edificios, libres de los defectos que encontré en los planos de construcción. Ante mí se hallaba la persona en cuya mano estaba la decisión. Yo esperaba pacientemente, con ganas de convertir los edificios en algo impecable.;;;;;;;;;x
EVTDESC105203;Another building collapsed today! I thought my Chief Architect [From.GetTitledFirstName] had found and corrected these flaws but it seems like [From.GetSheHe] squandered the money away. What should the punishment for this be?;Une autre bâtisse s'est effondrée aujourd'hui ! Je pensais que mon maître-architecte [From.GetTitledFirstName] avait trouvé le moyen de résoudre les problèmes mais apparemment, [From.GetIlElle] a utilisé l'argent d'une autre façon ! Quel châtiment réserve-t-on aux voleurs ?;Ein weiteres Gebäude ist heute zusammengebrochen! Ich dachte, mein Chef-Architekt [From.GetTitledFirstName] hat diese Fehler gefunden und diese korrigiert, doch es scheint, als hätte [From.GetSheHe] das Geld verprasst. Was soll die Bestrafung dafür sein? ;;¡Otro edificio se ha desplomado hoy! Pensaba que mi arquitecto jefe [From.GetTitledFirstName] había hallado y corregido estos defectos, pero parece que se limitó a quedarse con el dinero. ¿Cómo debería castigarle?;;;;;;;;;x
EVTDESC105204;I should have used the money for improvements! Another building collapsed today and [From.GetTitledFirstName] holds me responsible for it. I tremble at the mere thought of whatever punishment [From.GetTitledFirstName] see fit for my failure...;J'aurais dû utiliser l'argent pour les améliorations ! Une autre bâtisse s'est écroulée aujourd'hui et [From.Get_le_TitledFirstName] m'en tient responsable. Je tremble à la seule pensée du châtiment que me réserve [From.Get_le_TitledFirstName] pour me punir de mon échec...;Ich hätte das Geld für die Verbesserungen einsetzen sollen! Ein weiteres Gebäude ist heute zusammengebrochen und [From.GetTitledFirstName] macht mich dafür verantwortlich. Allein der bloße Gedanken, welche Bestrafung [From.GetTitledFirstName] als passend für meine Fehler erachten wird, lässt mich erzittern...;;¡Debería haber usado el dinero para las mejoras! Otro edificio se ha desplomado hoy y [From.GetTitledFirstName] cree que yo soy el responsable. Tiemblo solo de pensar el castigo que [From.GetTitledFirstName] me aplicará por mi error...;;;;;;;;;x
EVTDESC105250;Being the Food Taster for [Root.Liege.GetTitledFirstName] can be a dangerous job. I am supposed to taste the food and drink to be served to [Root.Liege.GetHerHim] to make sure it is safe to eat, not poisonous or tastes strange. Lately, I have been secretly trying to become immune to different poisons for I am under the grip of the fear of death.;Être le goûteur [Root.Liege.Get_du_TitledFirstName] comporte des risques. Je suis censé goûter la nourriture et les boissons qui lui sont servies afin de m'assurer que tout est en ordre et que ses aliments n'ont pas été empoisonnés. Dernièrement, j'ai tenté de trouver un remède aux différentes sortes de poisons existants car je crains le spectre de la mort qui plane quotidiennement au-dessus de moi.;Vorschmecker von [Root.Liege.GetTitledFirstName] zu sein, kann eine gefährliche Aufgabe sein. Ich soll das Essen und Trinken probieren, das [Root.Liege.Getihmihr] serviert wird, um sicherzustellen, dass es genießbar ist und nicht vergiftet oder seltsam schmeckend. In letzter Zeit habe ich heimlich versucht, immun gegen verschiedene Gifte zu werden, da ich Angst vor dem Tod habe.;;Ser catador de [Root.Liege.GetTitledFirstName] puede convertirse en un trabajo peligroso. Se supone que tengo que probar la comida y la bebida antes de servírselas para asegurarme de que están en buen estado, libres de venenos y sabores extraños. Últimamente he estado intentado inmunizarme contra diversos venenos, porque estoy atrapado por el miedo a morir.;;;;;;;;;x
EVTDESC105251;The food tasted a bit strange, something was hidden beneath the seasoning but I trusted Food Taster [From.GetTitledFirstName] would never serve me anything that might be poisoned. Oh, how I regretted that trust later that evening, when the stomach pains erupted...;La nourriture avait une saveur étrange, j'ai senti un arrière-goût derrière tout cet assaisonnement mais j'ai fait confiance à mon goûteur, [From.Get_le_TitledFirstName], qui ne m'aurait jamais servi un plat empoisonné. Mais j'ai amèrement regretté cet excès de confiance plus tard dans la soirée, quand les douleurs d'estomac sont apparues... ;Das Essen schmeckte seltsam, irgendetwas war unter den Gewürzen, doch ich vertraute darauf, dass mein Vorschmecker [From.GetTitledFirstName] mir niemals etwas Vergiftetes servieren würde. Oh, wie ich dieses Vertrauen später am Abend bedauerte, als die Magenschmerzen begannen...;;La comida sabía algo raro, la salsa ocultaba algo, pero yo confiaba en que el catador [From.GetTitledFirstName] nunca me serviría algo que pudiera estar envenenado. Oh, cuánto me arrepentí de esta confianza esa misma tarde, cuando empezó a dolerme el estómago...;;;;;;;;;x
EVTDESC105253;My plan to become immune to poisons did not turn out so good, I missed the poisoned food intended for [From.GetTitledFirstName] and that is how I ended up in [From.GetTitledFirstName]'s dungeon...;En m'immunisant contre les poisons, je n'ai malheureusement pas senti que la nourriture servie [From.Get_au_TitledFirstName] était empoisonnée. Et c'est pour cette raison que je me trouve à présent enfermé[Root.Get_E] dans les geôles [From.Get_du_TitledFirstName]...;Mein Plan, mich gegen Gift zu immunisieren, war nicht ganz so erfolgreich. Ich übersah vergiftetes Essen, dass für [From.GetTitledFirstName] gedacht war und so kam es dazu, dass ich in [From.GetTitledFirstName]s Verlies gelandet bin...;;Mi plan para inmunizarme contra los venenos no salió demasiado bien. No descubrí el veneno oculto en la comida de [From.GetTitledFirstName] y he terminado en sus mazmorras...;;;;;;;;;x

EVTOPTA105000;I have decided!;J'ai pris ma décision !;Ich habe entschieden!;;¡Ya me he decidido!;;;;;;;;;x
EVTOPTA105001;If you have no regrets after a month, you may be divorced;Si vous n'avez aucun regret au bout d'un mois, alors vous pourrez divorcer;Solltet Ihr es nach einem Monat nicht bedauern, könnt Ihr Euch scheiden lassen ;;Si no te arrepientes, después de un mes te podrás divorciar;;;;;;;;;x
EVTOPTA105002;A month I must wait, then;Je patienterai un mois, alors;Ich muss einen Monat warten, dann ;;Entonces debo esperar un mes;;;;;;;;;x
EVTOPTA105003;I must accept this marriage then;Dans ce cas, je dois accepter mon mariage;Ich muss diese Ehe also akzeptieren;;Entonces debo aceptar el matrimonio;;;;;;;;;x
EVTOPTA105004;Yes! I am no longer married to [Root.Spouse.GetTitledFirstName]!;Hourra ! Mon mariage avec [Root.Spouse.Get_le_TitledFirstName] est officiellement terminé !;Ja! Ich bin nicht länger mit [Root.Spouse.GetTitledFirstName] verheiratet!;;¡Sí! ¡Ya no estoy casada con [Root.Spouse.GetTitledFirstName]!;;;;;;;;;x
EVTOPTA105005;If that's what she wants...;Si c'est ce qu'elle veut...;Wenn es das ist, was sie möchte... ;;Si eso es lo que ella quiere...;;;;;;;;;x
EVTOPTA105006;No, I don't want to be married to you, I want that divorce!;Je ne veux plus t'avoir comme époux, je veux divorcer !;Nein, ich möchte mit dir nicht verheiratet sein - ich möchte diese Scheidung! ;;No, yo no quiero seguir casada contigo, !quiero el divorcio!;;;;;;;;;x
