#CODE;ENGLISH;FRENCH;GERMAN;;SPANISH;;;;;;;;;x

EVTDESC88500;The holy month of Ramadan is upon us, and all faithful Muslims, save the infirm and those on a journey, must observe the fast during daylight hours.;Le mois saint du ramadan est sur le point de débuter et tous les fidèles musulmans, à l'exception des infirmes et de ceux partis en voyage, doivent jeûner du lever au coucher du soleil.;Der heilige Monat des Ramadan steht uns bevor und alle gläubigen Moslems, mit Ausnahme der gebrechlichen und auf einer Reise befindlichen, müssen das Fasten während der Tagesstunden einhalten.;;Nos encontramos en el mes sagrado del Ramadán, por lo que todos los musulmanes creyentes, excepto los enfermos y los que se hallan de viaje, deben observar el ayuno durante las horas de luz.;;;;;;;;;x
EVTDESC88501;Ramadan is a blessed time for charity and kindness, and in that spirit you could release the prisoners languishing in your dungeons...;Le ramadan est une période dédiée à la charité et la gentillesse. Ainsi, vous pourriez éventuellement libérer les prisonniers qui croupissent dans vos geôles...;Ramadan ist eine gesegnete Zeit für Wohltätigkeit und Güte - in diesem Geist könntet Ihr die Gefangenen freilassen, die in Eurem Verlies schmachten... ;;El Ramadán es un período sagrado para la caridad y la amabilidad. Siguiendo su espíritu, podríais liberar a los prisioneros que languidecen en las mazmorras...;;;;;;;;;x
EVTDESC88502;The Prophet, may Allah honor him and grant him peace, teaches the importance of charity and good deeds, especially during the holy month of Ramadan. There are many poor in [Root.Location.GetName] who could be helped if you but parted with some of your treasury.;Le Prophète, que Dieu le bénisse, nous enseigne l'importance de la charité et des bonnes actions, plus particulièrement pendant le mois du ramadan. À [Root.Location.GetName], il y a de nombreuses personnes démunies à qui l'on pourrait venir en aide si vous acceptiez de donner un peu de votre or.;Der Prophet, möge Allah ihn ehren und Frieden gewähren, unterrichtet die Wichtigkeit von Wohltätigkeit und guten Taten, insbesondere im heiligen Monat des Ramadan. Es gibt viele Arme in [Root.Location.GetName], denen geholfen werden könnte, falls Ihr einen Teil Eurer Schatzkammer abgeben würdet. ;;El profeta, que Alá le honore y le dé la paz, enseña la importancia de la caridad y las buenas acciones, especialmente durante el mes sagrado del Ramadán. Hay muchos pobres en [Root.Location.GetName] que podrían recibir ayuda si aceptarais repartir parte de vuestro tesoro.;;;;;;;;;x
EVTDESC88503;Now is the time for prayers and devoted reading of the Qur'an. After the sun has set, you could recite the Qur'an through Tarawih prayers.;Le temps est venu de se consacrer aux prières et à la lecture du Coran. Au soleil couchant, vous pourriez réciter le Coran au travers des prières tarawhi.;Jetzt ist die Zeit der Gebete und dem aufmerksamen Lesen des Korans. Nachdem die Sonne untergegangen ist, könntet Ihr den Koran mit Hilfe der Tarawih-Gebete rezitieren.;;Ahora es época de oración y de lectura devota del Corán. Cuando se ponga el sol, podrías recitar el Corán a través de oraciones Tarawih.;;;;;;;;;x
EVTDESC88504;The strict fast you have been observing during the daylight hours of Ramadan has weakened you to the point of illness. As the ill are exempted from fasting, there would be no shame or loss of piety if you abandoned the fast and made up for the lost days at a later time. If you continue, however, there could be serious repercussions to your health...;Le jeûne sévère que vous observez la journée lors du ramadan vous a affaibli au point de vous rendre malade. Puisque les personnes souffrantes sont exemptées du jeûne, vous pourriez remanger normalement le temps de vous rétablir puis reprendre le jeûne sans risque d'être montré du doigt. Cependant, si vous persistez à ne rien manger, cela pourrait avoir de graves répercussions sur votre état de santé...;Das strenge Fasten, das Ihr während der Tagesstunden eingehalten habt, hat Euch bis zur Erkrankung geschwächt. Da die Kranken vom Fasten befreit sind, wäre es keine Schande, falls Ihr es abbrechen und die verlorenen Tage zu einem späteren Zeitpunkt nachholen würdet. Falls Ihr jedoch weitermacht, könnte dies schlimme Folgen für Eure Gesundheit haben...;;El ayuno estricto que has estado observando durante las horas de luz del Ramadán te ha debilitado hasta caer enfermo. Como los enfermos están exentos del ayuno, no sería vergonzoso ni perderías la piedad si abandonaras el ayuno y compensaras los días perdidos más adelante. Sin embargo, si continúas, tu salud podría sufrir graves repercusiones...;;;;;;;;;x
EVTDESC88505;Your decision to continue fasting despite your illness has proved a costly one. You have become infirm with weakness due to lack of food and water, and left with no choice but to interrupt the fast.;Votre décision de continuer à jeûner malgré la maladie a eu une conséquence tragique. Le manque de nourriture et d'eau vous a rendu infirme et vous n'avez d'autre choix que de cesser le jeûne.;Eure Entscheidung, trotz Eurer Krankheit mit dem Fasten fortzufahren, kommt Euch teuer zu stehen. Ihr seid aufgrund der Ermangelung von Essen und Wasser gebrechlich geworden. Das hat Euch keine andere Wahl gelassen, als das Fasten zu unterbrechen.;;La decisión de continuar con el ayuno a pesar de tu enfermedad te ha salido cara. Has entrado en estado de debilidad debido a la falta de agua y alimentos, y no te ha quedado otra opción que interrumpir el ayuno.;;;;;;;;;x
EVTDESC88506;The fast you have observed during Ramadan has taught you the value of moderation in all things, and the dangers of indulgence and excess. You feel closer to Allah.;Le jeûne que vous avez respecté durant le ramadan vous a appris la notion de modération ainsi que les dangers des petits plaisirs et des excès. Vous vous sentez plus proche d'Allah.;Das Fasten während des Ramadan hat Euch den Wert des Maßhaltens in allen Belangen beigebracht - und den Gefahren von Genuss und Exzessen. Ihr fühlt Euch Allah näher.;;El ayuno que has observado durante el Ramadán te ha enseñado el valor de la moderación en todas las cosas, así como los peligros de la indulgencia y del exceso. Te sientes más cerca de Alá.;;;;;;;;;x
EVTDESC88507;You have given generously to the poor during Ramadan and performed many good deeds. The urge to help those in need comes naturally to you.;Au cours du ramadan, vous avez fait preuve de générosité envers les pauvres et avez réalisé de bonnes actions. La nécessité d'aider les plus démunis est devenue une priorité chez vous.;Während des Ramadan habt Ihr freigiebig den Armen gegeben und gute Taten vollbracht. Der Wunsch, denen in Not zu helfen, ist ganz natürlich für Euch. ;;Has sido generoso con los pobres durante el Ramadán y has hecho muchas buenas acciones. La necesidad de ayudar a los necesitados es algo natural en ti.;;;;;;;;;x
EVTDESC88508;The ongoing war demands your full attention, and you and your men can no longer continue your fast. You will have to make up the lost days at a later date.;La guerre qui fait rage requiert toute votre attention, et vous et vos hommes ne pouvez plus continuer le jeûne. Vous devrez rattraper les jours perdus à une date ultérieure.;Der anhaltende Krieg verlangt Eure ganze Aufmerksamkeit, und Ihr und Eure Männer können nicht länger Euer Fasten fortführen. Ihr werdet die verlorenen Tage zu einem späteren Zeitpunkt nachholen müssen. ;;La guerra en curso acapara toda tu atención. Ni tú ni tus hombres podéis continuar el ayuno. Tendrás que compensar los días perdidos más adelante.;;;;;;;;;x
EVTDESC88509;You have become ill and will have to abandon the fast. The lost days will have to be made up at a later date.;Vous êtes tombé malade et devez interrompre le jeûne. Vous devrez compenser les jours perdus à une date ultérieure.;Ihr seid krank geworden und müsst das Fasten abbrechen. Die verlorenen Tage werdet Ihr zu einem späteren Zeitpunkt nachholen müssen. ;;Has enfermado y tendrás que abandonar el ayuno. Deberás compensar los días perdidos más adelante.;;;;;;;;;x
EVTDESC88510;The end of Ramadan approaches, and that means the holiday of Eid ul-Fitr is upon us. The preparations for the planned feast to celebrate this have already been made, and now the time has come to invite your vassals to your palace. What say you, Master?;La fin du ramadan approche, cela signifie que le jour de fête de l'Aïd al-Fitr est pour bientôt. Les préparatifs sont déjà terminés et vous devez maintenant inviter vos vassaux dans votre palais. Qu'en dites-vous, Maître ?;Der Ramadan neigt sich dem Ende und das bedeutet, dass uns der Feiertag des Eid ul-Fitr bevorsteht. Die Vorbereitungen für die geplanten Festlichkeiten, um dies zu feiern, wurden bereits gemacht und nun ist die Zeit gekommen, Eure Vasallen in Euren Palast einzuladen. Was sagt Ihr, Meister?;;Se acerca el fin del Ramadán. Eso significa que celebraremos el Eid al-Fitr, el banquete de caridad. Los preparativos ya están ultimados. Solo resta invitar a los vasallos a palacio. ¿Qué decís, Maestro?;;;;;;;;;x
EVTDESC88511;Peace be upon you, [Root.GetTitledName]. The end of Ramadan draws near, and to celebrate the holiday of Eid ul-Fitr I have decided to hold a great feast in my palace. You are of course invited.\n\nWith respect,\n[From.GetTitledFirstName];Que la paix soit avec vous, [Root.GetTitledFirstName]. La fin du ramadan approche et pour célébrer le jour saint de l'Aïd al-Fitr, j'ai décidé d'organiser une grand fête dans mon palais. Vous êtes bien sûr cordialement invité.\n\nSalutations,\n[From.GetTitledFirstName];Friede sei mit Euch,[Root.GetTitledName]. Das Ende des Ramadan rückt näher, und um den Feiertag des Eid ul-Fitr zu feiern, habe ich beschlossen, eine große Festivität in meinem Palast zu veranstalten. Natürlich seid Ihr eingeladen.\n\nMit Respekt,\n[From.GetTitledFirstName];;Que la paz esté contigo, [Root.GetTitledName]. Se acerca el fin del Ramadán y, para conmemorar la fiesta de Eid al-Fitr, he decidido celebrar un gran banquete en mi palacio. Por supuesto, estás invitado. \n\nAtentamente,\n[From.GetTitledFirstName];;;;;;;;;x
EVTDESC88512;Peace be upon you, [Root.GetTitledName]. I give thanks for your invitation to celebrate Eid ul-Fitr at your palace, but I regret to inform you I cannot attend.\n\nYour servant,\n[From.GetTitledFirstName];Que la paix soit avec vous, [Root.GetTitledFirstName]. Je vous remercie de m'avoir envoyé cette invitation pour la fête de l'Aïd al-Fitr mais je suis au regret de vous informer que je ne pourrai pas y participer.\n\nVotre serviteur,\n[From.GetTitledFirstName];Friede sei mit Euch, [Root.GetTitledName]. Habt Dank für Eure Einladung, Eid ul-Fitr in Eurem Palast zu feiern. Leider muss ich Euch jedoch davon in Kenntnis setzen, dass ich nicht teilnehmen kann.\n\nEuer Diener,\n[From.GetTitledFirstName];;Que la paz sea contigo, [Root.GetTitledName]. Agradezco vuestra invitación para conmemorar el Eid al-Fitr en palacio, pero lamento comunicaros que no podré asistir. \n\nVuestro siervo,\n[From.GetTitledFirstName];;;;;;;;;x
EVTDESC88513;The great banquet you ordered held to celebrate Eid ul-Fitr and the end of Ramadan was a rousing success! The food was exceptional, the entertainment magnificent and a great time was had by all. Your guests seemed suitably impressed by your wealth and generosity.;Le banquet que vous avez organisé afin de célébrer l'Aïd al-Fitr et la fin du ramadan a connu un grand succès ! La nourriture était d'une qualité exceptionnelle, l'ambiance était au rendez-vous et tous les convives ont passé un moment fort agréable. Vos invités ont été impressionnés par votre richesse et votre générosité.;Das große Bankett, das Ihr in Auftrag gegeben habt, um Eid ul-Fitr am Ende des Ramadan zu feiern, war ein großer Erfolg! Das Essen war außergewöhnlich, die Unterhaltung prächtig und alle hatten eine großartige Zeit. Eure Gäste schienen angemessen beeindruckt von Eurem Reichtum und Eurer Großzügigkeit.;;¡El gran banquete que ordenaste celebrar para festejar el Eid al-Fitr y el final de Ramadán fue un auténtico éxito! La comida era excepcional, la animación fantástica y todos lo pasaron muy bien. Tus invitados parecían muy impresionados por tus posesiones y generosidad.;;;;;;;;;x
EVTDESC88514;The great banquet held by [From.GetTitledName] to celebrate Eid ul-Fitr and the end of Ramadan was a splendid occasion. The food was exceptional, the entertainment magnificent and a great time was had by all.;Le banquet organisé par [From.Get_le_TitledName] pour célébrer l'Aïd al-Fitr et la fin du ramadan fut une splendide réception ! La nourriture était d'une qualité exceptionnelle, l'ambiance était au rendez-vous et tous les convives ont passé un agréable moment. ;Das große von [From.GetTitledName] veranstaltete Bankett, um Eid ul-Fitr und das Ende des Ramadan zu feiern, war ein famoses Ereignis. Das Essen war außergewöhnlich, die Unterhaltung prächtig und alle hatten eine großartige Zeit.;;¡El gran banquete celebrado por [From.GetTitledName] para festejar el Eid al-Fitr y el final de Ramadán fue un acontecimiento espléndido! La comida era excepcional, la animación fantástica y todos lo pasaron muy bien.;;;;;;;;;x
EVTDESC88515;To celebrate Eid ul-Fitr, perhaps you should present a gift to your beloved wife.;Pour célébrer l'Aïd al-Fitr , peut-être devriez-vous offrir un cadeau à votre épouse bien-aimée.;Um Eid ul-Fitr zu feiern, solltet Ihr Eurer geliebten Frau vielleicht etwas schenken. ;;Para festejar el Eid al-Fitr, tal vez deberías hacer un regalo a tu amada esposa.;;;;;;;;;x
EVTDESC88516;To celebrate Eid ul-Fitr, perhaps you should present gifts to your beloved wives.;Pour célébrer l'Aïd al-Fitr , peut-être devriez-vous offrir un cadeau à vos épouses bien-aimées.;Um Eid ul-Fitr zu feiern, solltet Ihr Euren geliebten Frauen vielleicht etwas schenken. ;;Para festejar el Eid al-Fitr, tal vez deberías hacer un regalo a tus amadas esposas.;;;;;;;;;x
EVTDESC88517;The hunger pains you experience during the fast have become unbearable due to your gluttonous nature. With the sun still high in the sky, you break into the pantry and help yourself to the food inside while tears stream down your face...;Les douleurs liées à la faim que vous connaissez pendant le jeûne deviennent insupportables en raison de votre caractère gourmand. Alors que le soleil est encore haut dans le ciel, vous pénétrez dans le garde-manger et engloutissez une montagne de nourriture tandis que des larmes inondent vos joues...;Der Hunger schmerzt Euch, die Erfahrung der Fastenzeit ist aufgrund Eurer gefräßigen Natur unerträglich. Mit der Sonne, die hoch oben am Himmel steht, brecht Ihr in die Speisekammer ein, um Euch an dem Essen zu bedienen, während Euch Tränen das Gesicht herunterlaufen... ;;El dolor que te produce el hambre durante el ayuno se ha convertido en insoportable debido a tu naturaleza glotona. Con el sol aún en lo alto, irrumpes en la despensa y te haces con la comida mientras se te caen las lágrimas...;;;;;;;;;x
EVTDESC88518;Overcome with lust and in broad daylight during the fast, you sinfully engage in the pleasures of the flesh with a serving girl.;Rongé par le désir, vous vous laissez aller aux plaisirs de la chair avec une jeune servante en pleine journée, pendant le jeûne.;Von der Begierde überwältigt, und im vagen Tageslicht während der Fastenzeit, lasst Ihr Euch auf die sündigen Genüsse des Fleisches mit einer Dienstmagd ein.;;El deseo te corrompe. A plena luz del día, caes en pecado y cedes a los placeres de la carne con una sirvienta.;;;;;;;;;x
EVTDESC88519;Though the fast requires you to abstain from food and drink during the daylight hours, you helped yourself to enough wine to fall into a drunken stupor.;Alors que le jeûne vous interdit de manger et de boire pendant la journée, vous ingurgitez suffisamment de vin pour plonger dans une stupeur éthylique.;Auch wenn die Fastenzeit die Abstinenz von Essen und Trinken während der Tagesstunden erfordert, habt Ihr Euch zu genug Wein verholfen, um in einen Vollrausch zu verfallen. ;;Aunque el ayuno te obliga a abstenerte de comer y beber durante las horas de sol, has tomado vino suficiente para el sopor etílico.;;;;;;;;;x
EVTDESC88520;Many in [Root.Location.GetName] have donated generously to provide for the poor during the holy month of Ramadan. The gold has been gathered in an urn but when you approach it to donate your own share, your greedy nature results in your coin purse gaining weight instead of losing it...;Beaucoup d'habitants de [Root.Location.GetName] ont fait preuve d'une grande générosité au cours du ramadan pour les pauvres. L'or est déposé dans une urne et alors que vous vous approchez du contenant pour donner l'aumône, votre cupidité prend le dessus et à la sortie, votre bourse pèse plus lourd qu'à votre arrivée...;Viele in [Root.Location.GetName] haben großzügig gespendet, um die Armen im heiligen Monat des Ramadan zu versorgen. Das Gold wurde in einer Urne gesammelt, doch als Ihr zu ihr geht, um Euren Anteil zu spenden, führt Eure geizige Natur dazu, dass Euer Geldbeutel an Gewicht gewinnt, statt zu verlieren... ;;Muchos habitantes de [Root.Location.GetName] han hecho donaciones generosas para los pobres durante el mes sagrado del Ramadán. Las monedas se recogen en una urna, pero cuando tú te acercas a realizar tu contribución, tu carácter acaparador hace que tu bolsa gane peso en lugar de perderlo...;;;;;;;;;x
EVTDESC88521;As a cynical unbeliever, you do your best to uphold the appearance of observing the fast, but behind closed doors you do not think twice about eating and drinking to your heart's content, be it day or night. One day you are caught in the act...;En tant qu'incrédule cynique, vous faites de votre mieux pour faire croire que vous observez le jeûne mais en réalité, vous n'hésitez pas une seconde avant de manger et de boire ce qu'il vous plaît, de jour comme de nuit. Mais un jour, vous êtes pris la main dans le sac...;Als zynischer Ungläubiger versucht Ihr Euer Bestes, um den äußeren Schein, dass Ihr an der Fastenzeit teilnehmt, zu wahren, doch hinter geschlossenen Türen denkt Ihr nicht zweimal darüber nach, nach Herzenslust zu essen und zu trinken, egal ob am Tag oder in der Nacht. Eines Tages werdet Ihr auf frischer Tat ertappt...;;Como ateo cínico que eres, tratas de guardar las apariencias observando el ayuno, pero de puertas para dentro no te lo piensas dos veces antes de comer y beber hasta saciarte, sea de día o de noche. Un día quedas eres descubierto...;;;;;;;;;x
EVTDESC88522;Your fast and observance of the holy month of Ramadan has ended.;Le jeûne du mois saint du ramadan est à présent terminé.;Eure Fastenzeit und Befolgung des heiligen Monats, dem Ramadan, ist zu Ende.;;El ayuno y la observación del mes sagrado del Ramadán han terminado.;;;;;;;;;x

EVTOPTA88500;Let the fast commence!;Que le jeûne commence !;Möge die Fastenzeit beginnen!;;¡Que comience el ayuno!;;;;;;;;;x
EVTOPTA88501;Yes, set them free.;Oui, libérez-les.;Ja, lasst sie frei.;;Sí, quedan liberados.;;;;;;;;;x
EVTOPTA88502;Yes, make it so. Distribute alms to the poor.;Oui, faites ainsi. Distribuez l'aumône aux pauvres.;Ja, tut das. Verteilt Almosen an die Armen.;;Sí, así lo haré. Dad limosna a los pobres.;;;;;;;;;x
EVTOPTA88503;Yes, I will thus draw nearer to Allah.;Oui, et ce faisant, je me rapprocherai un peu plus d'Allah.;Ja, ich werde danach näher zu Allah gezogen. ;;Sí, de este modo me acercaré más a Alá.;;;;;;;;;x
EVTOPTA88504;Yes, I need time to recover from this...;Oui, je dois absolument retrouver des forces...;Ja, ich brauche Zeit, um mich davon zu erholen...;;Sí, necesito tiempo para recuperarme de esto...;;;;;;;;;x
EVTOPTA88505;Perhaps next year...;Peut-être l'an prochain...;Vielleicht nächstes Jahr... ;;Tal vez el año que viene...;;;;;;;;;x
EVTOPTA88506;I am a new person.;Je suis une nouvelle personne.;Ich bin eine neue Person. ;;Soy una persona nueva.;;;;;;;;;x
EVTOPTA88507;I feel like a better person.;J'ai l'impression d'être une meilleure personne.;Ich habe das Gefühl, als wäre ich jetzt ein besserer Mensch. ;;Me siento mejor persona.;;;;;;;;;x
EVTOPTA88508;So it must be.;Nous n'avons pas le choix.;So muss es sein.;;Así debe ser.;;;;;;;;;x
EVTOPTA88509;So it is.;Puisqu'il le faut.;So sei es.;;Así sea.;;;;;;;;;x
EVTOPTA88510;Send out the invitations!;Envoyez les invitations !;Versendet die Einladungen.;;¡Enviad las invitaciones!;;;;;;;;;x
EVTOPTA88511;I am honored to accept.;C'est un honneur, j'accepte votre invitation.;Ich fühle mich geehrt, anzunehmen.;;Tengo el honor de aceptar.;;;;;;;;;x
EVTOPTA88512;So [From.GetSheHe] dares refuse!;Ah ! [From.GetIlElle] ose décliner mon invitation !;Also wagt [From.GetSheHe] es, sich zu weigern! ;;¡Así que se atreve a rechazar la invitación!;;;;;;;;;x
EVTOPTA88513;Eid Mubarak!;Bonne fête de l'Aïd !;Eid Mubarak!;;¡Eid Mubarak!;;;;;;;;;x
EVTOPTA88514;Eid Mubarak!;Bonne fête de l'Aïd !;Eid Mubarak!;;¡Eid Mubarak!;;;;;;;;;x
EVTOPTA88515;Of course! I will buy her a golden necklace.;Bien sûr ! Je vais lui acheter un collier en or.;Natürlich! Ich werde ihr eine goldene Halskette schenken. ;;¡Por supuesto! Le compraré un colgante de oro.;;;;;;;;;x
EVTOPTA88516;Yes, but only for [Root.Spouse.GetFirstName], my dear first wife.;Oui, mais uniquement pour [Root.Spouse.GetFirstName], ma première et tendre épouse.;Ja, aber nur [Root.Spouse.GetFirstName], meiner geliebten ersten Frau.;;Sí, pero solo a [Root.Spouse.GetFirstName], mi querida primera esposa.;;;;;;;;;x
EVTOPTA88517;Mmhf... c-can't.. help myself...;Miam... Impossible... De résister...;Mmpf...k-kann mir.. nicht helfen...;;Mmm... no... no puedo evitarlo...;;;;;;;;;x
EVTOPTA88518;I should not have done that...;Je n'aurais jamais dû faire ça...;Das hätte ich nicht tun sollen... ;;No debería haber hecho esto...;;;;;;;;;x
EVTOPTA88519;I-I'm schorry...;Je suis... *hips* désolé...;E-es tut mir leid...;;Lo... lo siento...;;;;;;;;;x
EVTOPTA88520;No one will miss a few coins...;Ces quelques piécettes ne manqueront à personne...;Niemand wird ein paar Münzen vermissen... ;;Nadie echará de menos unas pocas monedas...;;;;;;;;;x
EVTOPTA88521;I-It's not what it looks like!;Ce n'est pas ce que vous croyez !;E-es ist nicht, wonach es aussieht...;;¡No... no es lo que parece!;;;;;;;;;x
EVTOPTA88522;Until next year.;Jusqu'à l'an prochain.;Bis nächstes Jahr.;;Hasta el año que viene.;;;;;;;;;x

EVTOPTB88501;No, they are where they belong.;Non, qu'ils y restent.;Nein, sie sind dort, wo sie hingehören.;;No, están donde les corresponde.;;;;;;;;;x
EVTOPTB88502;No, I would not disturb their fast by giving them means to buy food...;Non, je ne voudrais pas perturber leur jeûne en leur donnant de quoi acheter à manger...;Nein, sie unterbrechen ihre Fastenzeit, indem sie Nahrung kaufen...;;No, no me gustaría interrumpir su ayuno proporcionándoles medios para comprar alimentos...;;;;;;;;;x
EVTOPTB88503;No, I do not have the time to spare.;Non, je n'ai pas de temps à perdre.;Nein, ich habe keine Zeit für so etwas.;;No, no tengo tiempo que perder.;;;;;;;;;x
EVTOPTB88504;No, I feel fine!;Non, je vais très bien !;Nein, mir geht es gut!;;No, ¡me siento bien!;;;;;;;;;x
EVTOPTB88510;No, I have a headache. Cancel the festivities!;Non, j'ai la migraine. Annulez la fête !;Nein, ich habe Kopfschmerzen. Sagt die Festlichkeiten ab!;;No, me duele la cabeza. ¡Cancelad las celebraciones!;;;;;;;;;x
EVTOPTB88511;No, I have other plans.;Non merci, j'ai d'autres projets.;Nein, ich habe andere Pläne.;;No, tengo otros planes.;;;;;;;;;x
EVTOPTB88515;No, my affection for her is gift enough.;Non, l'affection que j'ai à son égard suffit amplement.;Nein, meine Zuneigung ist Geschenk genug. ;;No, el afecto que le doy es regalo suficiente.;;;;;;;;;x
EVTOPTB88516;Of course, they will all see my love!;Bien sûr, je vais offrir à toutes un gage de mon amour !;Natürlich, sie werden alle meine Liebe sehen! ;;Por supuesto, ¡todas podrán ver mi amor!;;;;;;;;;x

EVTOPTC88516;My affection for them is gift enough.;L'affection que je leur porte suffit largement.;Meine Zuneigung für sie ist Geschenk genug. ;;El afecto que les doy es regalo suficiente.;;;;;;;;;x

EVTTOOLTIP88512;Invitation rejected.;Invitation rejetée.;Einladung abgelehnt.;;Invitación rechazada;;;;;;;;;x
EVTTOOLTIP88513;Eid ul-Fitr feast is held.;La fête de l'Aïd al-Fitr est organisée.;Das Eid-ul-Fitr-Festessen wird abgehalten. ;;Se celebra el Eid al-Fitr.;;;;;;;;;x
EVTTOOLTIP88514;Eid ul-Fitr feast is attended.;La fête de l'Aïd al-Fitr est un succès.;Am Eid-ul-Fitr-Festessen wird teilgenommen.;;Asistes al Eid al-Fitr.;;;;;;;;;x
EVTTOOLTIP88522;The fast ends.;Le jeûne se termine.;Die Fastenzeit endet.;;Finaliza el ayuno.;;;;;;;;;x

RAMADANTITLE;Ramadan;Ramadan;Ramadan;;Ramadán;;;;;;;;;x
