#CODE;ENGLISH;FRENCH;GERMAN;;SPANISH;;;;;;;;;x

evt_DESC_ZP_8;Today is a sad day. The dog I became the guardian of, that has loyally defended my family and I from evil spirits, has passed away. Today is a day of mourning and sorrow.;C'est un jour triste. Le chien dont je m'occupais, qui a bravement défendu ma famille et moi-même des esprits maléfiques, s'en est allé.;Heute ist ein trauriger Tag. Der Hund, dessen Wächter ich war und der meine Familie treu verteidigt hat und mich vor bösen Geistern geschützt hat, ist verstorben. Heute ist ein Tag der Trauer und des Schmerzes.;;Hoy es un día triste. El perro del que cuidé, que defendió mi familia y a mí mismo contra espíritus malignos, ha fallecido. Hoy es un día de luto y pena.;;;;;;;;;x
evt_DESC_ZP_9;Today is a sad day. The hedgehog I took into my house that faithfully hunted down vermin has passed away. Today is a day of mourning and sorrow.;C'est un jour triste. Le hérisson que j'ai pris sous mon toit, qui a loyalement traqué les animaux nuisibles s'en est allé.;Heute ist ein trauriger Tag. Der Igel, den ich in mein Haus nahm und der das Ungeziefer treu gejagt hat, ist verstorben. Heute ist ein Tag der Trauer und des Schmerzes.;;Hoy es un día triste. El erizo que traje a mi casa y que cazó alimañas fielmente , ha fallecido. Hoy es un día de luto y pena.;;;;;;;;;x
evt_DESC_ZP_10;Today is a sad day. The otter I took into my house that faithfully ensured the health and well-being of my realm has passed away. Today is a day of mourning and sorrow.;C'est un jour triste. Le chien à loutre que j'ai pris sous mon toit, qui a loyalement assuré santé et bien-être à mon pays s'en est allé.;Heute ist ein trauriger Tag. Der Otter, den ich in mein Haus gebracht habe und der die Gesundheit und das Wohlergehen meines Reiches treu gesichert hat, ist verstorben. Heute ist ein Tag der Trauer und des Schmerzes.;;Hoy es un día triste. La nutria que traje a mi casa y que garantizó lealmente la salud y bienestar de mi reino, ha fallecido. Hoy es un día de luto y pena.;;;;;;;;;x

evt_OPTA_ZP_8;He was loyal until the end.;Il a été loyal jusqu'à la fin.;Er war bis zum Schluss loyal.;;Leal hasta el fin.;;;;;;;;;x
evt_OPTA_ZP_9;Never was there a better hunter.;Jamais il n'y eut meilleur chasseur.;Niemals gab es einen besseren Jäger.;;Jamás hubo mejor cazador.;;;;;;;;;x
evt_OPTA_ZP_10;May he finally rest.;Puisse-t-il reposer en paix.;Möge er friedlich ruhen.;;Que al fin pueda descansar.;;;;;;;;;x

EVTDESC_ZP_1;As a pious man, after having read the texts of the Vendidad, you are more aware of the Daevas' presence all around you and the danger they put your family and realm in. So, you have decided that your house shall adopt one of the Good Spirit's Dogs.;En tant qu'homme pieux, après avoir lu les textes du Vendidad, vous êtes plus conscient de la présence des daevas tout autour de vous et du danger qu'ils représentent pour votre famille et votre Royaume. Ainsi, vous avez décidé que votre maison adopte l'un des chiens.;Als frommer Gläubiger, der die Vendidad-Texte gelesen hat, seid Ihr Euch im Klaren darüber, welche Gefahr für Euch und Eure Familie von der Anwesenheit Daevas' ausgeht. Deshalb habt Ihr beschlossen, einen Hund des guten Geistes bei Euch aufzunehmen.;;Como hombre piadoso, después de haber leído los textos del Vendidad, eres más consciente de la presencia de los daevas a tu alrededor y del peligro en el que ponen a tu familia y a tu reino. Por ello, has decidido que tu casa adoptará a uno de los perros del Buen Espíritu.;;;;;;;;;x
EVTDESC_ZP_2;A Vohunazga of [Root.Capital.Capital.GetName] is known to the people as a kind creature of Ahura Mazda, protecting your capital from the Daevas which roam in the darkness.;Un vohunazga de [Root.Capital.Capital.GetName] est connu du peuple comme une créature aimable d'Ahura Mazda, protégeant votre capital des daevas qui errent dans l'obscurité.;Ein Vohunazga von [Root.Capital.Capital.GetName] ist dem Volk als gütiges Wesen von Ahura Mazda bekannt und schützt Eure Hauptstadt vor den Daevas, die in der Dunkelheit ihr Unwesen treiben.;;Un Vohunazga de [Root.Capital.Capital.GetName] tiene fama de ser una criatura amable de Ahura Mazda que protégé tu capital de los daevas que vagan en la oscuridad.;;;;;;;;;x
EVTDESC_ZP_3;The dog called Vanghapara is known as a vigilant creature of the Spenta Mainyu. As darkness beckons this dog wakes to keep us safe from its evil creatures. This is why it is such a popular pet among [Root.Religion.GetName] families.;Le chien appelé Vanghapara est connu comme une créature vigilante de la Spenta Mainyu. La nuit tombée, ce chien se réveille pour nous garder à l'abri de ses créatures maléfiques. Voilà pourquoi, c'est un animal de compagnie populaire dans les familles [Root.Religion.GetName]s.;Der Hund namens Vanghapara ist bekannt als wachsame Kreatur von Spenta Mainyu. Wenn die Dunkelheit naht, erwacht der Hund, um uns vor den Geschöpfen des Bösen zu schützen. Deshalb ist er als Haustier bei den Anhängern der Religion [Root.Religion.GetName] beliebt.;;Al perro llamado Vanghapara se lo conoce por ser una criatura vigilante del Spenta Mainyu. Cuando la oscuridad llama, este perro se despierta para mantenernos a salvo de sus perversas criaturas. Esa es la razón de su popularidad como mascota entre las familias de la religión [Root.Religion.GetName].;;;;;;;;;x
EVTDESC_ZP_4;The dog of the water is the most revered of all the dogs. They are what keeps our fields watered and healthy, our bellies full and worries gone.;Le chien de l'eau est le plus vénéré de tous les chiens. Il maintient nos champs arrosés et en bonne santé, nos ventres pleins et fait disparaître nos inquiétudes.;Der Hund des Wassers ist der am höchsten geachtete unter den Hunden. Ihm haben wir es zu verdanken, dass unsere Felder Wasser haben und gesund sind und dass unsere Bäuche gefüllt und unser Denken frei von Sorge ist.;;El perro del agua es el más venerado de entre todos los perros. Ellos son quienes mantienen nuestros campos regados y saludables, nuestros estómagos llenos y nuestras preocupaciones alejadas.;;;;;;;;;x

EVTOPTA_ZP_1;Vohunazga, the dog without a master.;Vohunazga, le chien sans maître.;Vohunazga, der Hund ohne Herrn.;;Vohunazga, el perro sin amo.;;;;;;;;;x
EVTOPTA_ZP_2;He shall roam free but protected by the [Root.GetOnlyDynastyName].;Il doit se déplacer librement, mais protégé par les [Root.GetOnlyDynastyName].;Er soll frei sein und unter dem Schutz derer von [Root.GetOnlyDynastyName] stehen.;;Vagará libre, pero bajo la protección de los [Root.GetOnlyDynastyName].;;;;;;;;;x
EVTOPTA_ZP_3;The Vanghapara shall protect my home well.;Le Vanghapara protégera bien ma demeure;Der Vanghapara wird mein Zuhause schützen.;;El Vanghapara sabrá proteger mi hogar.;;;;;;;;;x
EVTOPTA_ZP_4;It is our honor to house the Sag-e Aabi;C'est un honneur d'abriter ce Sag-e Aabi;Es ist uns eine Ehre, Sag-e Aabi ein Zuhause zu geben!;;Para nosotros es un honor dar hogar al Sag-e Aabi.;;;;;;;;;x

EVTOPTB_ZP_1;Vanghapara, the dog with a prickly back.;Vanghapara, le chien avec un dos armé de piquants.;Vanghapara, der Hund mit dem dornigen Rücken.;;Vanghapara, el perro con el lomo lleno de púas.;;;;;;;;;x
EVTOPTB_ZP_2;Take him in! He is one of the [Root.GetOnlyDynastyName].;Le prendre ! Il est l'un des [Root.GetOnlyDynastyName].;Nehmt ihn auf! Er ist einer von uns, ein [Root.GetOnlyDynastyName].;;¡Traedlo! Es uno más de los [Root.GetOnlyDynastyName].;;;;;;;;;x

EVTOPTC_ZP_1;Sag-e Aabi, the dog of the water.;Sag-e Aabi, le chien de l'eau.;Sag-e Aabi, der Hund des Wassers.;;Sag-e Aabi, el perro del agua.;;;;;;;;;x

EVTOPTD_ZP_1;We need no damned dog!;Nous n'avons besoin d'aucun chien !;Wir brauchen keinen verwünschten Hund!;;¡No necesitamos ningún maldito perro!;;;;;;;;;x
