EVTDESC_SOA_2009;The mighty Sky-Father of the Tengri faith is all-seeing, but still has need of human instruments on the ground. The Lords of the Sky, a new holy order that has been founded in the wake of the Tengri Reformation, ride to do battle against infidels and to spread the will of the Sky-Father to all corners of the world. The deafening sound of these knights approaching on their mounts is like thunder in the sky, and the noise alone is rumored to have made some convert to the Tengri religion on the spot.;Le puissant Père-Ciel de la foi tengriste voit tout mais a besoin d'aide sur terre pour que sa volonté s'accomplisse.\nLes Seigneurs du Ciel, un nouvel ordre saint fondé dans le cadre de la réforme tengriste, chevauchent les steppes et combattent les infidèles tout en répandant la volonté du Père-Ciel aux quatre coins du monde. Le bruit assourdissant de ces guerriers lorsqu'ils approchent sur leurs montures est comme le tonnerre dans le ciel, et la rumeur court que ce bruit seul convertit certains à leur religion dès qu'ils l'entendent.;Der mächtige Himmelsvater des Tengri-Glaubens sieht alles, doch er braucht auf Erden Menschen als Werkzeuge. Die Herren des Himmels, ein neuer, nach der Tengri-Reformation gegründeter heiliger Orden, zieht gegen die Ungläubigen in den Kampf, um den Willen des Himmelsvaters auf der ganzen Erde zu verbreiten. Das Grollen der Hufe der heranpreschenden Ritter klingt wie Donner aus dem Himmel und hat schon manchen bewogen, sich auf der Stelle zum Tengri-Glauben zu bekennen. ;;El poderoso Padre-Cielo de la fe Tengri todo lo ve, pero aun así necesita valerse de instrumentos humanos en la Tierra. Los Señores del Cielo, una nueva orden santa fundada a la luz de la reforma Tengri, preparada para luchar contra los infieles y hacer llegar la voluntad del Padre-Cielo a todos los rincones del mundo. El sonido ensordecedor de estos caballeros acercándose sobre sus monturas a galope es como oír tronar el cielo. Dicen que el mero ruido ha sido suficiente para que algunos se hayan convertido a la religión Tengri en el acto.;;;;;;;;;x
EVTDESC_SOA_2031;My [GetFromRelation], [From.GetTitledFirstName], has requested to join the Lords of the Sky in their tireless pursuit of heathenry, even though this will forever disinherit him.;M[From.GetOnA] [GetFromRelation], [From.Get_le_TitledFirstName], a demandé à rejoindre les seigneurs du Ciel dans leur lutte infatigable contre les faibles hérétiques, même si cela le déshéritera à jamais.;Mein [GetFromRelation], [From.GetTitledFirstName] will den Herren des Himmels in ihrem unermüdlichen Kampf gegen das Heidentum beitreten, obwohl ihn dies auf ewig von der Erbfolge ausschließt. ;;Mi [GetFromRelation] [From.GetTitledFirstName] ha solicitado unirse a los Señores del Cielo en su búsqueda incansable del paganismo, a pesar de que esta acción le desheredará para siempre.;;;;;;;;;x
EVTDESC_SOA_2041;Great [Root.PrimaryTitle.GetRulerTitle], your extremely generous donation will aid us greatly as we ride into battle against the enemies of the Sky-Father! Upon my honor, I shall name one of my finest steeds after you!\n\nFor the Sky-Father!\nWarchief [From.GetFirstName];Noble [Root.PrimaryTitle.GetRulerTitle], votre très généreuse contribution nous aidera grandement lorsque nous chevaucherons contre les ennemis du Père-Ciel !\nNous vous promettons sur notre honneur que nous donnerons votre nom à l'un de nos meilleurs chevaux !\n\nPour le Père-Ciel !\nChef de guerre [From.GetFirstName];Großer [Root.PrimaryTitle.GetRulerTitle], Eure äußerst großzügige Spende wird uns sehr helfen, wenn wir in den Kampf gegen die Feinde des Himmelsvaters reiten! Bei meiner Ehre, ich will eines meiner besten Pferde nach Euch benennen!!\n\nFür den Himmelsvater!\nKriegshäuptling [From.GetFirstName];;Gran [Root.PrimaryTitle.GetRulerTitle], ¡esta donación tan generosa nos será de gran ayuda en nuestra batalla contra los enemigos del Padre-Cielo! ¡Uno de mis mejores corceles llevará su nombre!.\n\nPor el Padre-Cielo,\nJefe Guerrero [From.GetFirstName];;;;;;;;;x
EVTDESC_SOA_2053;Most righteous [Root.GetTitledFirstName], the Lords of the Sky are in need of more castles in order to train troops and generate a supporting income. There is a suitable location in your demesne - in [FromFrom.GetName] to be specific. I am willing to pay you 100 gold in exchange for the right to construct a fortress there.\n\nFor the Sky-Father!\nWarchief [From.GetFirstName];Très juste [Root.GetTitledFirstName], les Seigneurs du Ciel ont besoin de nouveaux fort afin de lever des troupes et de générer les revenus nécessaires à leur fonctionnement. Il se trouve que vous posséderiez un emplacement approprié sur votre domaine, à [FromFrom.GetName] pour être précis. Nous sommes disposés à vous payer 100 d'or en échange du droit d'y construire une forteresse.\n\nPour le Père du Ciel !\nChef de guerre [From.GetFirstName];Hochwohlgeborener [Root.GetTitledFirstName], die Herren des Himmels benötigen weitere Burgen zur Ausbildung von Truppen und zur Erzeugung von Einnahmen. Ich habe erfahren, dass es in Eurem Reich einen geeigneten Standort gibt, nämlich in [FromFrom.GetName]. Ich zahle Euch 100 Gold für das Recht, dort eine Burg zu errichten.\n\nFür den Himmelsvater!\nKriegshäuptling [From.GetFirstName];;Mi justo [Root.GetTitledFirstName], los Señores del Cielo necesitan más castillos para entrenar tropas y obtener ingresos para sostenerse. Ha llegado a mi conocimiento que hay un lugar adecuado en su heredad, en [FromFrom.GetName] para ser más precisos. Estoy dispuesto a pagarle 100 oros a cambio del derecho a construir allí una fortaleza.\n\nPor el Padre-Cielo,\nJefe Guerrero [From.GetFirstName];;;;;;;;;x
EVTDESC_SOA_2054;The Lords of the Sky have constructed a castle in [Root.GetName]!;Les Seigneurs du Ciel ont construit un château en [Root.GetName] !;Die Herren des Himmels haben in [Root.GetName] eine Burg errichtet!;;¡Los Señores del Cielo han construido un castillo en [Root.GetName]!;;;;;;;;;x
EVTDESC_SOA_2061;Your majesty, this antagonism is completely unwarranted! The Lords of the Sky seek only to ride into battle against the enemies of the Sky-Father. Can you make that same claim?\n\nWith anger and sadness,\n\nWarchief [From.GetFirstName];[Root.PrimaryTitle.GetFOA], cette opposition est complètement injustifiée ! Les Seigneurs du Ciel ne désirent que combattre les ennemis du Père du Ciel. Pouvez-vous en dire autant ?\n\nRecevez l'expression de notre infinie colère,\nChef de guerre [From.GetFirstName];Eure Majestät, diese Ablehnung ist völlig unbegründet! Die Herren des Himmels wollen nur gegen die Feinde des Himmelsvaters in die Schlacht reiten, doch könnt Ihr das auch von Euch behaupten? \n\nIn Zorn und Trauer,\n\nKriegshäuptling [From.GetFirstName];;Su majestad, ¡este antagonismo es totalmente injustificado! Los Señores del Cielo se esfuerzan únicamente por combatir a los enemigos del Padre-Cielo. ¿Puede usted decir lo mismo?\n\nCon ira y tristeza,\n\nJefe Guerrero [From.GetFirstName];;;;;;;;;x
EVTDESC_SOA_2109;With the reformation of the many African pagan belief systems into a single coherent whole, several tribes have agreed to pool together their best warriors into a single holy order. They claim to be the Guardians of the Spirits and they have vowed to defend the spirits and those who believe in them from all who would do them harm.;Avec la refonte de nombreuses croyances païennes de l'Ouest africain en un tout cohérent, de nombreuses tribus ont accepté de rassembler leurs meilleurs guerriers en un ordre saint.\nCes guerriers se sont nommés « Gardiens des Esprits » et ont fait voeux de protéger de tout préjudice les esprits de la nature et des anciens, ainsi que tout ceux qui croient en eux.;Nach dem Zusammenschluss der vielen westafrikanischen Naturreligionen zu einem einheitlichen Ganzen haben mehrere Stämme beschlossen, ihre besten Krieger in einem einzigen heiligen Orden zu vereinen. Sie nennen sich die Wächter der Geister und haben geschworen, die Geister und die, die an sie glauben, gegen alle zu verteidigen, die ihnen schaden könnten.;;Tras la unificación de los numerosos sistemas de fe paganos del África Occidental en un todo coherente, varias tribus se han puesto de acuerdo para agrupar a sus mejores guerreros en una única orden santa. Dicen ser los Guardianes de los Espíritus y se han comprometido a defender a los espíritus y a quienes creen en ellos de todo aquel que pretenda causarles algún mal.;;;;;;;;;x
EVTDESC_SOA_2131;My [GetFromRelation], [From.GetTitledFirstName], has requested to join the Spirit Guardians in their brave defense of our faith, even though this will forever disinherit him.;M[From.GetOnA] [GetFromRelation], [From.Get_le_TitledFirstName], a demandé à joindre les Gardiens des Esprits dans leur lutte pour défendre notre foi avec bravoure, même si cela le déshéritera à jamais.;Mein [GetFromRelation], [From.GetTitledFirstName] will sich den Wächtern der Geister in ihrer tapferen Verteidigung unseres Glaubens anschließen, obwohl ihn dies auf ewig von der Erbfolge ausschließt.;;Mi [GetFromRelation] [From.GetTitledFirstName] ha solicitado unirse a los Guardianes de los Espíritus en su valiente defensa de nuestra fe, a pesar de que esta acción le desheredará para siempre.;;;;;;;;;x
EVTDESC_SOA_2141;Great [Root.PrimaryTitle.GetRulerTitle], your extremely generous donation shall aid us greatly in our unceasing efforts to defend the Spirits and their faithful believers! You have my friendship, as well as that of the priesthood.\n\nMay the Spirits walk with you,\nWarchief [From.GetFirstName];Noble [Root.PrimaryTitle.GetRulerTitle], votre très généreuse contribution nous aidera grandement dans notre protection perpétuelle des esprits et des fidèles. Recevez notre reconnaissance ainsi que celle des chamans.\n\nQue les Esprits vous gardent,\nChef de guerre [From.GetFirstName];Großer [Root.PrimaryTitle.GetRulerTitle],Eure äußerst großzügige Spende wird uns sehr helfen bei der Verteidigung der Geister und all derer, die an sie glauben. Ihr habt meine Freundschaft und die der Priesterschaft!\n\nMögen die Geister stets bei Euch sein!\nKriegshäuptling [From.GetFirstName];;Gran [Root.PrimaryTitle.GetRulerTitle], ¡esta donación tan generosa nos será de gran ayuda en nuestro incesante esfuerzo por defender a los Espíritus y a sus auténticos devotos! Tiene mi amistad, así como la del sacerdocio.\n\nQue los espíritus le acompañen,\nJefe Guerrero [From.GetFirstName];;;;;;;;;x
EVTDESC_SOA_2153;Most righteous [Root.GetTitledFirstName], the Spirit Guardians are in need of more castles in order to train troops and generate a supporting income. There is a suitable location in your demesne - in [FromFrom.GetName] to be specific. I am willing to pay you 100 gold in exchange for the right to construct a fortress there.\n\nMay the Spirits walk with you,\nWarchief [From.GetFirstName];Très juste [Root.GetTitledFirstName], les Gardiens des Esprits ont besoin de nouvelles terres afin de lever troupes et revenus nécessaires à leur fonctionnement. Il nous est apparu que vous possédiez un emplacement approprié sur votre domaine, à [FromFrom.GetName] pour être précis. nous sommes disposés à vous payer 100 d'or en échange du droit d'y construire une forteresse.\n\nQue les Esprits vous gardent,\nChef de guerre [From.GetFirstName];Hochwohlgeborener [Root.GetTitledFirstName], die Wächter der Geister brauchen weitere Burgen zur Ausbildung von Truppen und zur Erzeugung von Einnahmen. Ich habe erfahren, dass es in Eurem Reich einen geeigneten Standort gibt, nämlich in [FromFrom.GetName]. Ich zahle Euch 100 Gold für das Recht, dort eine Burg zu errichten.\n\nMögen die Geister stets bei Euch sein!\nKriegshäuptling [From.GetFirstName];;Mi justo [Root.GetTitledFirstName], los Guardianes de los Espíritus necesitan más castillos para entrenar tropas y obtener ingresos para sostenerse. Hay un lugar adecuado en su heredad, en [FromFrom.GetName] para ser más precisos. Estoy dispuesto a pagarle 100 oros a cambio del derecho a construir allí una fortaleza.\n\nQue los espíritus le acompañen,\nJefe Guerrero [From.GetFirstName];;;;;;;;;x
EVTDESC_SOA_2154;The Spirit Guardians have constructed a castle in [Root.GetName]!;Les Gardiens des Esprits ont construit un château en [Root.GetName] !;Die Wächter der Geister haben in [Root.GetName] eine Burg errichtet!;;¡Los Guardianes de los Espíritus han construido un castillo en [Root.GetName]!;;;;;;;;;x
EVTDESC_SOA_2161;Your majesty, this antagonism is completely unwarranted! The Spirit Guardians walk with the Spirits and are prepared to give their lives to defend them, but, one has to wonder, are you?\n\nWith anger and sadness,\n\nWarchief [From.GetFirstName];[Root.PrimaryTitle.GetFOA], cette opposition est complètement injustifiée ! Les Gardiens des Esprits marchent avec les Esprits et sont prêts à sacrifier leur vie pour les défendre. Pouvez-vous en dire autant ?\n\nVeuillez agréer l'expression de notre colère ainsi que de notre tristesse,\nChef de guerre [From.GetFirstName];Eure Majestät, diese Ablehnung ist völlig unbegründet! Die Wächter der Geister gehen mit den Geistern und sind bereit, ihr Leben für sie zu geben, doch seid Ihr das auch? \n\nIn Zorn und Trauer,\n\nKriegshäuptling [From.GetFirstName];;Su majestad, ¡este antagonismo es totalmente injustificado! Los Guardianes de los Espíritus caminan junto a los espíritus y están preparados para dar la vida por defenderlos, pero cabe preguntarse, ¿y usted?\n\nCon ira y tristeza,\n\nJefe Guerrero [From.GetFirstName];;;;;;;;;x
EVTDESC_SOA_2209;The Slavic faith has been reformed and this has led to a religious fervor throughout the lands of the Slavs the likes of which has never been seen before. Many of the greatest champions have come together to form a new Slavic holy order. They call themselves the Warriors of Perun, the god of thunder, and have all taken vows to defend the Slavic faith and its believers to their dying breaths.;La foi slave a connu une réforme menant à une ferveur religieuse jamais connue auparavant sur les terres slaves. Un grand nombre de champions se sont rassemblés pour former un nouvel ordre saint à la gloire de leurs dieux.\nIls se font appeler les « Guerriers de Péroun », du nom du dieu slave de la Foudre, et ont fait le serment de défendre la foi slave ainsi que ses fidèles jusqu'à leur dernier souffle.;Die Reformation des slawischen Glaubens hat zu einem nie dagewesenen religiösen Eifer in den slawischen Ländern geführt. Viele ihrer größten Sieger haben sich zusammengeschlossen, um einen neuen slawischen Heiligen Orden zu gründen. Sie nennen sich die Krieger von Perun, nach Perun, ihrem Gott des Donners, und haben geschworen, den Slawischen Glauben bis zum letzten Atemzug zu verteidigen. ;;Se ha reformado la fe eslava, lo que ha dado lugar a un fervor religioso a través de las tierras de los eslavos de dimensiones inauditas. Muchos de los más grandes paladines se han unido para formar una nueva orden santa eslava. Se hacen llamar los Guerreros de Perún, dios del trueno, y han hecho voto de defender la fe eslava y a sus fieles hasta el último aliento.;;;;;;;;;x
EVTDESC_SOA_2231;My [GetFromRelation], [From.GetTitledFirstName], has requested to join the Warriors of Perun in their heroic deeds to smite the enemies of the gods, even though this will forever disinherit him.;M[From.GetOnA] [GetFromRelation], [From.Get_le_TitledFirstName], a demandé à rejoindre les Guerriers de Péroun dans leur lutte contre les dieux ennemis, même si cela le déshéritera à jamais.;Mein [GetFromRelation], [From.GetTitledFirstName] will sich den Kriegern von Perun in ihrem heldenhaften Kampf gegen die Feinde der Götter anschließen, obwohl ihn dies auf ewig von der Erbfolge ausschließt.;;Mi [GetFromRelation] [From.GetTitledFirstName] ha solicitado unirse a los Guerreros de Perún en sus heroicas gestas para aniquilar a los enemigos de los dioses, a pesar de que esta acción le desheredará para siempre.;;;;;;;;;x
EVTDESC_SOA_2241;Great [Root.PrimaryTitle.GetRulerTitle], your extremely generous donation shall aid us greatly in our quest to serve the will of Perun! You have my friendship, as well as that of the priesthood.\n\nMay Perun watch over you,\nWarchief [From.GetFirstName];Noble [Root.PrimaryTitle.GetRulerTitle], votre très généreuse contribution nous aidera grandement à servir la volonté de Péroun ! Recevez notre reconnaissance ainsi que celle des volkhves.\n\nQue Péroun vous garde,\nChef de guerre [From.GetFirstName];Großer [Root.PrimaryTitle.GetRulerTitle], Eure äußerst großzügige Spende wird uns sehr helfen in unserem Dienst zur Verteidigung Peruns. Ihr habt meine Freundschaft und die der Priesterschaft!\n\nMöge Perun Euch schützen!\nKriegshäuptling [From.GetFirstName];;Gran [Root.PrimaryTitle.GetRulerTitle], ¡esta donación tan generosa nos será de gran ayuda en nuestra lucha para servir a la voluntad de Perún! Tiene mi amistad, así como la del sacerdocio.\n\nQue Perún le guarde,\nJefe Guerrero [From.GetFirstName];;;;;;;;;x
EVTDESC_SOA_2253;Most righteous [Root.GetTitledFirstName], the Warriors of Perun are in need of more castles in order to train troops and generate a supporting income. There is a suitable location in your demesne - in [FromFrom.GetName] to be specific. I am willing to pay you 100 gold in exchange for the right to construct a fortress there.\n\nMay Perun watch over you,\nWarchief [From.GetFirstName];Très juste [Root.GetTitledFirstName], les Guerriers de Péroun ont besoin de nouveaux forts afin de rassembler troupes et revenus nécessaires au fonctionnement de notre ordre. Il nous a été rapporté que vous possédiez un emplacement approprié sur votre domaine, à [FromFrom.GetName] pour être précis. Nous sommes disposés à vous payer 100 d'or en échange du droit d'y construire une forteresse.\n\nQue Péroun vous garde,\nChef de guerre [From.GetFirstName];Hochwohlgeborener [Root.GetTitledFirstName], die Krieger von Perun brauchen weitere Burgen zur Ausbildung von Truppen und zur Erzeugung von Einnahmen. Ich habe erfahren, dass es in Eurem Reich einen geeigneten Standort gibt, nämlich in [FromFrom.GetName]. Ich zahle Euch 100 Gold für das Recht, dort eine Burg zu errichten.\n\nMöge Perun Euch schützen!\nKriegshäuptling [From.GetFirstName];;Mi justo [Root.GetTitledFirstName], los Guardianes de los Espíritus necesitan más castillos para entrenar tropas y obtener ingresos para sostenerse. Hay un lugar adecuado en su heredad, en [FromFrom.GetName] para ser más precisos. Estoy dispuesto a pagarle 100 oros a cambio del derecho a construir allí una fortaleza.\n\nQue Perún le guarde,\nJefe Guerrero [From.GetFirstName];;;;;;;;;x
EVTDESC_SOA_2254;The Warriors of Perun have constructed a castle in [Root.GetName]!;Les Guerriers de Péroun ont construit un château en [Root.GetName] !;Die Krieger von Perun haben in [Root.GetName] eine Burg errichtet!;;¡Los Guerreros de Perún han construido un castillo en [Root.GetName]!;;;;;;;;;x
EVTDESC_SOA_2261;Your majesty, this antagonism is completely unwarranted! The Warriors of Perun serve at the pleasure of the gods, but, one has to wonder, do you?\n\nWith anger and sadness,\n\nWarchief [From.GetFirstName];[Root.PrimaryTitle.GetFOA], cette opposition est complètement injustifiée ! Les Guerriers de Péroun ne cherchent qu'à servir la volonté des dieux, mais est-ce votre cas ?\n\nVeuillez agréer l'expression de notre colère et de notre tristesse,\nChef de guerre [From.GetFirstName];Eure Majestät, diese Ablehnung ist völlig unbegründet! Die Krieger von Perun dienen zum Wohlgefallen der Götter, doch tut Ihr das auch? \n\nIn Zorn und Trauer,\n\nKriegshäuptling [From.GetFirstName];;Su majestad, ¡este antagonismo es totalmente injustificado! Los Guerreros de Perún sirven a la voluntad de los dioses, pero cabe preguntarse, ¿y usted?\n\nCon ira y tristeza,\n\nJefe Guerrero [From.GetFirstName];;;;;;;;;x
EVTDESC_SOA_2309;Perkunas, the god of thunder, has spoken! As the Romuvan religion reforms to better face the modern world, several champions have stepped forward, claiming that Perkunas has willed them to found a new holy order. The Chosen of Perkunas, as they call themselves, have sworn to defend the Romuvan faith and to direct the wrath of the gods towards the skulls of their enemies.;Perkunas, le dieu de la Foudre, a parlé ! Alors que la religion romuvienne se réforme pour mieux faire face aux réalités du monde, plusieurs champions se sont manifestés, clamant que Perkunas leur avait demandé de créer un nouvel ordre saint. Les Élus de Perkunas, comme ils se font appeler, ont juré de défendre la foi romuva et de faire s'abattre la colère des dieux sur la tête de leurs ennemis.;Perkunas, der Gott des Donners, hat gesprochen! Bei der Reformation des Romuvanischen Glaubens zur Anpassung an die moderne Welt sind einige Sieger hervorgetreten und behaupten, Perkunas selbst habe sie beauftragt, einen neuen Heiligen Orden zu gründen. Diese Erwählten des Perkunas haben geschworen, den Romuvanischen Glauben zu verteidigen und den Zorn der Götter auf die Schädel seiner Feinde zu lenken .;;¡Perkunas, dios del trueno, ha hablado! Tras las reformas de la religión romuvita para afrontar mejor la era moderna, varios paladines han dado un paso adelante, proclamando que Perkunas les ha señalado para fundar una nueva orden santa. Los Elegidos de Perkunas, como se denominan, han jurado defender la fe romuvita y dirigir la ira de los dioses hacia las calaveras de sus enemigos.;;;;;;;;;x
EVTDESC_SOA_2331;My [GetFromRelation], [From.GetTitledFirstName], has requested to join the Chosen of Perkunas in their war against unbelievers, even though this will forever disinherit him.;M[From.GetOnA] [GetFromRelation], [From.Get_le_TitledFirstName], a demandé à rejoindre les Élus de Perkunas dans leur lutte contre les mécréants, même si cela le déshéritera à jamais.;Mein [GetFromRelation], [From.GetTitledFirstName] will sich den Erwählten des Perkunas in ihrem Kampf gegen die Ungläubigen anschließen, obwohl ihn dies auf ewig von der Erbfolge ausschließt.;;Mi [GetFromRelation] [From.GetTitledFirstName] ha solicitado unirse a los Elegidos de Perkunas en su guerra contra los no creyentes, a pesar de que esta acción le desheredará para siempre.;;;;;;;;;x
EVTDESC_SOA_2341;Great [Root.PrimaryTitle.GetRulerTitle], your extremely generous donation shall aid us greatly in our quest to serve the will of Perkunas! You have my friendship, as well as that of the priesthood.\n\nMay Perkunas watch over you,\nWarchief [From.GetFirstName];Noble [Root.PrimaryTitle.GetRulerTitle], votre très généreuse contribution nous aidera grandement à servir la volonté de Perkunas ! Recevez notre reconnaissance ainsi que celle des augures.\n\nQue Perkunas vous garde,\nChef de guerre [From.GetFirstName];Großer [Root.PrimaryTitle.GetRulerTitle], Eure äußerst großzügige Spende wird uns sehr bei der Erfüllung des Willens von Perkunas helfen. Ihr habt meine Freundschaft und die der Priesterschaft!\n\nMöge Perkunas Euch schützen!\nKriegshäuptling [From.GetFirstName];;Gran [Root.PrimaryTitle.GetRulerTitle], ¡esta donación tan generosa nos será de gran ayuda en nuestra lucha para servir a la voluntad de Perkunas! Tiene mi amistad, así como la del sacerdocio.\n\nQue Perkunas le guarde,\nJefe Guerrero [From.GetFirstName];;;;;;;;;x
EVTDESC_SOA_2353;Most righteous [Root.GetTitledFirstName], the Chosen of Perkunas are in need of more castles in order to train troops and generate a supporting income. There is a suitable location in your demesne - in [FromFrom.GetName] to be specific. I am willing to pay you 100 gold in exchange for the right to construct a fortress there.\n\nMay Perkunas watch over you,\nWarchief [From.GetFirstName];Très juste [Root.GetTitledFirstName], les Élus de Perkunas ont besoin de nouveaux châteaux afin de lever des troupes et de générer les revenus nécessaires à leur fonctionnement. Il nous est apparu que vous possédiez un emplacement approprié sur votre domaine de [FromFrom.GetName]. Nous sommes donc disposés à vous payer 100 d'or en échange du droit d'y construire une forteresse.\n\nQue Perkunas vous garde,\nChef de guerre [From.GetFirstName];Hochwohlgeborener [Root.GetTitledFirstName], die Erwählten von Perkunas brauchen weitere Burgen zur Ausbildung von Truppen und zur Erzeugung von Einnahmen. Ich habe erfahren, dass es in Eurem Reich einen geeigneten Standort gibt, nämlich in [FromFrom.GetName]. Ich zahle Euch 100 Gold für das Recht, dort eine Burg zu errichten.\n\nMöge Perkunas Euch schützen!\nKriegshäuptling [From.GetFirstName];;Mi justo [Root.GetTitledFirstName], los Elegidos de Perkunas necesitan más castillos para entrenar tropas y obtener ingresos para sostenerse. Hay un lugar adecuado en su heredad, en [FromFrom.GetName] para ser más precisos. Estoy dispuesto a pagarle 100 oros a cambio del derecho a construir allí una fortaleza.\n\nQue Perkunas le guarde,\nJefe Guerrero [From.GetFirstName];;;;;;;;;x
EVTDESC_SOA_2354;The Chosen of Perkunas have constructed a castle in [Root.GetName]!;Les Élus de Perkunas ont construit un château en [Root.GetName] !;Die Erwählten von Perkunas haben in [Root.GetName] eine Burg errichtet!;;¡Los Elegidos de Perkunas han construido un castillo en [Root.GetName]!;;;;;;;;;x
