EVTDESC_SoA_100;Construction of the Third Temple will begin immediately on Temple Mount overlooking Jerusalem. The design of the new temple is greater in scope than even King Solomon's fabled First Temple. Your architects estimate that the construction will take roughly four years. When it is finished, it will truly be a sight to see!;La construction du Troisième Temple commence immédiatement sur le Mont du Temple qui surplombe Jérusalem. Ce nouveau temple sera même plus grand que le légendaire Premier Temple du roi Salomon, mais vos architectes estiment que sa construction prendra environ quatre ans, bien que nous ne doutions pas résultat sera vraiment spectaculaire !;Der Bau des Dritten Tempels beginnt sofort auf dem Tempelberg in Jerusalem. Im Entwurf ist der neue Tempel sogar größer als der sagenhafte erste Tempel von König Salomon. Ihre Baumeister veranschlagen eine Bauzeit von etwa vier Jahren. Was für einen großartigen Anblick wird der Tempel geben, wenn er fertig ist!;;La construcción del Tercer Templo comenzará inmediatamente en el Monte del Templo situado junto a Jerusalén. El diseño del nuevo templo supera en alcance incluso al del legendario Primer Templo del rey Salomón. Tus arquitectos calculan que la construcción durará unos cuatro años. Una vez terminado, ¡será realmente digno de ver!;;;;;;;;;x
EVTDESC_SoA_101;The First Temple, built by King Solomon, was destroyed by the invading Babylonians. The Second Temple, built under the auspices of Cyrus the Great of Persia, was razed by the Romans after a terrible siege. The Third Temple, however, built by the great [FromFrom.GetTitledFirstName], shall stand for all eternity!\n\nFrom its position on Temple Mount, the magnificent building has become a dominant feature of Jerusalem, instantly recognizable from far away by travellers approaching the city. Truly, Solomon himself would have been moved to tears by the sight.;Le Premier temple, construit par le roi Salomon, fut détruit par les envahisseurs babyloniens. Le Second Temple, construit sous les auspices du grand Cyrus de Perse, fut rasé par les Romains au terme d'un épouvantable siège. Le Troisième temple, cependant, construit par l'illustre [FromFrom.GetTitledFirstName], se dressera pour l'éternité !\n\nConstruit au sommet du mont du Temple, le magnifique édifice est devenu un trait dominant de Jérusalem et les voyageurs qui arrivent de très loin le reconnaissent instantanément à leur approche. En vérité, Salomon lui-même aurait versé des larmes d'émotion en le voyant.;Der erste, von König Salomon errichtete Tempel, wurde von den babylonischen Eroberern zerstört. Der Zweite, unter der Herrschaft des Perserkönigs Cyrus dem Großen erbaute Tempel wurde nach schrecklicher Belagerung von den Römern geschliffen. Der Dritte Tempel aber, geschaffen von [FromFrom.GetTitledFirstName] dem Großen, wird in alle Ewigkeit stehen!\n\nDas prächtige Bauwerk auf dem Tempelberg überragt Jerusalem und ist schon aus weiter Ferne sichtbar. Selbst König Salomo wäre von seinem Anblick zu Tränen gerührt.;;El Primer Templo, construido por el rey Salomón, fue destruido por los invasores babilonios. El Segundo Templo, erigido bajo los auspicios de Ciro el Grande de Persia, fue arrasado por los romanos tras un terrible asedio. El Tercer Templo, sin embargo, edificado por el gran [FromFrom.GetTitledFirstName], ¡perdurará por toda la eternidad!\n\nDesde su posición en lo alto del Monte del Templo, este magnífico edificio se ha convertido en una insignia destacada de Jerusalén que los viajeros identifican de inmediato al acercarse a la ciudad. A decir verdad, contemplarlo habría hacho saltar las lágrimas al mismísimo Salomón.;;;;;;;;;x
EVTDESC_SoA_102;With Jerusalem and the Promised Land under Jewish control, the time is ripe for the creation of a new United Monarchy named Israel - like the great kingdom of ancient times under David and Solomon.\n\nThe long-suffering Jewish people are finally in control of their own destiny again. No longer shall the Holy Land be torn asunder by warring Christian and Muslim lords. May this new kingdom usher in an era of peace and prosperity for the region!;Maintenant que Jérusalem et la Terre promise sont sous contrôle juif, il est temps de recréer une monarchie unie, Israël, semblable au grand royaume des temps anciens qui brilla sous le règne du légendaire roi David, son fondateur, et de Salomon, fils de David et bâtisseur du Premier Temple.\n\nLe peuple juif, qui a tant souffert, reprend enfin sa destinée en main. La Terre Promise ne sera plus jamais déchirée par les luttes belliqueuses des chrétiens et des musulmans. Puisse ce nouveau royaume inaugurer une ère de paix et de prospérité pour la région !;Mit Jerusalem und dem Gelobten Land unter jüdischer Herrschaft ist die Zeit reif für die Schaffung einer neuen Vereinigten Monarchie namens Israel - wie das große Königreich der Antike unter Salomo und David. \n\nNach der langen Leidenszeit der Vertreibung ist das jüdische Volk endlich wieder Herr seines Schicksals. Nie wieder soll das Heilige Land zerrissen werden durch die Kriege christlicher und muslimischer Herrscher. Möge das neue Königreich der Region eine Ära von Frieden und Wohlstand bescheren!;;Con Jerusalén y la Tierra Prometida bajo control judío, es el momento oportuno para crear una nueva monarquía unida llamada Israel, como el gran reino de la antigüedad gobernado por David y Salomón.\n\nEl pueblo judío, que tanto ha sufrido, controlará por fin su propio destino de nuevo. La Tierra Santa ya no será nunca más despedazada por los señores de la guerra cristianos y musulmanes. ¡Que este nuevo reino traiga una era de paz y prosperidad a la región!;;;;;;;;;x
EVTDESC_SoA_105;You have decided to expel all [GetJewsName] from your realm. After your guards round the [GetJewryName] up, they are forced to depart in yet another large exodus for lands more friendly to their kind. They are allowed to keep many of their belongings, but you confiscate much of their gold.;Vous avez décidé d'expulser tous les [GetJewsName] de votre pays. Une fois les [GetJewryName] rassemblés par vos gardes, ils seront contraints à connaître un nouvel exode de masse vers des terres plus accueillantes pour eux.\nIls auront le droit d'emporter avec eux un grand nombre de leurs possessions, cependant, vous confisquerez une grande partie de leur or.;Ihr habt beschlossen, alle [GetJewsName] aus Eurem Reich zu vertreiben. Nachdem Eure Wachen alle [GetJewryName] Bewohner zusammengetrieben haben, müssen diese abermals einen Exodus in Länder antreten, wo man ihnen freundlicher gesonnen ist. Sie dürfen einen Teil ihres Besitzes mitnehmen, doch Ihr beschlagnahmt den größten Teil ihres Goldes.;;Has decidido expulsar a todos los [GetJewsName] del reino. Después de que tus guardias los hayan reunido a todos, se ven obligados a partir en éxodo a tierras más amistosas para los suyos. Pueden mantener muchas de sus pertenencias, pero te quedas todo su oro.;;;;;;;;;x
EVTDESC_SoA_106;Jews have been banned from your realm for some time, but strangely this seems to have had no effect on many of the malaises they were thought responsible for, such as famines and disease. By now most Jews seem to have forgiven your offenses, and you have decided to welcome them back with open arms.;Les juifs ont été bannis de notre royaume pendant un certain temps, mais curieusement, cela ne semble nullement remédier aux maux dont on les tenait pour responsables, comme la famine et la maladie. A présent, de nombreux juifs semblent avoir pardonné vos offenses à leur égard et vous décidez donc de les accueillir de nouveau à bras ouverts.;Die Juden sind seit einiger Zeit aus Eurem Reich verbannt, doch seltsamerweise sind dadurch die Übel nicht verschwunden, für die man sie verantwortlich gemacht hatte, etwa Hungersnöte und Seuchen. Mittlerweile scheinen die meisten Juden Euch Eure Vergehen verziehen zu haben, und Ihr habt beschlossen, sie mit offenen Armen wieder aufzunehmen.;;Los judíos han tenido el acceso prohibido a tu reino durante algún tiempo pero, curiosamente, no parece haber tenido efecto alguno sobre los muchos males que se les atribuían, como hambrunas y enfermedades. A estas alturas, la mayoría de los judíos parecen haber perdonado tus ofensas y tú has decidido readmitirlos con los brazos abiertos.;;;;;;;;;x
EVTDESC_SoA_107;Your liege, [From.GetTitledFirstName], has issued a decree calling for the expulsion of all unlanded Jews from the entire realm, citing various grievances committed by them against the Crown.;Votre [From.GetLordLady] lige, [From.Get_le_TitledFirstName], a émis un décret bannissant tous les juifs sans terre du Royaume, justifiant cet acte en listant les divers griefs commis envers la Couronne.;Euer Lehnsherr, [From.GetTitledFirstName], hat verfügt, dass alle Juden ohne Landbesitz das Reich zu verlassen haben. Als Begründung für den Erlass wurden diverse Vergehen gegen die Krone zitiert.;;Vuestro señor, [From.GetTitledFirstName], ha promulgado un decreto que exige la expulsión de todos los judíos del reino, citando varios agravios cometidos contra la Corona.;;;;;;;;;x
EVTDESC_SoA_108;Your liege, [Root.TopLiege.GetTitledFirstName], has decided to rescind the decree calling for the expulsion of all Jews. They are now once more permitted to live and work within the borders of the realm.;Votre souverain[Root.TopLiege.Get_E], [Root.TopLiege.Get_le_TitledFirstName], a décidé d'annuler le décret bannissant les juifs du Royaume. Ils ont donc de nouveau l'autorisation de vivre et travailler sur vos terres.;Euer Lehnsherr, [Root.TopLiege.GetTitledFirstName], hat beschlossen, den Beschluss zur Vertreibung der Juden außer Kraft zu setzen. Jetzt dürfen sie wieder im Reich leben und Handel treiben.;;Vuestro señor, [Root.TopLiege.GetTitledFirstName], ha decidido anular el decreto que exige la expulsión de todos los judíos. De nuevo pueden vivir y trabajar dentro de las fronteras del reino.;;;;;;;;;x
EVTDESC_SoA_200;A [jewish.GetName] exile, fleeing persecution elsewhere in Europe, has showed up at your court. His time spent abroad has gifted him with many connections, and by all accounts he is an able diplomat. He would make a fine chancellor.;Un exilé de foi [jewish.GetName] fuyant les persécutions ailleurs en Europe s'est présenté à votre cour. Son séjour à l'étranger lui a permis de tisser de nombreux liens, et il faut admettre qu'il est bon diplomate. Il ferait un excellent chancelier.;Ein [jewish.GetName]er Exilant, der auf der Flucht vor Verfolgung in Europa ist, taucht an Eurem Hof auf. Auf seiner unfreiwilligen Wanderschaft hat er viele wertvolle Kontakte knüpfen können und so ist er ein ausgezeichneter Diplomat. Er gäbe einen hervorragenden Kanzler ab.;;Ha venido a la corte un[recruited_physician_target.GetXA] exiliad[recruited_physician_target.GetOA] [jewish.GetName], huyendo de la persecución en otros lugares de Europa. El tiempo que ha pasado en el extranjero le ha proporcionado muchos contactos y según todos los indicios, es un diplomático competente. Sería un buen canciller.;;;;;;;;;x
EVTDESC_SoA_201;A learned [jewish.GetName] man has appeared at your court. He comes highly recommended in the arts of bookkeeping and administration. Already he has suggested several ways of improving the bureaucratic efficiency of the realm, and he could potentially make a fine steward.;Un érudit de foi [jewish.GetName] s'est présenté à la cour. Une excellente réputation dans les domaines de la comptabilité et de l'administration le précède. Il propose déjà quelques manières d'améliorer l'efficacité bureaucratique du pays et il a le potentiel pour être un bon intendant.;Ein gelehrter [jewish.GetName]er Mann taucht an Eurem Hof auf. Er hat beste Empfehlungen in Sachen Buchführung und Verwaltung. Schon jetzt hat er wertvolle Vorschläge zur Verbesserung der Bürokratie im Reich gemacht und er würde einen ausgezeichneten Verwalter abgeben.;;Un[jewish.GetXA] [jewish.GetName] cult[jewish.GetOA] se ha presentado en la corte. Viene muy recomendado en las artes de contabilidad y administración y ya ha sugerido varios modos de mejorar la eficiencia burocrática del reino. Podría ser un gran administrador.;;;;;;;;;x
EVTDESC_SoA_202;A mysterious [jewish.GetName] man has offered his services at your court. He is well-versed in feudal court intrigue and has a past as both a mercenary and a spy. If he can be trusted, he could very well prove to be an indispensable asset in your council...;Un mystérieux homme de foi [jewish.GetName] vous a proposé ses services. Il est familier avec les intrigues de cour et possède un passé de mercenaire et d'espion. Si nous pouvons lui faire confiance, il se pourrait qu'il devienne un atout indispensable pour votre Conseil...;Ein geheimnisvoller [jewish.GetName]er Mann bietet Eurem Hof seine Dienste an. Er ist versiert in höfischer Intrige und hat als Söldner und Spion gearbeitet. Wenn er vertrauenswürdig ist, könnte er Euch wertvolle Dienste als Berater leisten...;;Un [jewish.GetName] misterioso te ha ofrecido sus servicios en la corte. Está versado en la intriga de las cortes feudales y tiene una historia como mercenario y espía. Si podemos confiar en él, podría ser un activo de valor incalculable en el consejo…;;;;;;;;;x
EVTDESC_SoA_300;The sudden expulsion of several important [jewish.GetName] merchants has done some damage to the economy of your realm. It would seem they played a bigger role in the economic development of [Root.Capital.GetName] than your advisors gave them credit for.;L'expulsion soudaine de marchands [Get_juifs] importants a causé un préjudice notable à l'économie du pays. Il apparaît désormais clairement qu'ils jouaient un rôle plus important dans le développement économique de [Root.Capital.GetName] que ne l'estimaient vos conseillers.;Die plötzliche Vertreibung einiger wichtiger [jewish.GetName]er Händler hat der Wirtschaft Eures Reiches etwas Schaden zugefügt. Es scheint, dass sie eine größere Rolle in der wirtschaftlichen Entwicklung von [Root.Capital.GetName] gespielt haben, als es Eure Berater zugeben würden.;;La expulsión de muchos mercaderes [jewish.GetName] importantes hizo bastante daño a la economía de tu reino. Se ve que tenían un papel más importante en el desarrollo económico de [Root.Capital.GetName] de lo que consideraban tus consejeros.;;;;;;;;;x
EVTDESC_SoA_301;Several of the largest patrons of culture in [Root.Capital.GetName] were apparently [jewish.GetName], something your advisors were ignorant of. Since the expulsion of the [GetJewryName], cultural life all across the realm has suffered.;Certains des plus importants mécènes culturels de [Root.Capital.GetName] étaient apparemment de foi [jewish.GetName], fait que vos conseillers ignoraient. Cela explique que depuis l'expulsion des [GetJewryName], la vie culturelle du pays soit mal en point.;Wie sich herausstellte, waren unter den [GetJewsName] einige der wichtigsten Kulturförderer in ganz [Root.Capital.GetName]. Euren Beratern war dies wohl entgangen. Im Ergebnis hat sich die Vertreibung der [GetJewsName] sehr ungünstig auf das kulturelle Leben im ganzen Reich ausgewirkt.;;Al parecer, muchos de los grandes de mecenas de la cultura de [Root.Capital.GetName] eran [jewish.GetName], algo que tus consejeros desconocían. Desde la expulsión de la [GetJewryName], la vida cultural de tu reino ha sufrido.;;;;;;;;;x
EVTDESC_SoA_302;It would appear that the military of your realm was more dependent on the efforts of [jewish.GetName] men than previously thought. Since the expulsion of the [GetJewryName], several important administrative posts remain vacant and there simply aren't enough qualified men to fill them.;Il semblerait que l'armée du pays dépendait davantage de la communauté [jewish.GetName] que vous ne le pensiez. De plus, depuis son expulsion, plusieurs postes administratifs importants demeurent vacants car vous n'avez plus les hommes qualifiés pour les occuper.;Wie sich herausgestellt hat, war die [jewish.GetName]e Bevölkerung für das Militär wichtiger, als ursprünglich angenommen. Seit der Vertreibung der [GetJewsName] konnten mehrere Verwaltungsämter nicht mehr adäquat besetzt werden, da es nun an geeigneten Kandidaten fehlt.;;Parece que el ejército de tu reino dependía mucho más de los esfuerzos de los [jewish.GetName] de lo que se creía en un principio. Desde la expulsión de la [GetJewryName], muchos puestos administrativos importantes siguen vacantes. No hay hombres cualificados importantes para ocuparlos.;;;;;;;;;x
EVTDESC_SoA_500;More than 2,000 years ago, God aided the Children of Israel in their escape from slavery by inflicting ten plagues upon ancient Egypt. The last of these saw a spirit of the Lord slay every first-born in Egypt, but 'pass over' Jewish homes marked with the blood of a slaughtered lamb. This festival celebrates the return of freedom to the enslaved Jewish people.;Il y a plus de 2 000 ans, Dieu aida les Enfants d'Israël à fuir l'esclavage en infligeant les Dix Plaies d'Égypte. Pour la dernière de ces plaies, Dieu envoya un esprit qui causa la mort de tous les premiers-nés d'Égypte, mais qui ignora les maisons des juifs car ils en avaient marqué les portes du sang d'un agneau.\nLa fête célèbre le retour à la liberté pour le peuple juif réduit à l'esclavage.;Vor über 2000 Jahren half Gott den Kindern Israels bei ihrer Flucht aus der ägyptischen Gefangenschaft, indem er Ägypten mit 10 Plagen heimsuchte. Bei der letzten Plage schickte Gott einen Geist, der jeden Erstgeborenen in Ägypten erschlug. Nur die Häuser der Israeliten, die mit dem Blut eines geopferten Lamms gekennzeichnet waren, wurden verschont. Das Pessach-Fest wird zum Gedenken an die Rückkehr der Juden in die Freiheit gefeiert.;;Hace más de 2.000 años, Dios ayudó a los Hijos de Israel a huir de la esclavitud enviando diez plagas sobre el Antiguo Egipto. En la última de ellas un espíritu del Señor hizo matar a todos los primogénitos de Egipto, excepto los de aquellos hogares judíos cuya puerta estuviera marcada con la sangre de un cordero sacrificado. Esta festividad celebra el retorno del esclavizado pueblo judío a la libertad.;;;;;;;;;x
EVTDESC_SoA_501;You have been invited to join your liege, [From.GetTitledFirstName], at the Passover Seder [From.GetSheHe] is hosting this year. This ritual dinner is held on the first night of Passover and involves the retelling of the Exodus from Egypt.;Vous avez été invité par votre [Root.Liege.GetLordLady] lige au Seder de Pessa'h qu'[From.GetIlElle] organise cette année.\nCe repas rituel se déroule la première nuit de Pessa'h et consiste en une narration de l'Exode d'Égypte.;Ihr seid von Eurem Lehnsherrn [From.GetTitledFirstName] eingeladen worden, am Pessach-Seder-Mahl teilzunehmen, das [From.GetSheHe] heuer ausrichten wird. Diese rituelle Mahlzeit findet am ersten Abend von Pessach statt, dabei wird die Geschichte der Flucht aus Ägypten erzählt.;;Has recibido una invitación para asistir al Séder de Pesaj que tu señor, [From.GetTitledFirstName], celebra este año. Esta cena ritual tiene lugar la primera noche de la Pascua Judía e incluye la conmemoración del Éxodo de Egipto.;;;;;;;;;x
EVTDESC_SoA_502;[From.GetTitledFirstName] has refused your invitation to the Passover Seder, claiming [From.GetSheHe] has other plans.;[From.Get_Le_TitledFirstName] a refusé votre invitation au Séder de Pessa'h sous prétexte qu'[From.GetIlElle] avait d'autres projets.;[From.GetTitledFirstName] hat Eure Einladung zum Pessach-Seder-Mahl abgelehnt und behauptet, [From.GetSheHe] habe schon andere Pläne.;;[From.GetTitledFirstName] ha rechazado tu invitación para el Séder de Pesaj, alegando que tiene otros planes.;;;;;;;;;x
EVTDESC_SoA_503;The seder dinner has begun, as is traditional on the first night of the Passover. Matzo flatbread is consumed in liberal amounts together with bitter maror herbs. Everyone is required to drink four cups of wine, each at a specific point during the seder, as the story of the Exodus from Egypt is retold and discussed.;Le dîner du séder commence comme c'est la tradition la première nuit de Pessa'h.\nLa matza, un pain non levé, est consommé en grandes quantités avec du maror, des herbes amères. Tous doivent boire quatre coupes de vin à un moment particulier du séder, tandis que l'histoire de l'Exode d'Égypte est racontée et discutée.;Das traditionelle Seder-Mahl am ersten Pessach-Abend hat begonnen. Es gibt Matzen, d.h. ungesäuertes Fladenbrot, das mit bitteren Kräutern gegessen wird. Jeder Teilnehmer muss zu vorgeschriebenen Zeitpunkten während des Mahls vier Becher Wein trinken, während die Geschichte des Exodus erzählt und darüber gesprochen wird.;;La cena del Séder ha comenzado, como manda la tradición, en la primera noche de la Pascua Judía. Se consume pan matzá en grandes cantidades, junto con hierbas amargas de maror. Todo el mundo debe tomar cuatro copas de vino, cada una en un momento específico del séder, a medida que se relata y debate la historia del Éxodo de Egipto.;;;;;;;;;x
EVTDESC_SoA_504;The seder lasts well into the night, but all good things must end. Your vassals return home to celebrate the rest of Passover, but most seem to agree that your seder dinner was well worth the trip.;Le séder se poursuit jusqu'à tard dans la nuit, mais toute bonne chose a une fin. Les vassaux rentrent chez eux pour poursuivre la célébration de Pessa'h, et la plupart semblent être d'avis que votre dîner du séder en valait le déplacement.;Das Seder-Mahl dauert bis spät in die Nacht. Als Eure jüdischen Vasallen schließlich nach Hause aufbrechen, sind die meisten der Meinung, dass es sich gelohnt habe, Eure Einladung zum Seder-Mahl anzunehmen.;;El séder dura hasta bien entrada la noche, pero todo lo bueno llega a su fin. Tus vasallos regresan a casa parça celebrar el resto de la Pascua Judía, pero la mayoría parecen estar de acuerdo en que tu cena del Séder ha merecido el viaje.;;;;;;;;;x
EVTDESC_SoA_505;The seder lasts well into the night, but all good things must end. You return home to celebrate the rest of Passover, but you and most of the other guests seem to agree that the seder dinner was well worth the trip.;Le séder se poursuit jusque tard dans la nuit, mais toute bonne chose a une fin. Vous rentrez chez vous pour poursuivre la célébration de Pessa'h, et la plupart des autres invités semblent être d'accord avec vous pour dire que ce dîner du Séder en valait le déplacement.;Das Seder-Mahl dauert bis spät in die Nacht. Als Sie schließlich aufbrechen, um zu Hause weiter das Pessach-Fest zu feiern, sind Sie ebenso wie die meisten anderen Gäste der Meinung, dass es sich gelohnt habe, die Einladung anzunehmen.;;El séder dura hasta bien entrada la noche, pero todo lo bueno llega a su fin. Regresas a casa para celebrar el resto de la Pascua Judía, pero tanto tú como la mayoría de los demás invitados parecéis estar de acuerdo en que la cena del Séder ha merecido el viaje.;;;;;;;;;x
EVTDESC_SoA_550;There has not been a Kohen Gadol – a High Priest of Judaism – since the Romans destroyed the Second Temple roughly a thousand years ago. At long last, this position has been filled and the High Priesthood reconstituted.\n\nLike the Jewish priests of ancient times, the Kohen Gadol was traditionally required to be a descendant of Aaron, the older brother of Moses. Due to a lack of suitable candidates this requirement has been waived, but the new High Priest still enjoys the respect of the Jewish religious communities, and the Priesthood has moved into and established itself at the Third Temple.;Il n'y a pas eu de Kohen Gadol - de grand prêtre de Jérusalem - depuis la destruction du Second Temple par les romains au premier siècle de notre ère, mais enfin ce rôle n'est plus vacant et la Grande Prêtrise existe de nouveau.\n\nComme les prêtres juifs de l'ancien temps, le Kohen Gadol devait être un descendant d'Aaron, le frère aîné de Moïse. En raison du manque de candidats convenables cette condition a été abandonnée, mais le Grand prêtre bénéficie tout de même du respect et de l'approbation des communautés religieuses juives, et la Grande prêtrise a ainsi pu s'établir dans le Troisième Temple.;Seit den Zeiten, als die Römer den zweiten Tempel zerstörten, hat es keinen Kohen Gadol – einen Hohepriester des jüdischen Glaubens – mehr gegeben. Nun wurde diese Position endlich aufs Neue besetzt.\n\nAls einem jüdischen Priester der alten Zeit wurde von dem Kohen Gadol traditionell verlangt, ein Nachkomme Aarons, des älteren Bruders Mose, zu sein. Da keine geeigneten Kandidaten gefunden werden konnten, hat man diese Bedingung aufgegeben, doch der Hohepriester erfreut sich noch immer hoher Anerkennung in der jüdischen Gemeinde und die Priesterschaft gründete einen dritten Tempel, von dem aus sie nun ihre Geschäfte führt.;;No ha habido un Kohen Gadol, el Sumo Sacerdote del judaísmo, desde que los romanos destruyeron violentamente el Segundo Templo hace unos cien años. Por fin, esta posición ha sido ocupada y el Sumo Sacerdocio reconstituido.\n\nComo los sacerdotes judíos de la antigüedad, tradicionalmente el Kohen Gadol debía ser descendiente de Aarón, el hermano mayor de Moisés. Ante la falta de candidatos adecuados, no se ha aplicado este requisito, pero el nuevo Sumo Sacerdote sigue gozando del respeto de las comunidades religiosas judías y el Sacerdocio se ha trasladado y establecido en el Tercer Templo.;;;;;;;;;x
