EVTDESC_CM_4131;You walk for hours in the sun to honor [Root.Religion.GetRandomGodName]. On the seventy-third lap around the temple, you start to feel a weakness and pain in your legs. You try to move forwards but your head is pounding and you struggle for breath. As you fall to your knees, you start to vomit on the ground.;Vous marchez au soleil durant des heures pour honorer [Root.Get_le_HighGod]. Au soixante-dix-septième tour autour du temple, vous commencez à ressentir une douleur et une faiblesse dans vos jambes. Vous essayez d'avancer mais votre tête vous fait mal et vous cherchez votre souffle. Alors que vous tombez à genoux, vous vomissez sur le sol.;Stundenlang schreitet Ihr zu Ehren von [Root.Religion.GetRandomGodName] durch die pralle Sonne. Auf dem dreiundsiebzigsten Umgang werden Eure schmerzenden Beine schwach. Ihr wollt weitergehen, doch in Eurem Kopf pocht es und Ihr leidet unter Atemnot. Ihr fallt auf die Knie und müsst Euch übergeben.;;Caminas durante horas bajo el sol para honrar a [Root.Religion.GetRandomGodName]. En la vuelta setenta y tres alrededor del templo, te han comenzado a flaquear las fuerzas y sientes dolor en tus piernas. Tratas de seguir adelante pero te palpita la cabeza y luchas por respirar. Mientras caes sobre tus rodillas, empiezas a vomitar.;;;;;;;;;x
EVTDESC_CM_4133;You walk for hours in the sun to honor [Root.Religion.GetRandomGodName]. As your limbs grow more tired and the heat pulses through your brain, you start to see new and clearer perspectives on some things that previously seemed too mysterious to fathom. The sun is just a large cheese and the moon speaks soothing words about your feet. Oh those feet, how they bother you. Maybe you should cut them off?;Vous marchez au soleil durant des heures pour honorer [Root.Get_le_HighGod]. Alors que vos membres sont de plus en plus fatigués et que la chaleur vous donne des vertiges, vous commencez à voir les choses sous un autre angle et comprenez certains mystères. Le soleil n'est qu'un gros fromage et la lune tient un discours apaisant sur vos pieds. Ah ces pieds, qu'ils sont dérangeants. Nous pourrions peut-être les couper ?;Ihr marschiert zu Ehren von [Root.Religion.GetRandomGodName] stundenlang durch die glühende Sonne. Als Eure Glieder ermüden und die Hitze durch Euer Gehirn pulsiert, ergibt sich nach und nach eine neue, klarere Sicht auf Dinge, die zuvor zu mysteriös erschienen, um sie zu ergründen. Die Sonne ist bloß ein riesiger Käse und der Mond spendet tröstende Worte über Eure Füße. Ach diese Füße, sie sind nur noch eine Last. Solltet Ihr sie vielleicht abhacken?;;Caminas durante horas bajo el sol para honrar a [Root.Religion.GetRandomGodName]. A medida que crece el cansancio en tus extremidades y el calor palpita en tu cerebro, empiezas a ver desde nuevos y más reveladores puntos de vista algunas cosas que antes te parecían demasiado misteriosas y no comprendías. El sol no es más que un enorme queso y la luna pronuncia palabras reconfortantes sobre tus pies. Oh, esos pies, como te molestan. ¡Deberías cortártelos, quizás?;;;;;;;;;x
EVTDESC_CM_4135;You walk for hours in the sun to honor [Root.Religion.GetRandomGodName]. As your limbs grow more tired and the heat pulses through your brain, you start to feel a strange presence entering your mind. Yes, yes... the little devils that dwell underground in darkness have come to you and are sitting on your shoulder, invisible, telling you strange secrets!;Vous marchez au soleil durant des heures pour honorer [Root.Get_le_HighGod]. Alors que vos membres sont de plus en plus fatigués et que la chaleur vous donne des vertiges, vous commencez à sentir une étrange présence qui pénètre votre esprit. Oui, oui... ces petits démons qui habitent la noirceur souterraine sont assis sur votre épaule, invisibles et vous disant d'étranges secrets !;Ihr marschiert zu Ehren von [Root.Religion.GetRandomGodName] stundenlang durch die glühende Sonne. Als Eure Glieder ermüden und die Hitze durch Euer Gehirn pulsiert, ergreift auf einmal etwas Seltsames von Euch Besitz. Ja, wirklich ... die kleinen Teufel aus der finsteren Unterwelt sitzen auf Eurer Schulter, unsichtbar und flüstern Euch merkwürdige Geheimnisse zu.;;Caminas durante horas bajo el sol para honrar a [Root.Religion.GetRandomGodName]. A medida que crece el cansancio en tus extremidades y el calor palpita en tu cerebro, empiezas a sentir una extraña presencia penetrando en tu mente. Sí, sí... los pequeños demonios que habitan entre tinieblas bajo tierra, han venido y están sentados en tus hombros, invisibles, ¡explicándote extraños secretos!;;;;;;;;;x
EVTDESC_CM_4137;You walk for hours in the sun to honor [Root.Religion.GetRandomGodName]. As your limbs grow more tired and the heat pulses through your brain, you turn your face upwards towards the Sun. You feel the light and warmth coarse through your mind and body, and shudder with excitement. Only now have you fully understood!;Vous marchez au soleil durant des heures pour honorer [Root.Get_le_HighGod]. Alors que vos membres sont de plus en plus fatigués et que la chaleur vous donne des vertiges, vous tournez votre visage vers le Soleil. Vous sentez la lumière et une chaleur crue envahir votre esprit et votre corps. Vous frémissez d'excitation. Vous avez enfin tout compris !;Ihr marschiert zu Ehren von [Root.Religion.GetRandomGodName] stundenlang durch die glühende Sonne. Als Eure Glieder ermüden und die Hitze durch Euer Gehirn pulsiert, wendet Ihr Euer Antlitz der Sonne zu. Ihr spürt, wie Licht und Wärme durch Körper und Seele fahren und Ihr zittert vor Erregung. Endlich habt Ihr alles begriffen!;;Durante horas has caminado bajo el sol para honrar a [Root.Religion.GetRandomGodName]. A medida que crece el cansancio en tus extremidades y el calor palpita en tu cerebro, giras el rostro hacia el Sol. Sientes la luz y el intenso calor a través de tu mente y tu cuerpo, y te estremeces agitadamente. ¡Sólo ahora comprendes plenamente!;;;;;;;;;x
EVTDESC_CM_4139;You walk for hours in the sun to honor [Root.Religion.GetRandomGodName]. As your limbs grow more tired and the heat pulses through your brain, you press on. You feel this ordeal is hardening you and giving you new strength. Perhaps you should take to doing similar exercises more frequently once the festival is over?;Vous marchez au soleil durant des heures pour honorer [Root.Get_le_HighGod]. Alors que vos membres sont de plus en plus fatigués et que la chaleur vous donne des vertiges, vous pressez le pas. Vous sentez que cette épreuve vous rend plus fort. Vous devriez peut-être faire des exercices semblables plus souvent après la fête ?;Ihr marschiert zu Ehren von [Root.Religion.GetRandomGodName] stundenlang durch die glühende Sonne. Als Eure Glieder ermüden und die Hitze durch Euer Gehirn pulsiert, schreitet Ihr weiter voran. Ihr spürt, wie diese Prüfung Euch festigt und Euch neue Kraft gibt. Vielleicht solltet Ihr solche Übungen öfter auf Euch nehmen, auch wenn das Fest vorbei ist?;;Caminas durante horas bajo el sol para honrar a [Root.Religion.GetRandomGodName]. A medida que crece el cansancio en tus extremidades y el calor palpita en tu cerebro, tú sigues adelante sin desfallecer. Sientes que este sacrificio te está fortaleciendo y que te da fuerzas renovadas. ¿Deberías considerar hacer ejercicios de este tipo más frecuentemente una vez finalice el festival? ;;;;;;;;;x
EVTDESC_CM_4141;You walk for hours in the sun to honor [Root.Religion.GetRandomGodName]. As your limbs grow more tired and the heat pulses through your brain, your mind wanders and you start to see new perspectives and angles on some familiar problems. Perhaps you should start thinking outside your usual patterns?;Vous marchez au soleil durant des heures pour honorer [Root.Get_le_HighGod]. Alors que vos membres sont de plus en plus fatigués et que la chaleur vous donne des vertiges, votre esprit erre et vous voyez vos problèmes sous de nouveaux angles. Vous devriez peut-être penser différemment ?;Ihr marschiert zu Ehren von [Root.Religion.GetRandomGodName] stundenlang durch die glühende Sonne. Als Eure Glieder ermüden und die Hitze durch Euer Gehirn pulsiert, wandern Eure Gedanken und nach und nach ergeben sich neue Sichtweisen auf alte Probleme. Vielleicht sollten Eure Gedanken mal die üblichen Muster verlassen?;;Caminas durante horas bajo el sol para honrar a [Root.Religion.GetRandomGodName]. A medida que crece el cansancio en tus extremidades y el calor palpita en tu cerebro, tu mente deambula y empiezas a ver desde nuevas perspectivas algunos problemas familiares. ¿Quizás deberías empezar a mirar los problemas desde otros puntos de vista?;;;;;;;;;x
EVTDESC_CM_4143;You walk for hours in the sun to honor [Root.Religion.GetRandomGodName]. As your limbs grow more tired and the heat pulses through your brain, you turn your face upwards towards the Sun. As you feel His strong warmth and presence embrace you, you open your eyes and stare into His face to embrace the divine mysteries to be seen therein. You stare for a long while...;Vous marchez au soleil durant des heures pour honorer [Root.Get_le_HighGod]. Alors que vos membres sont de plus en plus fatigués et que la chaleur vous donne des vertiges, vous tournez votre visage vers le Soleil. Alors que vous vous sentez bercé par Sa forte et chaude présence, vous ouvrez les yeux et Le dévisagez pour percer Ses mystères. Vous restez ainsi longtemps...;Ihr marschiert zu Ehren von [Root.Religion.GetRandomGodName] stundenlang durch die glühende Sonne. Als Eure Glieder ermüden und die Hitze durch Euer Gehirn pulsiert, wendet Ihr Euer Antlitz der Sonne zu. Ihr spürt Seine starke Wärme, er ist da und umarmt Euch. Ihr öffnet die Augen und blickt in Sein Gesicht, um die göttlichen Geheimnisse darin zu erkennen. Ihr schaut ganz lange hin ...;;Caminas durante horas bajo el sol para honrar a [Root.Religion.GetRandomGodName]. A medida que crece el cansancio en tus extremidades y el calor palpita en tu cerebro, giras el rostro hacia el Sol. Mientras sientes como su fuerte calidez y presencia te embriaga, abres tus ojos y miras fijamente hacia Su rostro para abrazar los divinos misterios que se pueden ver en Él. Clavas la mirada por un largo tiempo...;;;;;;;;;x
EVTDESC_CM_4190;The ceremony of thanksgiving to Zun the Giver of Justice is held in courtyard of the temple. All the attendants bare their heads and kneel to give thanks for the light, warmth, justice, wisdom and fertility that He gives His faithful worshipers. Bread spiced with holy saffron is passed around and consumed by the worshipers.;La cérémonie des grâces en l'honneur de Zun le Justicier est tenue dans la cour du temple. Tous ceux qui y assistent se découvrent la tête et s'agenouillent afin de rendre grâce à la lumière, la chaleur, la justice, la sagesse et la fertilité qu'Il donne à Ses fidèles. Les fidèles se partagent du pain épicé de saint safran.;Die Dankesfeier für Zun, dem Geber der Gerechtigkeit, findet im Innenhof des Tempels statt. Alle Anwesenden entblößen ihre Häupter und knien nieder, um für Licht, Wärme, Gerechtigkeit, Weisheit und Fruchtbarkeit zu danken, die Er Seinen treuen Gläubigen spendet. Mit heiligem Safran gewürztes Brot wird an die Betenden verteilt.;;La ceremonia de acción de gracias a Zun, el que Imparte Justicia, se lleva a cabo en el claustro del templo. Todos los asistentes descubren sus cabezas y se arrodillan para dar gracias por la luz, la calidez, la justicia, la sabiduría y la fertilidad que Él proporciona a Sus devotos. Los creyentes comen y comparten pan sazonado con azafrán sagrado.;;;;;;;;;x
EVTDESC_CM_4196;The Festival of the Sun is over for this time. [Root.Religion.GetRandomGodName] has been properly honored and the realm is looking forward to a bright future under His blinding gaze.;La fête du Soleil est terminé. [Root.Get_le_HighGod] a été honoré comme il se doit et le royaume est empreint d'espoir d'un futur meilleur sous Son regard brillant.;Das diesjährige Fest der Sonne ist vorbei. [Root.Religion.GetRandomGodName] ist gebührend geehrt worden und das Reich freut sich auf eine glänzende Zukunft unter Seinem blendenden Blick.;;Se ha terminado El Festival del Sol de esta edición. [Root.Religion.GetRandomGodName] ha sido honrado como es debido y el reino está deleitoso de un brillante futuro bajo Su mirada cegadora.;;;;;;;;;x
EVTDESC_CM_4200;[From.GetTitledName] has declared [From.GetHerHis] renunciation of Iconoclasm, denouncing it as a heresy and officially returning the Empire to Orthodoxy. [From.GetSheHe] commands all [From.GetHerHis] subjects to follow suit and again venerate the holy icons and other religious art.;[From.Get_Le_TitledName] a déclaré son renoncement à l'iconoclasme, le dénonçant comme hérésie, et prônant le retour officiel à l'Empire orthodoxe. [From.GetIlElleCap] commande à tous ses sujets de faire de même et de vénérer de nouveau les saintes icônes et autres formes d'art religieux.;[From.GetTitledName] hat dem Ikonoklasmus abgeschworen und verdammt dessen Lehren als Ketzerei und führt von Amts wegen die Orthodoxie im Reich wieder ein. [From.GetSheHeCap] befiehlt all [From.GetHerHis]en Untertanen dem Beispiel zu folgen und wieder die heiligen Ikonen und andere religiöse Kunstwerke zu verehren.;;[From.GetTitledName] ha declarado [From.GetHerHis] renuncia a la Iconoclastia, denunciándola como herejía y devolviendo el Imperio a la Ortodoxia.;;;;;;;;;x
EVTDESC_CM_5000;You have, since a while, taken to wearing a pair of heavy, shaggy breeches for protection while practising your combat skills. Because of this, your kinsmen and friends have started to call you 'Ragnarr Lodbrok'.;Depuis un bon moment, vous devez porter une paire de culottes hirsutes et pesantes lors de vos exercices de combat. Vos parents et amis vous ont donc surnommé 'Ragnarr Lodbrok'.;Ihr habt Euch seit einiger Zeit angewöhnt, während Eurer Kampfübungen ein Paar schützende, schwere, zottelige Kniehosen zu tragen, sodass Euch Verwandte und Freunde den Namen "Ragnarr Lodbrok" gegeben haben.;;Desde hace un tiempo has estado usando un par de pesados y rudos calzones como protección mientras entrenas tus habilidades de combate. Por eso, tus familiares y amigos te han empezado a llamar "Ragnar Lodbrok".;;;;;;;;;x
EVTDESC_CM_5001;Lately, you son Ragnarr has taken to wearing a pair of heavy, shaggy breeches for protection while practising his combat skills. Because of this, your kinsmen and friends have started calling him '[From.GetFirstName] Loðbrok'.;Depuis un moment, votre fils Ragnarr doit porter une paire de culottes hirsutes et pesantes lors de ses exercices de combat. Vos parents et amis l'ont donc surnommé ''[From.GetFirstName] Loðbrok'.;Euer Sohn Ragnarr hat sich seit einiger Zeit angewöhnt, während seiner Kampfübungen ein Paar schützende, schwere, zottelige Kniehosen zu tragen, sodass ihm Verwandte und Freunde den Namen "[From.GetFirstName] Loðbrok" gegeben haben.;;Posteriormente, tu hijo Ragnar ha tomado por costumbre llevar unos pesados y rudos calzones como protección mientras practica sus habilidades de combate. Por eso, tus familiares y amigos han empezado a llamarlo '[From.GetFirstName] Lodbrok'.;;;;;;;;;x
EVTDESC_CM_6000;My [Root.GetLordLady], we have received news that [From.GetTitledName] has chosen to go into hiding in order to try to foil a plot against [From.GetHerHis] life!;M[Root.GetOnA][Root.GetLordLady], nous avons reçu la nouvelle que [From.Get_le_TitledName] a choisi de tenter de déjouer un complot contre sa vie !;M[Root.Geteineine] [Root.GetLordLady], uns hat die Nachricht ereilt, dass [From.GetTitledName] sich verstecken wolle, um einen Anschlag auf [From.GetHerHis] Leben zu vereiteln!;;Mi [Root.GetLordLady], hemos recibido noticias de que [From.GetTitledName] ¡ha escogido ir a la clandestinidad para tratar de frustrar la conspiración contra [From.GetHerHis] vida!;;;;;;;;;x
EVTDESC_CM_6001;My [Root.GetLordLady], it seems that [From.GetTitledName] has finally decided to come out of hiding, no longer as fearful for [From.GetHerHis] life.;M[Root.GetOnA][Root.GetLordLady], il semble que [From.Get_le_TitledName] ait décidé de ne plus se cacher, peu importe si sa vie est menacée.;M[Root.Geteineine] [Root.GetLordLady], es scheint, dass [From.GetTitledName] endlich aus dem Versteck kommen will, da [From.GetSheHe] nicht mehr derart um [From.GetHerHis] Leben fürchten muss!;;Mi [Root.GetLordLady], parece ser que [From.GetTitledName] finalmente ha decidido volver de la clandestinidad, ya no teme por [From.GetHerHis] vida.;;;;;;;;;x
EVTDESC_CM_6002;My [Root.GetLordLady], news has reached us that [FromFrom.GetTitledName] has sent [FromFrom.GetHerHis] [From.GetHusbandWife] [From.GetFirstName] into hiding in order to protect [From.GetHerHim] from a suspected murder plot.;M[Root.GetOnA][Root.GetLordLady], nous avons reçu la nouvelle que [FromFrom.Get_le_TitledName] a envoyé s[From.GetOnA] [From.GetHusbandWife], [From.GetFirstName], se cacher afin de [From.GetLeLa] protéger contre un probable complot meurtrier.;M[Root.Geteineine] [Root.GetLordLady], uns hat die Nachricht ereilt, dass [FromFrom.GetTitledName] [From.GetFirstName] ins Versteck geschickt hat, um [From.GetHerHim] vor einem vermuteten Mordkomplott zu schützen.;;Mi [Root.GetLordLady], nos han llegado noticias acerca de [FromFrom.GetTitledName]. Dicen que ha enviado [FromFrom.GetHerHis] [From.GetHusbandWife] [From.GetFirstName] a la clandestinidad para proteger [From.GetHerHim] de la sospecha de una conspiración de asesinato.;;;;;;;;;x
EVTDESC_CM_6003;My [Root.GetLordLady], it seems [FromFrom.GetTitledName] has brought [FromFrom.GetHerHis] [From.GetHusbandWife] [From.GetFirstName] out of hiding, no longer as fearful of murder plots against [From.GetHerHim].;M[Root.GetOnA][Root.GetLordLady], il semble que [FromFrom.Get_le_TitledName] a sorti s[From.GetOnA] [From.GetHusbandWife], [From.GetFirstName], de sa cachette, ne craignant plus pour sa vie.;M[Root.Geteineine] [Root.GetLordLady], es scheint, dass [From.GetTitledName] [From.Spouse.GetFirstName] aus dem Versteck geholt hat, da man nicht länger derart ein Mordkomplott gegen [From.Spouse.GetHerHim] fürchtet.;;Mi [Root.GetLordLady], parece ser que [FromFrom.GetTitledName] ha sacado su [From.GetHusbandWife] [From.GetFirstName] de la clandestinidad, ya no se teme por conspiraciones de asesinato contra [From.GetHerHim].;;;;;;;;;x
EVTDESC_CM_6004;My [Root.GetLordLady], news has reached us that [FromFrom.GetTitledName] has sent [FromFrom.GetHerHis] [From.GetSonDaughter] [From.GetFirstName] into hiding in order to protect [From.GetHerHim] from a suspected murder plot.;M[Root.GetOnA][Root.GetLordLady], nous avons reçu la nouvelle que [From.GetFirstName], [From.GetSonDaughter] [From.Get_du_TitledName], a dû se cacher afin de se protéger contre un probable complot meurtrier.;M[Root.Geteineine] [Root.GetLordLady], uns hat die Nachricht ereilt, dass [FromFrom.GetTitledName] [From.GetFirstName] ins Versteck geschickt hat, um [From.GetHerHim] vor einem vermuteten Mordkomplott zu schützen.;;Mi [Root.GetLordLady], nos han llegado noticias de que [FromFrom.GetTitledName] ha enviado [FromFrom.GetHerHis] [From.GetSonDaughter] [From.GetFirstName] a la clandestinidad para proteger [From.GetHerHim] de la sospecha de una conspiración de asesinato.;;;;;;;;;x
EVTDESC_CM_6005;My [Root.GetLordLady], it seems [FromFrom.GetTitledName] has brought [FromFrom.GetHerHis] [From.GetSonDaughter] [From.GetFirstName] out of hiding, no longer as fearful of murder plots against [From.GetHerHim].;M[Root.GetOnA][Root.GetLordLady], il semble que [From.Get_le_TitledName] a sorti s[From.GetOnA] [From.GetSonDaughter] [From.GetFirstName] de sa cachette, ne craignant plus pour sa vie.;M[Root.Geteineine] [Root.GetLordLady], es scheint, dass [FromFrom.GetTitledName] [From.GetFirstName] aus dem Versteck geholt hat, da man nicht länger allzu sehr ein Mordkomplott gegen [From.GetHerHim] fürchtet.;;Mi [Root.GetLordLady], parece ser que [FromFrom.GetTitledName] ha sacado [FromFrom.GetHerHis] [From.GetSonDaughter] [From.GetFirstName] de la clandestinidad, ya no se teme por conspiraciones de asesinato contra [From.GetHerHim].;;;;;;;;;x
EVTDESC_CM_6100;This terrible isolation in hiding... it has long been fraying at your fragile soul... it's almost unbearable. Yet you must learn to live with it... you must... adapt your mind. Yes, adapt... become something else...;Cet isolement contraint est horrible... Il fragilise votre esprit déjà affaibli... C'est à la limite du supportable. Pourtant, vous devez apprendre à vivre de la sorte... Vous devez... Adapter votre esprit. S'adapter, devenir quelqu'un d'autre...;Diese furchtbare Isolation im Versteck ... Sie zerrt seit langem an Euren empfindlichen Nerven ... Es ist kaum zu ertragen. Doch Ihr müsst lernen, damit zu leben ... Euer Geist muss sich anpassen. Ja, anpassen ... etwas anderes werden ...;;Este terrible aislamiento en la clandestinidad... desde hace tiempo está desgastando tu frágil alma... Es casi insoportable. Pronto deberás aprender a vivir con ello... Tienes que adaptar tu mente. Sí, adaptar... se convierte en algo más...;;;;;;;;;x
EVTDESC_CM_6101;It seems that your [GetFromRelation]'s spirit has been suffering greatly from hiding away for so long, enough to drive [From.GetHerHim] insane...;Il semble que l'esprit de votre [GetFromRelation] s'est grandement fragilisé, récemment, en raison de son isolement forcé. La folie n'est jamais bien loin...;Es scheint, dass das Gemüt von [GetFirstName] arg unter dem Leben im Versteck leidet. Es reicht, um [From.GetHerHim] in den Wahnsinn zu treiben ...;;Parece que el espíritu de tu [GetFromRelation] ha sufrido enormemente al pasar tanto tiempo en la clandestinidad, suficiente para llevar [From.GetHerHim] a la locura...;;;;;;;;;x
EVTDESC_CM_6102;You sit in hiding, thinking of your enemies, how they could get to you and how you might prevent it. You go over all your plans again and again - did you really take the proper precautions? Are there any persons close to you that might plot against you? Can you really trust the guards?;Vous êtes dans votre cachette et pensez à vos ennemis. Vous imaginez à quel point il serait dramatique qu'ils mettent la main sur vous et ressassez votre plan. Avez-vous pris toutes les précautions requises ? Y a-t-il quelqu'un parmi vos proches susceptible de vous trahir ? Les gardes sont-ils vraiment dignes de confiance ?;Ihr sitzt in Eurem Versteck, denkt an Eure Feinde, daran wie sie Euch kriegen könnten und wie Ihr das verhindern könntet. Ihr geht wieder und wieder Eure Pläne durch - habt Ihr wirklich alle Vorsichtsmaßnahmen getroffen? Gibt es Euch nahestehende Personen, die Euch verraten könnten? Könnt Ihr Euch wirklich auf die Wachen verlassen?;;Estás en la clandestinidad, pensando en tus enemigos, en cómo podrían cogerte y cómo lo puedes prevenir. Repasas tus planes una y otra vez - ¿Has tomado las precauciones adecuadas? ¿Tienes personas cercanas que pudieran conspirar contra ti? ¿Puedes confiar realmente en los guardias?;;;;;;;;;x
EVTDESC_CM_6104;Hiding from your enemies, you gain little opportunity for spending time with others. Also, there is little opportunity for 'spending time' with others. You find, however, that you are getting used to it. Indeed, the absence of carnal thoughts makes you feel strangely pure and more at ease with yourself.;À l'abri de vos ennemis, vous avez peu l'opportunité de passer du temps avec d'autres personnes, du sexe opposé, notamment. Vous commencez néanmoins à vous habituer à la solitude. En effet, en l'absence de pensées charnelles, vous retrouvez une certaine pureté et une aisance avec vous-même.;Wer sich vor seinen Feinden verstecken muss, hat kaum Gelegenheit, mit Freunden zusammen zu sein. Dazu gibt es ja auch keine Gelegenheit. Ihr stellt jedoch fest, dass Ihr Euch allmählich daran gewöhnt. Tatsächlich fühlt Ihr Euch durch das Fehlen fleischlicher Gelüste auf besondere Weise rein und mehr mit Euch selbst im Reinen.;;Escondiéndote de tus enemigos, tienes pocas oportunidades de relacionarte con los demás. También tienes pocas oportunidades de "relacionarte" con otras personas. No obstante, encuentras que te estás acostumbrando a ello. Efectivamente, la ausencia de pensamientos carnales te hace sentir extrañamente puro y más a gusto contigo mismo.;;;;;;;;;x
EVTDESC_CM_6105;[From.GetFirstName] has been hiding from [From.GetHerHis] enemies for some time now, living in relative isolation. The experience seems to have changed [From.GetHerHim]. You find that [From.GetSheHe] no longer shows a physical interest in you the same way that [From.GetSheHe] used to.;[From.GetFirstName] se cache de ses ennemis depuis quelque temps maintenant, vivant dans une certaine solitude. L'expérience semble l'affecter. D'ailleurs, vous avez le sentiment qu'[From.GetIlElle] ne vous porte plus le même intérêt qu'autrefois.;[From.GetFirstName] versteckt sich nun seit geraumer Zeit vor [From.GetHerHis]en Feinden und lebt nahezu in vollständiger Einsamkeit. Diese Erfahrung scheint [From.GetHerHim] verändert zu haben. Ihr stellt fest, dass [From.GetSheHe] nicht mehr körperlich an Euch interessiert ist.;;[From.GetFirstName] se ha estado escondiendo de [From.GetHerHis] enemigos por un tiempo, viviendo en un relativo aislamiento. La experiencia parece haber [From.GetHerHim] cambiado. Te das cuenta de que [From.GetSheHe] ya no siente el interés físico por ti que antes solía mostrar.;;;;;;;;;x
