EVTDESC_CM_6106;Living your life in hiding, you have much time to reflect on your situation. Sometimes there is fear, sometimes there is doubt. As the long hours pass at night, you find yourself increasingly taking comfort in religious musings. With time, the hope that [Root.Religion.GetRandomGodName] will protect you strengthens and becomes certainty.;L'isolement vous laisse le temps de réfléchir à votre situation. Parfois vous avez peur, parfois vous doutez. Tandis que les longues heures de la nuit s'égrènent, vous trouvez un certain réconfort dans vos songes spirituels. Avec le temps, l'espoir que [Root.Religion.GetRandomGodName] vous protègera se renforce et devient une certitude.;Wer im Versteck lebt, hat viel Zeit, über die eigene Situation nachzudenken. Manchmal kommen Ängste, dann wieder Zweifel. In den langen schlaflosen Stunden der Nacht hat man reichlich Zeit, über religiöse Fragen nachzugrübeln. Mit der Zeit wird die Hoffnung, dass [Root.Religion.GetRandomGodName] Euch beschützt zur Gewissheit.;;Viviendo tu vida en la clandestinidad, tienes mucho más tiempo para reflexionar sobre tu situación. Algunas veces con miedo, otras con dudas. En el transcurso de las largas horas de la noche, te descubres a ti mismo encontrándote cada vez más a gusto en la meditación religiosa. Con el tiempo, la esperanza de que [Root.Religion.GetRandomGodName] te protegerá se hace cada vez más fuerte y se convierte en certeza.;;;;;;;;;x
EVTDESC_CM_6108;It is hard to stay in hiding for so many hours of the day, being physically inactive and unable to walk in the light of the sun whenever you wish. Though you are more secure like this, you wish you were not forced to sit here like some rat. Yes... you do feel like a wretched rat...;Le jour, votre isolement est plus dur à supporter. L'inactivité et le manque de lumière vous rongent. Même si vous savez que c'est pour votre sécurité, vous voudriez ne plus tourner en rond comme un lion en cage... Même si vous vous sentez plus rat que lion, actuellement...;So viele Stunden am Tag im Versteck zu verharren, nichts tun zu können und auch nicht an die Sonne gehen zu dürfen, wann immer man will, ist hart. So seid Ihr zwar sicherer, doch Ihr wollt nicht gezwungen sein, wie eine Ratte in einem Loch zu sitzen. Ja, Ihr fühlt Euch wie eine armselige Ratte ...;;Es duro estar oculto tantas horas al día, estando físicamente inactivo y sin poder caminar bajo la luz del sol cuando uno lo desea. Aunque aquí estés más seguro, desearías que no te hubieran impuesto encerrarte como si de una rata se tratara. Sí... te sientes como una miserable rata...;;;;;;;;;x
EVTDESC_CM_6110;You have been spending too much time hiding in dusty, cold cellars and not getting enough fresh air. It is said that the stale air of closed rooms is unhealthy if too much time is spent there. Indeed, you aren't feeling all that well right now...;Vous avez passé trop de temps à vous cacher dans des cellules froides et crasseuses, loin de l'air frais. Il paraît que l'air confiné des pièces closes peut devenir malsain, à la longue. Il est vrai que vous ne vous sentez pas très bien...;Schon viel zu lange versteckt Ihr Euch in staubigen, kalten Kellern und bekommt zu wenig frische Luft. Man sagt, dass die abgestandene Luft geschlossener Räume auf Dauer der Gesundheit schadet. Und tatsächlich fühlt Ihr Euch gerade nicht besonders wohl ...;;Has estado demasiado tiempo escondiéndote en frías y polvorientas bodegas y sin tener suficiente aire fresco. Se dice que el aire viciado de las habitaciones cerradas resulta insalubre si se pasa demasiado tiempo en él. Efectivamente, tú no te sientes demasiado bien últimamente...;;;;;;;;;x
EVTDESC_CM_6112;It's very boring to sit in hiding. The hours are long, and not many pleasures are available. Luckily, there's always the joy of a good strong meal.;Rester assis toute la journée, quel ennui ! Les heures passent lentement et vous n'avez aucune distraction. Heureusement, vous avez toujours la satisfaction d'un repas bien copieux !;Im Versteck zu sitzen ist langweilig. Die Stunden werden immer länger und Ablenkung gibt es kaum. Zum Glück bleibt immer die Freude über eine kräftige Mahlzeit.;;Es muy aburrido estar en la clandestinidad. Las horas no pasan, y no hay muchos placeres a tu disposición. Afortunadamente, siempre te quedará el gozo de una buena y abundante comida.;;;;;;;;;x
EVTDESC_CM_6114;Hiding from your enemies, you spend a lot of time just sitting around. As time passes, you feel yourself getting used to it. You find you don't have the energy for doing much work, but there's also no urgency, really.;Alors que vous vous cachez de vos ennemis, vous passez le plus clair de votre temps à attendre. Au fur et à mesure que les jours s'écoulent, vous semblez vous habituer à la situation. Vous perdez de vos forces mais de toute façon, il n'y a pas grand-chose à faire, alors...;Wer sich vor den Feinden versteckt, sitzt die meiste Zeit nur herum. Mit der Zeit gewöhnt man sich daran. Ihr habt nicht viel Energie zum Arbeiten, aber es liegt ja auch nichts Dringendes an.;;Escondiéndote de tus enemigos, te pasas mucho tiempo sentado por ahí. A medida que el tiempo pasa, te vas acostumbrando a ello. Sientes que no tienes energía para hacer demasiado trabajo, pero en realidad tampoco hay ninguna urgencia.;;;;;;;;;x
EVTDESC_CM_6116;Life in hiding is not like normal life. You see very few people, everyone else is busy and it seems they have no time to come and see you. As time passes, you find that you start to get annoyed at the few visitors you do get. You just don't know what to say to people anymore.;La vie en cachette n'a rien d'agréable. La solitude y tient une grande place car pour les autres, la vie continue et les activités du quotidien les empêchent de venir vous voir souvent. Plus le temps passe, moins vous supportez les rares visiteurs qui viennent vous saluer. Vous n'avez pas grand-chose à leur dire.;Das Leben im Versteck ist kein normales Leben. Ihr seht kaum Menschen, alle sind beschäftigt und haben scheinbar keine Zeit, um Euch zu besuchen. Mit der Zeit fangt Ihr an, Euch über die wenigen Leute zu ärgern, die Euch doch noch besuchen. Ihr wisst einfach nicht mehr, was Ihr ihnen sagen sollt.;;La vida en la clandestinidad no es como la vida normal. Todo el mundo anda atareado y parece que no tengan tiempo para venir a verte. A medida que pasa el tiempo, te das cuenta de que empiezas a estar malhumorado con los pocos visitantes que tienes. Ya ni siquiera sabes qué decir a la gente.;;;;;;;;;x
EVTDESC_CM_6118;Life in hiding suits you, you feel much safer now than you have felt in years. It's always better to be safe than to be sorry. Or dead, surely. You're glad that you're getting this opportunity to reflect upon all the mistakes you've made in your life. You've been taking too many risks, but you will not be so foolish again.;La vie en cachette vous sied plutôt bien, vous n'avez jamais ressenti un tel sentiment de sécurité. Mieux vaut prévenir que guérir, ou pire, mourir ! Vous profitez de l'occasion pour réfléchir à vos erreurs passées. Vous savez que vous avez pris beaucoup de risques et vous faites la promesse de ne plus jamais recommencer.;Das Leben im Versteck bekommt Euch, Ihr fühlt Euch jetzt so sicher wie seit Jahren nicht mehr. Besser in Sicherheit zu sein als betrübt. Oder gar tot. Ihr freut Euch, dass Ihr die Zeit habt, über alle Fehler nachzudenken, die Ihr im Leben gemacht habt. Ihr habt zu viel riskiert, doch so leichtfertig werdet Ihr nie wieder sein.;;Estás a gusto con la vida en la clandestinidad, te sientes seguro como hacía años que no te sentías. Siempre es mejor estar a salvo que tener que lamentarse. O muerto, sin duda. Te alegras de tener esta oportunidad para reflexionar sobre todos tus errores. Has asumido demasiados riesgos, pero a partir de ahora no volverás a ser tan bobo.;;;;;;;;;x
EVTDESC_CM_6120;When people are out to kill you, and you sacrifice daily pleasures and companionship in order to hide from them, you do come to appreciate the little things in life and how much joy they can really bring you. Reflecting on this is making you see a new perspective, and suddenly the bigger issues seem less... big.;Alors que des hommes cherchent à vous tuer et que vous vous cachez, abandonnant les plaisirs de la vie et la compagnie de vos proches, vous commencez à apprécier les choses les plus simples et la joie qu'elles vous procurent. Vous envisagez la vie sous un nouvel angle et soudain, vos problèmes semblent dérisoires...;Wenn Leute Euch umbringen wollen und Ihr auf Vergnügen und Zweisamkeit verzichtet, um vor ihnen sicher zu sein, dann lernt Ihr die kleinen Dinge des Lebens zu schätzen und wie viel Freude sie Euch bringen können. Das Nachdenken darüber verschafft Euch eine neue Perspektive und auf einmal sehen die großen Probleme nicht mehr ganz so groß aus.;;Cuando estás fuera del punto de mira de la gente y sacrificas la compañía y los placeres cotidianos para ocultarte del mundo, es cuando realmente aprecias las pequeñas cosas de la vida y cuánta alegría pueden darte. Estas reflexiones te están dando una nueva perspectiva y de repente los grandes asuntos parecen menos... importantes.;;;;;;;;;x
EVTDESC_CM_6122;Life in hiding is very limiting. You miss things like being outside, seeing people, enjoying good food and drink, games, merriment and companionship. When this trying time is over, you vow to compensate by living life to the fullest.;La vie en cachette a ses limites. L'air pur vous manque, ainsi que vos proches, les bons repas bien arrosés, les jeux et les rires. Lorsque cette période transitoire sera terminée, vous comptez rattraper le temps perdu et profiter pleinement de ce que la vie a à vous offrir.;Das Leben im Versteck engt sehr ein. Ihr vermisst Dinge wie Leute zu treffen, gutes Essen und Getränke, Spiele, Vergnügen und Gemeinschaft zu genießen. Ihr schwört Euch das Leben in vollen Zügen zu genießen, wenn diese schwere Zeit erst vorüber ist.;;La vida en la clandestinidad es muy limitada. Echas de menos cosas como salir fuera, ver gente, deleitarte con una buena comida y bebida, los juegos, la alegría y la compañía. Te prometes compensarlo y, cuando superes esta prueba, vivirás la vida plenamente.;;;;;;;;;x
EVTDESC_CM_6124;Spending your time hidden away from your enemies, you don't get much outdoors time, nor do you see many people. You have taken to making the time pass by reading. You did not expect, however, that such a wonderful new world would open up to you through these books...;Alors que vous vous cachez de vos ennemis, vous ne sortez quasiment plus à l'air libre et ne voyez presque plus personne. Votre seul passe-temps est la lecture. Cependant, vous étiez loin d'imaginer que de simples livres vous permettraient de voyager vers un univers merveilleux et inconnu.;Da Ihr Euch vor Euren Feinden versteckt, kommt Ihr kaum noch ins Freie und seht nur wenige Menschen. Ihr verbringt Eure Zeit mit Lesen und staunt darüber, welch wunderbare Welt sich Euch in diesen Büchern eröffnet ...;;Pasando el tiempo escondido de tus enemigos, no tienes mucho tiempo para estar en el exterior, ni ves a demasiada gente. Matas el tiempo leyendo. Sin embargo, no esperabas que un mundo tan maravilloso se te pudiera abrir a través de estos libros...;;;;;;;;;x
EVTDESC_CM_6126;Trying to occupy your mind while hiding from enemy plotters, you have been reading some interesting new books that a friend acquired for you from a foreign bookmerchant. You study the books late into the night, fascinated with the strange mysteries that they describe. You start to think that maybe you could expand on these ideas yourself...;Alors que vous vous cachez des conspirateurs, vous vous plongez dans des livres passionnants achetés par l'un de vos amis à un marchand étranger. Vous lisez jusque tard dans la nuit, vous laissant emporter par les mystères que renferment ces ouvrages. D'ailleurs, cette activité fait travailler votre imagination et vous envisagez d'ajouter une nouvelle corde à votre arc...;Um Euren Geist im Versteck von den Feinden abzulenken, die Euch nach dem Leben trachten, habt Ihr interessante neue Bücher gelesen, die Euch ein Freund aus dem Ausland mitgebracht hat. Ihr lest bis spät in die Nacht, fasziniert von den seltsamen Mysterien, die sie beschreiben. Langsam überlegt Ihr, ob Ihr auf diesen Ideen nicht aufbauen könntet ...;;Tratando de ocupar la mente mientras te escondes de tus enemigos conspiradores, has estado leyendo algunos nuevos e interesantes libros que un amigo adquirió para ti de un comerciante extranjero. Estudias los libros entrada la noche, fascinado con los extraños misterios que describen. Empiezas a pensar que tal vez tú mismo podrías desarrollar estas ideas...;;;;;;;;;x
EVTDESC_CM_6128;Spending time in hiding, you find it hard to sleep at night. Your mind wanders, you feel restless. Someone once said that the restless soul needs to express itself, or it shall wilt and die. Perhaps you should pick up quill and parchment and write something?.;Bien qu'à l'abri de vos ennemis, vous peinez à trouver le sommeil. Votre esprit vagabonde et l'agitation s'empare de vous. Un jour, quelqu'un a dit qu'un esprit tourmenté a besoin de s'exprimer, faute de quoi il se flétrit et meurt. Vous devriez peut-être vous emparer d'une plume et d'un parchemin pour écrire ce que vous avez sur le coeur ?;Wer im Versteck lebt, findet nachts nur schwer in den Schlaf. Die Gedanken wandern, Ihr seid unruhig. Jemand hat mal gesagt, dass die unruhige Seele sich ausdrücken muss, um nicht dahinzuwelken und zu sterben. Vielleicht solltet Ihr zu Feder und Pergament greifen und etwas schreiben?;;Pasando el rato en la clandestinidad, no te es fácil dormir por las noches. Tu mente da vueltas, te sientes inquieto. Alguien dijo una vez que las almas inquietas necesitan expresarse, de otro modo se marchitan y mueren. ¿Quizá deberías coger pluma y pergamino y escribir algo?;;;;;;;;;x
EVTDESC_CM_6130;Your daily religious observations will keep you safe. You say the name of [Root.Religion.GetRandomGodName] ten times on the strike of each hour - first forwards, then backwards. Each time you do it, you feel closer to the unearthly and the divine. You can feel it stronger and stronger. Something is coming, something is changing...;Vos observations religieuses quotidiennes vous préservent du malheur. Vous invoquez [Root.Religion.GetRandomGodName] dix fois par jour, d'abord normalement puis à l'envers. Ce faisant, vous vous sentez plus proche du divin et ce sentiment n'a de cesse de croître. Un changement est sur le point de se produire, c'est une certitude.;Eure täglichen religiösen Betrachtungen geben Euch Sicherheit. Ihr sprecht beim Schlagen jeder vollen Stunde zehnmal den Namen von [Root.Religion.GetRandomGodName] - erst vorwärts, dann rückwärts. Und bei jedem Mal fühlt Ihr Euch dem Überirdischen näher, dem Göttlichen. Ihr fühlt es jedes Mal stärker. Etwas kommt, etwas verändert sich ...;;Tus obligaciones diarias religiosas te mantienen a salvo. Dices el nombre de [Root.Religion.GetRandomGodName] diez veces en cada hora en punto – primero hacia delante, luego hacia atrás. Cada vez que lo haces, te sientes más cerca de lo sobrenatural y de lo divino. Puedes sentirlo más y más fuerte. Algo está viniendo, algo está cambiando...;;;;;;;;;x
EVTDESC_CM_6132;It's frustrating and boring to hide away from the world like this. You need a little something to put a warm glow on your days. Perhaps a drink would help... ah, that's good, this is working. Perhaps another one, just one...;Devoir rester à l'abri du monde est tellement frustrant et ennuyeux ! Vous devez trouver de quoi égayer votre quotidien. Peut-être qu'un petit verre ferait l'affaire... Ah, ça fait du bien ! Allez, un deuxième pour la route...;Sich so vor der Welt zu verstecken ist langweilig und frustrierend. Ihr braucht etwas, das ein warmes Gefühl in Euer Leben bringt. Ein Glas Wein zu trinken wäre wohl nicht schlecht ... Aah, das tut gut, das wirkt. Vielleicht noch eins, nur noch eins ...;;Es frustrante y aburrido estar escondido del mundo de esta forma. Necesitas poner un leve y cálido resplandor en tus días. Quizás la bebida ayude... ah, así está mejor, esto funciona. Quizás otra más, sólo una...;;;;;;;;;x
EVTDESC_CM_6180;My [Root.GetLordLady], we have received news that [Root.PlotTarget.GetTitledName] has gone into hiding! This will severely compromise our efforts to assassinate [Root.PlotTarget.GetHerHim].;M[Root.GetOnA][Root.GetLordLady], nous avons appris que [Root.PlotTarget.Get_le_TitledName] se cache ! Cela va considérablement compliquer notre plan visant à l'assassiner.;M[Root.Geteineine] [Root.GetLordLady], wir haben Nachricht erhalten, dass [Root.PlotTarget.GetTitledName] sich versteckt hält! Dies ist ein schwerer Schlag gegen unsere Pläne, [Root.PlotTarget.GetHerHim] zu ermorden.;;Mi [Root.GetLordLady], hemos recibido noticias acerca de [Root.PlotTarget.GetTitledName]. ¡Se ha ido a la clandestinidad! Esto compromete severamente nuestros esfuerzos para asesinar [Root.PlotTarget.GetHerHim].;;;;;;;;;x
EVTDESC_CM_6200;The world is a dangerous place, and devious plots are everywhere. Rumors have reached you that people are conspiring to kill you.;Le monde est un endroit dangereux où les conspirations sont légion. Vous avez entendu dire que certaines personnes complotent de vous tuer.;Die Welt ist gefährlich und überall lauern Schurken. Es kommt Euch zu Ohren, dass man Euch nach dem Leben trachtet.;;El mundo es un lugar peligroso y por todas partes hay ladinas conspiraciones. Te han llegado rumores de que hay gente conspirando para asesinarte.;;;;;;;;;x
EVTDESC_CM_6210;The world is a dangerous place, and devious plots are everywhere. Rumors have reached you that people are conspiring to kill your [GetFromRelation], [From.GetFirstName].;Le monde est un endroit dangereux où les conspirations sont légion. Vous avez entendu dire que certaines personnes complotent de tuer votre [GetFromRelation], [From.GetFirstName].;Die Welt ist gefährlich, und überall lauern Schurken. Es kommt Euch zu Ohren, dass man [From.GetFirstName] ermorden will.;;El mundo es un lugar peligroso y por todas partes hay ladinas conspiraciones. Te han llegado rumores que hay gente conspirando para asesinar a tu [GetFromRelation], [From.GetFirstName].;;;;;;;;;x
EVTDESC_CM_6300;My [Root.GetLordLady], an opportunity has arisen in your plan to rid yourself of [Root.PlotTarget.GetTitledName]. We have been contacted by a secret guild of highly trained professional killers. They are master infiltrators, dressing all in black, and they are offering to 'solve your problems'. How shall we proceed, my [Root.GetLordLady]?;M[Root.GetOnA][Root.GetLordLady], sachez que l'opportunité de vous débarrasser [Root.PlotTarget.Get_du_TitledName] est sur le point de se présenter. Nous avons été contactés par une guilde secrète d'assassins professionnels hautement entraînés. Ce sont des experts de l'infiltration, tout de noir vêtus, et proposant de « résoudre notre problème ». Comment devons-nous procéder, M[Root.GetOnA][Root.GetLordLady] ?;M[Root.Geteineine] [Root.GetLordLady], es hat sich für Euren Plan, [Root.PlotTarget.GetTitledName] loszuwerden, eine Möglichkeit ergeben. Eine geheime Gilde hochprofessioneller Mörder hat uns angesprochen. Sie kleiden sich ganz in Schwarz, schleichen sich lautlos überall ein und bieten an, "Eure Probleme zu lösen". Wie sollen wir verfahren?;;Mi [Root.GetLordLady], ha surgido una oportunidad en vuestras intenciones de libraros de Root.PlotTarget.GetTitledName]. Hemos contactado con un gremio de asesinos profesionales altamente preparados. Son maestros en la infiltración, visten completamente de negro y ofrecen "solucionar vuestros problemas". ¿Como debemos proceder, mi [Root.GetLordLady]?;;;;;;;;;x
EVTDESC_CM_6301;It seems as though [From.GetTitledName] has found an opportunity to send a secret guild of elite murderers to infiltrate the hiding place of the cowardly [From.PlotTarget.GetTitledName] and kill [From.PlotTarget.GetHerHim].;Il semble que [From.Get_le_TitledName] a trouvé le moyen d'envoyer une guilde secrète de tueurs d'élite afin de dévoiler la cachette de ce lâche de [From.PlotTarget.GetTitledName] et mettre fin à ses jours.;Es scheint, dass [From.GetTitledName] eine Möglichkeit gefunden hat, eine geheime Gilde von Elitemördern anzuheuern, die in das Versteck des feigen [From.PlotTarget.GetTitledName] eindringen sollen, um [From.PlotTarget.GetHerHim] zu töten.;;Parece que [From.GetTitledName] ha encontrado una manera de enviar un secreto gremio de asesinos de élite para infiltrarse en el lugar donde se oculta el/la cobarde de [From.PlotTarget.GetTitledName] y matar[From.PlotTarget.GetHerHim].;;;;;;;;;x
EVTDESC_CM_6303;Late one evening, as you are sitting in your hiding place, contemplating your situation, there is a sound just outside. You look up, and to your astonishment see one of the guards falling through the door, stabbed in the neck. A man clad in black enters and walks silently but swiftly towards you. As you rise to challenge him, he makes a swift movement and you feel a sharp pain in your chest. You look down and see a dagger lodged between your ribs. Your legs start to buckle underneath you, and your vision starts to blur...;Un soir, tard, alors que vous vous trouvez dans votre cachette à vous lamenter sur votre sort, un bruit se fait entendre dehors. Vous levez la tête et à votre plus grande surprise, vous voyez l'un des gardes tomber, poignardé à la gorge. Un homme vêtu de noir entre dans la pièce et s'avance silencieusement vers vous. Tandis que vous vous levez pour lui faire face, il esquisse un geste rapide et précis, et vous sentez une vive douleur au torse. Vous baissez les yeux et voyez une dague plantée entre vos côtes. Vos jambes se dérobent sous votre poids et votre vue se brouille...;Spät am Abend sitzt Ihr in Eurem Versteck und denkt über Eure Lage nach, als Ihr draußen ein Geräusch hört. Ihr blickt auf und seht zu Eurem Entsetzen, dass eine der Wachen mit einem Messer im Nacken durch die Tür hereinfällt. Ein schwarz gekleideter Mann tritt ein und kommt lautlos, aber rasch auf Euch zu. Ihr springt auf, um Euch zu verteidigen, doch da spürt Ihr schon einen stechenden Schmerz in der Brust. Ihr blickt hinunter und seht einen Dolch zwischen Euren Rippen stecken. Eure Knie geben nach, die Welt vor Euren Augen verschwimmt ...;;Al final de un atardecer, mientras estás sentado en tu lugar oculto contemplando tu situación, oyes un ruido en la parte de afuera. Miras hacia arriba y para tu asombro ves a uno de los guardias cayendo bajo el umbral de la puerta, con un puñal en el cuello. Un hombre vestido de negro entra y camina silenciosa pero rápidamente hacia ti. En el momento en que te levantas para retarle, hace un rápido movimiento y sientes un agudo dolor en el pecho. Miras hacia abajo y ves una daga alojada entre tus costillas. Tus piernas empiezan a ceder y tu visión va haciéndose borrosa...;;;;;;;;;x
EVTDESC_CM_6304;News reach you that the plot to murder [From.GetTitledName] has met with success. [From.GetTitledName] has fallen victim to the assassin's knife. The plotters behind it have not been revealed.;On vous apprend que le complot pour tuer [From.Get_le_TitledName] a été un franc succès. [From.Get_Le_TitledName] a péri sous la lame de l'assassin. On ignore l'identité des conspirateurs.;Euch erreicht die Nachricht, dass Euer Plan, [From.GetTitledName] zu ermorden, erfolgreich war. [From.GetTitledName] ist durch Mörderklinge gefallen. Die Auftraggeber des Mordes sind unbekannt.;;Te han llegado noticias de que el complot para asesinar [From.GetTitledName] se ha llevado a cabo con éxito. [From.GetTitledName] ha caído víctima del asesino del cuchillo. Los conspiradores que hay detrás de esto no han salido a la luz.;;;;;;;;;x
EVTDESC_CM_6306;News reach you that the plot to murder [From.GetTitledName] has met with success. [From.GetTitledName] has fallen victim to the assassin's knife. Unfortunately, the assassin was caught and revealed who ordered the murder.;On vous apprend que le complot pour tuer [From.Get_le_TitledName] a été un franc succès. [From.Get_Le_TitledName] a péri sous la lame de l'assassin. Malheureusement, le tueur s'est fait arrêter et a révélé l'identité du commanditaire.;Euch erreicht die Nachricht, dass Euer Plan, [From.GetTitledName] zu ermorden, erfolgreich war. [From.GetTitledName] ist durch Mörderklinge gefallen. Bedauerlicherweise wurde der Mörder gefasst und hat seinen Auftraggeber verraten.;;Te han llegado noticias de que el complot para asesinar [From.GetTitledName] se ha llevado a cabo con éxito. [From.GetTitledName] ha caído víctima del asesino del cuchillo. Desgraciadamente, el asesino ha sido capturado y ha revelado quién ordeno el asesinato.;;;;;;;;;x
