EVTDESC_CM_6337;You sleep soundly in your hiding place, dreaming of safer and happier times. Suddenly you are disturbed by something... cold and slippery... it slithers up under your blanket. You are instantly wide awake - something is wrong! You grab in the darkness and find you have something cold and scaly in your hand, twisting frenetically. You carefully light the lamp and find you are holding a small snake just below the head. Venom is dripping from its fangs as it snaps its jaws against you. You're sure this animal is not here by coincidence, and you thank [Root.Religion.GetRandomGodName] for your narrow escape.;Vous dormez sur vos deux oreilles dans votre cachette, rêvant de liberté et de jours heureux, quand quelque chose perturbe votre sommeil... Une chose froide et visqueuse... Qui se glisse sous votre couverture. Vous vous réveillez brutalement, quelque chose d'anormal est en train de se produire ! Il fait noir mais vous vous emparez de la chose pleine d'écailles s'agitant frénétiquement. Vous allumez avec précaution une bougie et découvrez que vous tenez un petit serpent par la tête. Du venin coule de ses crocs, ses mâchoires sont grandes ouvertes. Ce reptile ne s'est pas retrouvé là par hasard et vous remerciez [Root.Religion.GetRandomGodName] de vous avoir laissé la vie sauve.;Ihr schlaft friedlich in Eurem Versteck und träumt von sichereren und glücklicheren Zeiten. Plötzlich werdet Ihr von etwas gestört ... es ist kalt und glatt ... und gleitet lautlos unter Eure Decke. Ihr seid sofort hellwach - irgendwas stimmt nicht! Ihr greift in die Dunkelheit und habt etwas kaltes, schuppiges in der Hand, das sich aufgeregt windet. Ihr entzündet vorsichtig das Licht und seht, dass Ihr eine kleine Schlange direkt hinter dem Kopf gefasst haben. Gift tropft aus ihren Zähnen, während sie nach Euch schnappt. Dieses Tier ist gewiss nicht zufällig gekommen und Ihr dankt [Root.Religion.GetRandomGodName], dass Ihr noch einmal davongekommen seid.;;Estás durmiendo profundamente en tu escondrijo, soñando en tiempos más felices y más seguros. De repente hay algo que te desvela... frío y escurridizo... se desliza por debajo de tu manta. Te despiertas al instante ¡algo va mal! Tratas de ver algo en la oscuridad y te das cuenta de que tienes algo frío y escamoso en tu mano, retorciéndose frenéticamente. Cuidadosamente enciendes la lámpara y descubres que tienes una pequeña serpiente agarrada justo por debajo de la cabeza. El veneno está chorreando de sus colmillos mientras intenta morderte. Estás seguro de que este animal no está aquí por casualidad, y das gracias a [Root.Religion.GetRandomGodName] por haberte escapado por los pelos.;;;;;;;;;x
EVTDESC_CM_6338;It seems the snake charmer failed to kill [From.GetTitledName]. The instigators of the plot were not revealed, however.;Il semble que le charmeur de serpent n'a pas réussi à tuer [From.Get_le_TitledName]. L'identité des instigateurs du complot demeure inconnue, toutefois.;Es scheint, dass der Schlangenbeschwörer es nicht geschafft hat, [From.GetTitledName] zu töten. Die Auftraggeber des Anschlags aber bleiben unbekannt.;;Parece que el guardia que encantador de serpientes no ha logrado matar a [From.GetTitledName]. De todos modos, los instigadores del complot no han sido revelados.;;;;;;;;;x
EVTDESC_CM_6340;My [Root.GetLordLady], an opportunity has arisen in your plot to rid yourself of [Root.PlotTarget.GetTitledName]. We have found a disloyal chamber maid who says she is willing to end her [Root.PlotTarget.GetLordLady]'s life. How shall we proceed, my [Root.GetLordLady]?;M[Root.GetOnA][Root.GetLordLady], sachez que l'opportunité de vous débarrasser [Root.PlotTarget.Get_du_TitledName] est sur le point de se présenter. Nous avons rencontré une femme de chambre déloyale qui prétend vouloir aussi mettre fin à son existence. Comment devons-nous procéder, M[Root.GetOnA][Root.GetLordLady] ?;M[Root.Geteineine] [Root.GetLordLady], es hat sich für Euren Plan, [Root.PlotTarget.GetTitledName] loszuwerden, eine Möglichkeit ergeben. Wir haben eine verräterische Kammerzofe gefunden, die bereit ist, dem Leben von [Root.PlotTarget.GetLordLady] ein Ende zu setzen. Wie sollen wir verfahren?;;Mi [Root.GetLordLady], en su complot ha surgido la oportunidad de acabar con [Root.PlotTarget.GetTitledName]. Hemos encontrado una doncella que dice querer acabar con la vida de su [Root.PlotTarget.GetLordLady]. ¿Cómo vamos a proceder, mi [Root.GetLordLady]?;;;;;;;;;x
EVTDESC_CM_6341;It seems as though [From.GetTitledName] has found an opportunity to hire a disloyal chamber maid with access to [Root.PlotTarget.GetTitledName]. This presents us with a chance to kill [From.PlotTarget.GetHerHim].;Il semble que [From.Get_le_TitledName] a eu l'opportunité d'engager une femme de chambre déloyale proche [Root.PlotTarget.Get_du_TitledName]. Elle pourrait nous aider à mettre notre plan à exécution et l'occire.;Es scheint, dass [From.GetTitledName] eine illoyale Kammerzofe engagieren kann, die Zugang zu [Root.PlotTarget.GetTitledName] hat. Das gibt uns die Chance, [From.PlotTarget.GetHerHim] zu töten.;;Parece que [From.GetTitledName] ha encontrado la oportunidad de contratar a una doncella desleal que tiene acceso a [Root.PlotTarget.GetTitledName]. Esto se nos presenta como una oportunidad para matar a [From.PlotTarget.GetHerHim].;;;;;;;;;x
EVTDESC_CM_6343;Here you lie, nothing happening, nothing to look at. Why have they put you here? You would rather be out in the sun. Why does no one listen when you can't speak? Nurse! Nurse! Ah, there you are... what are you doing with that rope... nurse?;Vous êtes sur votre lit et vous vous ennuyez à mourir. Pourquoi donc vous oblige-t-on à rester ici ? Vous seriez bien mieux au soleil. Pourquoi ne vous écoute-t-on jamais ? Femme de chambre ! Femme de chambre ! Ah, vous voilà... Mais, que faites-vous avec cette corde ?;Hier liegt Ihr, nichts passiert, nichts zum Anschauen. Warum haben sie Euch hierher gebracht? Ihr würdet lieber draußen in der Sonne liegen. Warum hört niemand zu, wenn Ihr nicht sprechen könnt? Magd! Magd! Ah, da bis du ja. Was machst du mit dem Strick da ... Magd?;;Estás aquí tumbado, no sucede nada, no hay nada qué mirar. ¿Por qué te habrán traído aquí? Preferirías estar fuera y que te diera el sol. ¿Por qué no hay nadie que escuche cuando no puedes hablar? ¡Enfermera! ¡Enfermera! Ah, estás ahí... ¿qué estás haciendo con esa cuerda?... ¿Enfermera?;;;;;;;;;x
EVTDESC_CM_6344;News reach you that the plot to murder [From.GetTitledName] has met with success. [From.GetTitledName] was strangled in [From.GetHerHis] bed by [From.GetHerHis] chamber maid. The plotters behind it have not been revealed.;On vous apprend que le complot pour tuer [From.Get_le_TitledName] a été un franc succès. [From.Get_Le_TitledName] a péri dans son lit, suite à un acte de strangulation perpétré par sa femme de chambre. L'identité des conspirateurs demeure inconnue.;Euch erreicht die Nachricht, dass Euer Plan, [From.GetTitledName] zu ermorden, erfolgreich war. [From.GetTitledName] wurde in [From.GetHerHis]em Bett von [From.GetHerHis]er Kammerzofe stranguliert. Die Auftraggeber des Mordes sind unbekannt.;;Te llegan noticias de que el complot para matar a [From.GetTitledName] ha resultado exitoso. [From.GetTitledName] fue ahogado en [From.GetHerHis] propia cama por [From.GetHerHis] doncella. No se han revelado los nombres de los conspiradores. ;;;;;;;;;x
EVTDESC_CM_6346;News reach you that the plot to murder [From.GetTitledName] has met with success. [From.GetTitledName] was strangled in [From.GetHerHis] bed by [From.GetHerHis] chamber maid. Unfortunately, the snake charmer was caught and revealed who ordered the murder.;On vous apprend que le complot pour tuer [From.Get_le_TitledName] a été un franc succès. [From.Get_Le_TitledName] a péri dans son lit, suite à un acte de strangulation perpétré par sa femme de chambre. Malheureusement, la femme de chambre a été arrêtée et a dévoilé l'identité du commanditaire.;Euch erreicht die Nachricht, dass Euer Plan, [From.GetTitledName] zu ermorden, erfolgreich war. [From.GetTitledName] wurde in [From.GetHerHis]em Bett von [From.GetHerHis]er Kammerzofe stranguliert. Bedauerlicherweise wurde die Magd gefangen genommen und verriet die Auftraggeber.;;Te llegan noticias de que el complot para matar a [From.GetTitledName] ha resultado exitoso. [From.GetTitledName] fue ahogado en [From.GetHerHis] propia cama por [From.GetHerHis] doncella. Desafortunadamente, arrestaron a la doncella y ésta reveló quién había dado la orden de matar.;;;;;;;;;x
EVTDESC_CM_6347;Here you lie, nothing happening, nothing to look at. Why have they put you here? You would rather be out in the sun. Why does no one listen when you can't speak? Nurse! Nurse! Ah, there you are... what are you doing with that rope... yes, give it to me... no, why did the guard kill the nurse?;Vous êtes sur votre lit et vous vous ennuyez à mourir. Pourquoi donc vous oblige-t-on à rester ici ? Vous seriez bien mieux au soleil. Pourquoi ne vous écoute-t-on jamais ? Femme de chambre ! Femme de chambre ! Ah, vous voilà... Mais, que faites-vous avec cette corde ? Donnez-la-moi, je vous prie. Pourquoi donc le garde a-t-il tué la femme de chambre ?;Hier liegt Ihr, nichts passiert, nichts zum Anschauen. Warum haben sie Euch hierher gebracht? Ihr würdet lieber draußen in der Sonne liegen. Warum hört niemand zu, wenn Ihr nicht sprechen könnt? Magd! Magd! Ah, da bis du ja. Was machst du mit dem Strick da ... ja, gib ihn mir... nein, warum hat die Wache die Magd getötet?;;Estás aquí tumbado, no sucede nada, no hay nada qué mirar. ¿Por qué te habrán traído aquí? Preferirías estar fuera y que te diera el sol. ¿Por qué no hay nadie que escuche cuando no puedes hablar? ¡Enfermera! ¡Enfermera! Ah, estás ahí... ¿qué estás haciendo con esa cuerda?... Dámela... No, ¿Por qué el guardia ha matado a la enfermera?;;;;;;;;;x
EVTDESC_CM_6348;It seems the chamber maid failed to kill [From.GetTitledName]. The instigators of the plot were not revealed, however.;Il semble que la femme de chambre n'a pas réussi à tuer [From.Get_le_TitledName]. L'identité des instigateurs du complot demeure inconnue, toutefois.;Es scheint, dass die Kammerzofe es nicht geschafft hat, [From.GetTitledName] zu töten. Die Auftraggeber des Anschlags aber bleiben unbekannt.;;Parece que la doncella no ha logrado matar a [From.GetTitledName]. De todos modos, los instigadores del complot no han sido revelados.;;;;;;;;;x
EVTDESC_CM_6350;My [Root.GetLordLady], an opportunity has arisen in your plot to rid yourself of [Root.PlotTarget.GetTitledName]. A travelling witch claims she can provide poisoned candies which could be smuggled in as a gift. How shall we proceed, my [Root.GetLordLady]?;M[Root.GetOnA][Root.GetLordLady], sachez que l'opportunité de vous débarrasser [Root.PlotTarget.Get_du_TitledName] est sur le point de se présenter. Une sorcière vagabonde prétend pouvoir fabriquer des friandises empoisonnées que nous pourrions offrir à notre cible. Comment devons-nous procéder, M[Root.GetOnA][Root.GetLordLady] ?;M[Root.Geteineine] [Root.GetLordLady], es hat sich für Euren Plan, [Root.PlotTarget.GetTitledName] loszuwerden, eine Möglichkeit ergeben. Eine Wanderhexe behauptet, sie könne vergiftete Pralinen herstellen, die man als Geschenk einschmuggeln könnte. Wie sollen wir verfahren?;;Mi [Root.GetLordLady], en su complot ha surgido la oportunidad de acabar con [Root.PlotTarget.GetTitledName]. Una bruja viajera asegura que nos puede conseguir unos dulces envenenados que se podrían entrar de contrabando como si fuesen un obsequio. ¿Cómo vamos a proceder, mi [Root.GetLordLady]?;;;;;;;;;x
EVTDESC_CM_6351;It seems as though [From.GetTitledName] has found an opportunity to hire a witch who makes poisoned candies. This presents us with a chance to kill [From.PlotTarget.GetTitledName].;Il semble que [From.Get_le_TitledName] a eu l'opportunité d'engager une sorcière capable de fabriquer des friandises empoisonnées, que nous pourrions offrir [From.PlotTarget.Get_au_TitledName].;Es scheint, dass [From.GetTitledName] eine Hexe aufgetan hat, die vergiftete Pralinen herstellen kann. Das gibt uns die Chance, [From.PlotTarget.GetTitledName] zu töten.;;Parece que [From.GetTitledName] ha encontrado la oportunidad de contratar a una bruja que hace dulces envenenados. Esto nos brinda la oportunidad de matar a [From.PlotTarget.GetTitledName].;;;;;;;;;x
EVTDESC_CM_6353;It's boring to sit here, hidden away. You hardly get out at all, there is no room to run and play and hardly anyone comes to see you. Well, at least people send you gifts to cheer you up. These candies are really nice, though they do have a strange bitter aftertaste... very bitter...;Comme c'est ennuyeux de rester en permanence dans cette cachette ! Vous ne sortez quasiment jamais, il n'y a pas la place pour courir ou jouer et vous ne recevez quasiment pas de visite. Mais aujourd'hui, quelqu'un vous a envoyé un présent pour vous remonter le moral ! Ces bonbons sont délicieux, malgré un arrière-goût assez amer... Très amer...;Es ist langweilig, die ganze Zeit hier im Versteck zu hocken. Ihr kommt kaum raus, es gibt keinen Platz zum Rennen und Spielen und kaum jemand kommt Euch besuchen. Aber wenigstens schickt man Euch Geschenke, um Euch aufzuheitern. Diese Pralinen sind wirklich hübsch, obwohl sie einen eigenartigen Nachgeschmack haben ... sehr bitter ...;;Estar aquí escondido resulta muy aburrido. A penas puedes salir, no hay espacio para correr ni distraerse y prácticamente nadie viene a visitarte. Bueno, por lo menos te mandan regalos para animarte. Estos dulces son realmente buenos, aunque dejan un extraño regusto amargo... muy amargo...;;;;;;;;;x
EVTDESC_CM_6354;News reach you that the plot to murder [From.GetTitledName] has met with success. Apparently, [From.GetTitledName] ate the poisoned candies that the witch sent to [From.GetHerHim]. The plotters behind it have not been revealed.;On vous apprend que le complot pour tuer [From.Get_le_TitledName] a été un franc succès. Apparemment, [From.Get_le_TitledName] a mangé des friandises empoisonnées que la sorcière lui a envoyées. L'identité des conspirateurs demeure inconnue.;Euch erreicht die Nachricht, dass Euer Plan, [From.GetTitledName] zu ermorden, erfolgreich war. Offenbar hat [From.GetTitledName] die vergifteten Pralinen gegessen, die die Hexe [From.Getihmihr] geschickt hat. Die Auftraggeber des Mordes sind unbekannt.;;Te llegan noticias de que el complot para matar a [From.GetTitledName] ha resultado exitoso. Al parecer, [From.GetTitledName] comió los dulces que la bruja [From.GetHerHim] envió. No se han revelado los nombres de los conspiradores. ;;;;;;;;;x
EVTDESC_CM_6356;News reach you that the plot to murder [From.GetTitledName] has met with success. Apparently, [From.GetTitledName] ate the poisoned candies that the witch sent to [From.GetHerHim]. Unfortunately, the snake charmer was caught and revealed who ordered the murder.;On vous apprend que le complot pour tuer [From.Get_le_TitledName] a été un franc succès. Apparemment, [From.GetIlElle] a mangé des friandises empoisonnées que la sorcière lui a envoyées. Malheureusement, la sorcière a été arrêtée et a dévoilé l'identité du commanditaire.;Euch erreicht die Nachricht, dass Euer Plan, [From.GetTitledName] zu ermorden, erfolgreich war. Offenbar hat [From.GetTitledName] die vergifteten Pralinen gegessen, die die Hexe [From.Getihmihr] geschickt hat. Bedauerlicherweise aber wurde die Hexe gefangen genommen und hat den Auftraggeber des Mordes genannt.;;Te llegan noticias de que el complot para matar a [From.GetTitledName] ha resultado exitoso. Al parecer, [From.GetTitledName] comió los dulces que la bruja [From.GetHerHim] envió. Desafortunadamente, arrestaron a la bruja y ésta reveló quién había dado la orden de matar.;;;;;;;;;x
EVTDESC_CM_6357;It's boring to sit here, hidden away. You hardly get out at all, there is no room to run and play and hardly anyone comes to see you. Well, at least people send you gifts to cheer you up. These candies look really nice, but they smell funny. Hmm, the cat can have them. Here kitty...;Comme c'est ennuyeux de rester en permanence dans cette cachette ! Vous ne sortez quasiment jamais, il n'y a pas la place pour courir ou jouer et vous ne recevez quasiment pas de visite. Mais aujourd'hui, quelqu'un vous a envoyé un présent pour vous remonter le moral ! Ces bonbons sont très jolis avec toutes leurs couleurs, mais leur odeur est étrange. Ceux-là seront pour le chat. Tiens, minouche...;Es ist langweilig, die ganze Zeit hier im Versteck zu hocken. Ihr kommt kaum raus, es gibt keinen Platz zum Rennen und Spielen und kaum jemand kommt Euch besuchen. Aber wenigstens schickt man Euch Geschenke, um Euch aufzuheitern. Diese Pralinen sehen hübsch aus, doch sie riechen komisch. Ich gebe sie der Katze. Hier, Mieze ...;;Estar aquí escondido resulta muy aburrido. A penas puedes salir, no hay espacio para correr ni distraerse y prácticamente nadie viene a visitarte. Bueno, por lo menos te mandan regalos para animarte. Estos dulces tienen muy buena pinta pero desprenden un olor extraño Mmm... se los podría dar al gato. Toma, ven aquí minino...;;;;;;;;;x
EVTDESC_CM_6358;It seems the poisoned candies failed to kill [From.GetTitledName]. The instigators of the plot were not revealed, however.;Les friandises empoisonnées n'ont pas suffi à tuer [From.Get_le_TitledName]. L'identité des instigateurs du complot demeure inconnue, toutefois.;Es scheint, dass der Anschlag auf [From.GetTitledName] mit den vergifteten Pralinen fehlgeschlagen ist. Die Auftraggeber des Anschlags aber bleiben unbekannt.;;Parece que los dulces envenenados no han matado a [From.GetTitledName]. De todos modos, los instigadores del complot no han sido revelados.;;;;;;;;;x
EVTDESC_CM_63099;It seems the assassin's knife failed to find [From.GetTitledName]. To make things worse, the assassin was caught and revealed who ordered the murder.;Il semble que [From.Get_le_TitledName] a échappé à la lame de l'assassin. Et pour ne rien arranger, le tueur a été arrêté et a dévoilé le nom des conspirateurs.;Es scheint, dass die Klinge des Mörders [From.GetTitledName] verfehlt hat. Schlimmer noch, der Mörder wurde gefasst und hat seinen Auftraggeber verraten.;;Parece que el asesino del cuchillo no ha conseguido encontrar a [From.GetTitledName]. Y para empeorar las cosas, el asesino ha sido capturado y ha revelado quien ordenó el asesinato.;;;;;;;;;x
EVTDESC_CM_63199;It seems the plan to poison [From.GetTitledName] failed. To make things worse, the cook was caught and revealed who ordered the murder.;Le plan visant à empoisonner [From.Get_le_TitledName] a échoué. Et pour ne rien arranger, le cuisinier a été arrêté et a dévoilé le nom des conspirateurs.;Es scheint, dass der Plan, [From.GetTitledName] zu vergiften, fehlgeschlagen ist. Schlimmer noch, der Koch wurde gefasst und hat seinen Auftraggeber verraten.;;Parece que el plan para envenenar a [From.GetTitledName] ha fracasado. Para empeorar las cosas, cogieron al cocinero y éste reveló quién había ordenado el envenenamiento.;;;;;;;;;x
EVTDESC_CM_63299;It seems the guard we bribed failed to kill [From.GetTitledName]. To make things worse, he was caught and revealed who ordered the murder.;Il semble que le garde que nous avons soudoyé n'a pas réussi à tuer [From.Get_le_TitledName]. Et pour ne rien arranger, le garde a été arrêté et a dévoilé le nom des conspirateurs.;Es scheint, dass der von uns bestochene Wachsoldat [From.GetTitledName] nicht töten konnte. Schlimmer noch: Er wurde gefasst und hat den Auftraggeber des Anschlags genannt.;;Parece que el guardia que sobornamos no ha logrado matar a [From.GetTitledName]. Para empeorar las cosas, lo atraparon y reveló quién había ordenado el asesinato.;;;;;;;;;x
EVTDESC_CM_63399;It seems the snake charmer failed to kill [From.GetTitledName]. To make things worse, he was caught and revealed who ordered the murder.;Il semble que le charmeur de serpent n'a pas réussi à tuer [From.Get_le_TitledName]. Et pour ne rien arranger, il a été arrêté et a dévoilé le nom des conspirateurs.;Es scheint, dass der Schlangenbeschwörer es nicht geschafft hat, [From.GetTitledName] zu töten. Schlimmer noch: Er wurde gefasst und hat den Auftraggeber des Anschlags genannt.;;Parece que el encantador de serpientes no ha logrado matar a [From.GetTitledName]. Para empeorar las cosas, lo atraparon y reveló quién había ordenado el asesinato.;;;;;;;;;x
EVTDESC_CM_63499;It seems the chamber maid failed to kill [From.GetTitledName]. To make things worse, he was caught and revealed who ordered the murder.;Il semble que la femme de chambre n'a pas réussi à tuer [From.Get_le_TitledName]. Et pour ne rien arranger, elle a été arrêtée et a dévoilé le nom des conspirateurs.;Es scheint, dass die Kammerzofe es nicht geschafft hat, [From.GetTitledName] zu töten. Schlimmer noch, sie wurde gefasst und hat den Auftraggeber des Anschlags genannt.;;Parece que la doncella no ha logrado matar a [From.GetTitledName]. Para empeorar las cosas, la atraparon y reveló quién había ordenado el asesinato.;;;;;;;;;x
EVTDESC_CM_63599;It seems the poisoned candies failed to kill [From.GetTitledName]. To make things worse, the witch was caught and revealed who ordered the murder.;Les friandises empoisonnées n'ont pas suffi à tuer [From.Get_le_TitledName]. Et pour ne rien arranger, la sorcière a été arrêtée et a dévoilé le nom des conspirateurs.;Es scheint, dass der Anschlag auf [From.GetTitledName] mit den vergifteten Pralinen fehlgeschlagen ist. Schlimmer noch: Die Hexe wurde gefasst und hat den Auftraggeber des Anschlags genannt.;;Parece que los dulces envenenados no han matado a [From.GetTitledName]. Para empeorar las cosas, atraparon a la bruja y ésta reveló quién había dado la orden de matar.;;;;;;;;;x
EVTDESCCM15000;You've been thrown into a pit dug out in the middle of the desert. The guards explain to you that you are to be judged by Zun the Justice-Giver. If you are guilty, the Sun will punish you for your crimes.;Vous avez été jeté dans un trou creusé en plein milieu du désert. Les gardes vous expliquent que vous allez subir le jugement de Zun, le Justicier. Si vous êtes coupable, le Soleil vous punira pour vos crimes.;Man hat Euch in eine Grube mitten in der Wüste geworfen. Die Wachen erklären Euch, dass Ihr von Zun, dem Geber der Gerechtigkeit, gerichtet werden sollt. Wenn Ihr schuldig seid, wird die Sonne Euch für Eure Verbrechen bestrafen.;;Te han lanzado en un hoyo cavado en medio del desierto. Los guardias te cuentan que serás juzgado por Zun, el que Imparte Justicia. Si eres culpable, el Sol te castigará por tus crímenes.;;;;;;;;;x
EVTDESCCM15002;The guards visited me today, they merely tossed down a rope I hope I have the strength to climb.;Les gardes sont venus me voir aujourd'hui. Ils n'ont fait que me lancer une corde. J'espère que j'aurai la force de remonter.;Die Wachen besuchten mich heute und warfen mir einfach ein Seil zu. Ich hoffe, ich habe noch die Kraft zu klettern.;;Hoy los guardias han venido a verme, se han limitado a tirarme una cuerda. Espero tener la fuerza para poder subir.;;;;;;;;;x
EVTDESCCM15004;The rays from the sun dig into my skin, it cracks and bleeds and I feel myself slipping away almost as if floating out of this pit.;Les rayons du soleil transpercent ma peau, elle craque et saigne, je me sens partir, j'ai l'impression que je commence à sortir de ce puits en flottant dans l'air.;Die Strahlen der Sonne dringen in meine Haut ein, sie reißt und blutet und ich spüre, wie ich dahinschwinde, fast als ob ich aus dieser Grube entschweben würde.;;The rays from the sun dig into my skin, it cracks and bleeds and I feel myself slipping away almost as if floating out of this pit.;;;;;;;;;x
EVTDESCCM15005;Who's there, who are you? I can hear you but can't touch you? P-Please help me I can hear you just outside the pit please i'm begging you.!;Qui est là ? Qui êtes-vous ? Je vous entends mais je ne peux pas vous toucher ! Je vous en prie, aidez-moi à sortir de ce puits, je vous en supplie !;Wer ist da, wer seid Ihr? Ich kann Euch hören, aber nicht ertasten. B-Bitte helft mir. Ich höre Euch doch. Ihr seid draußen, vor der Grube! Bitte! Ich flehe Euch an!;;¿Quién está ahí? ¿Quién eres?¿Puedo oírte pero no te puedo tocar? P-Por favor ayúdeme, puedo oírte justo fuera del pozo. ¡Por favor, te lo suplico!;;;;;;;;;x
EVTDESCCM15006;As I lie in the pit hoping for salvation yet another day I realize that none will come. Has I been forsaken? No that can't be it! I must keep believing, its the only thing I have left.;Couché dans ce puits à espérer qu'on me vienne en aide, je comprends soudain que personne ne viendra. Ai-je été abandonné ? Non ! C'est impossible ! Je dois continuer à croire. C'est tout ce qu'il me reste.;Nach einem weiteren Tag in der Grube wird mir klar, dass niemand kommen wird. Hat man mich im Stich gelassen? Nein, das kann nicht sein! Ich darf den Glauben nicht aufgeben. Er ist das Einzige, was mir noch bleibt.;;Mientras yazgo en el pozo esperando la salvación durante otro día, me doy cuenta que no vendrá nadie. ¿Me han abandonado? ¡No, esto no puede ser! Necesito tener esperanza, es lo único que me queda.;;;;;;;;;x
