EVTTITLE_WoL_5001;The White [Root.GetHuntingQuarryCap];[Root.GetHuntingQuarryCap] blanc;Der Weiße [Root.GetHuntingQuarryCap];;El [Root.GetHuntingQuarry] blanco;;;;;;;;;x
# EVTDESC_WoL_5007_tiger;On the hunt, you get separated from your party in the wilderness. As you are roaming around and trying to find your bearings, you glimpse something strange in the distance... you ride closer and see a fearsome great white tiger! As you cautiously approach, it sees you and runs away. You try to follow but are unable to catch up in the difficult terrain.\n\nAs you get back to your party, you find you can't stop thinking about this strange animal.;Pendant la chasse, vous perdez votre groupe de vue et vous vous retrouvez seul dans la nature. Alors que vous essayez de vous repérer, vous entrevoyez quelque chose d'étrange au loin... Vous chevauchez dans sa direction et découvrez un terrifiant tigre blanc ! Vous vous approchez doucement, mais la bête vous aperçoit et s'enfuit. Vous tentez de la suivre mais le terrain accidenté vous empêche de la rattraper.\n\nVous rejoignez votre groupe de chasse sans parvenir à chasser l'étrange animal de votre mémoire.;Auf der Jagd werdet Ihr in der Wildnis von Eurer Jagdgesellschaft getrennt. Beim Versuch, die Gruppe wiederzufinden, erblickt Ihr in der Ferne etwas Seltsames... Es scheint sich um einen majestätischen weißen Tiger zu handeln! Doch dann, beim Versuch sich ihm zu nähern, wird er auf Euch aufmerksam und ergreift die Flucht. Ihr versucht, ihn zu verfolgen, könnt ihn aber aufgrund des schwierigen Geländes nicht einholen.\n\nWährend Ihr zur Jagdgesellschaft zurückkehrt, müsst Ihr ständig an dieses seltsame Tier denken.;;Durante la caza, te separas de tus compañeros en el páramo. Mientras das vueltas y tratas de encontrar tu rumbo, vislumbras a algo extraño en la distancia… ¡Cabalgas cerca y ves un tremendo tigre blanco! Como te lo acercas cautelosamente, te ve y se escapa. Tratas de seguirlo pero eres incapaz de alcanzarlo en este terreno difícil.\n\nCuando vuelvas con los tuyos, descubres que no puedes dejar de pensar en este extraño animal.;;;;;;;;;x
# EVTDESC_WoL_5010_bear;You have gathered your followers and your hunting dogs, you have saddled your horse and prepared your weapons. You are ready to set out to hunt the great white bear.;Vous avez rassemblé votre suite et vos chiens de chasse, fait seller vos chevaux et préparer vos armes. Vous êtes maintenant prêt à chasser le grand ours blanc.;Ihr habt Eure Getreuen und Eure Jagdhunde versammelt, das Pferd gesattelt und die Waffen vorbereitet. Nun seid Ihr bereit, die Jagd auf den weißen Bären zu beginnen.;;Has reunido a los tuyos, tus perros de caza, ensillado tu caballo y preparado tus armas. Estás list[Root.GetOA] para cazar al gran oso blanco. ;;;;;;;;;x
# EVTDESC_WoL_5010_lion;You have gathered your followers and your hunting dogs, you have saddled your horse and prepared your weapons. You are ready to set out to hunt the great white lion.;Vous avez rassemblé votre suite et vos chiens de chasse, fait seller vos chevaux et préparer vos armes. Vous êtes maintenant prêt à chasser le grand lion blanc.;Ihr habt Eure Getreuen und Eure Jagdhunde versammelt, das Pferd gesattelt und die Waffen vorbereitet. Nun seid Ihr bereit, die Jagd auf den weißen Löwen zu beginnen.;;Has reunido a los tuyos, tus perros de caza, ensillado tu caballo y preparado tus armas. Estás list[Root.GetOA] para cazar al gran león blanco. ;;;;;;;;;x
# EVTDESC_WoL_5010_stag;You have gathered your followers and your hunting dogs, you have saddled your horse and prepared your weapons. You are ready to set out to hunt the great white stag.;Vous avez rassemblé votre suite et vos chiens de chasse, fait seller vos chevaux et préparer vos armes. Vous êtes maintenant prêt à chasser le grand cerf blanc.;Ihr habt Eure Getreuen und Eure Jagdhunde versammelt, das Pferd gesattelt und die Waffen vorbereitet. Nun seid Ihr bereit, die Jagd auf den weißen Hirsch zu beginnen.;;Has reunido a los tuyos, tus perros de caza, ensillado tu caballo y preparado tus armas. Estás list[Root.GetOA] para cazar al gran ciervo blanco. ;;;;;;;;;x
# EVTDESC_WoL_5010_tiger;You have gathered your followers and your hunting dogs, you have saddled your horse and prepared your weapons. You are ready to set out to hunt the great white tiger.;Vous avez rassemblé votre suite et vos chiens de chasse, fait seller vos chevaux et préparer vos armes. Vous êtes maintenant prêt à chasser le grand tigre blanc.;Ihr habt Eure Getreuen und Eure Jagdhunde versammelt, das Pferd gesattelt und die Waffen vorbereitet. Nun seid Ihr bereit, die Jagd auf den weißen Tiger zu beginnen.;;Has reunido a los tuyos, tus perros de caza, ensillado tu caballo y preparado tus armas. Estás list[Root.GetOA] para cazar al gran tigre blanco. ;;;;;;;;;x
# EVTDESC_WoL_5030_bear;After many days of hard hunting and tracking, you have finally managed to trap the white bear in a cul-de-sac between two rocks. The great animal is at your mercy - it looks at you with intelligent eyes, and you are suddenly struck by its great beauty...;Après plusieurs jours de rude traque, vous parvenez à acculer l'ours blanc entre deux rochers. Le bel animal est à votre merci. Il vous regarde de ses yeux intelligents et, soudain, sa grande beauté vous frappe.;Jagd und Aufspüren des Tieres erweisen sich als schwierig und langwierig. Doch nach zwei Tagen schafft Ihr es schließlich, den weißen Bären in einer Sackgasse zwischen zwei Felsen in die Enge zu treiben. Das große Tier ist Euch ausgeliefert und es sieht Euch mit klugen Augen an. Plötzlich werdet Ihr seiner enormen Schönheit gewahr...;;Después de muchos días de difícil caza y rastreo, por fin, has logrado atrapar al oso blanco en un callejón sin salida entre dos rocas. El gran animal está a tu merced... Te mira con ojos inteligentes y de repente te sientes impresionado por su gran belleza... ;;;;;;;;;x
# EVTDESC_WoL_5030_lion;After many days of hard hunting and tracking, you have finally managed to trap the white lion in a cul-de-sac between two rocks. The great animal is at your mercy - it looks at you with intelligent eyes, and you are suddenly struck by its great beauty...;Après plusieurs jours de rude traque, vous parvenez à acculer le lion blanc entre deux rochers. Le bel animal est à votre merci. Il vous regarde de ses yeux intelligents et, soudain, sa grande beauté vous frappe.;Jagd und Aufspüren des Tieres erweisen sich als schwierig und langwierig. Doch nach zwei Tagen schafft Ihr es schließlich, den weißen Löwen in einer Sackgasse zwischen zwei Felsen in die Enge zu treiben. Das große Tier ist Euch ausgeliefert und es sieht Euch mit klugen Augen an. Plötzlich werdet Ihr seiner enormen Schönheit gewahr...;;Después de muchos días de difícil caza y rastreo, por fin, has logrado atrapar al león blanco en un callejón sin salida entre dos rocas. El gran animal está a tu merced... Te mira con ojos inteligentes y de repente te sientes impresionado por su gran belleza... ;;;;;;;;;x
# EVTDESC_WoL_5030_stag;After many days of hard hunting and tracking, you have finally managed to trap the white stag in a cul-de-sac between two rocks. The great animal is at your mercy - it looks at you with intelligent eyes, and you are suddenly struck by its great beauty...;Après plusieurs jours de rude traque, vous parvenez à acculer le cerf blanc entre deux rochers. Le bel animal est à votre merci. Il vous regarde de ses yeux intelligents et, soudain, sa grande beauté vous frappe.;Jagd und Aufspüren des Tieres erweisen sich als schwierig und langwierig. Doch nach zwei Tagen schafft Ihr es schließlich, den weißen Hirsch in einer Sackgasse zwischen zwei Felsen in die Enge zu treiben. Das große Tier ist Euch ausgeliefert und es sieht Euch mit klugen Augen an. Plötzlich werdet Ihr seiner enormen Schönheit gewahr...;;Después de muchos días de difícil caza y rastreo, por fin, has logrado atrapar al ciervo blanco en un callejón sin salida entre dos rocas. El gran animal está a tu merced -te mira con ojos inteligentes , y estás de repente golpeado por su gran belleza... ;;;;;;;;;x
# EVTDESC_WoL_5030_tiger;After many days of hard hunting and tracking, you have finally managed to trap the white tiger in a cul-de-sac between two rocks. The great animal is at your mercy - it looks at you with intelligent eyes, and you are suddenly struck by its great beauty...;Après plusieurs jours de rude traque, vous parvenez à acculer le tigre blanc entre deux rochers. Le bel animal est à votre merci. Il vous regarde de ses yeux intelligents et, soudain, sa grande beauté vous frappe.;Jagd und Aufspüren des Tieres erweisen sich als schwierig und langwierig. Doch nach zwei Tagen schafft Ihr es schließlich, den weißen Tiger in einer Sackgasse zwischen zwei Felsen in die Enge zu treiben. Das große Tier ist Euch ausgeliefert und es sieht Euch mit klugen Augen an. Plötzlich werdet Ihr seiner enormen Schönheit gewahr...;;Después de muchos días de difícil caza y rastreo, por fin, has logrado atrapar al tigre blanco en un callejón sin salida entre dos rocas. El gran animal está a tu merced... Te mira con ojos inteligentes y de repente te sientes impresionado por su gran belleza... ;;;;;;;;;x
# EVTDESC_WoL_5035_bear;During your hunt, you come to a deep gorge. Right on the other side is the white bear, staring at you! You are so close, yet cannot reach it. As it runs away, you realize that you must return home without a victory this time.;Au cours de la chasse, vous atteignez une profonde gorge. De l'autre côté de la faille, c'est l'ours blanc qui vous regarde ! Vous en êtes si proche et si loin à la fois... Il s'enfuit soudain et vous comprenez qu'une fois de plus, vous rentrerez bredouille.;Während der Jagd gelangt Ihr an eine tiefe Schlucht. Genau auf der anderen Seite befindet sich der weiße Bär und starrt Euch an! Ihr seid ihm so nah und doch könnt Ihr ihn nicht erreichen. Als er wegläuft, wird Euch klar, dass Ihr dieses Mal keinen Sieg davontragen werdet.;;Durante la caza, llegas a un profundo barranco. ¡Justo al otro lado está el oso blanco, mirándote fijamente! Estás tan cerca, mas no puedes alcanzarlo. Al escaparse, te das cuenta que esta vez deberás volver a casa sin una victoria.;;;;;;;;;x
# EVTDESC_WoL_5035_lion;During your hunt, you come to a deep gorge. Right on the other side is the white lion, staring at you! You are so close, yet cannot reach it. As it runs away, you realize that you must return home without a victory this time.;Au cours de la chasse, vous atteignez une profonde gorge. De l'autre côté de la faille, c'est le lion blanc qui vous regarde ! Vous en êtes si proche et si loin à la fois... Il s'enfuit soudain et vous comprenez qu'une fois de plus, vous rentrerez bredouille.;Während der Jagd gelangt Ihr an eine tiefe Schlucht. Genau auf der anderen Seite befindet sich der weiße Löwe und starrt Euch an! Ihr seid ihm so nah und doch könnt Ihr ihn nicht erreichen. Als er wegläuft, wird Euch klar, dass Ihr dieses Mal keinen Sieg davontragen werdet.;;Durante la caza, llegas a un profundo barranco. ¡Justo al otro lado está el león blanco, mirándote fijamente! Estás tan cerca, mas no puedes alcanzarlo. Al escaparse, te das cuenta que esta vez deberás volver a casa sin una victoria.;;;;;;;;;x
# EVTDESC_WoL_5035_stag;During your hunt, you come to a deep gorge. Right on the other side is the white stag, staring at you! You are so close, yet cannot reach it. As it runs away, you realize that you must return home without a victory this time.;Au cours de la chasse, vous atteignez une profonde gorge. De l'autre côté de la faille, c'est le cerf blanc qui vous regarde ! Vous en êtes si proche et si loin à la fois... Il s'enfuit soudain et vous comprenez qu'une fois de plus, vous rentrerez bredouille.;Während der Jagd gelangt Ihr an eine tiefe Schlucht. Genau auf der anderen Seite befindet sich der weiße Hirsch und starrt Euch an! Ihr seid ihm so nah und doch könnt Ihr ihn nicht erreichen. Als er wegläuft, wird Euch klar, dass Ihr dieses Mal keinen Sieg davontragen werdet.;;Durante la caza, llegas a un profundo barranco. ¡Justo al otro lado está el ciervo blanco, mirándote fijamente! Estás tan cerca, mas no puedes alcanzarlo. Al escaparse, te das cuenta que esta vez deberás volver a casa sin una victoria.;;;;;;;;;x
# EVTDESC_WoL_5035_tiger;During your hunt, you come to a deep gorge. Right on the other side is the white tiger, staring at you! You are so close, yet cannot reach it. As it runs away, you realize that you must return home without a victory this time.;Au cours de la chasse, vous atteignez une profonde gorge. De l'autre côté de la faille, c'est le tigre blanc qui vous regarde ! Vous en êtes si proche et si loin à la fois... Il s'enfuit soudain et vous comprenez qu'une fois de plus, vous rentrerez bredouille.;Während der Jagd gelangt Ihr an eine tiefe Schlucht. Genau auf der anderen Seite befindet sich der weiße Tiger und starrt Euch an! Ihr seid ihm so nah und doch könnt Ihr ihn nicht erreichen. Als er wegläuft, wird Euch klar, dass Ihr dieses Mal keinen Sieg davontragen werdet.;;Durante la caza, llegas a un profundo barranco. ¡Justo al otro lado está el tigre blanco, mirándote fijamente! Estás tan cerca, mas no puedes alcanzarlo. Al escaparse, te das cuenta que esta vez deberás volver a casa sin una victoria.;;;;;;;;;x
#EVTOPTA_WoL_5221;Faithful, catch!;Fidèle, va chercher !;Getreuer, fang!;;¡Fiel, captura!;;;;;;;;;x
#EVTOPTB_WoL_5221;Hunter, catch!;Chasseur, va chercher !;Jäger, fang!;;¡Cazador, atrapa!;;;;;;;;;x
#EVTOPTC_WoL_5221;Tricky, catch!;Farceur, va chercher !;Trickser, fang!;;¡Tramposo, atrapa!;;;;;;;;;x
#EVTOPTC_WoL_5290;A pyramid for Faithful!;Une pyramide pour Fidèle !;Eine Pyramide für Getreuer!;;Una pirámide para Fiel.;;;;;;;;;x
#EVTOPTD_WoL_5221;Lucifer, catch!;Lucifer, va chercher !;Luzifer, fang!;;¡Lucifer, atrapa!;;;;;;;;;x
#EVTOPTD_WoL_5290;A pyramid for Hunter!;Une pyramide pour Chasseur !;Eine Pyramide für Jäger!;;Una pirámide para Cazador.;;;;;;;;;x
#EVTOPTE_WoL_5221;Shaytan, catch!;Shaytan, va chercher !;Shaytan, fang!;;¡Shaytan, atrapa!;;;;;;;;;x
#EVTOPTE_WoL_5290;A pyramid for Tricky!;Une pyramide pour Farceur !;Eine Pyramide für Trickser!;;Una pirámide para Tramposo.;;;;;;;;;x
#EVTOPTF_WoL_5221;Fenrir, catch!;Fenrir, va chercher !;Fenrir, fang!;;¡Fenrir, atrapa!;;;;;;;;;x
#EVTOPTF_WoL_5290;A pyramid for Lucifer!;Une pyramide pour Lucifer !;Eine Pyramide für Luzifer!;;Una pirámide para Lucifer.;;;;;;;;;x
#EVTOPTG_WoL_5221;Erlik, catch!;Erlik, va chercher !;Erlik, fang!;;¡Erlik, atrapa!;;;;;;;;;x
#EVTOPTG_WoL_5290;A pyramid for Shaytan!;Une pyramide pour Shaytan !;Eine Pyramide für Shaytan!;;Una pirámide para Shaytan;;;;;;;;;x
#EVTOPTH_WoL_5221;Velnias, catch!;Velnias, va chercher !;Velnias, fang!;;¡Velnias, atrapa!;;;;;;;;;x
#EVTOPTH_WoL_5290;A pyramid for Fenrir!;Une pyramide pour Fenrir !;Eine Pyramide für Fenrir!;;Una pirámide para Fenrir.;;;;;;;;;x
#EVTOPTI_WoL_5221;Tuoni, catch!;Tuoni, va chercher !;Tuoni, fang!;;¡Tuoni, atrapa!;;;;;;;;;x
#EVTOPTI_WoL_5290;A pyramid for Erlik!;Une pyramide pour Elrik !;Eine Pyramide für Erlik!;;Una pirámide para Erlik.;;;;;;;;;x
#EVTOPTJ_WoL_5221;Xolotl, catch!;Xolotl, va chercher !;Xolotl, fang!;;¡Xolotl, atrapa!;;;;;;;;;x
#EVTOPTJ_WoL_5290;A pyramid for Velnias!;Une pyramide pour Velnias !;Eine Pyramide für Velnias!;;Una pirámide para Velnias.;;;;;;;;;x
#EVTOPTK_WoL_5221;Veles, catch!;Vélès, va chercher !;Veles, fang!;;¡Veles, atrapa!;;;;;;;;;x
#EVTOPTK_WoL_5290;A pyramid for Tuoni!;Une pyramide pour Turoni !;Eine Pyramide für Tuoni!;;Una pirámide para Tuoni.;;;;;;;;;x
#EVTOPTL_WoL_5221;Guruhi, catch!;Guruhi, va chercher !;Guruhi, fang!;;¡Guruhi, atrapa!;;;;;;;;;x
#EVTOPTL_WoL_5290;A pyramid for Xolotl!;Une pyramide pour Xolotl !;Eine Pyramide für Xolotl!;;Una pirámide para Xolotl.;;;;;;;;;x
#EVTOPTM_WoL_5221;Darkness, catch!;Ténèbres, va chercher !;Dunkelheit, fang!;;¡Oscuridad, atrapa!;;;;;;;;;x
#EVTOPTM_WoL_5290;A pyramid for Veles!;Une pyramide pour Vélès !;Eine Pyramide für Veles!;;Una pirámide para Veles.;;;;;;;;;x
#EVTOPTN_WoL_5221;Ahriman, catch!;Ahriman, va chercher !;Ahriman, fang!;;¡Ahriman, atrapa!;;;;;;;;;x
#EVTOPTN_WoL_5290;A pyramid for Guruhi!;Une pyramide pour Guruhi !;Eine Pyramide für Guruhi!;;Una pirámide para Guruhi.;;;;;;;;;x
#EVTOPTO_WoL_5221;Satan, catch!;Satan, va chercher !;Satan, fang!;;¡Satán, atrapa!;;;;;;;;;x
#EVTOPTO_WoL_5290;A pyramid for Darkness!;Une pyramide pour Ténèbres !;Eine Pyramide für Dunkelheit!;;Una pirámide para Oscuridad.;;;;;;;;;x
#EVTOPTP_WoL_5221;Vinayaka, catch!;Vinayaka, va chercher !;Vinayaka, fang!;;¡Vinayaka, atrapa!;;;;;;;;;x
#EVTOPTP_WoL_5290;A pyramid for Ahriman!;Une pyramide pour Ahriman !;Eine Pyramide für Ahriman!;;Una pirámide para Ahriman.;;;;;;;;;x
#EVTOPTQ_WoL_5221;Mara, catch!;Mara, va chercher !;Mara, fang!;;¡Mara, atrapa!;;;;;;;;;x
#EVTOPTQ_WoL_5290;A pyramid for Satan!;Une pyramide pour Satan !;Eine Pyramide für Satan!;;Una pirámide para Satán.;;;;;;;;;x
#EVTOPTR_WoL_5221;Punisher, catch!;Vengeur, va chercher !;Vollstrecker, fang!;;¡Castigador, atrapa!;;;;;;;;;x
#EVTOPTR_WoL_5290;A pyramid for Vinayaka!;Une pyramide pour Vinayaka !;Eine Pyramide für Vinayaka!;;Una pirámide para Vinayaka.;;;;;;;;;x
#EVTOPTS_WoL_5290;A pyramid for Mara!;Une pyramide pour Mara !;Eine Pyramide für Mara!;;Una pirámide para Mara.;;;;;;;;;x
#EVTOPTT_WoL_5290;A pyramid for Punisher!;Une pyramide pour Vengeur !;Eine Pyramide für Vollstrecker!;;Una pirámide para Castigador.;;;;;;;;;x
