EVTTITLE_WoL_5001;The White [Root.GetHuntingQuarryCap];[Root.GetHuntingQuarryCap] blanc;Der Weiße [Root.GetHuntingQuarryCap];;El [Root.GetHuntingQuarry] blanco;;;;;;;;;x

EVTDESC_WoL_5001;Lately, you have heard persistent rumors from peasants and travellers in the wilds that a strange, mythical beast has been sighted in your realm. It's a white [Root.GetHuntingQuarry], powerful and elusive. The common folk claim it comes from another world and that the hunter who claims it will be imbued with divine power.;Ces derniers temps, les paysans et les voyageurs font courir le bruit qu'une bête mythique a été aperçue dans vos terres. C'est un [Root.GetHuntingQuarry] blanc, puissant et insaisissable. Le peuple dit que cette créature vient d'un autre monde et que le chasseur qui abattra l'animal recevra un pouvoir divin.;Seit Kurzem verbreitet sich unter Bauern und Reisenden das Gerücht, dass ein seltsames, mythisches Tier in Eurem Reich gesichtet wurde. Es handelt sich um einen weißen [Root.GetHuntingQuarryAkk], mächtig und scheu. Das gemeine Volk behauptet, er stamme aus einer anderen Welt und wer ihn erlegte, der werde von göttlicher Macht erfüllt.;;Últimamente, has escuchado rumores persistentes de campesinos y viajeros de las regiones desoladas que se ha visto una bestia extraña, mítica en tu reino. Se trata de un [Root.GetHuntingQuarry] blanco, poderoso y evasivo. El pueblo llano afirmar que proviene de otro mundo y que el cazador que lo reclame se imbuirá de poder divino.;;;;;;;;;x
EVTDESC_WoL_5004;Good news, my [Root.GetLordLady]! We have received credible reports of a recent sighting of the great white [Root.GetHuntingQuarry] in the county of [target_province.GetName].;Bonne nouvelle, M[Root.GetOnA][Root.GetLordLady] ! Des personnes dignes de confiance disent avoir récemment croisé le grand [Root.GetHuntingQuarry] blanc dans le comté de [target_province.GetName].;Gute Nachrichten, oh [Root.GetLordLady]! Wir haben glaubwürdige Berichte erhalten, dass ein großer weißer [Root.GetHuntingQuarry] vor kurzem in der Provinz [target_province.GetName] gesichtet wurde.;;Buenas noticias, mi [Root.GetLordLady]! Hemos recibido informes creíbles de un avistamiento reciente del gran [Root.GetHuntingQuarry] blanco en la provincia de [target_province.GetName].;;;;;;;;;x
EVTDESC_WoL_5007_fearsome;On the hunt, you get separated from your party in the wilderness. As you are roaming around and trying to find your bearings, you glimpse something strange in the distance... you ride closer and see a fearsome great white [Root.GetHuntingQuarry]! As you cautiously approach, it sees you and runs away. You try to follow but are unable to catch up in the difficult terrain.\n\nAs you get back to your party, you find you can't stop thinking about this strange animal.;Pendant la chasse, vous perdez votre groupe de vue et vous vous retrouvez seul dans la nature. Alors que vous essayez de vous repérer, vous entrevoyez quelque chose d'étrange au loin... Vous chevauchez dans sa direction et découvrez un terrifiant [Root.GetHuntingQuarry] blanc ! Vous vous approchez doucement, mais la bête vous aperçoit et s'enfuit. Vous tentez de la suivre mais le terrain accidenté vous empêche de la rattraper.\n\nVous rejoignez votre groupe de chasse sans parvenir à chasser l'étrange animal de votre mémoire.;Auf der Jagd werdet Ihr in der Wildnis von Eurer Jagdgesellschaft getrennt. Beim Versuch, die Gruppe wiederzufinden, erblickt Ihr in der Ferne etwas Seltsames... Ihr reitet näher heran und seht einen furchterregenden großen weißen [Root.GetHuntingQuarryAkk]! Während Ihr Euch ihm vorsichtig nähert, wird er auf Euch aufmerksam und ergreift die Flucht. Ihr versucht, ihn zu verfolgen, aber aufgrund des schwierigen Geländes könnt Ihr ihn nicht einholen.\n\nWährend Ihr zu Eurer Jagdgesellschaft zurückkehrt, müsst Ihr ständig an dieses seltsame Tier denken.;;Durante la caza, te separas de tus compañeros en el páramo. Mientras das vueltas y tratas de encontrar tu rumbo, vislumbras a algo extraño en la distancia… ¡Cabalgas cerca y ves un tremendo [Root.GetHuntingQuarry] blanco! Como te lo acercas cautelosamente, te ve y se escapa. Tratas de seguirlo pero eres incapaz de alcanzarlo en este terreno difícil.\n\nCuando vuelvas con los tuyos, descubres que no puedes dejar de pensar en este extraño animal.;;;;;;;;;x
EVTDESC_WoL_5007_majestic;On the hunt, you get separated from your party in the wilderness. As you are roaming around and trying to find your bearings, you glimpse something strange in the distance... you ride closer and see a majestic great white [Root.GetHuntingQuarry]! As you cautiously approach, it sees you and runs away. You try to follow but are unable to catch up in the difficult terrain.\n\nAs you get back to your party, you find you can't stop thinking about this strange animal.;Pendant la chasse, vous perdez votre groupe de vue et vous vous retrouvez seul dans la nature. Alors que vous essayez de vous repérer, vous entrevoyez quelque chose d'étrange au loin... Vous chevauchez dans sa direction et découvrez un majestueux [Root.GetHuntingQuarry] blanc ! Vous vous approchez doucement, mais la bête vous aperçoit et s'enfuit. Vous tentez de la suivre mais le terrain accidenté vous empêche de la rattraper.\n\nVous rejoignez votre groupe de chasse sans parvenir à chasser l'étrange animal de votre mémoire.;Auf der Jagd werdet Ihr in der Wildnis von Eurer Jagdgesellschaft getrennt. Beim Versuch, die Gruppe wiederzufinden, erblickt Ihr in der Ferne etwas Seltsames... Es scheint sich um einen majestätischen weißen [Root.GetHuntingQuarryAkk] zu handeln! Doch dann, beim Versuch sich ihm zu nähern, wird er auf Euch aufmerksam und ergreift die Flucht. Ihr versucht, ihn zu verfolgen, könnt ihn aber aufgrund des schwierigen Geländes nicht einholen.\n\nWährend Ihr zur Jagdgesellschaft zurückkehrt, müsst Ihr ständig an dieses seltsame Tier denken.;;Durante la caza, te separas de tus compañeros en el páramo. Mientras das vueltas y tratas de encontrar tu rumbo, vislumbras a algo extraño en la distancia… ¡Cabalgas cerca y ves un majestuoso [Root.GetHuntingQuarry] blanco! Como te lo acercas cautelosamente, te ve y se escapa. Tratas de seguirlo pero eres incapaz de alcanzarlo en este terreno difícil.\n\nCuando vuelves con los tuyos, descubres que no puedes dejar de pensar en este extraño animal.;;;;;;;;;x
EVTDESC_WoL_5010;You have gathered your followers and your hunting dogs, you have saddled your horse and prepared your weapons. You are ready to set out to hunt the great white [Root.GetHuntingQuarry].;Vous avez rassemblé votre suite et vos chiens de chasse, fait seller vos chevaux et préparer vos armes. Vous êtes maintenant prêt à chasser le grand [Root.GetHuntingQuarry] blanc.;Ihr habt Eure Getreuen und Eure Jagdhunde versammelt, das Pferd gesattelt und die Waffen vorbereitet. Nun seid Ihr bereit, die Jagd auf den weißen [Root.GetHuntingQuarryAkk] zu beginnen.;;Has reunido a los tuyos, tus perros de caza, ensillado tu caballo y preparado tus armas. Estás list[Root.GetOA] para cazar al gran [Root.GetHuntingQuarry] blanco. ;;;;;;;;;x
EVTDESC_WoL_5030;After many days of hard hunting and tracking, you have finally managed to trap the white [Root.GetHuntingQuarry] in a cul-de-sac between two rocks. The great animal is at your mercy - it looks at you with intelligent eyes, and you are suddenly struck by its great beauty...;Après plusieurs jours de rude traque, vous parvenez à acculer [Root.GetTheHuntingQuarry] blanc entre deux rochers. Le bel animal est à votre merci. Il vous regarde de ses yeux intelligents et, soudain, sa grande beauté vous frappe.;Jagd und Aufspüren des Tieres erweisen sich als schwierig und langwierig. Doch nach zwei Tagen schafft Ihr es schließlich, den weißen [Root.GetHuntingQuarryAkk] in einer Sackgasse zwischen zwei Felsen in die Enge zu treiben. Das große Tier ist Euch ausgeliefert und es sieht Euch mit klugen Augen an. Plötzlich werdet Ihr seiner enormen Schönheit gewahr...;;Después de muchos días de difícil caza y rastreo, por fin, has logrado atrapar al [Root.GetHuntingQuarry] blanco en un callejón sin salida entre dos rocas. El gran animal está a tu merced... Te mira con ojos inteligentes y de repente te sientes impresionado por su gran belleza... ;;;;;;;;;x
EVTDESC_WoL_5035;During your hunt, you come to a deep gorge. Right on the other side is the white [Root.GetHuntingQuarry], staring at you! You are so close, yet cannot reach it. As it runs away, you realize that you must return home without a victory this time.;Au cours de la chasse, vous atteignez une profonde gorge. De l'autre côté de la faille, c'est [Root.GetTheHuntingQuarry] blanc qui vous regarde ! Vous en êtes si proche et si loin à la fois... Il s'enfuit soudain et vous comprenez qu'une fois de plus, vous rentrerez bredouille.;Während der Jagd gelangt Ihr an eine tiefe Schlucht. Genau auf der anderen Seite befindet sich der weiße [Root.GetHuntingQuarry] und starrt Euch an! Ihr seid ihm so nah und doch könnt Ihr ihn nicht erreichen. Als er wegläuft, wird Euch klar, dass Ihr dieses Mal keinen Sieg davontragen werdet.;;Durante la caza, llegas a un profundo barranco. ¡Justo al otro lado está el [Root.GetHuntingQuarry] blanco, mirándote fijamente! Estás tan cerca, mas no puedes alcanzarlo. Al escaparse, te das cuenta que esta vez deberás volver a casa sin una victoria.;;;;;;;;;x
EVTDESC_WoL_5040;Scouring the countryside for your prey, you come upon a lone rider. As you strike up conversation, it turns out he also hunts the same great animal that you are after. His lack of success thus far seems to match yours, but he invites you to talk and share experiences.;Alors que vous parcourez la campagne à la recherche de votre proie, vous croisez un cavalier solitaire. Parlant avec lui, vous comprenez qu'il chasse également le magnifique animal qui vous obsède. Son manque de succès vaut bien le vôtre, mais il vous invite à discuter et à échanger vos expériences respectives.;Während Ihr in der Wildnis nach Eurer Beute Ausschau haltet, begegnet Ihr einem einsamen Reiter. Als ihr ins Gespräch kommt, stellt sich heraus, dass ihr das gleiche Tier jagt und dass ihm genauso wenig Erfolg beschieden ist wie Euch. Er lädt Euch zum Meinungs- und Erfahrungsaustausch ein.;;Dando una batida por el campo en busca de tu presa, encuentras a un jinete solitario. Al entablar conversación, resulta que él también busca el mismo gran animal que tú. Su falta de éxito hasta el momento parece coincidir con la tuya, pero te invita a hablar y compartir experiencias.;;;;;;;;;x
EVTDESC_WoL_5045;You spend weeks in the wilderness searching for any trace of your prey, but to no avail. You find plenty of bugs, snakes and riding sores, however.;Vous passez des semaines dans les étendues sauvages à la recherche d'un indice vous menant à votre proie, sans succès. En revanche, vous ne manquez pas d'insectes, de serpents et de muscles endoloris.;Ihr verbringt Wochen in der Wildnis und sucht nach einer Spur Eurer Beute, aber ohne Erfolg. Ihr findet jedoch jede Menge Insekten und Schlangen und Eure Oberschenkel sind wundgeritten.;;Pasas semanas en los páramos buscando algún rastro de tu presa, pero en vano. Sin embargo encuentras un montón de insectos, serpientes y llagas de montar a caballo.;;;;;;;;;x
EVTDESC_WoL_5050;You spend weeks in the wilderness searching for any trace of your prey, but to no avail. However, you find that you rather enjoy being out in the wilds. All this daily physical activity, it makes you feel... stronger.;Vous passez des semaines dans les étendues sauvages à la recherche d'un indice vous menant à votre proie, sans succès. Cependant, chevaucher en pleine nature vous apporte un certain plaisir. Après toute cette activité physique, vous vous sentez... plus fort.;Ihr verbringt Wochen in der Wildnis und sucht nach einer Spur Eurer Beute, aber ohne Erfolg. Ihr findet jedoch großen Gefallen an Eurem Aufenthalt in der Wildnis. Die körperliche Betätigung führt dazu, dass Ihr Euch... stärker fühlt.;;Pasas semanas en los páramos buscando algún rastro de tu presa, pero en vano. Sin embargo, encuentras que disfrutas y prefieres estar en la naturaleza. Toda esta actividad física diaria, te hace sentir... ¡más fuerte!;;;;;;;;;x
EVTDESC_WoL_5055;You spend weeks in the wilderness searching for any trace of your prey, but are forced to return emptyhanded. You are sure that no one's impressed by your failed adventure.;Vous passez des semaines dans les étendues sauvages à la recherche d'un indice vous menant à votre proie, mais vous devez rentrer bredouille. Votre aventure infructueuse ne fait pas belle impression.;Ihr verbringt Wochen in der Wildnis und sucht nach einer Spur Eurer Beute, seid aber gezwungen, mit leeren Händen zurückzukehren. Ihr seid sicher, dass Ihr mit Eurem gescheiterten Abenteuer niemanden beeindrucken werdet.;;Pasas semanas en los páramo buscando algún rastro de tu presa, pero la situación te obliga a volver con las manos vacías. Estás seguro que nadie queda impresionado por su fallida aventura.;;;;;;;;;x
EVTDESC_WoL_5060;Fruitlessly scouring the countryside, you come upon a small cottage in the wilds. As you knock, an old crone opens. When she sees you and your hunting party, she cackles eerily and says that she has a powerful potion that will make you a stronger hunter, sure to catch any prey.;Alors que vous parcourez la campagne sans trouver ce que vous cherchez, vous tombez sur une petite ferme. Vous frappez à la porte et une vieille mégère vous ouvre. Vous voyant accompagné de votre suite, elle glousse joyeusement et vous dit posséder une puissante potion qui fera de vous un chasseur qui ne ratera jamais sa cible.;Während Ihr erfolglos die ländliche Gegend durchstreift, stoßt Ihr auf ein kleines Häuschen in der Wildnis. Ihr klopft an und ein altes Weib öffnet die Tür. Als sie Euch und Eure Jagdgesellschaft sieht, keckert sie ein schauderhaftes Lachen und bietet Euch einen mächtigen Trank an, mit dem Ihr angeblich jede Beute fangen könnt.;;Dando una batida sin frutos por el campo, llegas a una pequeña cabaña en el bosque. Al llamar, abre una viaje bruja. Cuando os ve a ti y tu grupo de caza, ríe extraña e inquietantemente y dice que tiene una potente poción que te hará un cazador más fuerte, capaz de atrapar cualquier presa.;;;;;;;;;x
EVTDESC_WoL_5061_bad;You drink the potion down. Soon, you start to feel all queasy, and then you pass out. As you awake, you have a strong headache and no desire to continue your hunting expedition. The old crone has disappeared, your guards don't seem to know how or where to.;Vous engloutissez la potion. Vous sentez bien vite la nausée monter, puis tout devient noir. Vous reprenez conscience avec une forte migraine et aucune envie de continuer votre expédition. La vieille a disparu et votre escorte ne semble pas savoir où elle est.;Ihr kippt den Trank hinunter. Bald fühlt Ihr Übelkeit in Euch aufsteigen und werdet ohnmächtig. Als Ihr erwacht, habt Ihr starke Kopfschmerzen. Ihr habt kein Verlangen mehr danach, Euren Jagdausflug fortzusetzen. Das alte Weib ist verschwunden und Eure Wachen scheinen nicht zu wissen, wie oder wohin.;;Bebes la porción en un trago. Pronto comienzas a sentirte muy mareado, y luego te desmayas. Al despertar, tienes un fuerte dolor de cabeza y ninguna gana de seguir tu expedición de caza. La vieja bruja ha desaparecido, los guardias no parecen saber ni cómo ni dónde.;;;;;;;;;x
EVTDESC_WoL_5061_good;You drink the potion down. Soon, you start to feel all warm inside. The crone whispers: 'See? You know that this will make you stronger, I can see it in your eyes! Now go, great hunter!'.\n\nYou return home, certain in your belief that next time you will find your prey...;Vous engloutissez la potion. Vous sentez bien vite une chaleur vous envahir. La vieille vous chuchote : 'Vous voyez ? Vous savez que cela vous aidera, je le vois dans vos yeux ! Maintenant, en chasse !'\n\nVous rentrez chez vous, convaincu que la prochaine chasse sera la bonne...;Ihr kippt den Trank hinunter. Bald fühlt Ihr Wärme in Euch aufsteigen. Das alte Weib flüstert: "Seht Ihr? Ihr wisst, dass dieser Trank Euch stärker machen wird, ich kann es in Euren Augen sehen! Geht jetzt, großer Jäger!"\n\nIhr geht nach Hause mit dem sicheren Gefühl, dass Ihr nächstes Mal Eure Beute aufspüren werdet...;;Bebe la poción de un trago. Pronto comienzas a sentirte más caliente por dentro. La bruja susurra: '¿Ves? Sabes que esto te hará más fuerte, ¡lo veo en tus ojos! ¡Ahora vete, gran cazador!' \n\n Vuelves a casa, convencido que la próxima vez encontrarás tu presa...;;;;;;;;;x
EVTDESC_WoL_5062;You have returned to your court. The hunt for this elusive white beast seems fruitless, but there are many more things out there in the wilds. Maybe next time you will catch your prey...;Vous êtes de retour à votre cour. La traque de cette insaisissable bête blanche semble infructueuse, mais la nature regorge de choses intéressantes. Peut-être la prochaine fois sera-t-elle la bonne...;Ihr seid zum Hof zurückgekehrt. Die Jagd nach diesem scheuen weißen Tier scheint vergebens zu sein, aber es gibt noch viele andere Dinge da draußen in der Wildnis. Vielleicht erwischt Ihr Eure Beute das nächste Mal...;;Has regresado a tu corte. La caza de esta elusiva bestia blanca parece infructuosa, pero hay muchas cosas más ahí en las regiones salvajes. Quizás la próxima vez cogerás tu presa...;;;;;;;;;x
EVTDESC_WoL_5065_female_lover;Fruitlessly scouring the countryside, you come upon a small cottage in the wilds. As you knock, a beautiful young woman opens. She pauses, then gives you a warm, inviting look and says: 'It's very lonely out here, I wonder if you will stay the night?';Alors que vous parcourez la campagne sans trouver ce que vous cherchez, vous tombez sur une petite ferme. Vous frappez à la porte et une magnifique jeune femme vous ouvre. Elle marque un temps puis vous lance un regard accueillant et déclare : « Je suis très seule ici, voudriez-vous passer la nuit avec moi ? »;Während Ihr erfolglos die ländliche Gegend durchstreift, stoßt Ihr auf ein kleines Häuschen in der Wildnis. Auf Euer Klopfen hin öffnet eine wunderschöne junge Frau die Tür. Sie hält kurz inne und sieht Euch dann mit warmen, einladenden Augen an. Sie sagt: "Das hier ist eine äußerst einsame Gegend. Möchtet Ihr vielleicht über Nacht hierbleiben?";;Dando una batida sin frutos por el campo, llegas a una pequeña cabaña en el bosque. Al llamar, abre una hermosa joven. Ella hace una pausa, lanzando una mirada cálida, incitante y dice: 'Esto es muy solitario, ¿te quedarías a pasar la noche?';;;;;;;;;x
EVTDESC_WoL_5065_male_lover;Fruitlessly scouring the countryside, you come upon a small cottage in the wilds. As you knock, a handsome young man opens. He pauses, then gives you a warm, inviting look and says: 'It's very lonely out here, I wonder if you will stay the night?';Alors que vous parcourez la campagne sans trouver ce que vous cherchez, vous tombez sur une petite ferme. Vous frappez et un jeune homme vous ouvre. Il marque un temps puis vous lance un regard accueillant et déclare : « Je suis très seul ici, voudriez-vous passer la nuit avec moi ? »;Während Ihr erfolglos die ländliche Gegend durchstreift, stoßt Ihr auf ein kleines Häuschen in der Wildnis. Auf Euer Klopfen hin öffnet ein hübscher junger Mann die Tür. Er hält kurz inne und sieht Euch dann mit warmen, einladenden Augen an. Er sagt: "Das hier ist eine äußerst einsame Gegend. Möchtet Ihr gerne die Nacht hier verbringen?";;Dando una batida sin frutos por el campo, llegas a una pequeña cabaña en el bosque. Al llamar, abre un hermoso joven. Hace una pausa, lanzando una mirada cálida, incitante y dice: 'Esto es muy solitario, ¿te quedarías a pasar la noche?';;;;;;;;;x
EVTDESC_WoL_5066;The next morning, you awake with a warm body next to you. You spent a long, pleasant night in the cabin but it's time to get back to the world outside. Your companion looks you in the eyes, caresses you and asks you to stay a little longer...;Le matin suivant, vous vous éveillez allongé[Root.Get_E] à côté d'un corps chaud. Vous avez passé une longue et agréable nuit dans la cabane, mais il est temps de partir en chasse. Votre partenaire d'une nuit vous regarde dans les yeux, vous caresse le bras et vous demande de rester un peu plus longtemps...;Am nächsten Morgen spürt Ihr den warmen Körper eines anderen Menschen neben Euch. Ihr habt eine lange Nacht voller Vergnügen in der Hütte verbracht, aber nun ist es an der Zeit, wieder in die Welt da draußen zurückzukehren. Die Person, mit der Ihr das Bett geteilt habt, sieht Euch in die Augen, berührt Euch zärtlich und bittet Euch, noch etwas zu bleiben...;;La mañana siguiente, te despierta con un cuerpo caliente al lado de ti. Pasaste una noche larga y agradable en la cabaña pero es hora de volver al mundo exterior. Tu pareja te mira a los ojos, te acaricia y pide que te quedes un poco más...;;;;;;;;;x
EVTDESC_WoL_5202;Your [puppy_giver.GetRootRelation], [puppy_giver.GetTitledFirstName], has sent you a gift. It is a small puppy, but of the finest pedigree and destined to grow into a great hunting dog.;Votre [puppy_giver.GetRootRelation], [puppy_giver.Get_le_TitledFirstName], vous a envoyé un cadeau. C'est un petit chiot de pure race destiné à devenir un excellent chien de chasse.;[puppy_giver.GetRootRelation] [puppy_giver.GetTitledFirstName] hat Euch ein Geschenk geschickt. Es handelt sich um einen kleinen Welpen, der jedoch einen auserlesenen Stammbaum besitzt und zu einem hervorragenden Jagdhund heranwachsen wird.;;Tu [puppy_giver.GetRootRelation], [puppy_giver.GetTitledFirstName], te ha enviado un regalo. Es un pequeño cachorro, pero del pedigrí más fino y está destinado a convertirse en un gran perro de caza.;;;;;;;;;x
EVTDESC_WoL_5203;Your new puppy has no name yet, my [Root.GetLordLady]. What will you call it?;M[Root.GetOnA][Root.GetLordLady], votre nouveau chiot n'a pas encore de nom. Quel nom voulez-vous choisir ?;Euer neuer Welpe hat noch keinen Namen, oh [Root.GetLordLady]. Wie werdet Ihr ihn nennen?;;Tu nuevo cachorro aún no tiene un nombre, mi [Root.GetLordLady]. ¿Cómo lo llamarás?;;;;;;;;;x
EVTDESC_WoL_5204_bad;Your dog is growing quickly and is no longer a little puppy. He runs fast and has a keen nose. He bites hard too, as several of the dog handlers can testify.;Votre chien grandit rapidement. Ce n'est plus un chiot désormais. Il court vite et son flair est excellent. Mais il est agressif, plusieurs dresseurs peuvent en témoigner.;Euer Hund wächst schnell heran und ist kein kleiner Welpe mehr. Er läuft geschwind und hat eine gute Nase. Er kann auch heftig zubeißen, wie mehrere Eurer Hundeführer bestätigen können.;;Tu perro está creciendo rápidamente y ya no es un cachorrito. Corre rápido y tiene un olfato agudo. También muerde con fuerza, como varios de tus adiestradores de perros pueden declarar.;;;;;;;;;x
EVTDESC_WoL_5204_good;Your dog is growing quickly and is no longer a little puppy. He runs fast and has a keen nose, and your dog handlers praise his good character.;Votre chien grandit rapidement. Ce n'est plus un chiot désormais. Il court vite et son flair est excellent. Les dresseurs apprécient son bon tempérament.;Euer Hund wächst schnell heran und ist kein kleiner Welpe mehr. Er läuft geschwind und hat eine gute Nase. Eure Hundeführer loben seinen guten Charakter.;;Tu perro está creciendo rápidamente y ya no es un cachorrito. Corre rápido y tiene un olfato agudo, y tus adiestradores de perros elogian su buen carácter.;;;;;;;;;x
EVTDESC_WoL_5210;Your faithful hunting dog is always around, and always happy to see you. It is good to have such a faithful friend.;Votre chien fidèle est toujours dans vos pattes, toujours heureux de vous voir. Qu'il est bon d'avoir un ami si fidèle.;Euer treuer Jagdhund ist immer da und freut sich immer, Euch zu sehen. Es ist von Vorteil, einen so treuen Freund zu haben.;;Tu fiel perro de caza siempre está cerca y contento de verte. Está bueno tener un amigo tan fiel.;;;;;;;;;x
EVTDESC_WoL_5211;Everyone at court loves your dog. Especially the children find much joy in playing with him.;Toute la cour adore votre chien. En particulier les enfants qui s'amusent beaucoup avec lui.;Jeder bei Hofe liebt Euren Hund. Besonders Kinder haben viel Spaß daran, mit ihm zu spielen.;;Todos en la corte quieren a tu perro. Sobre todo los niños, que se divierten mucho jugando con él.;;;;;;;;;x
EVTDESC_WoL_5220;Your hunting dog needs proper training if he is to perform well during hunts. Perhaps you should take a hand in this yourself?;Votre chien a besoin d'un bon entraînement si vous comptez en faire un bon chien de chasse. Peut-être devriez-vous prendre les choses en main vous-même ?;Euer Jagdhund muss entsprechend abgerichtet werden, um bei der Jagd nützlich zu sein. Vielleicht solltet Ihr Euch persönlich darum kümmern?;;Tu perro de caza necesita entrenamiento apropiado si tiene que actuar bien en las cacerías. ¿Tal vez deberías ocuparte tú mismo?;;;;;;;;;x
