EVTOPTB_WoL_7020;I can't.;Non, je ne peux pas.;Ich kann nicht.;;No puedo.;;;;;;;;;x
EVTOPTB_WoL_7030;I should ponder this more deeply.;Je dois méditer là-dessus.;Ich sollte intensiver darüber nachdenken.;;Debería reflexionar más profundamente sobre esto.;;;;;;;;;x
EVTOPTB_WoL_7042;Their heathen delusions do not interest me.;Ces illusions païennes ne m'intéressent pas.;Ihre heidnischen Wahnvorstellungen interessieren mich nicht.;;No me interesan sus delirios paganos.;;;;;;;;;x
EVTOPTB_WoL_7050;These blasphemous feelings will soon pass.;Ces pensées blasphématoires ne dureront pas.;Diese lästerlichen Gefühle werden bald vorbeigehen.;;Estos sentimientos blasfemos pronto pasarán.;;;;;;;;;x
EVTOPTB_WoL_7060;Perhaps it should not all be taken so literally after all.;Peut-être ne devrais-je pas prendre tout cela au pied de la lettre.;Vielleicht sollte der Inhalt nicht so wörtlich genommen werden.;;Quizás no se debería tomarlo todo tan literalmente después de todo.;;;;;;;;;x
EVTOPTB_WoL_7070;Religion has its uses and is well worthy of study.;La religion a son utilité et vaut la peine d'être étudiée.;Religion hat ihre Berechtigung und es ist sinnvoll, sie zu studieren.;;La religión tiene sus usos y muy digna de estudio.;;;;;;;;;x
EVTOPTB_WoL_7090;Bah! I'll get over it eventually.;Je finirai par surmonter cette situation;Ach was! Das vergeht wieder.;;¡Bah! Al final lo superaré;;;;;;;;;x

EVTOPTC_WoL_7000;No, I have no time for this.;Non, je n'ai pas le temps.;Nein, dafür habe ich keine Zeit.;;No, no tengo tiempo para esto.;;;;;;;;;x
EVTOPTC_WoL_7030;These religious ponderings give me a headache.;Toutes ces réflexions religieuses me donnent la migraine.;Diese religiösen Gedanken verursachen bei mir Kopfschmerzen.;;Estas meditaciones religiosas me dan dolor de cabeza.;;;;;;;;;x
EVTOPTC_WoL_7050;Perish these blasphemous thoughts!;Loin de moi ces pensées blasphématoires !;Entsagt diesen gotteslästerlichen Gedanken!;;¡Ahoga esos pensamientos blasfemos!;;;;;;;;;x
EVTOPTC_WoL_7060;These [Root.Religion.GetPriestTitle]s are charlatans!;Ces [Root.Religion.GetPriestTitle]s sont des charlatans !;Alles Scharlatane, diese Geistlichen!;;!Éstos [Root.Religion.GetPriestTitle] son unos charlatanes!;;;;;;;;;x
EVTOPTC_WoL_7070;It is interesting, but there are other things in life.;C'est un sujet intéressant, mais il n'y a pas que cela dans la vie.;Ganz interessant, aber es gibt noch andere Dinge im Leben.;;Es interesante, pero hay otras cosas en la vida.;;;;;;;;;x
