EVTDESCB_HL_1250;You’ve returned after spending several days out in the wild, running with the wolves. As you appear at court, people stare in awed silence. Your clothes are torn and full of dirt, leaves and blood. Your hair is disheveled and your face has scratches from branches and form the loving attentions of your packmates. But what perhaps impresses your subjects the most is the wide wolfish grin on your face.\n\n[wolf_worried_homecoming.GetName] rushes out to meet you, fussing over you and asking where you’ve been.;Après plusieurs jours passés dans la nature en compagnie des loups, vous revoilà chez vous. À les cour, on vous regarde avec stupeur. Vos vêtements sont déchirés et couverts de poussière, de feuilles et de sang. Vos cheveux sont en broussaille, votre visage est lacéré par les branchages et les marques d'affection de vos frères de meute. Mais ce qui fait la plus forte impression, c'est le large sourire canin que vous arborez fièrement.\n\n[wolf_worried_homecoming.GetName] se presse pour vous accueillir, vous dorloter et vous inonder de questions indiscrètes.;Nach mehreren Tagen unter den Wölfen in der Wildnis kehrt Ihr an den Hof zurück, wo die Menschen Euch vor Staunen sprachlos empfangen. Eure Kleider sind zerfetzt und von einem Gemisch aus Dreck, Laub und Blut bedeckt. Euer Haar bietet einen wilden Anblick, so wie auch Euer Gesicht, das bedeckt ist von Kratzern, die zum Teil dem Dickicht, zum Teil der Zuneigung Eurer Rudelgenossen zuzuschreiben sind. Was Euren Untertanen allerdings am meisten imponiert, ist das breite, wölfische Grinsen auf Eurem Gesicht.\n\n[wolf_worried_homecoming.GetName] stürzt herbei und fragt voller Sorge immer wieder, wo Ihr denn gewesen seid.;;Has vuelto después de pasar varios días en la naturaleza, corriendo con los lobos. Cuando apareces en por la corte, la gente te mira en un silencio asombrado. Tu ropa está rasgada y llena de suciedad, hojas y sangre. Tu cabello está despeinado y tu cara tiene rasguños de ramas y de las atenciones cariñosas de tus compañeros de manada. Pero tal vez lo que más impresiona a sus súbditos es la amplia sonrisa rapaz de tu cara\n\n[wolf_worried_homecoming.GetName] corre a verte, montando un número por ti y preguntándote dónde has estado.;;;;;;;;;x
EVTDESCB_HL_1490;You wake in the morning, but you feel as though you hadn’t slept at all. You vaguely remember having nightmares. You are cold as well, and wet. What happened during the night? You don’t remember at all.;Vous vous réveillez le lendemain matin avec l'impression de ne pas avoir dormi. Vous avez quelques vagues souvenirs de cauchemars. Vous avez froid et votre corps est couvert de transpiration. Que s'est-il passé la nuit dernière ? Impossible de vous souvenir.;Am Morgen erwacht Ihr und fühlt Euch, als hättet Ihr nicht geschlafen. Dunkel erinnert Ihr Euch an einen Albtraum. Euch ist kalt und Ihr seid durchnässt. Was ist vorgefallen in der Nacht? Ihr könnt Euch an nichts erinnern.;;Te despiertas por la mañana, pero te sientes como si no hubieras dormido en absoluto. Vagamente recuerdas haber tenido pesadillas. También estás frío, y mojado. ¿Qué pasó durante la noche? No lo recuerdas. ;;;;;;;;;x
EVTDESCB_HL_1702;Little [From.GetFirstName] is not like most other children. You notice that [From.GetSheHe] growls when other children cry, and is quicker and stronger than other children [From.GetHerHis] age. There is also that sniffing thing [From.GetSheHe] does. If you didn’t know better, you’d say [From.GetSheHe] has inherited [From.GetHerHis] [Spouse.GetFatherMother]’s blood, the blood of wolves...;[From.GetFirstName] ne ressemble pas aux autres enfants. Les autres enfants pleurent, [From.GetIlElle] grogne. Sa force et sa vivacité dépassent celles des bambins du même âge. Et puis, [From.GetIlElle] renifle constamment. Quelqu'un de moins avisé que vous dirait qu'[From.GetIlElle] a hérité du sang de s[Spouse.GetOnA] [Spouse.GetFatherMother], du sang des loups...;[From.GetFirstName] ist anders als andere Kinder. [From.GetSheHeCap] knurrt, statt zu weinen, und ist außerdem schneller und stärker als andere Kinder gleichen Alters. Auch das Schnüffeln ist auffällig. Wenn Ihr es nicht besser wüsstet, würdet Ihr denken, dass [From.GetSheHe] das Erbe des Wolfs in sich trägt.;;El/La pequeño/a [From.GetFirstName] no es como la mayoría de los otros niños/as. Notas que [From.GetSheHe] gruñe cuando otros niños lloran, y tiene más rapidez y fuerza que otros niños de [From.GetHerHis] edad. También está ese olfateo que [From.GetSheHe] suele hacer. Si no supieras mejor, dirías que [From.GetSheHe] ha heredado la sangre [From.GetHerHis] [Spouse.GetFatherMother], la sangre de los lobos...;;;;;;;;;x
EVTDESCC_HL_1490;You wake in the morning, but you feel as though you hadn’t slept at all. You vaguely remember having nightmares. You seem to have something wet and sticky on your chest. As you look down, you realize that you are covered in blood. It’s clearly not yours, and you don’t remember how it got there. There is something about it, however, that awakens a vague exhilaration in you...;Vous vous réveillez le lendemain matin avec l'impression de ne pas avoir dormi. Vous avez quelques vagues souvenirs de cauchemars. Sur votre poitrine, une sensation humide et collante. Vous baissez les yeux : du sang ! Ce n'est de toute évidence pas le vôtre mais impossible de vous souvenir comment il est arrivé là. Ce spectacle, cependant, provoque en vous une étrange excitation...;Am Morgen erwacht Ihr und fühlt Euch, als hättet Ihr nicht geschlafen. Dunkel erinnert Ihr Euch an einen Albtraum. Scheinbar befindet sich etwas Feuchtes, Klebriges auf Eurer Brust. Als Ihr hinabseht, bemerkt Ihr, dass Ihr blutüberströmt seid. Das Blut stammt mit Sicherheit nicht von Euch selbst, doch von wem es stammt und wie es dort hinkommen konnte, das wisst Ihr nicht. Dennoch ... irgendetwas an diesem Blut ruft ein vages Hochgefühl in Euch wach ...;;Te despiertas por la mañana, pero te sientes como si no hubieras dormido en absoluto. Vagamente recuerdas haber tenido pesadillas. Parece que tienes algo mojado y pegajoso en el pecho. Al mirar allí, te das cuenta de que estás cubierto de sangre. Está claro que no es tuya y no recuerdas cómo llegó allí. Sin embargo, tiene algo que despierta una vaga euforia en ti... ;;;;;;;;;x
EVTDESCHL1;[FromFrom.GetTitledName] has decided to abandon nomadic life and settle down in [FromFrom.PrimaryTitle.GetName] with [FromFrom.GetHerHis] followers, making it a new homeland for the [FromFrom.Culture.GetName] people.;[FromFrom.Get_Le_TitledName] a choisi d'abandonner sa vie nomade et de s'installer [FromFrom.PrimaryTitle.Get_en_Realm] avec ses suivants, fondant une nouvelle patrie pour le peuple [FromFrom.GetCultureMasc].;[FromFrom.GetTitledName] hat beschlossen, dem Nomadenleben zu entsagen und sich in [FromFrom.PrimaryTitle.GetName] mit den Gefolgsleuten niederzulassen, somit dem Volke von der [FromFrom.Culture.GetName]en Kultur eine neue Heimat zu schaffen.;;[FromFrom.GetTitledName] ha decidido abandonar la vida nómada y establecerse en [FromFrom.PrimaryTitle.GetName] con [FromFrom.GetHerHis] seguidores, convirtiéndose en la nueva patria para el pueblo [FromFrom.Culture.GetName].;;;;;;;;;x
EVTDESCHL2;The King of the [FromFrom.Culture.GetName]s, [FromFrom.GetBestName], has decided to settle down in [FromFrom.PrimaryTitle.GetName], making it [FromFrom.GetHerHis] new tribal homeland.;Le roi [FromFrom.GetCultureMasc], [FromFrom.Get_only_le_Title][FromFrom.GetBestName], a décidé de s'installer [FromFrom.PrimaryTitle.Get_en_Realm] et d'en faire sa nouvelle patrie tribale.;Der [FromFrom.Culture.GetName]e König [FromFrom.GetBestName] hat beschlossen, [FromFrom.PrimaryTitle.GetName] zum neuen Stammland des Stammes zu machen und sich dort niederzulassen.;;El rey de los [FromFrom.Culture.GetName]s, [FromFrom.GetBestName], ha decidido instalarse en [FromFrom.PrimaryTitle.GetName], pasando a ser [FromFrom.GetHerHis] nueva patria tribal.;;;;;;;;x
EVTDESCHL6;[From.GetBestName] and his people have hunted on our lands, stolen our sheep and kidnapped our women. This even though they know very well the boundaries between our clans! They truly are despicable and would betray us instantly if given the chance.;[From.Get_only_Le_Title][From.GetBestName] et les siens ont chassé sur nos terres, volé nos moutons et ont enlevé nos femmes. Ils ont perpétré ces actes en étant pleinement conscients des frontières qui existent entre nos deux clans ! Ce sont des vermines détestables, et ils nous trahiraient sans hésiter à la moindre occasion.;[From.GetBestName] und seine Helfershelfer haben Vieh und Wild von unserem Land gestohlen und unsere Frauen entführt. Dies geschah, obwohl der Grenzverlauf zwischen unseren Klans ihnen wohlbekannt ist! Sie sind wahrhaft verabscheuungswürdig und würden keinen Moment zögern, uns zu verraten, wenn sich ihnen die Gelegenheit dazu böte.;;[From.GetBestName] y su pueblo han cazado en nuestras tierras, robado nuestras ovejas y secuestrado nuestras mujeres. ¡Eso a pesar de saber muy bien los límites entre nuestros clanes! Son realmente despreciables y nos traicionarían al instante si les diéramos la oportunidad.;;;;;;;;;x
EVTDESCHL9;[FromFrom.GetBestName], leader of the [FromFrom.Clan.GetName] Clan, has adopted the faith of [From.GetFirstName] and become [From.Religion.GetName].;[FromFrom.Get_only_Le_Title][FromFrom.GetBestName], chef du clan [FromFrom.Clan.GetName] a adopté la religion de [From.GetFirstName] en devenant [From.Religion.GetName].;[FromFrom.GetBestName], der Anführer des Klans [FromFrom.Clan.GetName], hat den Glauben von [From.GetFirstName] angenommen und ist nun [From.Religion.GetName].;;[FromFrom.GetBestName], líder del clan [FromFrom.Clan.GetName] ha adoptado la fe de [From.GetFirstName] y se convierte al [From.Religion.GetName].;;;;;;;;x
EVTDESCHL10;With the death of [From.GetBestName] our blood oath with his family and our obligation to his people vanishes together with his life.;Avec la mort [From.Get_only_du_Title][From.GetBestName], le pacte du sang qui liait notre famille à la sienne cesse d'exister, tout comme notre obligation envers les siens.;Der Tod von [From.GetBestName] bedeutet das Ende unseres Blutschwurs mit seiner Familie und unsere Verpflichtungen gegenüber seinem Volk sind damit aufgehoben.;;Con la muerte de [From.GetBestName], nuestro juramento de sangre con su familia y nuestra obligación hacia su pueblo desaparece junto con su vida.;;;;;;;;;x
EVTDESCHL11;[FromFrom.GetBestName], leader of the [FromFrom.Clan.GetName] Clan, has adopted our religion.;[FromFrom.Get_only_Le_Title][FromFrom.GetBestName], chef du clan [FromFrom.Clan.GetName], a adopté notre religion.;[FromFrom.GetBestName], der Anführer des Klans [FromFrom.Clan.GetName], hat unseren Glauben angenommen.;;[FromFrom.GetBestName], líder del clan [FromFrom.Clan.GetName], ha adoptado nuestra religión.;;;;;;;;x
EVTNAME_HL_8005;Sky Burial;Funérailles célestes;Himmelsgrab;;Entierro celestial;;;;;;;;;x
EVTNAME_HL_8006;Bad Weather;Mauvais temps;Schlechtes Wetter;;Mal tiempo;;;;;;;;;x
EVTNAME_HL_8008;A Lone Hermit;L'ermite;Ein einsamer Einsiedler;;Un ermitaño solitario.;;;;;;;;;x
EVTNAME_HL_8010;Sky Burial;Funérailles célestes;Himmelsgrab;;Entierro celestial;;;;;;;;;x
EVTNAME_HL_8011;Being Followed;On vous suit;Verfolgt;;Seguido.;;;;;;;;;x
EVTNAME_HL_8020;Constructing Tomb;La construction du tombeau;Gruftbau;;Construyendo una tumba;;;;;;;;;x
EVTNAME_HL_8022;Golden Tomb;Le tombeau d'or;Goldene Gruft;;Tumba dorada;;;;;;;;;x
EVTNAME_HL_8030;The Gobi Desert;Le désert de Gobi;Die Wüste Gobi;;El desierto de Gobi;;;;;;;;;x
EVTNAME_HL_8032;The Gobi Desert;Le désert de Gobi;Die Wüste Gobi;;El desierto de Gobi;;;;;;;;;x
EVTNAME_HL_8035;Home at Last;Enfin chez soi;Endlich zu Hause;;Por fin en casa.;;;;;;;;;x
EVTNAMEHL1;A New Realm;Un nouveau royaume;Ein neues Reich;;Un nuevo reino;;;;;;;;x
EVTNAMEHL2;Nomads Settled;Nomades sédentarisés;Nomaden lassen sich nieder;;Nómadas establecidos;;;;;;;;x
EVTNAMEHL6;The [From.Clan.GetName] Feud;La querelle avec le clan [From.Clan.GetName];Die [From.Clan.GetName]-Fehde;;La enemistad de [From.Clan.GetName];;;;;;;;;x
EVTNAMEHL9;Clan Adopted another Faith;Un clan a adopté une autre religion;Klan übernahm fremden Glauben;;Clan adoptó otra fe;;;;;;;;x
EVTNAMEHL10;Death of a brother;La mort d'un frère;Tod eines Bruders;;Muerte de un hermano;;;;;;;;;x
EVTNAMEHL11;Clan Adopted your Faith;Un clan a adopté votre religion.;Klan trat zu Eurem Glauben über;;Clan adoptó tu fe;;;;;;;;x
EVTOPTA_HL_112;We must stop [From.GetHerHim].;Nous devons l'arrêter.;Das werden wir nicht zulassen!;;Debemos detener[From.GetHerHim].;;;;;;;;;x
EVTOPTA_HL_121;My friend, gold is the sign of nobility!;Mon ami, l'or est un signe de noblesse !;Mein Freund, Gold ist das Zeichen des Adels!;;¡Amigo mío, el oro es el signo de nobleza!;;;;;;;;;x
EVTOPTA_HL_1001;A fine little [From.GetBoyGirl]!;Que[From.GetLLle] adorable [From.GetBoyGirl] !;Was für ein wundervolles Kind!;;¡Un/Una [From.GetBoyGirl] pequeño/a y agradable ;;;;;;;;;x
EVTOPTA_HL_1010;I shall take this child in as my own [New.GetSonDaughter].;J'adopterai cet enfant.;Ich werde mich um dieses Kind kümmern, als ob es mein eigenes wäre.;;Recogeré a este niño como si fuera mi propio/a [New.GetSonDaughter].;;;;;;;;;x
EVTOPTA_HL_1020;What an exciting day!;Une journée pleine de sensations fortes !;Was für ein aufregender Tag!;;¡Qué día tan emocionante!;;;;;;;;;x
EVTOPTA_HL_1021;What a strange tale...;Quelle étrange histoire...;Was für eine seltsame Geschichte ...;;Qué cuento tan extraño...;;;;;;;;;x
EVTOPTA_HL_1030;Yes, I am a wolf! Raawr!;Oui, je suis un loup ! Grrr !;Ja, ein Wolf bin ich! Knurr!;;¡Sí, soy un lobo! ¡Grrr!;;;;;;;;;x
EVTOPTA_HL_1031;I'm glad they call my [From.GetSonDaughter] a wolf!;Ce qu'ils pensent de [From.GetSonDaughter] me remplit de fierté !;Es freut mich, dass man meine[From.GetnMale] [From.GetSonDaughter] einen Wolf nennt!;;¡Me alegra que llamen a lobo a mi [From.GetSonDaughter]!;;;;;;;;;x
EVTOPTA_HL_1040;My future is still to be forged.;Mon avenir reste à tracer.;Noch stehen mir alle Lebenswege offen.;;Mi futuro todavía está por venir.;;;;;;;;;x
EVTOPTA_HL_1041;I hope it shall be a blessing and not a curse.;Espérons que ce sera une bénédiction et non une malédiction.;Ich hoffe, dies erweist sich als Segen und nicht als Fluch.;;Espero que será una bendición y no una maldición.;;;;;;;;;x
EVTOPTA_HL_1100;The hunt! I feel so alive!;La chasse ! Je me sens tellement en vie !;Die Jagd! Ich fühle mich lebendig wie nie!;;¡La caza! ¡Me siento tan vivo!;;;;;;;;;x
EVTOPTA_HL_1200;What is this?;Que m'arrive-t-il ?;Was geht hier vor sich?;;¿Qué es esto?;;;;;;;;;x
EVTOPTA_HL_1201;I’ll go out and meet these wolves, alone.;J'irai rencontrer ces loups, sans personne pour m'accompagner.;Ich werde aufbrechen und die Wölfe aufsuchen, allein.;;Saldré y encontraré a esos lobos, solo.;;;;;;;;;x
EVTOPTA_HL_1202;Guards - leave me to meet these beasts alone.;Gardes, laissez-moi avec ces bêtes.;Wache, zurückbleiben! Ich werde mich diesen Tieren alleine nähern.;;Guardias - déjame que me vea con estas bestias a solas.;;;;;;;;;x
EVTOPTA_HL_1203;Who am I?;Qui suis-je ?;Wer bin ich?;;¿Quién soy yo?;;;;;;;;;x
EVTOPTA_HL_1210;Raaaawr!;Grrrr !;Knurr!;;¡Grrr!;;;;;;;;;x
EVTOPTA_HL_1230;Rip, tear, devour!;Déchirons, éventrons, dévorons !;Zerfetzen! Zerbeißen! Verschlingen!;;¡Romper, rasgar, devorar!;;;;;;;;;x
EVTOPTA_HL_1240;We will meet again!;Nous nous reverrons !;Eines Tages werden wir uns wiedersehen!;;¡Nos encontraremos otra vez!;;;;;;;;;x
EVTOPTA_HL_1250;It's my own business.;Cela ne regarde que moi.;Das geht nur mich selbst etwas an.;;Es asunto mío.;;;;;;;;;x
EVTOPTA_HL_1401;What will the night bring?;Que nous réserve cette nuit ?;Was wird die Nacht bringen?;;¿Qué traerá la noche?;;;;;;;;;x
EVTOPTA_HL_1420;So good but so tiring...;Quel bonheur, mais quelle fatigue...;Wunderbar. Aber anstrengend ...;;Que bien, pero qué cansado...;;;;;;;;;x
EVTOPTA_HL_1430;Blood!;Du sang !;Blut!;;¡Sangre!;;;;;;;;;x
EVTOPTA_HL_1490;Strange.;Voilà qui est étrange.;Seltsam.;;Que extraño;;;;;;;;;x
EVTOPTA_HL_1500;The wolf is hungry!;Une faim de loup !;Der Wolf ist hungrig!;;¡El lobo tiene hambre!;;;;;;;;;x
EVTOPTA_HL_1510;Aoooouuuuuuuu!!!;Aoooouuuuuuuu !!!;Aoooouuuuuuuu!!!;;¡¡¡Auuuuuuuu!!!;;;;;;;;;x
EVTOPTA_HL_1520;No one touches my meat.;Personne ne touche à ma viande.;Niemand stiehlt mir mein Fleisch.;;Nadie toca mi carne.;;;;;;;;;x
EVTOPTA_HL_1530;The wolves always catch their prey.;Un loup ne manque jamais sa proie.;Ein Wolf lässt seine Beute niemals entwischen.;;Los lobos siempre atrapan a sus presas.;;;;;;;;;x
EVTOPTA_HL_1540;I feel strong!;Quelle force !;Ich fühle mich stark!;;¡Me siento fuerte!;;;;;;;;;x
EVTOPTA_HL_1550;Few have it.;C'est un don rare.;Eine seltene Gabe.;;Pocos lo han hecho.;;;;;;;;;x
EVTOPTA_HL_1560;Growl.;Grrr.;Knurr.;;Gruñido.;;;;;;;;;x
EVTOPTA_HL_1570;I almost licked someone today.;Aujourd'hui, j'ai failli lécher quelqu'un.;Beinahe hätte ich heute jemanden abgeleckt.;;Hoy casi lamí a alguien.;;;;;;;;;x
EVTOPTA_HL_1580;I am the wolf.;Je suis le loup.;Ich bin der Wolf.;;Soy el lobo.;;;;;;;;;x
EVTOPTA_HL_1590;The law must be respected.;Il faut respecter la loi.;Das Gesetz muss geachtet werden.;;La ley debe ser respetada.;;;;;;;;;x
EVTOPTA_HL_1610;Let the wolf rage.;Que la rage du loup s'exprime.;Lebt Eure Wolfsnatur aus.;;Deja que el lobo rabie.;;;;;;;;;x
EVTOPTA_HL_1620;There is nothing I can do about it.;Je ne peux rien faire pour l'empêcher.;Dagegen kann ich nichts tun.;;No hay nada que pueda hacer.;;;;;;;;;x
EVTOPTA_HL_1630;Maybe instinct is better than learning.;L'inné vaut peut-être mieux que l'acquis.;Vielleicht ist der Instinkt der Gelehrsamkeit überlegen.;;Tal vez el instinto sea mejor que el aprendizaje.;;;;;;;;;x
EVTOPTA_HL_1702;[From.GetSheHeCap] will grow to be a strong [From.GetManWoman]!;[From.GetIlElleCap] deviendra un[From.Get_E] [From.GetManWoman] fort[From.Get_E] !;[From.GetSheHeCap] wird zu [From.Geteinemeiner] prächtigen [From.GetManWoman] heranwachsen!;;¡[From.GetSheHeCap] crecerá para ser un/una [From.GetManWoman] fuerte!;;;;;;;;;x
EVTOPTA_HL_2000;We shall see who proves the stronger!;Nous verrons bien qui est le plus fort !;Wir werden sehen, wer sich als stärker erweist!;;¡Veremos quién es el más fuerte!;;;;;;;;;x
EVTOPTA_HL_4813;Bring back the spoils to me and we will divide them between us!;Ramenez-moi le butin et nous le partagerons !;Bringt mir die gesamte Beute und wir werden sie unter uns aufteilen!;;¡Traedme el botín a mí y los dividiremos entre nosotros!;;;;;;;;;x
EVTOPTA_HL_4814;We will use the corpses to fertilize the fields!;Nous utiliserons les cadavres pour fertiliser les champs !;Wir werden die Felder mit den Leichen düngen!;;¡Usaremos los cadáveres para fertilizar los campos!;;;;;;;;;x
EVTOPTA_HL_5000;These are the finest and strongest horses.;Ce sont les chevaux les plus forts et les plus robustes.;Das sind die besten und stärksten Pferde.;;Son los caballos mejores y más fuertes.;;;;;;;;;x
EVTOPTA_HL_5001;I'll let him govern the trade.;Je le laisserai conduire les échanges commerciaux.;Ich werde ihm die Verwaltung des Handels übertragen.;;Le dejaré dirigir el comercio.;;;;;;;;;x
EVTOPTA_HL_5005;Let the silk flow.;Laissez circuler la soie.;Die Seide soll weiterhin zu uns fließen.;;Que la seda fluya.;;;;;;;;;x
EVTOPTA_HL_5006;Sell them for profit.;Les vendre et réaliser un profit.;Gewinnbringend verkaufen.;;Véndelas para sacar beneficios.;;;;;;;;;x
EVTOPTA_HL_5007;Apologize and reimburse them.;Offrons nos excuses et remboursons-les.;Entschuldigt Euch und entschädigt sie.;;Me disculpo y les compensaré.;;;;;;;;;x
EVTOPTA_HL_5008;I wonder if this is just a coincidence?;Je me demande si ce n'est que coïncidence ?;Ich frage mich, ob das wirklich Zufall ist ...;;Me pregunto si sólo es una coincidencia.;;;;;;;;;x
EVTOPTA_HL_5014;Ahem.. We were just discussing that matter, [FromFrom.GetFirstName]. Right?;Heu... On en parlait justement, [FromFrom.GetFirstName]. Pas vrai ?;Ach ... Genau darüber sprachen wir gerade, nicht wahr, [FromFrom.GetFirstName]?;;Ejem... Justo estábamos discutiendo ese asunto, [FromFrom.GetFirstName]. ¿Verdad?;;;;;;;;;x
EVTOPTA_HL_5016;Just stay away from these people.;Ne vous approchez pas de ces gens.;Haltet Euch fern von diesem Gesindel.;;Aléjate de esas personas.;;;;;;;;;x
EVTOPTA_HL_5017;I hope it doesn't bite.;J'espère qu'il ne mord pas.;Ich hoffe, sie beißt nicht.;;Espero que no muerda.;;;;;;;;;x
EVTOPTA_HL_5045;That's too bad.;C'est dommage.;Das ist schade.;;Qué pena.;;;;;;;;;x
EVTOPTA_HL_5048;This could be bad for trade.;Ceci pourrait nuire au commerce.;Dem Handel wird das schaden.;;Esto podría ser malo para el comercio.;;;;;;;;;x
EVTOPTA_HL_5050;I'll let them continue if they share the loot.;S'ils partagent leur butin, pourquoi les arrêter ?;Wenn sie die Beute mit mir teilen, werde ich sie gewähren lassen.;;Les dejaré seguir si comparten el botín.;;;;;;;;;x
EVTOPTA_HL_5051;It is my duty.;Tel est mon devoir.;So ist es meine Pflicht.;;Es mi deber.;;;;;;;;;x
EVTOPTA_HL_5052;Excellent work!;Excellent travail?;Ausgezeichnete Leistung!;;|n trabajo excelente!;;;;;;;;;x
EVTOPTA_HL_5053;What a horrible fate.;Quelle horrible fin.;Welch ein furchtbares Schicksal.;;Qu?destino tan horrible.;;;;;;;;;x
EVTOPTA_HL_5054;I need to deal with my unruly marshal.;Je dois m'occuper de ce maréchal indiscipliné.;Ich muss mich um meinen ungehorsamen Marschall kümmern.;;Tengo que tratar con mi mariscal rebelde.;;;;;;;;;x
EVTOPTA_HL_5055;Annoying pests!;Quelle vermine?;Was f? eine Plage!;;·ar?itos molestos!;;;;;;;;;x
EVTOPTA_HL_5056;... enter the camp and approach their leader.;... de nous introduire dans le camp pour trouver leur chef.;... in ihr Lager reiten, um den Anf?rer zur Rede zu stellen.;;... entrar en el campamento y acercarnos a su l?er;;;;;;;;;x
EVTOPTA_HL_5057;Fight the leader to shatter the band of raiders.;Affronter le chef pour disperser le groupe.;Anf?rer zum Zweikampf fordern, um so seine Bande zu zerschlagen.;;Lucha contra el l?er para romper el grupo de asaltantes.;;;;;;;;;x
EVTOPTA_HL_5058;Ow!;A??;Autsch!;;,y!;;;;;;;;;x
EVTOPTA_HL_5059;Pay them for my freedom.;Acheter ma libert?;Kauft mich frei.;;C?prales por mi libertad.;;;;;;;;;x
EVTOPTA_HL_5060;Surrender.;Rendons-nous.;Wir ergeben uns!;;Rendir;;;;;;;;;x
EVTOPTA_HL_5061;Threaten him to leave my land!;Lui faire quitter mes terres par la menace.;Versprecht ihm, ihn zu verschonen, wenn er das Land verl?st.;;,men?alo para que deje mi tierra!;;;;;;;;;x
EVTOPTA_HL_6000;Dragon.;Dragon.;Drache.;;Dragón;;;;;x
EVTOPTA_HL_6010;This will not do! I shall teach [ward_cant_ride.GetHerHim] personally.;Cela suffit ! Je vais lui apprendre à monter personnellement !;Ein unmöglicher Zustand! Ich werde [ward_cant_ride.Getihmihr] persönlich das Reiten beibringen!;;¡Esto no puede ser! [ward_cant_ride.GetHerHim] enseñaré personalmente.. ;;;;;x
EVTOPTA_HL_6020;I must save [spouse_danger_nomad_river_crossing.GetFirstName]!;Je dois sauver [spouse_danger_nomad_river_crossing.GetFirstName] !;Ich muss [spouse_danger_nomad_river_crossing.GetFirstName] retten!;; ¡Tengo que salvar a [spouse_danger_nomad_river_crossing.GetFirstName]!;;;;;x
EVTOPTA_HL_6021;I am glad [spouse_danger_nomad_river_crossing.GetSheHe]'s safe.;Heureusement, [spouse_danger_nomad_river_crossing.GetIlElle] est en sécurité.;Ein Glück, dass [spouse_danger_nomad_river_crossing.GetSheHe] in Sicherheit ist.;;Me alegra que [spouse_danger_nomad_river_crossing.GetSheHe] esté a salvo.;;;;;x
EVTOPTA_HL_6022;I, too, now question my decision.;Ce n'était peut-être pas le bon choix.;Das habe ich mich auch gerade gefragt.;;Ahora yo también pongo mi decisión en duda.;;;;;x
EVTOPTA_HL_6030;You shall have six mares from my personal herd.;Prends six juments de mon troupeau personnel.;Ihr sollt sechs Stuten meiner Herde bekommen.;;Tendrás seis yeguas de mi manada personal.;;;;;x
EVTOPTA_HL_6500;Goodbye, old friend.;Au revoir, mon ami.;Leb wohl, treuer Freund.;;Adiós, viejo amigo;;;;;;;;;x
EVTOPTA_HL_6512;I'll have that beast killed!;Je ferai tuer cet animal !;Ich werde dieses Biest schlachten lassen!;;¡Haré matar esa bestia!;;;;;;;;;x
EVTOPTA_HL_6520;I want a portrait of myself.;Je veux me voir en portrait.;Ich möchte ein Porträt von mir selbst.;;Quiero un retrato propio.;;;;;;;;;x
EVTOPTA_HL_6990;I have to carry this burden alone.;Je dois porter ce fardeau sans aide.;Ich muss diese traurige Bürde alleine schultern.;;Tengo que llevar esta carga solo/a.;;;;;;;;;x
EVTOPTA_HL_7000;It will be a great contest.;Ce sera un magnifique concours.;Das wird ein großartiger Wettkampf.;;Será un gran concurso.;;;;;x
EVTOPTA_HL_7001;I will saddle my horse now!;Je vais seller mon cheval sans attendre !;Ich werde sofort mein Pferd satteln!;;¡Ensillaré mi caballo ahora!;;;;;x
EVTOPTA_HL_7020;The best warrior shall win!;Que le meilleur gagne !;Der beste Krieger soll siegen!;;¡Que gane el mejor guerrero!;;;;;x
EVTOPTA_HL_7025;I shall give it my best!;Je ferai de mon mieux !;Ich werde mein Bestes geben!;;¡Daré todo lo que tengo!;;;;;x
EVTOPTA_HL_7055;I knew I would win!;Je savais que je gagnerais !;Ich wusste, ich würde siegen!;;¡Sabía que ganaría!;;;;;x
EVTOPTA_HL_7060;A worthy winner.;Un digne vainqueur.;Ein würdiger Sieger.;;Un digno ganador.;;;;;x
EVTOPTA_HL_8005;I shall take him to the mountains myself.;C'est moi qui l'emmènerai dans les montagnes.;Ich werde ihn selbst in die Berge bringen.;;Lo llevaré personalmente a las montañas.;;;;;;;;;x
