#CODE;ENGLISH;FRENCH;GERMAN;;SPANISH;;;;;;;;;x
EVTDESC_MNM_1622_COURT;My dear [divine_summoning_collaborator.GetRootRelation] and [divine_summoning_collaborator.GetSisterBrother] in the Hermetic Order, [divine_summoning_collaborator.GetFirstName], has stepped forth with an idea for a ritual that might invoke the presence of a Divine Being. The prospect of petitioning the Divine itself for knowledge is tantalizing, and the idea was therefore received with excitement by the Order. The ritual will take place in a few weeks' time.;M[divine_summoning_collaborator.GetOnA] ch[divine_summoning_collaborator.GetErEre] [divine_summoning_collaborator.GetRootRelation] et [divine_summoning_collaborator.GetSisterBrother] de l'Ordre hermétique, [divine_summoning_collaborator.GetFirstName], a avancé l'idée d'un rituel qui pourrait invoquer la présence d'un être divin. La perspective de solliciter le Divin pour obtenir un savoir est attirante, et l'idée a donc été reçue avec enthousiasme par l'Ordre. Le rituel aura lieu dans quelques semaines.;[divine_summoning_collaborator.GetFirstName], m[divine_summoning_collaborator.Geteineine] liebe[divine_summoning_collaborator.GetrMale] [divine_summoning_collaborator.GetRootRelation] und [divine_summoning_collaborator.GetSisterBrother] im hermetischen Orden, hat ein Ritual vorgeschlagen, mit dem man möglicherweise ein göttliches Wesen herbeirufen kann. Die Aussicht, beim Göttlichen selbst nach Wissen zu suchen, ist verlockend, und die Idee wurde daher von Seiten des Ordens mit Begeisterung aufgenommen. Das Ritual wird in wenigen Wochen stattfinden.;;A [divine_summoning_collaborator.GetFirstName], mi [divine_summoning_collaborator.GetRootRelation] y [divine_summoning_collaborator.GetSisterBrother] de la Orden Hermética, se le ha ocurrido una idea para un ritual que podría invocar la presencia de un ser divino. La posibilidad de apelar al Divino mismo para recibir conocimiento es tentadora, y la Orden ha recibido la idea con entusiasmo. El ritual se celebrará dentro de unas semanas.;;;;;;;;;x
EVTDESC_MNM_1624;The time for the ritual has come, and your Order has congregated in a spacious room. Symbols scatter the floor as you chant your hymns. [divine_summoning_collaborator.GetSocietyRank] [divine_summoning_collaborator.GetFirstName] has provided you all with a new, special type of incense that [divine_summoning_collaborator.GetSheHe] claims is necessary to make the eventual connection with the Divine Being. Before long it has permeated the air, and as you inhale more and more of it, hearing the drone of your fellows' chants, you feel your soul disconnect from your body and begin to ascend...\n\n...until it seems to connect with something. An... entity touches your soul, though you cannot perceive it with any senses other than your mind's eye. It must be the Divine Being! You have succeeded! You struggle to control your emotions, and to coalesce all your thoughts into one burning question that you pose to this being...;Le temps du rituel est venu, et votre Ordre s'est rassemblé dans une pièce spacieuse. Les symboles sont éparpillés sur le sol alors que vous chantez vos cantiques. [divine_summoning_collaborator.Get_Le_SocietyRank] [divine_summoning_collaborator.GetFirstName] vous a fourni à tous un nouveau type d'encens qu'[divine_summoning_collaborator.GetIlElle] affirme être nécessaire pour faire la connexion éventuelle avec l'être divin. En peu de temps, il imprègne l'air, et alors que vous inspirez profondément, en entendant les chants de vos camarades, vous sentez votre âme se séparer de votre corps et commencer à s'élever...\n\n...jusqu'à ce qu'elle semble se relier à quelque chose. Une... entité touche votre âme, bien que vous ne puissiez la percevoir avec aucun autre sens que l'oeil de votre esprit. Ce doit être l'Être divin ! Vous avez réussi ! Vous luttez pour contrôler vos émotions, et réunir toutes vos pensées en une question brûlante que vous posez à cet être...;Die Zeit des Rituals ist gekommen und der Orden hat sich in einem großen Saal versammelt. Der Boden ist voller Symbole. Die Anwesenden singen. [divine_summoning_collaborator.GetSocietyRank] [divine_summoning_collaborator.GetFirstName] hat einen besonderen Weihrauch beschafft, von dem [divine_summoning_collaborator.GetSheHe] behauptet, er sei die Verbindung zu dem göttlichen Wesen. Schon bald erfüllt sein Aroma die Luft und je mehr Ihr davon einatmet, desto mehr spürt Ihr, wie sich Eure Seele loslöst und getragen vom Gesang Eurer Brüder und Schwestern nach oben schwebt ...\n\n... bis sie schließlich gegen etwas stößt. Eine ... Wesenheit ... berührt Eure Seele. Auch wenn Ihr das mit keinem anderen Sinn als Eurem inneren Auge erfassen könnt. Das muss das göttliche Wesen sein! Ihr habt es geschafft! Ihr könnt Eure Emotionen kaum zügeln und alles kulminiert in einer einzigen brennenden Frage, die Ihr diesem Wesen stellen wollt ...;;Ha llegado el momento de celebrar el ritual, y tu Orden se ha congregado en una sala espaciosa. Se colocan símbolos por el suelo mientras cantáis vuestros himnos. [divine_summoning_collaborator.GetSocietyRank] [divine_summoning_collaborator.GetFirstName] te ha proporcionado un tipo de incienso especial que, según asegura, es necesario para conectar con el ser divino. No tarda en invadir el aire y lo inhalas mientras oyes el zumbido de los cánticos de tus compañeros. Sientes que tu alma se separa del cuerpo y comienza a ascender...\n\n... hasta que parece conectar con algo. Un... ente toca tu alma, aunque ninguno de tus sentidos logra percibirlo, aparte de tu ojo interno. ¡Debe de ser el ente divino! ¡Lo has logrado! Luchas por controlar tus emociones y por unir todos tus pensamientos en una sola e imperiosa pregunta que formulas a este ser...;;;;;;;;;x
EVTDESC_MNM_1626_ALCH_BONUS;The Divine Being has given me cryptic advice on the pursuit of alchemy in its many forms, but with ample time spent mulling it over afterwards, I believe I have deciphered what it meant. I look forward to putting it to good use!;L'Être Divin m'a donné des conseils cryptiques sur l'alchimie sous ses diverses formes, mais après avoir passé suffisamment de temps à retourner le problème dans tous les sens, je pense avoir compris ce qu'il voulait dire. J'ai hâte de les mettre à profit !;Das göttliche Wesen hat mir hinsichtlich der Alchemie einen kryptischen Rat gegeben, doch nachdem ich viel Zeit damit verbracht habe, darüber nachzudenken, denke ich, dass ich nun verstehe, was sie bedeutet. Ich freue mich darauf, meine Erkenntnisse in die Tat umzusetzen!;;El ser divino me ha dado consejos crípticos sobre la práctica de la alquimia en sus diversas formas, pero tras meditarlo mucho tiempo, creo que he comprendido lo que quería decir. ¡Estoy deseando sacarle partido!;;;;;;;;;x
EVTDESC_MNM_1626_ASTR_BONUS;The Divine Being has given me cryptic advice on the pursuit of astrology in its many forms, but with ample time spent mulling it over afterwards, I believe I have deciphered what it meant. I look forward to putting it to good use!;L'Être Divin m'a donné des conseils cryptiques sur l'astrologie sous ses diverses formes, mais après avoir passé suffisamment de temps à retourner le problème dans tous les sens, je pense avoir compris ce qu'il voulait dire. J'ai hâte de les mettre à profit !;Das göttliche Wesen hat mir hinsichtlich der Astrologie einen kryptischen Rat gegeben, doch nachdem ich viel Zeit damit verbracht habe, darüber nachzudenken, denke ich, dass ich nun verstehe, was sie bedeutet. Ich freue mich darauf, meine Erkenntnisse in die Tat umzusetzen!;;El ser divino me ha dado consejos crípticos sobre la práctica de la astrología en sus diversas formas, pero tras meditarlo mucho tiempo, creo que he comprendido lo que quería decir. ¡Estoy deseando sacarle partido!;;;;;;;;;x
EVTDESC_MNM_1626_FAILURE;The Divine Being gave me a cryptic reply to my question, and for many days since the ritual I have tried to make sense of it... Yet, no matter how much time I spend on it, I cannot. Whatever the Being intended for me to know is beyond my capacity to understand – I can only conclude I simply am not worthy of its knowledge...;L'Être divin m'a donné une réponse mystérieuse à ma question, et depuis le rituel d'il y a plusieurs jours, j'ai essayé de comprendre... Peu importe le temps que j'y consacre, je n'y parviens pas. Quoi que fut ce que l'Être m'a transmis, c'est au-delà de ma compréhension – je ne peux que conclure que je ne suis simplement pas digne de ce savoir...;Das göttliche Wesen gab mir eine kryptische Antwort auf meine Frage und die ganze Zeit seit Ende des Rituals versuche ich nun, sie zu verstehen ... Aber ganz gleich, wie viel Zeit ich damit verbringe ... es gelingt mir nicht. Was dieses Wesen mir sagen wollte, liegt jenseits meines Verstands. Ich kann es mir nur so erklären, dass ich solchen Wissens eben einfach nicht würdig bin ...;;El ser divino dio una respuesta críptica a mi pregunta, y llevo muchos días tratando de encontrarle el sentido... Sin embargo, da igual cuánto tiempo pase dándole vueltas: no lo consigo. Lo que sea que el Ser tenía guardado para que yo lo descubriese escapa a mi entendimiento: solo puedo concluir que soy indign[Root.GetOA] de su sabiduría...;;;;;;;;;x
EVTDESC_MNM_1626_MIND_BONUS;The Divine Being has given me cryptic advice on the pursuit of Theurgy in its many forms, but with ample time spent mulling it over afterwards, I believe I have deciphered what it meant. I look forward to putting it to good use!;L'Être Divin m'a donné des conseils cryptiques sur la théurgie sous ses diverses formes, mais après avoir passé suffisamment de temps à retourner le problème dans tous les sens, je pense avoir compris ce qu'il voulait dire. J'ai hâte de les mettre à profit !;Das göttliche Wesen hat mir hinsichtlich der Theurgie einen kryptischen Rat gegeben, doch nachdem ich viel Zeit damit verbracht habe, darüber nachzudenken, denke ich, dass ich nun verstehe, was sie bedeutet. Ich freue mich darauf, meine Erkenntnisse in die Tat umzusetzen!;;El ser divino me ha dado consejos crípticos sobre la práctica de la teúrgia en sus diversas formas, pero tras meditarlo mucho tiempo, creo que he comprendido lo que quería decir. ¡Estoy deseando sacarle partido!;;;;;;;;;x
EVTDESC_MNM_1626_SUCCESS;In my trance, the Divine Being tells me of great Truths that have been hidden from Man – of alchemy and astrology, of the will of the gods, of the cyphers to ancient texts, and even of things that have not yet come to pass. Once my soul returns to my body, I see the world with new eyes!;Dans mon état de transe, l'Être divin me dit de grandes vérités qui ont été cachées à l'Homme – sur l'alchimie et l'astrologie, sur la volonté des dieux, sur le chiffrement des textes anciens et même des choses qui n'ont pas encore eu lieu. Une fois que mon âme revient à mon corps, je vois le monde avec de nouveaux yeux !;In meiner Trance erzählt mir das göttliche Wesen von den großen Wahrheiten, von denen der Mensch nichts wissen sollte ... von der Alchemie und der Astrologie, dem Willen der Götter, den Chiffren der antiken Texte und sogar von Dingen, die sich noch gar nicht ereignet haben. Wenn meine Seele in meinen Körper zurückgekehrt ist, werde ich die Welt mit anderen Augen sehen!;;En mi trance, el ser divino me cuenta las grandes Verdades que se han ocultado al hombre: de alquimia y astrología, de la voluntad de los dioses, de las claves para descifrar textos antiguos, e incluso de acontecimientos que aún no han tenido lugar. ¡Cuando mi alma regresa a mi cuerpo, veo el mundo con otros ojos!;;;;;;;;;x
EVTDESC_MNM_1626_TRUTH_BONUS;The Divine Being has given me cryptic advice on the decryption of hidden secrets throughout the world, but with ample time spent mulling it over afterwards, I believe I have deciphered what it meant. I look forward to putting it to good use!;L'Être Divin m'a donné des conseils cryptiques sur le décryptage des secrets cachés à travers le monde, mais après avoir passé suffisamment de temps à retourner le problème dans tous les sens, je pense avoir compris ce qu'il voulait dire. J'ai hâte de les mettre à profit !;Das göttliche Wesen hat mir hinsichtlich der esoterischen Geheimnisse einen kryptischen Rat gegeben, doch nachdem ich viel Zeit damit verbracht habe, darüber nachzudenken, denke ich, dass ich nun verstehe, was sie bedeutet. Ich freue mich darauf, meine Erkenntnisse in die Tat umzusetzen!;;El ser divino me ha dado consejos crípticos sobre cómo desentrañar los secretos ocultos por el mundo, pero tras meditarlo mucho tiempo, creo que he comprendido lo que quería decir. ¡Estoy deseando sacarle partido!;;;;;;;;;x
EVTDESC_MNM_1630;I face the daunting task of researching and writing an entire theorem paper, to be reviewed by my peers... To have it be accepted by the Order would be a great boon to me, but if the quality is found to be lacking it might be a big blow to my prestige.;Je suis confronté[Root.Get_E] à la tâche intimidante de rechercher et rédiger un théorème qui sera examiné par mes pairs... Être accepté[Root.Get_E] par l'Ordre serait une grande aubaine pour moi, mais si la qualité se trouve être insuffisante, cela pourrait porter atteinte à mon prestige.;Nun stehe ich vor der schwierigen Aufgabe, eine ganze Abhandlung der Theoreme zu schreiben, die meine Kollegen bewerten werden ... Wenn sie vom Orden anerkannt würde, wäre das ein Segen, aber wenn man an der Qualität etwas zu bemängeln hätte, könnte das ein schwerer Schlag für mein Prestige sein.;;Me enfrento a la abrumadora tarea de investigar y escribir todo un teorema para que lo revisen mis colegas... Si la Orden lo acepta sería una bendición, pero si estiman que la calidad es deficiente, sería un golpe muy duro para mi reputación.;;;;;;;;;x
EVTDESC_MNM_1642;Esteemed [Root.GetSocietyRank] [Root.GetFirstName],\n\nHaving spent ample time considering your paper's worth, I have decided to endorse your work before the Order. I hope that it shall speedily be added to our library. Well done!\n\nRespectful greetings,\nSigned, [From.GetSocietyRank] [From.GetFirstName];Estimé[Root.Get_E] [Root.GetSocietyRank] [Root.GetFirstName],\n\nAyant passé le temps nécessaire à évaluer votre article, j'ai décidé d'appuyer votre travail devant l'Ordre. J'espère qu'il sera bientôt ajouté à notre bibliothèque.\n\nSalutations respectueuses,\nSigné, [From.GetSocietyRank] [From.GetFirstName];Verehrte[Root.GetrMale] [Root.GetSocietyRank] [Root.GetFirstName],\nnach eingehender Prüfung Eures Werkes bin ich zu dem Entschluss gekommen, es dem Orden gegenüber zu empfehlen. Ich hoffe sehr, dass man es schnell in unsere Bibliothek aufnehmen wird. Gute Arbeit!\n\nMit respektvollen Grüßen\n[From.GetSocietyRank] [From.GetFirstName];;[Root.GetSocietyRank] [Root.GetFirstName]:\n\nDespués de una larga revisión de tu trabajo, he decidido refrendarlo ante la Orden. Espero que se añada a nuestra biblioteca con la mayor prontitud. ¡Enhorabuena!\n\nAtentamente,\n[From.GetSocietyRank] [From.GetFirstName];;;;;;;;;x
EVTDESC_MNM_1643;Esteemed [Root.GetSocietyRank] [Root.GetFirstName],\n\nHaving spent ample time considering your paper's worth, I have decided NOT to endorse your work before the Order. In my view, the quality of the work was unfortunately not in keeping with the standards of our library.\n\nRespectful greetings,\nSigned, [From.GetSocietyRank] [From.GetFirstName];Estimé[Root.Get_E] [Root.GetSocietyRank] [Root.GetFirstName],\n\nAyant passé le temps nécessaire à évaluer votre article, j'ai décidé de ne pas appuyer votre travail devant l'Ordre. Sa qualité n'était malheureusement pas conforme au niveau de notre bibliothèque.\n\nSalutations respectueuses,\nSigné, [From.GetSocietyRank] [From.GetFirstName];Verehrte[Root.GetrMale] [Root.GetSocietyRank] [Root.GetFirstName],\nnach eingehender Prüfung Eures Werkes bin ich zu dem Entschluss gekommen, es dem Orden gegenüber NICHT zu empfehlen. In meinen Augen wird das Werk leider nicht dem Standard unserer Bibliothek gerecht.\n\nMit respektvollen Grüßen\n[From.GetSocietyRank] [From.GetFirstName];;[Root.GetSocietyRank] [Root.GetFirstName]:\n\nDespués de una larga revisión de tu trabajo, he decidido no refrendarlo ante la Orden. Desde mi punto de vista, la calidad del trabajo no estaba, por desgracia, a la altura de nuestra biblioteca.\n\nAtentamente,\n[From.GetSocietyRank] [From.GetFirstName];;;;;;;;;x
EVTDESC_MNM_1646;Drat! That nosy [From.GetSocietyRank] [From.GetFirstName] has somehow discovered that I borrowed elements from other authors... [From.GetSheHeCap] has already spread the word, slandering me before the Order and ensuring my paper will never be accepted.;Diable ! C[From.GetEtEtte] fouineu[From.GetRSe] d[From.Get_e_SocietyRank] [From.GetFirstName] a d'une façon ou d'une autre découvert que j'ai emprunté des éléments d'autres auteurs... [From.GetIlElleCap] a déjà répandu la nouvelle, me calomniant devant l'Ordre et s'assurant que mon papier ne sera jamais accepté.;Verflixt! [From.GetSocietyRank] [From.GetFirstName] hat tatsächlich festgestellt, dass ich mir bestimmte Passagen von anderen Autoren geborgt habe ... und diese Erkenntnis auch postwendend hinausposaunt. Mein Ruf ist ruiniert und der Orden wird mein Werk nun nie und nimmer akzeptieren.;;¡Maldición! [From.GetSocietyRank] [From.GetFirstName] ha descubierto que tomé prestados algunos elementos de otros autores... Ya ha hecho correr la voz, difamándome ante la Orden y garantizando que nunca acepten mi trabajo.;;;;;;;;;x
EVTDESC_MNM_1800_A;I have called upon my apprentice, [gathering_companion.GetTitledFirstName] to help me gather ingredients that are needed for further studies of the mysteries in the world. But first I need to decide what kind of ingredients we need.;J'ai appelé mon apprenti[gathering_companion.Get_E], [gathering_companion.Get_le_TitledFirstName], pour m'aider à recueillir des ingrédients qui sont nécessaires pour des études plus poussées des mystères du monde. Mais d'abord, je dois décider de quel type d'ingrédients nous avons besoin.;Ich habe meinen Lehrling [gathering_companion.GetTitledFirstName] gebeten, mir zu helfen, Zutaten zu sammeln, die für die weitere Erforschung der Geheimnisse der Welt vonnöten sind. Doch zuerst muss ich bestimmen, welche Art von Zutaten wir benötigen.;;He llamado a [gathering_companion.GetTitledFirstName], mi aprendiz, para que me ayude a reunir ingredientes que necesito para profundizar en mis estudios sobre los misterios del mundo. Pero primero, debo decidir qué clase de ingredientes necesitamos.;;;;;;;;;x
EVTDESC_MNM_1800_B;[gathering_companion.GetSocietyRank] [gathering_companion.GetFirstName] has offered [gathering_companion.GetHerHis] help with gathering much needed ingredients for further studies of the mysteries in the world. But first I need to decide what kind of ingredients we need.;[gathering_companion.GetSocietyRank] [gathering_companion.GetFirstName] s'est proposé[gathering_companion.Get_E] pour chercher des ingrédients nécessaires pour des études plus poussées des mystères du monde. Mais d'abord, je dois décider de quel type d'ingrédients nous avons besoin.;[gathering_companion.GetSocietyRank] [gathering_companion.GetFirstName] hat [gathering_companion.GetHerHis]e Hilfe dabei angeboten, Zutaten zu sammeln, die für die weitere Erforschung der Geheimnisse der Welt dringend vonnöten sind. Doch zuerst muss ich bestimmen, welche Art von Zutaten wir benötigen.;;[gathering_companion.GetSocietyRank] [gathering_companion.GetFirstName] se ha ofrecido para ayudar a conseguir ingredientes muy necesarios para profundizar en mis estudios sobre los misterios del mundo. Pero primero, debo decidir qué clase de ingredientes necesitamos.;;;;;;;;;x
EVTDESC_MNM_1802;To [Root.GetSocietyRank] [Root.GetFirstName],\n\nMy [Root.GetSisterBrother], as you know we're always in need of more ingredients to perform our experiments. These experiments are essential to uncover the mysteries of the world. I propose a joint venture to combine our knowledge in an effort to identify and gather ingredients so that our search for truth will not be halted by such worldly things as material shortages.\n\nAs above, so below.\nSigned, [hermetic_collaborator.GetSocietyRank] [hermetic_collaborator.GetFirstName];[Root.GetSocietyRank] [Root.GetFirstName],\nM[Root.GetOnA] [Root.GetSisterBrother], comme vous le savez, nous avons toujours besoin de plus d'ingrédients pour effectuer nos expériences. Ils sont essentiels pour découvrir les mystères du monde. Je propose de combiner nos connaissances dans un effort visant à les identifier et les rassembler afin que notre recherche de la vérité ne soit pas stoppée par des choses de ce monde telles qu'une pénurie.\n\nCe qui est en haut, tel est en bas.\nSigné, [hermetic_collaborator.GetSocietyRank] [hermetic_collaborator.GetFirstName];An [Root.GetSocietyRank] [Root.GetFirstName],\nM[Root.Geteineine] [Root.GetSisterBrother], wie Ihr wisst, benötigen wir stets weitere Zutaten, um Experimente durchzuführen. Diese sind unerlässlich, um die Geheimnisse der Welt zu ergründen. Ich schlage ein gemeinsames Unterfangen vor, um unser Wissen mit dem Ziel zu vereinen, Zutaten zu identifizieren und zu sammeln, damit unserer Suche nach der Wahrheit nicht durch weltliche Dinge wie Materialmangel aufgehalten wird.\n\nGezeichnet\n[hermetic_collaborator.GetSocietyRank] [hermetic_collaborator.GetFirstName];;[Root.GetSocietyRank] [Root.GetFirstName]:\n\n[Root.GetSisterBrother], como sabes, siempre necesitamos ingredientes para realizar nuestros experimentos. Dichos experimentos son fundamentales para desvelar los misterios del mundo. Te propongo una misión conjunta en la que unamos nuestro conocimiento para identificar y reunir ingredientes. De ese modo, nuestra búsqueda de la verdad no quedará interrumpida por cosas tan mundanas como la escasez de materiales.\n\nComo arriba, es abajo.\nFirmado: [hermetic_collaborator.GetSocietyRank] [hermetic_collaborator.GetFirstName];;;;;;;;;x
EVTDESC_MNM_1810;[gathering_companion.GetTitledFirstName] and I arrived in the hills early in the morning to collect various useful herbs that we could find in the countryside.;[gathering_companion.Get_Le_TitledFirstName] et moi sommes arrivés aux collines tôt ce matin pour recueillir diverses herbes utiles que nous pourrions trouver dans la campagne.;[gathering_companion.GetTitledFirstName] und ich erreichten am frühen Morgen die Hügel, um verschiedene nützliche Kräuter zu sammeln, die wir in der Natur finden könnten.;;[gathering_companion.GetTitledFirstName] y yo hemos llegado a las colinas temprano para recoger varias hierbas útiles que se encuentran en el campo.;;;;;;;;;x
EVTDESC_MNM_1812_A;[gathering_companion.GetTitledFirstName] is most resourceful. While discussing the different aspects of the elements we identify a plethora of plants by tasting and smelling them and the days pass without us even noticing.;[gathering_companion.Get_Le_TitledFirstName] est plus débrouillard[gathering_companion.Get_E] que moi. Tout en discutant des leurs différents aspects, nous identifions une pléthore de plantes en les goûtant et en les sentant, et les jours passent sans que nous n'ayons le temps de le remarquer.;[gathering_companion.GetTitledFirstName] ist höchst einfallsreich. Während wir über die verschiedenen Aspekte der Elemente diskutieren, gelingt es uns, eine Fülle von Pflanzen anhand ihres Geschmacks und Geruchs zu bestimmen, und die Tage verfliegen, ohne dass wir dies überhaupt bemerken.;;[gathering_companion.GetTitledFirstName] es realmente capaz. Mientras hablábamos sobre diferentes aspectos de los elementos, identificamos toda una plétora de plantas probándolas y oliéndolas, y los días pasan sin que nos demos cuenta.;;;;;;;;;x
EVTDESC_MNM_1812_B;We have now spent days looking high and low for useful herbs. With both me and [gathering_companion.GetTitledFirstName] exhausted we are forced to conclude that the small assortment of interesting plants is what we are getting out of this.;Nous avons passé des jours à chercher des herbes utiles. [gathering_companion.Get_Le_TitledFirstName] et moi sommes épuisés, et forcés de conclure que ce petit assortiment de plantes intéressantes est tout ce que nous avons réussi à obtenir.;Wir haben jetzt mehrere Tage damit zugebracht, in hohen und tiefen Lagen nach nützlichen Kräutern zu suchen. Als ich und [gathering_companion.GetTitledFirstName] vollends erschöpft sind, müssen wir uns eingestehen, dass die kleine Sammlung interessanter Pflanzen unsere einzige Ausbeute sein wird.;;Llevamos días buscando hierbas útiles por doquier. [gathering_companion.GetTitledFirstName] y yo, al borde del agotamiento, hemos concluido a nuestro pesar que lo único que conseguiremos será un pequeño surtido de plantas.;;;;;;;;;x
EVTDESC_MNM_1812_C;My mouth is feeling funny and numb after [gathering_companion.GetTitledFirstName] got me to taste a weird looking plant.;Ma bouche est engourdie après que [gathering_companion.Get_le_TitledFirstName] m'a fait goûter une plante étrange.;Mein Mund fühlt sich merkwürdig taub an, nachdem [gathering_companion.GetTitledFirstName] mich von einer merkwürdig aussehenden Pflanze kosten ließ.;;Tengo una sensación extraña y de adormecimiento en la boca después de que [gathering_companion.GetTitledFirstName] me hiciera probar una planta de aspecto sospechoso.;;;;;;;;;x
