#CODE;ENGLISH;FRENCH;GERMAN;;SPANISH;;;;;;;;;x

EVTDESC_MNM_100;Greetings [Root.GetTitledFirstName]!\nWe are delighted to learn that you have taken your first step towards enlightenment. The secrets of the Corpus may be obscured to you now, but in time you may come to understand them as I have.\n\nHold in thy mind all thou wouldst know, and [Root.GetHermesThriceBlessed], will teach thee.\nSigned, [inviter.GetSocietyRank] [inviter.GetFirstName];Salutations, [Root.GetTitledFirstName] !\nNous sommes ravis d'apprendre que vous avez fait votre premier pas vers l'illumination. Les secrets du Corpus peuvent vous paraître obscurs, mais avec le temps vous pourrez les comprendre aussi bien que moi.\n\nGardez à l'esprit ce que vous voulez savoir, et [Root.GetHermesThriceBlessed], vous l'enseignera.\nSigné, [inviter.GetSocietyRank] [inviter.GetFirstName];Seid gegrüßt, [Root.GetTitledFirstName]!\nWir sind davon entzückt, zu erfahren, dass Ihr Euren ersten Schritt auf dem Weg zur Erleuchtung getan habt, [Root.GetTitle]. Die Geheimnisse des Corpus mögen Euch zwar jetzt noch verborgen sein, doch mit der Zeit werdet Ihr sie so wie ich selbst zu verstehen beginnen.\n\nDenkt immer an das Wissen, das Euch verheißen ist, dann wird [Root.GetHermesThriceBlessed] es Euch auch lehren.\n\nGezeichnet\n[inviter.GetSocietyRank] [inviter.GetFirstName];;Saludos, [Root.GetTitledFirstName]:\nNos complace saber que has dado tu primer paso hacia la iluminación, [Root.GetTitle]. Los secretos del Corpus pueden parecerte oscuros ahora, pero con el tiempo lograrás comprenderlos tan bien como yo.\n\nGuarda en tu mente lo que quieres aprender, que [Root.GetHermesThriceBlessed] te enseñará.\nFirmado: [inviter.GetSocietyRank] [inviter.GetFirstName];;;;;;;;;x
EVTDESC_MNM_1100;A truly useful Laboratory can take both time and money to assemble but without an office dedicated to alchemy I doubt I will ever be able to unveil the deeper secrets of the world.;Un laboratoire vraiment utile peut prendre du temps et coûter de l'argent, mais sans un bureau dédié à l'alchimie, je doute d'être capable de dévoiler les secrets plus profonds du monde.;Der Bau eines wahrhaft nützlichen Labors kann Zeit und Geld kosten, doch ich bezweifle, dass es mir ohne ein spezielles Alchemielabor möglich sein wird, die tieferen Geheimnisse der Welt zu entschleiern.;;Un laboratorio realmente útil puede requerir tiempo y dinero, pero sin un estudio dedicado a la alquimia, dudo que llegue a desvelar los secretos más recónditos del universo.;;;;;;;;;x
EVTDESC_MNM_1101;Secrecy is of great importance as the experiments I will perform in my laboratory may both frighten the ignorant and tantalize my fellow alchemists. To keep intruders away laboratories are often built deep within a castle, but a more accessible building would likely be more efficient...;La discrétion est d'une grande importance, car les expériences que je ferai dans mon laboratoire pourraient à la fois effrayer les ignorants et intriguer mes collègues alchimistes. Pour empêcher les intrusions, les laboratoires sont souvent construits à l'intérieur d'un château, mais un bâtiment plus accessible serait probablement plus efficace...;Geheimhaltung ist von größter Bedeutung, da die Experimente, die ich in meinem Labor durchführen werde, die Unwissenden ängstigen und andere Alchemisten neidisch machen könnten. Um Eindringlinge fernzuhalten, werden Labors oft tief im Innern einer Burg eingerichtet, doch ein zugänglicheres Gebäude wäre wahrscheinlich effizienter...;;La discreción tiene una importancia clave, pues los experimentos que realizaré en mi laboratorio podrían asustar a los ignorantes y atormentar a mis colegas alquimistas. Para mantener a los intrusos alejados, los laboratorios suelen construirse en las profundidades de un castillo, pero un edificio más accesible podría resultar más eficaz...;;;;;;;;;x
EVTDESC_MNM_1102;In order to properly heat and transform metals or other substances I require furnaces of differing temperature and flames of different types. The alchemical texts speak of various setups that could be beneficial.;Pour bien chauffer et transformer des métaux ou d'autres substances, j'ai besoin de fours de différentes températures et de flammes de différents types. Les textes alchimiques parlent d'installations diverses qui pourraient être bénéfiques.;Um Metalle oder andere Substanzen richtig erhitzen und transformieren zu können, benötige ich Öfen für verschiedene Temperaturen und Flammen verschiedener Natur. Die alchemistischen Texte sprechen von verschiedenen Einrichtungen, die von Vorteil sein könnten.;;Para calentar y transformar metales u otras sustancias correctamente, necesito hornos de diversa temperatura y varios tipos de llamas. Los textos alquímicos tratan sobre diversas disposiciones que podrían resultar ventajosas.;;;;;;;;;x
EVTDESC_MNM_1103;The glass in which I keep my concoctions is brittle and breaks easily. This may be tolerable for beakers and other dispensable glass but earlier today a giant alembic shattered into a thousand pieces after having been heated carelessly by one of my helpers...;Le verre dans lequel je garde mes concoctions se brise facilement. Cela peut être tolérable pour les béchers, mais plus tôt dans la journée, un alambic géant a éclaté en mille morceaux après avoir été chauffé négligemment par un de mes assistants...;Die Glasgefäße, in denen ich meine Mixturen aufbewahre, sind spröde und leicht zerbrechlich. Bei Bechern und anderen entbehrlichen Glasgefäßen mag dies zu dulden sein, doch heute zersprang ein riesiger Destillierhelm in tausend Stücke, als er von einem meiner Gehilfen leichtfertig erhitzt wurde...;;Los recipientes en los que guardo mis pócimas son frágiles y se rompen con facilidad. Puedo tolerarlo en el caso de matraces y otros recipientes prescindibles, pero hoy un alambique gigante se ha roto en mil pedazos después de que uno de mis ayudantes lo calentase demasiado...;;;;;;;;;x
EVTDESC_MNM_1104;Not all pottery is suited for the kind of alchemical work I do. My experiments require both the porous orange pottery that can absorb components in the crucible and the dark and highly fire resistant pots in which even the strongest metal can be melted. Good quality does come at a high price however...;Toutes les poteries ne sont pas adaptées au genre d'activités alchimiques que je pratique. Mes expériences nécessitent à la fois la poterie orange poreuse qui peut absorber les composants dans un creuset et les pots foncés et hautement résistants au feu dans lequel même le métal le plus dur peut être fondu. La qualité a cependant un coût...;Nicht alle Tonwaren eignen sich für die Art von alchemistischer Arbeit, die ich verrichte. Meine Experimente erfordern sowohl die porösen orangefarbenen Tonwaren, die Komponenten im Schmelztiegel aufnehmen können, als auch die dunklen und äußerst feuerfesten Töpfe, in denen selbst die stärksten Metalle geschmolzen werden können. Gute Qualität ist allerdings teuer.;;No todo el material es adecuado para el tipo de trabajo alquímico que hago. Mis experimentos requieren tanto la cerámica porosa naranja capaz de absorber componentes en el crisol, como los recipientes ignífugos en los que se pueda deshacer el metal más resistente. Sin embargo, la calidad tiene un precio...;;;;;;;;;x
EVTDESC_MNM_1105;The local smiths do not seem to appreciate the great care that must be taken to create the kind of tools we need to work the fires of my laboratory. Perhaps in time they will learn but so far the results have been most disappointing.;Les forgerons locaux ne semblent pas apprécier le grand soin qui doit être pris pour créer le genre d'outils dont nous avons besoin pour travailler les feux de mon laboratoire. Peut-être qu'avec le temps ils vont apprendre, mais jusqu'ici les résultats ont été des plus décevants.;Die ansässigen Schmiede scheinen die große Sorgfalt nicht zu schätzen, die vonnöten ist, um die Werkzeuge zu fertigen, die wir für die Arbeit mit den Feuern meines Labors benötigen. Vielleicht werden sie dies im Lauf der Zeit noch lernen, doch bisher waren die Ergebnisse höchst enttäuschend.;;Los herreros locales no parecen apreciar el cuidado esmerado que se requiere para crear el tipo de herramientas que necesitamos para hacer funcionar los fuegos de mi laboratorio. Quizá lleguen a aprender con el tiempo, pero hasta ahora los resultados han sido decepcionantes.;;;;;;;;;x
EVTDESC_MNM_1106;Sometimes the difference identifying success can be as hard as achieving it. Many metals and other substances are so alike that only an expert can tell them apart. To avoid mishaps perhaps it would be best to invest in a rich library of reference literature to avoid unwelcome surprises.;Parfois, la différence entre le succès et l'échec est très subtile. De nombreux métaux et autres substances sont si semblables que seul un expert peut les distinguer. Pour éviter de se tromper, il serait peut-être préférable d'investir dans une riche bibliothèque de références afin d'éviter des surprises inopportunes.;Zuweilen ist es ebenso schwer, einen Erfolg zu erkennen, wie diesen Erfolg zu erreichen. Viele Metalle und andere Substanzen sind sich so ähnlich, dass sie nur Experten auseinanderhalten können. Um Missgeschicke zu vermeiden, wäre es vielleicht am besten, in eine umfangreiche Bibliothek von Referenzliteratur zu investieren, um unwillkommene Überraschungen auszuschließen.;;A veces, conseguir la diferencia del éxito puede ser tan difícil como llegar hasta él. Muchos metales y otras sustancias se parecen tanto que solo un experto es capaz de diferenciarlas. Para evitar accidentes y sorpresas desagradables, quizá convendría invertir en una buena biblioteca de literatura de referencia.;;;;;;;;;x
EVTDESC_MNM_1108;It may not be the most advanced office of alchemy, in fact it might well be the opposite of that, but I have finally completed a laboratory in which to conduct my experiments. Soon the secrets of this world will reveal themselves to me!;Ce n'est peut-être pas le laboratoire d'alchimie le plus avancé – ce pourrait même être le contraire -, mais j'ai finalement terminé un endroit où mener mes expériences. Bientôt les secrets de ce monde se révéleront à moi !;Es mag zwar nicht gerade das fortschrittlichste Alchemielabor sein, wahrscheinlich sogar eher das Gegenteil, doch endlich habe ich ein Labor gebaut, in dem ich meine Experimente durchführen kann. Bald werden sich mir die Geheimnisse dieser Welt offenbaren!;;Puede que no sea el estudio de alquimia más avanzado, de hecho, puede que sea lo contrario, pero por fin he terminado un laboratorio en el que emprender mis experimentos. ¡Pronto, los secretos de este mundo se me revelarán!;;;;;;;;;x
EVTDESC_MNM_1109;The work to create an office in which I can conduct my experiments is finally complete! It may not compare to the greatest laboratories of this age but it will surely help me find the knowledge which I seek.;Le travail pour créer une pièce dans laquelle je peux mener mes expériences est enfin terminé ! Il ne peut pas être comparé aux plus grands laboratoires de notre époque, mais il va sûrement m'aider à trouver les connaissances que je cherche.;Die Arbeiten zum Bau eines Labors, in dem ich meine Experimente durchführen kann, sind endlich abgeschlossen! Es mag zwar nicht mit den größten Labors dieses Zeitalters zu vergleichen sein, wird mir aber gewiss helfen, das Wissen zu erlangen, nach dem ich strebe.;;¡Por fin he terminado el laboratorio en el que podré emprender mis experimentos! No es comparable a los mejores laboratorios de esta época, pero seguro que me ayudará a encontrar el conocimiento que busco.;;;;;;;;;x
EVTDESC_MNM_1110;My laboratory is finally completed. Will it be able to fulfill my dreams of enlightenment? Only time will tell...;Mon laboratoire est enfin terminé. Sera-t-il capable de réaliser mes rêves d'illumination ? Seul le temps nous le dira...;Mein Labor ist endlich fertig. Wird es dazu imstande sein, meine Träume von Erleuchtung Wirklichkeit werden zu lassen? Nur die Zeit wird das zeigen...;;Mi laboratorio por fin está terminado. ¿Logrará ayudarme a alcanzar el entendimiento con el que siempre he soñado? Solo el tiempo lo dirá...;;;;;;;;;x
EVTDESC_MNM_1111;After months of hard work and a considerable amount of money spent, the laboratory of [Root.GetFullName] is the envy of anyone who wishes to delve into the deeper secrets of life. This office of alchemy allows the [Root.GetTitle] to perform any experiment that has so far been documented and is a testament to [Root.GetHerHis] great ambitions in the field.;Après des mois de travail acharné et une quantité considérable d'argent dépensé, le laboratoire de [Root.GetFullName] est envié par quiconque souhaitant se plonger dans les secrets plus profonds de l'existence. Ce centre d'alchimie lui permet d'effectuer toute expérience qui a été documentée et est un témoignage de ses grandes ambitions dans le domaine.;Nach Monaten voller harter Arbeit und dem Aufwenden einer beträchtlichen Menge an Geld erregt das Labor von [Root.GetFullName] den Neid aller, die danach streben, die tieferen Geheimnisse des Lebens zu ergründen. Dieses Alchemielabor ermöglicht [Root.GetTitle], jedes bisher dokumentierte Experiment durchzuführen, und ist ein Zeugnis für [Root.GetHerHis]e großen Ambitionen auf diesem Gebiet.;;Tras meses de mucho trabajo y una cantidad de dinero considerable, el laboratorio de [Root.GetFullName] se ha convertido en la envidia de cualquiera que desee ahondar en los secretos más profundos de la vida. Este laboratorio de alquimia permite [Root.GetAlAla] [Root.GetTitle] realizar cualquier experimento que se haya documentado hasta ahora y atestigua su gran ambición en este campo.;;;;;;;;;x
EVTDESC_MNM_1112;With no expenses spared and under the constant supervision of [Root.GetFullName] a house unlike any other has been erected to realize the dream of a perfect alchemical working environment. Many of the contraptions have been conceived and drawn by the [Root.GetTitle] personally and the great number of furnaces alone employs a team of helpers from the entire realm.\n\nThe office now stands ready to allow [Root.GetFullName] to uncover the secrets of the world, all it requires is for its master to give the instructions.;Sans aucune dépense épargnée et sous la surveillance constante de [Root.GetFullName], une salle différente de toute autre a été aménagée pour réaliser le rêve d'un environnement de travail alchimique parfait. Beaucoup de ces engins ont été conçus et dessinés par [Root.Get_only_le_Title][Root.GetTitle] en personne, et le grand nombre de fours emploie une équipe d'assistants de tout le Royaume.\n\nLe bureau est maintenant prêt à permettre à [Root.GetFullName] de découvrir les secrets du monde, il suffit que son maître donne les instructions.;Ohne Kosten zu scheuen und unter der ständigen Aufsicht von [Root.GetFullName] wurde ein einzigartiges Gebäude gebaut, um eine perfekte alchemistische Arbeitsumgebung zu schaffen. Viele der Vorrichtungen wurden von [Root.Getdemder] [Root.GetTitle] selbst ersonnen und entworfen und die große Zahl an Öfen allein beschäftigt eine ganze Gruppe von Gehilfen aus dem ganzen Reich.\n\nDas Labor steht bereit, um es [Root.GetFullName] zu ermöglichen, die Geheimnisse der Welt zu ergründen. Nun muss sein Besitzer nur noch die Anweisungen erteilen.;;[Root.GetFullName] no ha escatimado en gastos y supervisa constantemente una construcción nunca antes vista para dar vida a un entorno de trabajo alquímico de ensueño. [Root.GetTitle] ha creado y diseñado muchos de los artilugios, y solo en la gran cantidad de hornos hay empleado un equipo de ayudantes de todo el reino.\n\nEl laboratorio ya está listo para desvelar los secretos del mundo, y solo basta con que [Root.GetFullName] dé las instrucciones.;;;;;;;;;x
EVTDESC_MNM_1113;The entire castle just shook, waking me from the dreamless sleep that comes after hours of preparatory laboratory work. Did I forget to properly lock the laboratory?;Tout le château vient de trembler, me sortant de mon sommeil venu après des heures de travail préparatoire au laboratoire. Ai-je oublié de verrouiller correctement le laboratoire ?;Soeben erbebte die ganze Burg in ihren Grundfesten, wodurch ich aus dem traumlosen Schlaf gerissen wurde, den stundenlange Vorbereitungsarbeiten im Labor mit sich bringen. Habe ich etwa vergessen, das Labor richtig abzuschließen?;;El castillo entero tembló y me despertó de mi sueño profundo, consecuencia de horas de trabajo en el laboratorio. ¿Olvidé cerrar el laboratorio?;;;;;;;;;x
EVTDESC_MNM_1114;To the ignorant laboratory equipment can appear both frightening and alien. Word has gotten out of some of the unusual contraptions that have been built for my laboratory. A small mob has assembled outside, demanding answers about why I am constructing so clearly ungodly things.;Aux yeux d'un ignorant, le matériel de laboratoire peut paraître à la fois effrayant et étranger. Des gens parlent de certains des engins inhabituels qui ont été construits pour mon laboratoire. Une petite foule s'est rassemblée à l'extérieur, demandant des réponses sur les raisons pour lesquelles je construis des choses si clairement impies.;Auf Unwissende können die Vorrichtungen im Labor beängstigend und fremdartig wirken. Es hat sich herumgesprochen, welch ungewöhnliche Vorrichtungen für mein Labor gefertigt wurden. Draußen hat sich eine kleine Meute versammelt, die Auskunft darüber fordert, warum ich solche gottlosen Dinge baue.;;Para los ignorantes, el material de laboratorio puede parecer aterrador y extraño. Se comenta que algunos de los artilugios fabricados para mi laboratorio son poco usuales. Una pequeña muchedumbre se ha reunido fuera y exigen respuestas sobre por qué estoy fabricando cosas tan impías.;;;;;;;;;x
EVTDESC_MNM_1115;Disaster has struck! An increasingly foul stench from the kitchen area made the guards investigate my stores of alchemical ingredients. I have been focusing so much on the work of assembling my laboratory that the ingredients have begun to rot!;La catastrophe a frappé ! Une puanteur de plus en plus nauséabonde émanant de la cuisine a fait enquêter les gardes sur mes réserves d'ingrédients alchimiques. Je me suis tellement concentré sur le travail d'assemblage de mon laboratoire que les ingrédients ont commencé à pourrir !;Ein Unheil ist geschehen! Ein immer übler werdender Gestank aus dem Bereich der Küche hat die Wachen dazu bewegt, meine Vorräte an alchemistischen Zutaten zu untersuchen. Ich war dermaßen in die Arbeit vertieft gewesen, mein Labor zusammenzustellen, dass die Zutaten zu vergammeln begonnen haben!;;¡Es una catástrofe! Un hedor cada vez mayor proveniente de la zona de la cocina ha provocado que los guardias investiguen mi despensa de ingredientes alquímicos. ¡Me he centrado tanto en montar mi laboratorio que los ingredientes se han empezado a pudrir!;;;;;;;;;x
EVTDESC_MNM_1121;To [Root.GetSocietyRank] [Root.GetFirstName],\n\nIt has come to my attention that you still lack a proper office of Alchemy! How can you hope to uncover the secrets of [Root.GetHermesThriceBlessed], without the proper tools or staff? You should build one or your work will fade into obscurity.\n\nAs above, so below.\nSigned, [hermetic_collaborator.GetSocietyRank] [hermetic_collaborator.GetFirstName];[Root.GetSocietyRank] [Root.GetFirstName],\nJ'ai appris que vous manquiez toujours d'une salle d'alchimie convenable ! Comment pouvez espérer découvrir les secrets d'[Root.GetHermesThriceBlessed], sans les outils appropriés ni le personnel. Vous devriez en construire une ou vos travaux tomberont dans l'oubli.\nCe qui est en haut, tel est en bas.\nSigné, [hermetic_collaborator.GetSocietyRank] [hermetic_collaborator.GetFirstName];An [Root.GetSocietyRank] [Root.GetFirstName],\nmir kam zu Ohren, dass Ihr noch immer kein geeignetes Alchemielabor habt! Ich kann nicht begreifen, wie Ihr Euch ohne geeignete Werkzeuge oder Gehilfen erhoffen könnt, die Geheimnisse von [Root.GetHermesThriceBlessed] zu entschleiern. Mein Labor erregt den Neid jedes Gelehrten und ist im Lauf der Zeit zu einem zweiten Zuhause für mich geworden. Ihr solltet es mir gleichtun, sonst wird Eure Arbeit schon bald in Vergessenheit geraten.\n\nWie oben, so unten\nGezeichnet, [hermetic_collaborator.GetSocietyRank] [hermetic_collaborator.GetFirstName];;[Root.GetSocietyRank] [Root.GetFirstName]:\n\n¡Ha llegado a mi conocimiento que aún te falta un laboratorio de alquimia adecuado! Ni siquiera yo logro comprender cómo esperas desvelar los secretos de [Root.GetHermesThriceBlessed] sin las herramientas o el personal adecuados. Mi laboratorio es la envidia de cualquier hombre docto, y se ha convertido en un hogar para mí. Deberías tratar de imitarme, o tu trabajo se sumirá en el olvido.\n\nComo arriba, es abajo.\nFirmado: [hermetic_collaborator.GetSocietyRank] [hermetic_collaborator.GetFirstName];;;;;;;;;x
EVTDESC_MNM_1121_apprentice;To [Root.GetSocietyRank] [Root.GetFirstName],\n\nMaster, I feel we are both held back by the lack of a proper office of Alchemy. If we are to uncover the secrets of [Root.GetHermesThriceBlessed], we will need the proper tools and work space. Unless you build a laboratory or our work here will fade into obscurity.\n\nAs above, so below.\nSigned, [hermetic_collaborator.GetSocietyRank] [hermetic_collaborator.GetFirstName];[Root.GetSocietyRank] [Root.GetFirstName],\nJe sens que nous sommes tous deux freinés par l'absence d'un bureau d'alchimie convenable. Si nous voulons découvrir les secrets d'[Root.GetHermesThriceBlessed], nous aurons besoin des outils appropriés et d'un espace de travail. À moins que vous construisiez un laboratoire, vos travaux tomberont dans l'oubli.\n\nCe qui est en haut, tel est en bas.\nSigné, [hermetic_collaborator.GetSocietyRank] [hermetic_collaborator.GetFirstName];An [Root.GetSocietyRank] [Root.GetFirstName],\nMeister, ich finde, dass wir beide durch den Mangel eines richtigen Alchemielabors gehemmt werden. Wenn wir die Geheimnisse von [Root.GetHermesThriceBlessed] ergründen wollen, brauchen wir die richtigen Werkzeuge und den nötigen Arbeitsraum. Baut ein Labor, sonst wird unsere Arbeit hier schon bald in Vergessenheit geraten.\n\nWie oben, so unten.\n[hermetic_collaborator.GetSocietyRank] [hermetic_collaborator.GetFirstName];;[Root.GetSocietyRank] [Root.GetFirstName]:\n\nMaestr[Root.GetOA], siento que la falta de un laboratorio de alquimia adecuado nos está limitando. Si pretendemos desvelar los secretos de [Root.GetHermesThriceBlessed], necesitaremos las herramientas y el espacio de trabajo adecuados. A menos que construyas un laboratorio, nuestro trabajo quedará sumido en el olvido.\n\nComo arriba, es abajo.\nFirmado: [hermetic_collaborator.GetSocietyRank] [hermetic_collaborator.GetFirstName];;;;;;;;;x
EVTDESC_MNM_1122_normal;With a laboratory of my own I can proceed to perform greater works than ever before. How I ever got by without a dedicated workspace and the right tools I will never understand. The secrets of [Root.GetHermesThriceBlessed], shall be mine!;Avec mon propre laboratoire, je peux réaliser des travaux plus grands que jamais. Comment ai-je pu me passer d'un espace de travail dédié et des bons outils ? Je ne le comprendrai jamais. Les secrets d'[Root.GetHermesThriceBlessed] seront à moi !;Mit einem eigenen Labor kann ich größere Werke als je zuvor verrichten. Ich werde nie verstehen, wie ich jemals ohne einen speziellen Arbeitsraum und ohne die richtigen Werkzeuge zurande kommen konnte. Die Geheimnisse von [Root.GetHermesThriceBlessed] werden mein sein!;;Con un laboratorio propio, puedo seguir realizando trabajos más extraordinarios que nunca. No sé cómo he podido trabajar sin un espacio apropiado y sin las herramientas adecuadas. ¡Los secretos de [Root.GetHermesThriceBlessed] serán míos!;;;;;;;;;x
EVTDESC_MNM_1122_rich;My new laboratory is the envy of both those that now live and all that came before me. I dare say even [Root.GetHermesThriceBlessed], himself would be impressed by the setup I now employ to uncover the hidden secrets of matter and spirit.;Mon nouveau laboratoire est envié par tous les vivants et tous ceux qui ont vécu avant moi. J'ose même dire qu'[Root.GetHermesThriceBlessed] serait lui-même impressionné par les installations que j'utilise maintenant pour découvrir les secrets cachés de la matière et de l'esprit.;Mein neues Labor erregt den Neid meiner Zeitgenossen und meiner Vorgänger zugleich. Ich wage zu behaupten, dass sogar [Root.GetHermesThriceBlessed] selbst von der Einrichtung beeindruckt wäre, die ich jetzt dazu nutze, die verborgenen Geheimnisse von Materie und Geist zu ergründen.;;Mi laboratorio nuevo es la envidia tanto de aquellos que viven como de los que vinieron antes que yo. Casi me atrevo a decir que el propio [Root.GetHermesThriceBlessed] estaría impresionado por las herramientas que empleo actualmente para desvelar los secretos ocultos de la materia y del espíritu.;;;;;;;;;x
