#CODE;ENGLISH;FRENCH;GERMAN;;SPANISH;;;;;;;;;x
EVTDESC_MNM_1423;Our expedition into foreign lands encountered some difficulties, but in the end we made it to the ruins of [ruin_site.GetName] safely. After a fortnight of excavation the servants uncovered the entrance to a hidden underground chamber. [hermetic_collaborator.GetSocietyRank] [hermetic_collaborator.GetFirstName] and I entered side by side, the air heavy with excitement.;Notre expédition en terre étrangère a rencontré quelques difficultés, mais nous avons finalement atteint les ruines de [ruin_site.GetName] sains et saufs. Après une quinzaine de fouilles, mes serviteurs ont découvert l'entrée d'une salle souterraine cachée. [hermetic_collaborator.Get_Le_SocietyRank] [hermetic_collaborator.GetFirstName] et moi sommes entrés côte à côte, dans une atmosphère pesante à cause de l'excitation.;Wir stießen bei unserer Expedition in ferne Länder zwar auf einige Schwierigkeiten, doch am Ende erreichten wir wohlbehalten die Ruinen von [ruin_site.GetName]. Nach vierzehntägigen Ausgrabungen entdeckten die Diener den Eingang zu einer versteckten unterirdischen Kammer. [hermetic_collaborator.GetSocietyRank] [hermetic_collaborator.GetFirstName] und ich wagten uns in ihr Inneres, gespannt, was uns dort erwarten würde.;;Nuestra expedición a tierras extranjeras sufrió algunos contratiempos, pero al final logramos llegar a [ruin_site.GetName] a salvo. Tras dos semanas de excavaciones, los sirvientes despejaron la entrada a una cámara escondida bajo tierra. [hermetic_collaborator.GetSocietyRank] [hermetic_collaborator.GetFirstName] y yo entramos. El aire estaba cargado de emoción.;;;;;;;;;x
EVTDESC_MNM_1424;The bribe we offered the [temple_site.Holder.Religion.GetPriestTitle] of [temple_site.GetName] was enough to make [temple_site.Holder.GetHerHim] unlock the inner chambers of the [temple_site.Holder.GetHouseOfWorship]. We examined every nook and cranny for clues of the scroll's hiding place. On the fifth day, one of the servants announced [Root.GetSheHe] had found a hidden chamber...;Le pot-de-vin que nous avons offert au [temple_site.Holder.Religion.GetPriestTitle] de [temple_site.GetName] était suffisant pour qu'il déverrouille les portes [temple_site.Holder.GetHouseOfWorshipDuDela]. Nous avons examiné chaque recoin pour trouver des indices de la cachette du rouleau. Le cinquième jour, un des serviteurs a annoncé avoir trouvé une salle cachée...;Das Bestechungsgeld, das wir dem/der [temple_site.Holder.Religion.GetPriestTitle] in [temple_site.GetName] angeboten hatten, reichte aus, um [temple_site.Holder.GetHerHim] zu veranlassen, uns Einlass zu den inneren Bereichen [temple_site.Holder.GetHouseOfWorshipdesder] zu gewähren. Wir durchsuchten jeden Winkel, um Anhaltspunkte zum Versteck der Schriftrolle zu finden. Am fünften Tag verkündete einer der Diener, dass [Root.GetSheHe] eine versteckte Kammer gefunden hätte...;;El soborno que ofrecimos al/a la [temple_site.Holder.Religion.GetPriestTitle] de [temple_site.GetName] bastó para que nos abriera la recámara del/de la [temple_site.Holder.GetHouseOfWorship]. Examinamos cada recoveco y cada grieta en busca de pistas sobre el escondite del pergamino. Al quinto día, uno de los sirvientes anunció que había encontrado una cámara secreta...;;;;;;;;;x
EVTDESC_MNM_1425;[hermetic_collaborator.GetSocietyRank] [hermetic_collaborator.GetFirstName] and I searched every shelf and chest in the dusty old shop. For days on end we did nothing but breathe dust and leaf through boring old texts. They were all full of nonsense! On the fourth day, I was thus incredibly surprised to lay my eyes on the symbols of the Three Primes!;[hermetic_collaborator.GetSocietyRank] [hermetic_collaborator.GetFirstName] et moi avons fouillé chaque étagère et chaque coffre dans la vieille boutique poussiéreuse. Pendant des jours, nous n'avons fait que respirer de la poussière et feuilleter de vieux textes ennuyeux. Ils étaient remplis de bêtises ! Le quatrième jour, j'étais donc incroyablement surpris[Root.Get_E] de tomber sur les symboles des Trois Principaux !;[hermetic_collaborator.GetSocietyRank] [hermetic_collaborator.GetFirstName] und ich durchsuchten jedes Fach und jede Truhe in dem staubigen, alten Laden. Tagelang atmeten wir den Staub alter Schriftrollen, als wir uns durch alte, langatmige Texte kämpften. Sie enthalten nichts weiter als Unsinn! Insofern war ich aufs Höchste überrascht, als ich am vierten Tag tatsächlich auf die Symbole der drei Urmaterien stieß!;;[hermetic_collaborator.GetSocietyRank] [hermetic_collaborator.GetFirstName] y yo buscamos por cada estante y cofre de la vieja y polvorienta tienda. Durante varios días, no respiramos nada más que polvo y páginas de viejos y aburridos libros. ¡Estaban llenos de sandeces! Al cuarto día, me sorprendió enormemente posar la mirada sobre los símbolos de las Tres Bases.;;;;;;;;;x
EVTDESC_MNM_1426_A;My misgivings arose early after our arrival in Alexandria, but [hermetic_collaborator.GetSocietyRank] [hermetic_collaborator.GetFirstName] insisted that we must have misinterpreted the map. After every failure, [hermetic_collaborator.GetSheHe] had a new idea. A suspicion crept upon me... What if the map was forged, and [hermetic_collaborator.GetFirstName] knew? Was the blasted expedition a plot to ruin me?!;Mes inquiétudes se sont manifestées peu de temps après notre arrivée à Alexandrie, mais [hermetic_collaborator.Get_le_SocietyRank] [hermetic_collaborator.GetFirstName] a affirmé que nous avions mal interprété la carte. Après chaque échec, [hermetic_collaborator.GetIlElle] avait une nouvelle idée. J'ai commencé à avoir des soupçons... Et si la carte était falsifiée, et que [hermetic_collaborator.GetFirstName] le savait ? Serait-ce un complot visant à me ruiner ?;Mein Ungemach begann schon nach unserer Ankunft in Alexandria, aber [hermetic_collaborator.GetSocietyRank] [hermetic_collaborator.GetFirstName] bestand darauf, dass wir die Karte missverstanden hatten. Jedes Mal, wenn wir scheiterten, hatte [hermetic_collaborator.GetSheHe] eine neue Idee. In mir regte sich ein Verdacht... Was, wenn die Karte eine Fälschung wäre und [hermetic_collaborator.GetFirstName] mich mit dieser Expedition ruinieren will?;;Yo había empezado a dudar poco después de llegar a Alejandría, pero [hermetic_collaborator.GetSocietyRank] [hermetic_collaborator.GetFirstName] insistía en que debíamos de habernos equivocado al interpretar el mapa. Después de cada fracaso, a [hermetic_collaborator.GetFirstName] se le ocurría otra idea. Comencé a sospechar... ¿Y si el mapa era falso y [hermetic_collaborator.GetFirstName] lo sabía? ¡¿Era esta expedición condenada al fracaso un complot para arruinarme?!;;;;;;;;;x
EVTDESC_MNM_1426_B;Our expedition into foreign lands certainly encountered its fair share of difficulties. We dealt with everything from unfavorable weather to lame horses, but in the end, the fraudulent guide was the nail in the coffin. When [Root.GetSheHe] escaped with our last gold, we also discovered that we were in the wrong part of [ruin_site.Holder.TopLiege.PrimaryTitle.GetName]!;Notre expédition à l'étranger a inévitablement eu sa part de difficultés, allant du mauvais temps aux chevaux boiteux. Cependant, [Root.GetLeLa] guide frauduleu[Root.GetXSe] fut le coup de grâce. Quand [Root.GetIlElle] s'est enfui[Root.Get_E] avec le reste de notre argent, nous avons également découvert que nous n'étions pas au bon endroit [ruin_site.Holder.TopLiege.PrimaryTitle.Get_en_Realm] !;Unsere Expedition in ferne Länder hatte unbestreitbar mit so mancher Widrigkeit zu kämpfen gehabt. Für alles hatten wir eine Lösung gefunden, für schlechtes Wetter, für lahmende Pferde, doch letztlich war es der betrügerische Führer, der unser Schicksal besiegelte. Als [Root.GetSheHe] sich mit dem Rest unseres Goldes aus dem Staub machte, mussten wir zudem feststellen, dass wir uns im falschen Teil von [ruin_site.Holder.TopLiege.PrimaryTitle.GetName] befanden!;;No cabe duda de que nuestra expedición a tierras extranjeras había atravesado bastantes adversidades. Sufrimos de todo, desde mal tiempo hasta caballos cojos, pero que el guía fuese un fraude era el colmo. Cuando escapó con el último oro que nos quedaba, también descubrimos que estábamos en la peor zona de [ruin_site.Holder.TopLiege.PrimaryTitle.GetName].;;;;;;;;;x
EVTDESC_MNM_1426_C;The bribe we offered the [temple_site.Holder.Religion.GetPriestTitle] of [temple_site.GetName] was enough to make [temple_site.Holder.GetHerHim] unlock the inner chambers of the [temple_site.Holder.GetHouseOfWorship]. We examined every nook and cranny for clues of the scroll's hiding place. After a week of nothing more interesting than the discovery of a stash of lewd letters, we had to admit defeat.;Le pot-de-vin que nous avons offert au [temple_site.Holder.Religion.GetPriestTitle] de [temple_site.GetName] était suffisant pour qu'il déverrouille les portes [temple_site.Holder.GetHouseOfWorshipDuDela]. Nous avons examiné chaque recoin pour trouver des indices de la cachette du rouleau. Au bout d'une semaine avec rien de plus intéressant que la découverte d'une cachette de lettres obscènes, nous avons dû admettre la défaite.;Das Bestechungsgeld, das wir dem/der [temple_site.Holder.Religion.GetPriestTitle] in [temple_site.GetName] angeboten hatten, reichte aus, um [temple_site.Holder.GetHerHim] zu veranlassen, uns Einlass zu den inneren Bereichen [temple_site.Holder.GetHouseOfWorshipdesder] zu gewähren. Wir durchsuchten jeden Winkel, um Anhaltspunkte zum Versteck der Schriftrolle zu finden. Nachdem wir eine Woche gesucht und nichts als einen Stapel unzüchtiger Briefe gefunden hatten, mussten wir uns unser Scheitern eingestehen.;;El soborno que ofrecimos al/a la [temple_site.Holder.Religion.GetPriestTitle] de [temple_site.GetName] bastó para que nos abriera la recámara del/de la [temple_site.Holder.GetHouseOfWorship]. Examinamos cada recoveco y cada grieta en busca de pistas sobre el escondite del pergamino. Después de una semana sin ningún descubrimiento más interesante que el de un fajo de cartas lascivas, tuvimos que admitir nuestra derrota.;;;;;;;;;x
EVTDESC_MNM_1426_D;[hermetic_collaborator.GetSocietyRank] [hermetic_collaborator.GetFirstName] and I searched every shelf and chest in the dusty old shop. For days at end we did nothing but breathe dust and page through boring old texts. They were all full of nonsense! After a week, we had to admit defeat. We would never uncover anything of worth in this place.;[hermetic_collaborator.GetSocietyRank] [hermetic_collaborator.GetFirstName] et moi avons fouillé chaque étagère et chaque coffre dans la vieille boutique poussiéreuse. Pendant des jours, nous n'avons fait que respirer de la poussière et feuilleter de vieux textes ennuyeux. Ils étaient remplis de bêtises ! Au bout d'une semaine, nous avons dû admettre notre défaite. Nous ne découvririons rien de valeur dans cet endroit.;[hermetic_collaborator.GetSocietyRank] [hermetic_collaborator.GetFirstName] und ich durchsuchten jedes Fach und jede Truhe in dem staubigen, alten Laden. Tagelang atmeten wir den Staub alter Schriftrollen, als wir uns durch alte, langatmige Texte wühlten. Sie enthalten nichts weiter als Unsinn! Nach einer Woche mussten wir uns unser Scheitern eingestehen. Hier würden wir niemals etwas von Wert finden.;;[hermetic_collaborator.GetSocietyRank] [hermetic_collaborator.GetFirstName] y yo buscamos por cada estante y cofre de la vieja y polvorienta tienda. Durante días no respiramos nada más que polvo y páginas de viejos y aburridos libros. ¡Estaban llenos de sandeces! Una semana después, tuvimos que admitir nuestra derrota. Nunca descubriríamos nada de valor en este lugar.;;;;;;;;;x
EVTDESC_MNM_1431_A;To [Root.GetCollaboratorHermeticsRank] [Root.GetFirstName],\n\n[infiltration_target.GetSocietyRank] [infiltration_target.GetFirstName] is a pompous, featherbrained scoundrel – you know it to be true, [Root.GetSisterBrother]! It is time for [infiltration_target.GetHerHim] to pay for [infiltration_target.GetHerHis] sins. Let us ruin [infiltration_target.GetHerHis] laboratory and steal [infiltration_target.GetHerHis] secrets!\n\nAs above, so below.\nSigned, [hermetic_collaborator.GetSocietyRank] [hermetic_collaborator.GetFirstName];[Root.GetCollaboratorHermeticsRank] [Root.GetFirstName],\n[infiltration_target.GetSocietyRank] [infiltration_target.GetFirstName] est une fripouille pontifiante sans cervelle – vous savez que c'est vrai, m[Root.GetOnA] [Root.GetSisterBrother] ! Il est temps pour [infiltration_target.GetLuiElle] de payer pour ses péchés. Allons ruiner son laboratoire et voler ses secrets !\n\nCe qui est en haut, tel est en bas.\nSigné, [hermetic_collaborator.GetSocietyRank] [hermetic_collaborator.GetFirstName];An [Root.GetCollaboratorHermeticsRank] [Root.GetFirstName],\n[infiltration_target.GetSocietyRank] [infiltration_target.GetFirstName] ist ein prunksüchtiger Schurke und ein Spatzenhirn. Das wisst Ihr ebenso gut wie ich, liebe[Root.GetrMale] [Root.GetSisterBrother]! Es ist an der Zeit, dass [infiltration_target.GetSheHe] für [infiltration_target.GetHerHis]e Sünden bezahlt. Lasst uns [infiltration_target.GetHerHis] Labor zerstören und alle darin aufbewahrten Geheimnisse stehlen!\n\nWie oben, so unten.\n[hermetic_collaborator.GetSocietyRank] [hermetic_collaborator.GetFirstName];;[Root.GetCollaboratorHermeticsRank] [Root.GetFirstName]:\n\n¡[infiltration_target.GetSocietyRank] [infiltration_target.GetFirstName] es una rata pomposa e ignorante, y tú lo sabes, [Root.GetSisterBrother]! Es hora de que pague por sus pecados. ¡Arruinemos su laboratorio y robemos sus secretos!\n\nComo arriba, es abajo.\nFirmado: [hermetic_collaborator.GetSocietyRank] [hermetic_collaborator.GetFirstName];;;;;;;;;x
EVTDESC_MNM_1431_B;To [Root.GetCollaboratorHermeticsRank] [Root.GetFirstName],\n\nMy friend, we have a common nemesis. You know of whom I speak – the despicable idiot [infiltration_target.GetSocietyRank] [infiltration_target.GetFirstName]! The thought of [infiltration_target.GetHerHim] being a member of our respectable community... it makes me sick! Let us ruin [infiltration_target.GetHerHis] laboratory and steal [infiltration_target.GetHerHis] secrets!\n\nAs above, so below.\nSigned, [hermetic_collaborator.GetSocietyRank] [hermetic_collaborator.GetFirstName];[Root.GetCollaboratorHermeticsRank] [Root.GetFirstName],\nCh[Root.GetErEre] ami[Root.Get_E], nous avons une bête noire en commun. Vous savez de qui je veux parler – [infiltration_target.Get_le_SocietyRank] [infiltration_target.GetFirstName], c[infiltration_target.GetEEtte] méprisable idiot[infiltration_target.Get_E] ! Savoir qu'[infiltration_target.GetIlElle] est membre de notre respectable communauté me rend malade. Allons ruiner son laboratoire et voler ses secrets !\n\nCe qui est en haut, tel est en bas.\nSigné, [hermetic_collaborator.GetSocietyRank] [hermetic_collaborator.GetFirstName];An [Root.GetCollaboratorHermeticsRank] [Root.GetFirstName],\nliebe[Root.GetrMale] Freund[Root.GetinFemale], wir haben einen gemeinsamen Erzfeind. Von welchem abscheulichen Idioten ich spreche, könnt Ihr Euch sicherlich denken: von [infiltration_target.GetSocietyRank] [infiltration_target.GetFirstName]! Allein der Gedanke, dass [infiltration_target.GetSheHe] Mitglied in unserer ehrenwerten Gemeinschaft sein könnte, bereitet mir Übelkeit! Lasst uns [infiltration_target.GetHerHis] Labor zerstören und alle darin aufbewahrten Geheimnisse stehlen!\n\nWie oben, so unten.\n[hermetic_collaborator.GetSocietyRank] [hermetic_collaborator.GetFirstName];;[Root.GetCollaboratorHermeticsRank] [Root.GetFirstName]:\n\nCompartimos un mismo enemigo. Sabes a quién me refiero: ¡a esa rata despreciable de [infiltration_target.GetSocietyRank] [infiltration_target.GetFirstName]! Solo de pensar que pertenece a nuestra respetable sociedad... ¡No puedo soportarlo! ¡Arruinemos su laboratorio y robemos sus secretos!\n\nComo arriba, es abajo.\nFirmado: [hermetic_collaborator.GetSocietyRank] [hermetic_collaborator.GetFirstName];;;;;;;;;x
EVTDESC_MNM_1431_C;To [Root.GetCollaboratorHermeticsRank] [Root.GetFirstName],\n\n[infiltration_target.GetSocietyRank] [infiltration_target.GetFirstName] is a greedy, slothful idiot who deserves none of the riches in [infiltration_target.GetHerHis] possession. What do you say, [Root.GetSisterBrother] – shall we raid [infiltration_target.GetHerHis] laboratory and claim that which should be ours?\n\nAs above, so below.\n\nSigned, [hermetic_collaborator.GetSocietyRank] [hermetic_collaborator.GetFirstName];[Root.GetCollaboratorHermeticsRank] [Root.GetFirstName],\n[infiltration_target.GetSocietyRank] [infiltration_target.GetFirstName] est un[infiltration_target.Get_E] idiot[infiltration_target.Get_E] paresseu[infiltration_target.GetXSe] et avare qui ne mérite aucune des richesses en sa possession. Qu'en dites-vous, m[Root.GetOnA] [Root.GetSisterBrother] – allons-nous piller son laboratoire et prendre ce qui devrait être nôtre ?\n\nCe qui est en haut, tel est en bas.\nSigné, [hermetic_collaborator.GetSocietyRank] [hermetic_collaborator.GetFirstName];An [Root.GetCollaboratorHermeticsRank] [Root.GetFirstName],\n[infiltration_target.GetSocietyRank] [infiltration_target.GetFirstName] ist strohdumm, und gierig und faul noch dazu. Nichts von dem, was sich in [infiltration_target.GetHerHis]em Besitz befindet, verdient [infiltration_target.GetSheHe]. Was meint Ihr, liebe[Root.GetrMale] [Root.GetSisterBrother] – sollen wir [infiltration_target.GetHerHis] Labor überfallen und uns holen, was eigentlich uns gehören müsste?\n\nWie oben, so unten.\n[hermetic_collaborator.GetSocietyRank] [hermetic_collaborator.GetFirstName];;[Root.GetCollaboratorHermeticsRank] [Root.GetFirstName]:\n\n[infiltration_target.GetSocietyRank] [infiltration_target.GetFirstName] es una persona idiota e indolente, la pura imagen de la mezquindad, que no merece ninguna de las riquezas que posee. ¿Qué me dices, [Root.GetSisterBrother], asaltamos su laboratorio y reclamamos lo que debería ser nuestro?\n\nComo arriba, es abajo.\n\nFirmado: [hermetic_collaborator.GetSocietyRank] [hermetic_collaborator.GetFirstName];;;;;;;;;x
EVTDESC_MNM_1433;Most esteemed [Root.GetCollaboratorHermeticsRank] [Root.GetFirstName],\n\nYet my spies have not found the exact location of [infiltration_target.GetSocietyRank] [infiltration_target.GetFirstName]'s laboratory. You need not worry, friend, for they have some promising leads. We will just have to be patient.\n\nAs above, so below.\nSigned, [infiltration_companion.GetSocietyRank] [infiltration_companion.GetFirstName];Très estimé[Root.Get_E] [Root.GetCollaboratorHermeticsRank] [Root.GetFirstName],\nMes espions n'ont pas trouvé la localisation exacte du laboratoire [infiltration_target.Get_du_SocietyRank] [infiltration_target.GetFirstName]. Vous n'avez pas besoin de vous inquiéter, car ils ont des pistes prometteuses. Nous devons juste être patients.\n\nCe qui est en haut, tel est en bas.\nSigné, [infiltration_companion.GetSocietyRank] [infiltration_companion.GetFirstName];Verehrte[Root.GetrMale] [Root.GetCollaboratorHermeticsRank] [Root.GetFirstName],\nbislang konnten meine Spione den genauen Standort des Labors von [infiltration_target.GetSocietyRank] [infiltration_target.GetFirstName] noch nicht ermitteln. Doch seid unbesorgt, werter Freund, denn vielversprechende Anhaltspunkte sind durchaus vorhanden. Wir müssen einfach Geduld haben.\n\nWie oben, so unten.\n[infiltration_companion.GetSocietyRank] [infiltration_companion.GetFirstName];;Estimadísim[Root.GetOA] [Root.GetCollaboratorHermeticsRank] [Root.GetFirstName]:\n\nMis espías aún no han logrado encontrar la ubicación exacta del laboratorio de [infiltration_target.GetSocietyRank] [infiltration_target.GetFirstName]. Pero no te preocupes, porque tienen varias pistas prometedoras. Solo debemos tener paciencia.\n\nComo arriba, es abajo.\nFirmado: [infiltration_companion.GetSocietyRank] [infiltration_companion.GetFirstName];;;;;;;;;x
EVTDESC_MNM_1435_A;[infiltration_target.GetSocietyRank] [infiltration_target.GetFirstName] must be paranoid, for [infiltration_target.GetHerHis] laboratory is a fortress hidden away on a remote island. As we cross the dark waters under the cover of night, [infiltration_companion.GetFirstName] tells me about the guard rotation. We will only have one chance to breach the defenses.;[infiltration_target.GetSocietyRank] [infiltration_target.GetFirstName] doit être paranoïaque pour que ce son laboratoire soit une forteresse sur une île éloignée. Alors que nous traversons les eaux sombres au milieu de la nuit, [infiltration_companion.GetFirstName] me parle de la rotation des gardes. Nous n'aurons qu'une seule chance de nous engouffrer dans la brèche.;[infiltration_target.GetSocietyRank] [infiltration_target.GetFirstName] muss wirklich paranoid sein, denn [infiltration_target.GetHerHis] Labor ähnelt einer Festung und befindet sich versteckt auf einer abgelegenen Insel. Als wir im Schutze der Nacht auf schwarzer See zur Insel übersetzen, informiert mich [infiltration_companion.GetFirstName] über den Turnus der Wachwechsel. Wir werden nur einen einzigen Versuch haben, die Sicherheitsvorkehrungen zu überwinden.;;La paranoia de [infiltration_target.GetSocietyRank] [infiltration_target.GetFirstName] es preocupante, su laboratorio está oculto en una isla remota. Mientras cruzamos las oscuras aguas bajo el manto de la noche, [infiltration_companion.GetFirstName] me habla de los turnos de guardia. Solo tendremos una oportunidad de burlar la vigilancia.;;;;;;;;;x
EVTDESC_MNM_1435_B;[infiltration_target.GetSocietyRank] [infiltration_target.GetFirstName] has hidden [infiltration_target.GetHerHis] laboratory deep in the dungeons of [infiltration_target.Capital.GetName]. [infiltration_companion.GetFirstName] and I have passed unnoticed so far thanks to the intelligence [infiltration_companion.GetHerHis] spies provided, but the last door is heavily guarded.;[infiltration_target.GetSocietyRank] [infiltration_target.GetFirstName] a caché son laboratoire au fond de son donjon à [infiltration_target.Capital.GetName]. [infiltration_companion.GetFirstName] et moi sommes passés inaperçus grâce aux renseignements que ses espions nous ont fournis, mais la dernière porte est très bien gardée.;[infiltration_target.GetSocietyRank] [infiltration_target.GetFirstName] hat [infiltration_target.GetHerHis] Labor tief in den Gewölben unterhalb von [infiltration_target.Capital.GetName] eingerichtet. [infiltration_companion.GetFirstName] und ich konnten dank der Informationen, die uns die Spione lieferten, unbemerkt bis hierher vordringen, doch die letzte Tür ist schwer bewacht.;;[infiltration_target.GetSocietyRank] [infiltration_target.GetFirstName] ha ocultado su laboratorio en las recónditas mazmorras de [infiltration_target.Capital.GetName]. [infiltration_companion.GetFirstName] y yo hemos pasado desapercibidos hasta ahora gracias a la información que nos proporcionaron sus espías, pero la última puerta está celosamente custodiada.;;;;;;;;;x
EVTDESC_MNM_1435_C;It was not hard to locate [infiltration_target.GetSocietyRank] [infiltration_target.GetFirstName]'s laboratory, [infiltration_companion.GetFirstName] tells me as we enter the [infiltration_target.Capital.GetHolding]. 'While old [infiltration_target.GetFirstName] has no talent for keeping secrets, [infiltration_target.GetSheHe] does know how to hire proper guards,' [infiltration_companion.GetSheHe] continues, telling me about the obstacle ahead.;« Ce ne fut pas difficile de localiser précisément le laboratoire [infiltration_target.Get_du_SocietyRank] [infiltration_target.GetFirstName] », me dit [infiltration_companion.GetFirstName] alors que nous entrons dans [infiltration_target.Capital.GetHolding]. « Bien que [infiltration_target.GetFirstName] n'a pas de talent pour garder des secrets, [infiltration_target.GetIlElle] sait comment embaucher de bons gardes », poursuit-[infiltration_companion.GetIlElle], me parlant des obstacles qui se trouvent devant nous.;Es sei nicht schwer gewesen, das Labor von [infiltration_target.GetSocietyRank] [infiltration_target.GetFirstName] zu finden, teilt [infiltration_companion.GetFirstName] mir mit, als wir im/in der [infiltration_target.Capital.GetHolding] ankommen. "Auch wenn [infiltration_target.Getderdie] alte [infiltration_target.GetFirstName] kein Talent zum Bewahren von Geheimnissen hat, wie man brauchbare Wachen anheuert, das weiß [infiltration_target.GetSheHe]", fährt [infiltration_companion.GetSheHe] fort und berichtet mir, welche Hindernisse uns erwarten.;;"No fue difícil localizar el laboratorio de [infiltration_target.GetSocietyRank] [infiltration_target.GetFirstName], me dice [infiltration_companion.GetFirstName] mientras entramos en el/la [infiltration_target.Capital.GetHolding]. Aunque [infiltration_target.GetFirstName] no sabe guardar un secreto, sí que sabe contratar buenos guardias", dice antes de hablarme del obstáculo que nos espera más adelante.";;;;;;;;;x
