#CODE;ENGLISH;FRENCH;GERMAN;;SPANISH;;;;;;;;;x
EVTDESC_JD_70008;Soon after writing to the Chinese Emperor, an emissary arrived with several guards however [escaped_chinese_noble.GetFullName] had escaped the night before! Someone must have warned [escaped_chinese_noble.GetHerHim]. All the emissary said before he left was: "The Emperor will be... displeased";Vous veniez à peine d'écrire à l'Empereur chinois, lorsqu'un émissaire est arrivé avec plusieurs gardes. Cependant, [escaped_chinese_noble.GetFullName] s'était échappé[escaped_chinese_noble.Get_E] durant la nuit ! Quelqu'un a dû l'avoir prévenu. Tout ce qu'a dit le diplomate avant de partir, c'était que « l'Empereur allait être... contrarié ».;Kurz nach Eurem Schreiben an den chinesischen Kaiser kam ein Abgesandter mit mehreren Wachen an. [escaped_chinese_noble.GetFullName] ist allerdings in der letzten Nacht geflohen! Jemand muss [escaped_chinese_noble.GetHerHim] gewarnt haben. Alles, was der Gesandte noch gesagt hat, bevor er abreiste, war: "Der Kaiser wird äußerst... ungehalten sein.";;"Poco después de escribir al emperador chino, un emisario llega con varios guardias, ¡pero [escaped_chinese_noble.GetFullName] escapó la noche anterior! Alguien le habrá avisado. Lo único que dice el emisario antes de irse es: ""El emperador se sentirá… contrariado""";;;;;;;;x;
EVTDESC_JD_70009;[escaped_chinese_noble.GetFullName] was found dead in [escaped_chinese_noble.GetHerHis] room this morning, strangled to death with a length of the finest Chinese Silk. The killer was nowhere to be found but I'm sure I know who is responsible.;[escaped_chinese_noble.GetFullName] a été retrouvé[escaped_chinese_noble.Get_E] mort[escaped_chinese_noble.Get_E] dans sa chambre ce matin, étranglé[escaped_chinese_noble.Get_E] avec de la belle soie chinoise. Le tueur s'est échappé, mais je sais qui est responsable.;[escaped_chinese_noble.GetFullName] wurde diesen Morgen tot in [escaped_chinese_noble.GetHerHis]em Raum aufgefunden, erdrosselt mit einer Schlinge aus chinesischer Seide. Der Mörder war nirgends zu finden, aber ich bin sicher, ich weiß, wer verantwortlich ist.;;[escaped_chinese_noble.GetFullName] ha muerto en su habitación esta mañana, estrangulado con un cabo de la seda china más fina. No se encontró al asesino, pero estoy seguro de quién es el responsable.;;;;;;;;x;
EVTDESCA_JD_32111;A warm hearth and healthy meals has invigorated the whole company, but after enjoying the hospitality of [target_host.GetTitledFirstName] for some days it's now time to get moving on our path towards [offmap_china.GetName] again.;Un foyer chaud et de bons repas ont revigoré toute la compagnie, mais après avoir profité de l'hospitalité [target_host.Get_du_TitledFirstName] pendant quelques jours, il est temps de repartir vers l'[offmap_china.GetName].;Ein warmer Herd und eine gesunde Mahlzeit hat das ganze Unternehmen belebt, aber nach einigen Tagen des Genießens der Gastfreundschaft ist es nun Zeit, uns wieder Richtung [offmap_china.GetName] aufzumachen.;;Un hogar caliente y comidas sustanciosas han dado fuerzas a todo el grupo, pero tras disfrutar de la hospitalidad de [target_host.GetTitledFirstName] durante unos días, vuelve a ser hora de continuar de nuevo nuestro viaje hacia [offmap_china.GetName].;;;;;;;;;x
EVTDESCA_JD_32113;'Trust is such a delicate thing', I tell my horse galloping away in the dark night, accompanied by the sound of screams and clattering plates while panic ensues behind us. Some of my servants also had to put their life to it for the whole charade to be believable, but that is an acceptable price to pay.;« La confiance est une chose si délicate », dis-je à mon cheval galopant dans la nuit sombre, accompagné des bruits de cris et de vaisselle dus à la panique derrière nous. Certains de mes serviteurs ont dû perdre la vie pour que toute la comédie soit crédible, mais c'est un prix à payer acceptable.;"Vertrauen ist eine heikle Angelegenheit", erzählte ich meinem Pferd, während ich durch die schwarze Nacht galoppierte und dabei von dem Geräusch von Schreien und klirrendem Geschirr begleitet wurde. Einige meiner Diener mussten leider auch ihr Leben für die Sache geben, damit es glaubwürdiger aussah, aber das ist ein akzeptabler Preis.;;'La confianza es algo muy delicado', le digo a mi caballo galopando en la noche, acompañado por el sonido de gritos y platos cayendo al suelo en el pánico resultante. Algunos de mis servidores también tuvieron que pagar con sus vidas para que la farsa fuera creíble, pero es un precio aceptable.;;;;;;;;;x
EVTDESCA_JD_32290;'The [offmap_china.Ruler.GetEmperorEmpress] has kept [offmap_china.Ruler.GetHerHis] eyes on you', the Chief Minister says. '[offmap_china.Ruler.GetSheHeCap] is however very busy and thought it more fitting if you bowed in here instead of the occupied throne room'.;« L'[offmap_china.Ruler.GetEmperorEmpress] a gardé un oeil sur vous », dit le ministre en chef. « [offmap_china.Ruler.GetIlElleCap] est cependant très occupé[offmap_china.Ruler.Get_E] et pensait que ce serait plus pertinent que vous vous incliniez ici plutôt que dans la salle du trône occupée ».;[offmap_china.Ruler.GetDerDie] [offmap_china.Ruler.GetEmperorEmpress] hat [offmap_china.Ruler.GetHerHis]e Augen auf Euch gerichtet", erklärt der Staatsminister. "[offmap_china.Ruler.GetSheHeCap] ist allerdings sehr beschäftigt und würde es begrüßen, wenn Ihr Euch hier anstatt im vollbesetzten Thronsaal verbeugen würdet".;;'El/La [offmap_china.Ruler.GetEmperorEmpress] no os ha perdido de vista', dice el ministro principal'. Sin embargo, muchas son sus ocupaciones, y ha pensado que sería más adecuado que os postréis aquí en lugar sala del trono, tan ocupada'.;;;;;;;;;x
EVTDESCA_JD_32299;I cannot continue on my journey towards [offmap_china.GetFullName] since a state of hostility has occurred.;Je ne peux pas poursuivre mon voyage vers l'[offmap_china.GetFullName] puisque des troubles sont survenus.;Ich kann meine Reise Richtung [offmap_china.GetFullName] nicht fortsetzen, da ein Zustand der Feinseligkeit aufgetreten ist.;;No puedo continuar mi viaje a [offmap_china.GetFullName] porque hay un estado de hostilidad.;;;;;;;;;x
EVTDESCB_JD_32111;The previous days have certainly been a delight. I never imagined that we could have so many things in common. It's with regret that I bid farewell to [target_host.GetTitledFirstName] when we decide to move on towards our goal of [offmap_china.GetName].;Les derniers jours ont été un délice. Je n'aurais jamais imaginé que nous puissions avoir tant de choses en commun. C'est avec regret que nous avons fait nos adieux [target_host.Get_au_TitledFirstName] et décider de reprendre la route pour la [offmap_china.GetName].;Die vergangenen Tage waren eine Erleichterung. Ich hätte nie gedacht, dass wir so viele Gemeinsamkeiten haben könnten. Es betrübt mich zutiefst, dass ich Abschied von [target_host.GetTitledFirstName] nehmen musste, als wir uns entschieden, unsere Reise Richtung [offmap_china.GetName] fortzusetzen.;;Los días pasados han sido una delicia. Nunca imaginé que tendríamos tantas cosas en común. Con pena me despido de [offmap_china.GetName] cuando decidimos seguir hacia nuestro destino de [offmap_china.GetName].;;;;;;;;;x
EVTDESCB_JD_32113;Just as you are about to make your escape into the dead of the night you are apprehended by the Captain of the guard. Sweat started forming on the temples of your head. Any second now.\nThere's the bellowing scream of [target_host.GetTitledFirstName]'s guts exploding. For a split second you notice the shock in the face of the Captain, as someone exclaims that the [target_host.GetTitle] is dead. Then his eyes refocus on you. Without hesitation, the burly man raises his sword and cuts you in half.;Alors que vous êtes sur le point de vous échapper en pleine nuit, vous êtes appréhendé[Root.Get_E] par le capitaine de la garde. La sueur a commencé à se former sur vos tempes. D'ici peu...\nOn entend soudain le hurlement [target_host.Get_du_TitledFirstName] alors que ses tripes explosent. Pendant une fraction de seconde vous percevez l'effroi sur le visage du capitaine, tandis que quelqu'un s'écrie que [target_host.GetLeLa] [target_host.GetTitle] est mort[target_host.Get_E]. Puis ses yeux se recentrent sur vous. Sans hésiter, l'homme dégaine son épée et vous coupe en deux.;Grade als Ihr im Begriff seid, Eure Flucht in die Nacht anzutreten, werdet Ihr vom Hauptmann der Wache erfasst. Schweiß bildete sich auf den Schläfen Eures Kopfes. Jede Sekunde ist es so weit.\nIhr hört einen lauten Schrei, als die Eingeweide von [target_host.GetTitledFirstName] explodierten. Für einen Sekundenbruchteil bemerkt Ihr die Angst im Gesicht des Hauptmanns, als jemand schreit, dass [target_host.Getderdie] [target_host.GetTitle] Tod ist. Dann richtet er seine Augen auf Euch. Ohne zu zögern zieht der stämmige Mann sein Schwert und schneidet Euch in zwei Hälften.;;El capitán de la guardia te detiene cuando estabas a punto de escapar en la noche. Empiezas sudar copiosamente. En cualquier momento…\n[target_host.GetTitledFirstName] grita cuando le estallan las tripas. Por un segundo ves la impresión en el capitán cuando alguien grita que el [target_host.GetTitle] ha muerto. Luego sus ojos se centran en ti. Sin dudarlo, este hombre fornido desenvaina su espada y te parte en dos.;;;;;;;;;x
EVTDESCB_JD_32290;'The [offmap_china.Ruler.GetEmperorEmpress] has kept [offmap_china.Ruler.GetHerHis] eyes on you', the Chief Minister says. 'You may enter the throne room to show your subordination, but be quick about it'.;« L'[offmap_china.Ruler.GetEmperorEmpress] a gardé un oeil sur vous », dit le ministre en chef. « Vous pouvez entrer dans la salle du trône pour montrer votre subordination, mais faites vite ».;[offmap_china.Ruler.GetDerDie] [offmap_china.Ruler.GetEmperorEmpress] hat [offmap_china.Ruler.GetHerHis]e Augen auf Euch gerichtet", erklärt der Staatsminister. "Ihr dürft den Thronsaal betreten und Eure Unterwürfigkeit zeigen, aber macht schnell".;;'El/La [offmap_china.Ruler.GetEmperorEmpress] no os ha perdido de vista', dice el ministro principal. 'Podéis entrar en el salón del trono para mostrar vuestra sumisión pero daos prisa'.;;;;;;;;;x
EVTDESCB_JD_32299;I cannot continue on my journey towards [offmap_china.GetFullName] after they decided to close their borders and oust foreigners.;Je ne peux pas poursuivre mon voyage vers l'[offmap_china.GetFullName] puisqu'ils ont décidé de fermer leurs frontières et d'évincer les étrangers.;Ich kann meine Reise Richtung [offmap_china.GetFullName] nicht fortsetzen, nachdem sie entschieden haben, ihre Grenzen für Ausländer zu schließen.;;No puedo continuar mi viaje a [offmap_china.GetFullName] porque decidieron cerrar las fronteras y expulsar a los extranjeros.;;;;;;;;;x
EVTDESCC_JD_32111;We are presented with a deliciously looking meal when [target_host.GetTitledFirstName] raises [target_host.GetHerHis] chalice to honor us with a toast. Longing for a good drink I take a big gulp before I notice that [target_host.GetFirstName] turns [target_host.GetHerHis] chalice upside down emptying its content on the floor, laughing manically.;On nous sert un repas qui a l'air délicieux lorsque [target_host.Get_le_TitledFirstName] lève sa coupe en notre honneur. Je bois une grande gorgée avant de remarquer que [target_host.GetFirstName] renverse sa coupe, vidant son contenu sur le sol, et riant frénétiquement.;Wir genießen grade ein köstlich aussehendes Mahl, als [target_host.GetTitledFirstName] [target_host.GetHerHis]e Hand hob, um uns mit einem Toast zu ehren. Sehnsüchtig nach einem guten Drink nehme ich einen großen Schluck, bevor ich merke, dass [target_host.GetFirstName] [target_host.GetHerHis]en Kelch umdreht und den Inhalt lachend auf dem Boden entleerte.;;Se nos obsequia una comida de aspecto delicioso cuando [target_host.GetTitledFirstName] alza su copa para honrarnos con un brindis. Doy un gran trago buscando beber bien antes de ver que [target_host.GetFirstName] vierte su copa sobre el suelo, riendo como un loco.;;;;;;;;;x
EVTDESCC_JD_32113;During the dinner, [target_host.GetTitledFirstName], exclaims that [target_host.GetSheHe] has a present for you. Seconds later a man with an arrow sticking out of his back is dragged into the room. With fear you immediately recognize the man from your company that you ordered to assassinate [target_host.GetFirstName]. With a finger pointed towards your head [target_host.GetFirstName] shouts 'I sentence you all to die for your treachery!'. From every corner of the room, guards with drawn weapons are closing a circle fast around your band.;Durant le dîner, [target_host.GetTitledFirstName] dit qu'[target_host.GetIlElle] a un présent pour vous. Quelques secondes plus tard, un homme avec une flèche sortant de son dos est traîné dans la pièce. Vous reconnaissez avec effroi l'homme de votre compagnie à qui vous avez ordonné d'assassiner [target_host.GetFirstName]. Le doigt pointé vers vous, [target_host.GetFirstName] crie: « Je vous condamne à mort pour votre traîtrise ! ». De chaque coin de la pièce, des gardes viennent rapidement encercler votre bande.;Während dem Abendessen macht [target_host.GetTitledFirstName] darauf aufmerksam, dass [target_host.GetSheHe] ein Geschenk für Euch hat. Sekunden später wird ein Mann mit einem Pfeil, der aus seinem Rücken herausragt, in den Raum geschliffen. Mit Furcht erkennt Ihr sofort, dass der Mann zu Eurem Gefolge gehört und er es war, dem Ihr befohlen habt, [target_host.GetFirstName] zu ermorden. [target_host.GetFirstName] zeigt mit dem Finger auf Euch und brüllt: "Aufgrund Eures Verrats erkläre ich Euch alle zum Tode". Von jeder Ecke der großen Halle beginnen die Wachen mit gezogenen Waffen einen Kreis um Euch zu bilden.;;Durante la cena [target_host.GetTitledFirstName] afirma que tiene un regalo para ti. Segundos después, arrastran a la sala a un hombre con una flecha clavada en la espalda. Te asustas al reconocer al miembro de tu grupo a que ordenaste asesinar a [target_host.GetFirstName], quien te señala gritando: '¡te sentencio a morir por tu traición!'. Los guardias de todos los rincones de la sala cierran un círculo entorno a tu grupo con las espadas desenvainadas.;;;;;;;;;x
EVTDESCC_JD_32290;The Chief Minister opens the doors to the throne room nodding for me to enter. After I've performed a deep bow in sign of subservience the [offmap_china.Ruler.GetEmperorEmpress] reaches out and touches my forehead.;Le ministre en chef ouvre les portes de la salle du trône et me fait signe d'entrer. Après m'être agenouillé[Root.Get_E] en signe d'asservissement, l'[offmap_china.Ruler.GetEmperorEmpress] tend le bras et touche mon front.;Der Staatsminister öffnet die Türen zum Thronsaal und nickt mich herein. Nachdem ich eine tiefe Verbeugung im Zeichen meiner Unterwerfung gemacht hatte, streckte [offmap_china.Ruler.Getderdie] [offmap_china.Ruler.GetEmperorEmpress] [offmap_china.Ruler.GetHerHis]e Hand aus und berührte meine Stirn.;;El ministro principal abre la puerta a la sala del trono indicándome que entre. Tras realizar una profunda inclinación en señal de sumisión, el/la [offmap_china.Ruler.GetEmperorEmpress] se acerca y me toca la frente.;;;;;;;;;x
EVTDESCC_JD_32299;I cannot continue on my journey towards [offmap_china.GetFullName].;Je ne peux pas poursuivre mon voyage vers l'[offmap_china.GetFullName].;Ich kann meine Reise Richtung [offmap_china.GetFullName] nicht fortsetzen.;;No puedo continuar mi viaje a [offmap_china.GetFullName].;;;;;;;;;x
EVTOPT_JD_4020_normal_raid_outcome;Bring the spoils to me!;Apportez-moi le butin !;Bringt die Beute zu mir!;;¡Traedme el botín!;;;;;;;;;x
EVTOPT_JD_4020_normal_raid_outcome_artifact;An artifact? Bring it to me!;Un artefact ? Apportez-le-moi !;Ein Artefakt? Bringt es her!;;¿Un artefacto? ¡Traédmelo!;;;;;;;;;x
EVTOPT_JD_4020_normal_raid_outcome_bad;Curse it! This must be the work of [Root.Religion.GetRandomEvilGodName]...;Malédiction ! Ce doit être l'oeuvre [Root.GetEvilGodDuDelaDes]...;Verflucht! Das muss das Werk des [Root.Religion.GetRandomEvilGodName] sein...;;¡Maldición! Esto es obra de [Root.Religion.GetRandomEvilGodName]…;;;;;;;;;x
EVTOPT_JD_4020_normal_raid_outcome_character;A stunning beauty!;Qu'est-ce qu'[captured_character.GetIlElle] est b[captured_character.GetEauElle] !;Welch atemberaubende Schönheit!;;¡Una belleza deslumbrante!;;;;;;;;;x
EVTOPT_JD_4020_normal_raid_outcome_character_b;I shall make [captured_character.GetHerHim] my concubine.;Je vais en faire m[captured_character.GetOnA] concubin[captured_character.Get_E].;Ich werde [captured_character.GetHerHim] zu meiner Konkubine machen.;;Será mi concubina/o.;;;;;;;;;x
EVTOPT_JD_4020_normal_raid_outcome_extra;Fantastic! Bring it all to me!;Formidable ! Apportez-moi tout ça !;Fantastisch! Bringt alles her!;;¡Fantástico! ¡Traédmelo todo!;;;;;;;;;x
EVTOPT_JD_4020_normal_raid_outcome_extra_plus;The treasures of the [offmap_china.GetShortName] shall all be mine!;Tous les trésors de la [offmap_china.GetShortName] seront miens !;Die Reichtümer von [offmap_china.GetShortName] sollen mein sein!;;¡Todos los tesoros del [offmap_china.GetShortName] serán míos!;;;;;;;;;x
EVTOPT_JD_4020_normal_raid_outcome_panda;Prepare an enclosure!;Aménagez un enclos !;Bereitet ein Gehege vor!;;¡Preparad un cercado!;;;;;;;;;x
EVTOPT_JD_4020_normal_raid_outcome_siege_engineer;A siege engineer of my own? Excellent!;Un ingénieur de siège à moi ? Excellent !;Ein Belagerungsingenieur ganz für mich alleine? Hervorragend!;;¿Un ingeniero de asedios propio? ¡Excelente!;;;;;;;;;x
EVTOPT_JD_4020_normal_raid_outcome_siege_engineer_b;Make him a commander immediately.;En faire un commandant immédiatement.;Macht ihn unverzüglich zum Kommandanten!;;Nombradlo comandante inmediatamente.;;;;;;;;;x
EVTOPT_JD_50001_EXP;An Expansionist [From.GetEmperorEmpress]? This could get ugly...;Un[From.Get_E] [From.GetEmperorEmpress] expansionniste ? Cela pourrait mal finir...;[From.GetEinEine] expansionistische[From.GetrMale] [From.GetEmperorEmpress]? Das könnte hässlich werden...;;¿Un/a [From.GetEmperorEmpress] expansionista? Esto se puede poner muy feo…;;;;;;;;;x
EVTOPT_JD_50001_ISO;Time for the [From.GetEmperorEmpress] to [GetChinaIsolationPastime]?;L'occasion pour l'[From.GetEmperorEmpress] [GetChinaIsolationPastime]?;Zeit, dass [From.Getderdie] [From.GetEmperorEmpress], [GetChinaIsolationPastime]?;;¿Llegó la hora de [GetChinaIsolationPastime], [From.GetEmperorEmpress]?;;;;;;;;;x
EVTOPT_JD_50001_OPEN;Business as usual then!;On va faire des affaires comme d'habitude alors !;Wie gewohnt!;;¡Sigamos con los negocios como siempre!;;;;;;;;;x
EVTOPT_JD_50021_ISO;Time for the [FromFrom.Ruler.GetEmperorEmpress] to contemplate [FromFrom.Ruler.GetPossPronoun] navel...;Le moment pour l'[FromFrom.Ruler.GetEmperorEmpress] de contempler son ombre...;Zeit, dass [FromFrom.Ruler.Getderdie] [FromFrom.Ruler.GetEmperorEmpress] über [FromFrom.Ruler.GetHerHis]e Rolle nachdenkt...;;Hora de que el/la [FromFrom.Ruler.GetEmperorEmpress] se admire el ombligo…;;;;;;;;;x
EVTOPT_JD_50141;Most inauspicious!;Vraiment fâcheux !;Sehr ungünstig!;;¡Qué poco propicio!;;;;;;;;;x
EVTOPT_JD_50161;Beware the Dragon of the East...;Méfiez-vous du Dragon de l'Est...;Hütet Euch vor dem Drachen des Ostens...;;Cuidado con el Dragón de Oriente…;;;;;;;;;x
EVTOPT_JD_50162;The Mongols truly are fearsome!;Les Mongols sont vraiment redoutables !;Die Mongolen sind wahrlich furchteinflößend!;;¡Los mongoles son temibles!;;;;;;;;;x
EVTOPT_JD_50201;The Dragon roars...;Le dragon rugit...;Der Drache brüllt...;;El dragón ruge…;;;;;;;;;x
EVTOPT_JD_50202;These Jurchens sound dangerous...;Ces Jurchens semblent dangereux...;Diese Jurchen klingen gefährlich...;;Esos yurchen parecen peligrosos…;;;;;;;;;x
EVTOPT_JD_50281;A House Divided...;Une maison divisée...;Ein geteiltes Haus...;;Una casa dividida…;;;;;;;;;x
EVTOPT_JD_50301;Good, I could use some new silk clothes!;Bien, je pourrais me procurer de nouveaux vêtements en soie !;Gut, ich könnte einige neue Seidenkleider brauchen!;;¡Bien, me vendrían bien nuevas ropas de seda!;;;;;;;;;x
EVTOPT_JD_50302_BROKEN_PEACE_DEAL;Curses, there goes my Peace Deal with China!;Malédictions ! C'en est fini de mon accord de paix avec la Chine !;Verflucht! Da geht mein Friedensvertrag mit China dahin!;;¡Rayos! ¡Se acabó mi acuerdo de paz con China!;;;;;;;;;x
EVTOPTA_JD_2000;This war must end, offer to send their people back.;Cette guerre doit se terminer. Offrons de libérer ces personnes.;Dieser Krieg muss enden. Bietet an, ihre Leute zurückzuschicken.;;Esta guerra debe acabar, ofreced devolver a su gente.;;;;;;;;;x
EVTOPTA_JD_2001;Excellent! We accept.;Excellent ! Nous acceptons.;Hervorragend. Wir nehmen an!;;¡Excelente! Aceptamos;;;;;;;;;x
EVTOPTA_JD_2002;It is for the best.;C'est pour le mieux.;Es ist zum Besten.;;Es lo mejor.;;;;;;;;;x
EVTOPTA_JD_2003;The war goes on.;La guerre continue.;Der Krieg geht weiter.;;La guerra continúa.;;;;;;;;;x
EVTOPTA_JD_2004;Oh, now it is personal!;Oh, maintenant ça devient personnel !;Oh, jetzt ist es persönlich!;;¡Ahora es personal!;;;;;;;;;x
EVTOPTA_JD_2005;This is a war of vengeance now!;C'est une guerre de vengeance maintenant !;Dies ist nun ein Rachekrieg!;;¡Ahora es una guerra de venganza!;;;;;;;;;x
EVTOPTA_JD_2100;I must liberate my [Root.Religion.GetName] brethren!;Je dois libérer mes frères [Root.GetReligionMascPl] !;Ich muss meine [Root.Religion.GetName]en Brüder befreien!;;¡Debo liberar a mis hermanos en el [Root.Religion.GetName]!;;;;;;;;;x
EVTOPTA_JD_2200;Perhaps it is time to make [From.GetHerHim] get back in line...;Peut-être qu'il est temps de [From.GetLeLa] faire revenir dans les rangs...;Vielleicht ist es Zeit, [From.GetHerHim] zu zügeln...;;Tal vez sea hora de volver a meterlos en vereda…;;;;;;;;;x
EVTOPTA_JD_3001;Send my most sincere gratitude to the [From.Offmap.Ruler.GetTitle].;Envoyer ma plus sincère gratitude à l'[From.Offmap.Ruler.GetTitle].;Sendet [From.Offmap.Ruler.Getdemder] [From.Offmap.Ruler.GetTitle] meinen aufrichtigen Dank.;;Enviad mi más sincera gratitud al [From.Offmap.Ruler.GetTitle].;;;;;;;;;x
EVTOPTA_JD_3001_tt;Assign all currently open Commander Slots to the Siege Engineers.;Assigner tous les postes de commandants disponibles aux ingénieurs de siège.;Alle momentan offenen Kommandantenplätze den Belagerungsingenieuren zuweisen.;;Asignar todas las casillas de comandante vacías a los ingenieros de asedio.;;;;;;;;;x
EVTOPTA_JD_3011;Anything to please the [From.Offmap.Ruler.GetTitle].;Je ferais tout pour satisfaire l'[From.Offmap.Ruler.GetTitle].;Alles, um [From.Offmap.Ruler.Getdemder] [From.Offmap.Ruler.GetTitle] zu gefallen.;;Lo que sea para agradar al §Y[From.Offmap.Ruler.GetTitle]§!;;;;;;;;;x
EVTOPTA_JD_3021;We shall humbly assist the Emperor in this endeavor!;Nous assisterons humblement l'Empereur !;Wir sollten dem Kaiser bei dem Bestreben demütig helfen!;;¡Ayudaremos humildemente al emperador en esta empresa!;;;;;;;;;x
EVTOPTA_JD_3031;Truly a magnificent item!;Vraiment un magnifique objet !;Ein wahrlich bezaubernder Gegenstand!;;¡Una pieza magnífica!;;;;;;;;;x
EVTOPTA_JD_3041;May they trample your enemies!;Qu'ils piétinent nos ennemis !;Mögen sie Eure Feinde zertrampeln!;;¡Así pisoteen a tus enemigos!;;;;;;;;;x
EVTOPTA_JD_3051;I am not afraid of empty threats!;Vos vaines menaces ne me font pas peur !;Ich habe keine Angst vor leeren Drohungen.;;¡No me asustan las amenazas vacías!;;;;;;;;;x
EVTOPTA_JD_4001;We shall raid again another day...;Nous pillerons une autre fois...;Wir werden an einem anderen Tag wiederkommen...;;Ya asaltaremos otro día…;;;;;;;;;x
EVTOPTA_JD_4030;Oh well.;Soit.;Nun ja...;;En fin.;;;;;;;;;x
EVTOPTA_JD_4100;I should have payed them back earlier...;J'aurais dû les payer plus tôt...;Ich hätte sie schneller bezahlen sollen...;;Debería haberles pagado antes…;;;;;;;;;x
EVTOPTA_JD_7000;Intriguing, bring [traveling_teacher.GetHerHim] to court!;Intriguant, amenez-[traveling_teacher.GetLeLa] à la cour !;Faszinierend, bringt [traveling_teacher.GetHerHim] an den Hof!;;Interesante, ¡traedlo a mi corte!;;;;;;;;;x
EVTOPTA_JD_7000_TT;You invite the traveling teacher to your court.;Vous invitez le professeur itinérant à votre cour.;Ihr ladet den reisenden Lehrer an Euren Hof ein.;;Invitas al maestro viajero a tu corte.;;;;;;;;;x
EVTOPTA_JD_7001;Hm, can you teach [child_to_be_taught.GetHerHim] how to read faster?;Hm, pouvez-vous lui apprendre à lire plus vite ?;Könnt Ihr [child_to_be_taught.Getihmihr] beibringen, schneller zu lesen?;;¿Puedes enseñarle a leer más rápido?;;;;;;;;;x
EVTOPTA_JD_7010;More trade is a good thing, I shall sponsor you.;Plus de commerce est une bonne chose, je vais vous patronner.;Mehr Handel ist gut, ich unterstütze Euch.;;Es bueno tener más comercio, os apoyaré.;;;;;;;;;x
EVTOPTA_JD_7010_TT;The Radhanite merchants set up a rudimentary trade office.;Les radhanites établissent un local commercial rudimentaire.;Die radhanitischen Händler errichten einen rudimentären Handelsposten.;;Los mercaderes radanitas levantan un puesto comercial rudimentario.;;;;;;;;;x
EVTOPTA_JD_10011;What a brilliant idea! Go, with my blessing.;Quelle bonne idée ! Allez-y, vous avez ma bénédiction.;Ausgezeichnete Idee! Gehe mit meinem Segen.;;¡Qué idea más brillante! Parte con mis bendiciones.;;;;;;;;;x
