#CODE;ENGLISH;FRENCH;GERMAN;;SPANISH;;;;;;;;;x
EVTDESC_JD_20048_SUPPORTIVE;Everyone is amazed by the arrival of the imperial [From.GetPrincessPrince], [From.GetHerHis] [From.GetChineseComplimentAdjective] highness [From.GetDynName]. Not that [From.GetSheHe] has not been expected – the court in [Root.Capital.GetName] has been busy with the preparations for weeks – no, they are simply astounded by the grandeur of [From.GetHerHis] procession. While those standing close to you begin to whisper about the silk banners and the gleaming armor of the imperial soldiers, you have your sight trained on the intricately decorated litter approaching, holding your future [From.GetHusbandWife].\n\n[From.GetPrincessPrince] [From.GetFirstName]'s eyes are cast low as [From.GetSheHe] exits to greet you, but for the shortest moment they dart up to meet yours. The tiniest of smiles plays at the corners of [From.GetHerHis] mouth, and a soft blush tints [From.GetHerHis] cheeks. The sight is a balm to your frayed nerves. Surely, you can make this work.;Tout le monde est ébahi par l'arrivée [From.GetDuDela] [From.GetPrincessPrince] impérial[From.Get_E], Son Altesse [From.GetDynName]. Non pas que ce n'était pas prévu - la cour de [Root.Capital.GetName] est occupée avec les préparatifs depuis des semaines - non, ils sont tout simplement étonnés par la grandeur de sa procession. Alors que ceux qui sont près de vous commencent à murmurer sur les banderoles de soie et l'armure étincelante des soldats impériaux, vous avez les yeux rivés sur la litière finement décorée qui approche, avec votre futur[From.Get_E] [From.GetHusbandWife] à l'intérieur.\nLes yeux [From.GetDuDela] [From.GetPrincessPrince] [From.GetFirstName] fixent le sol alors qu'[From.GetIlElle] sort pour vous accueillir, mais pendant un court instant, ils se perdent pour rencontrer les vôtres. Le plus petit des sourires se dessine sur son visage, et un doux rougissement teint ses joues. La vue est un baume pour vos nerfs à vif. Assurément, vous pouvez faire en sorte que ça marche.;Jeder ist von der Ankunft [From.Getdesder] kaiserlichen [From.GetPrincessPrince], [From.GetHerHis]er [From.GetChineseComplimentAdjective]en Hoheit [From.GetDynName] begeistert. Nicht, dass es niemand erwartet hätte. Im Gegenteil, der Hof von [Root.Capital.GetName] war für Wochen mit den Vorbereitungen beschäftigt, aber ein jeder ist einfach über die Größe der Festlichkeiten erstaunt. Während jene, die sich in der Nähe von Euch aufhalten, anfangen, sich über die Seidenfahnen und die glänzenden Rüstungen der kaiserlichen Soldaten zu unterhalten, habt Ihr Euren Blick auf die aufwendig dekorierte Bahre fokussiert, die Eure[From.GetnMale] künftige[From.GetnMale] [From.GetHusbandWife] trägt.\nDer Blick von [From.GetPrincessPrince] [From.GetFirstName] ist gesenkt, als [From.GetSheHe] aussteigt, um Euch zu grüßen, aber für einen winzigen Augenblick schlagen die Augen hoch, um Eure zu treffen. In [From.GetHerHis]en Mundwinkeln lässt sich ein kleines Lächeln ablesen und [From.GetHerHis]e Wangen erröten sich leicht. Der Anblick ist ein Balsam für die Seele. Ihr seid Euch sicher, dass nichts schiefgehen wird.;;La llegada del/de la [From.GetPrincessPrince] imperial, Su Alteza [From.GetChineseComplimentAdjective], [From.GetDynName] asombra a todo el mundo. No por inesperada, pues la corte de [Root.Capital.GetName] lleva semanas ocupada con los preparativos. No, quedaron estupefactos por la grandeza de su desfile. Mientras los cercanos a ti susurran sobre los estandartes de seda y la armadura reluciente de los soldados imperiales, tú has centrado la vista en la litera intrincadamente decorada que se acerca y lleva a tu futuro/a [From.GetHusbandWife].\nLos ojos de [From.GetPrincessPrince] [From.GetFirstName] están bajos cuando sale a saludarte, pero por un brevísimo momento osan encontrarse con los tuyos. La más leve de las sonrisas aparece en un rincón de su boca y un leve rubor tinta sus mejillas. Esta visión es un bálsamo para tus nervios crispados. Seguro que lograrás que esto funcione.;;;;;;;;;x
EVTDESC_JD_20049;My [GetFromRelation], [From.GetTitledFirstName], has now married the imperial [imperial_marriage_spouse_2.GetPrincessPrince] [imperial_marriage_spouse_2.GetDynName]. The grand ceremony and the foreign [imperial_marriage_spouse_2.GetPrincessPrince] will be the talk of the realm for many years to come.;M[From.GetOnA] [GetFromRelation], [From.Get_le_TitledFirstName], est maintenant marié[From.Get_E] [imperial_marriage_spouse_2.GetAuAla] [imperial_marriage_spouse_2.GetPrincessPrince] impérial[imperial_marriage_spouse_2.Get_E] [imperial_marriage_spouse_2.GetDynName]. La grande cérémonie et [imperial_marriage_spouse_2.GetLeLa] [imperial_marriage_spouse_2.GetPrincessPrince] étrang[imperial_marriage_spouse_2.GetErEre] seront un sujet de conversation pendant de nombreuses années.;M[From.Geteineine] [GetFromRelation] [From.GetTitledFirstName] ist den Bund der Ehe mit [imperial_marriage_spouse_2.GetPrincessPrince] [imperial_marriage_spouse_2.GetDynName] eingegangen. Die große Zeremonie und [imperial_marriage_spouse_2.Getderdie] ausländische [imperial_marriage_spouse_2.GetPrincessPrince] werden noch für Jahre das Tagesgespräch im Reich sein.;;Mi [GetFromRelation], [From.GetTitledFirstName], se ha casado con el/al [imperial_marriage_spouse_2.GetPrincessPrince] imperial [imperial_marriage_spouse_2.GetDynName]. La gran ceremonia y este/a [imperial_marriage_spouse_2.GetPrincessPrince] extranjero/a serán la comidilla del reino durante muchos años.;;;;;;;;;x
EVTDESC_JD_30002;[Root.GetGovernorLetterGreeting]. [Root.GetChineseLetterBlessing].\n\nIt has come to the attention of the heavenly [From.Offmap.Ruler.GetShortChineseEmperorName] that merchants from your lands have been acting with deceit and dishonesty while conducting trade with our merchants. We are certain that you will make sure that this behavior will cease immediately.;[Root.GetGovernorLetterGreeting]. [Root.GetChineseLetterBlessing].\n\nIl est venu à l'attention du Céleste [From.Offmap.Ruler.GetShortChineseEmperorName] que des marchands de vos terres ont escroqué les nôtres. Nous sommes persuadés que vous vous assurerez que ces agissements ne se reproduisent plus.;[Root.GetGovernorLetterGreeting]. [Root.GetChineseLetterBlessing].\n\n[From.Offmap.Ruler.GetDerDie] himmlische [From.Offmap.Ruler.GetShortChineseEmperorName] hat Kenntnis davon erlangt, dass Eure Kaufleute mit Täuschung und Unehrlichkeit agieren, während sie mit unseren Händlern Handel betreiben. Wir sind sicher, Ihr werdet dafür sorgen, dass dieses Verhalten sofort aufhört.;;[Root.GetGovernorLetterGreeting]. [Root.GetChineseLetterBlessing].\n\nHa llegado a la atención del celeste [From.Offmap.Ruler.GetShortChineseEmperorName] que mercaderes de tus tierras actúan con engaño y falta de honradez al negociar con los nuestros. Estamos seguros de que os encargaréis de que este comportamiento cese de inmediato.;;;;;;;;;x
EVTDESC_JD_30003;[From.GetTitledFirstName] has reprimanded merchants in our region, citing misconduct in other realms. However, there are those arguing that the rights of merchants from [Root.PrimaryTitle.GetName] does not fall under the jurisdiction of [From.GetTitledFirstName]. While it might anger the [From.GetTitle], I am considering a public show of resolve.;[From.Get_Le_TitledFirstName] a réprimandé les marchands de notre région, en invoquant une mauvaise conduite dans d'autres pays. Cependant, des personnes soutiennent que les droits des marchands [Root.PrimaryTitle.Get_du_Realm] ne relèvent pas [From.Get_du_TitledFirstName]. Bien que cela pourrait irriter [From.Get_only_le_Title][From.GetTitle], j'envisage de rendre la chose publique.;[From.GetTitledFirstName] hat die Handlungsfreiheiten der Händler eingeschränkt, die Regeln gebrochen haben. Die Rechte der Kaufleute aus unseren Städten fallen jedoch unter die Gerichtsbarkeit von [From.GetTitledFirstName]. Obwohl dies [From.Getdendie] [From.GetTitle] verärgern könnte, ziehe ich eine öffentliche Bekanntmachung in Betracht.;;[From.GetTitledFirstName] ha reprendido a comerciantes de nuestra región, mencionando su mala conducta en otros reinos. Sin embargo, hay quienes argumentan que los derechos de los comerciantes de [Root.PrimaryTitle.GetName] no recaen bajo la jurisdicción de [From.GetTitledFirstName]. Aunque podría enojar al/a la [From.GetTitle], estoy considerando una demostración pública de resolución.;;;;;;;;;x
EVTDESC_JD_30004;Your vassal, [From.GetTitledFirstName], was less than impressed by your intrusion on merchant rights in the cities of [From.GetHerHis] lands. [From.GetSheHeCap] has now made a public statement on how this action was an unjustified use of power in an area of [From.GetHerHis] responsibility.;Votre vassal[From.Get_E], [From.Get_le_TitledFirstName], n'a pas apprécié votre intervention sur les droits marchands des cités sur ses terres. [From.GetIlElleCap] a dénoncé publiquement un « abus de pouvoir ».;Euer Vasall [From.GetTitledFirstName] war wenig beeindruckt von Eurem Eingriff in die Handelsrechte [From.GetHerHis]er Städte. [From.GetSheHeCap] hat nun öffentlich gemacht, dass diese Handlung ein ungerechtfertigter Machtmissbrauch in einem Bereich [From.GetHerHis]er Verantwortung gewesen sei.;;Tu vasallo, [From.GetTitledFirstName] no se llevó una buena impresión con tu intromisión en los derechos de los mercaderes en las ciudades de sus tierras. Ha hecho una declaración pública sobre cómo esta acción fue un abuso injustificado de poder en un área bajo su responsabilidad.;;;;;;;;;x
EVTDESC_JD_30011;Last night, [chinese_courtier.GetBestName] and I ended up having discussions until dawn, about [chinese_courtier.GetRootMatchingPersonalityStreak]. I must have made a good impression, as [chinese_courtier.GetSheHe] told me that [chinese_courtier.GetSheHe] will be sending a letter, praising the hospitality [chinese_courtier.GetSheHe] has received.;La nuit dernière, [chinese_courtier.Get_only_le_Title][chinese_courtier.GetBestName] et moi avons discuté jusqu'à l'aube au sujet [chinese_courtier.GetRootMatchingPersonalityStreak]. Je dois lui avoir fait bonne impression, puisqu'[chinese_courtier.GetIlElle] m'a dit qu'[chinese_courtier.GetIlElle] enverra une lettre louant l'hospitalité qu'[chinese_courtier.GetIlElle] a reçue.;Letzte Nacht diskutierten [chinese_courtier.GetBestName] und ich bis zum Morgengrauen über [chinese_courtier.GetRootMatchingPersonalityStreak]. Ich muss einen guten Eindruck gemacht haben, da [chinese_courtier.GetSheHe] mir gesagt hat, dass [chinese_courtier.GetSheHe] einen Brief schicken wird, der die Gastfreundschaft lobt, die [chinese_courtier.GetSheHe] erfahren hat.;;Anoche [chinese_courtier.GetBestName] y yo tuvimos una charla hasta el amanecer sobre [chinese_courtier.GetRootMatchingPersonalityStreak]. Debo haber causado una buena impresión ya que dijo que me mandaría una carta alabando la hospitalidad que recibió.;;;;;;;;;x
EVTDESC_JD_30012;I have noticed that [chinese_courtier.GetBestName] has grown increasingly aggravated during the last couple of weeks, and today something extra unthoughtful slipped my tongue which caused [chinese_courtier.GetHerHim] to storm off exclaiming that the Emperor would hear about this.;J'ai remarqué que [chinese_courtier.Get_only_le_Title][chinese_courtier.GetBestName] s'est agacé[chinese_courtier.Get_E] de plus en plus ces dernières semaines, et aujourd'hui, quelque chose de très irréfléchi est sorti de ma bouche, ce qui lui a fait s'écrier que l'Empereur allait en entendre parler.;Ich habe bemerkt, dass [chinese_courtier.GetBestName] in den letzten paar Wochen deutlich gereizter war, und heute ist mir unachtsamerweise etwas über die Lippen gegangen, das [chinese_courtier.GetHerHim] dazu gebracht hat, mit der Anmerkung hinaus zu stürmen, dass der Kaiser davon hören würde.;;He notado que la exasperación de [chinese_courtier.GetBestName] ha aumentado en estas semanas, y hoy se me escapó algo especialmente torpe, lo que le hizo marcharse presa de la ira, gritando que el Emperador se enterará de esto.;;;;;;;;;x
EVTDESC_JD_30014;[Root.GetGovernorLetterGreeting]. [Root.GetChineseLetterBlessing].\n\nThe heavenly [From.Offmap.Ruler.GetLongChineseEmperorName], has generously granted your request. A royal seal has been delivered denoting the status of the [Root.PrimaryTitle.GetFullName] as a favored state for imperial goods.;[Root.GetGovernorLetterGreeting]. [Root.GetChineseLetterBlessing].\n\n[From.Offmap.Ruler.GetLeLaCap] Céleste [From.Offmap.Ruler.GetLongChineseEmperorName], a généreusement accédé à votre requête. Un sceau royal a été remis, indiquant le statut [Root.PrimaryTitle.Get_du_RealmFull] comme État privilégié pour les biens impériaux.;[Root.GetGovernorLetterGreeting]. [Root.GetChineseLetterBlessing].\n\n[From.Offmap.Ruler.GetDerDie] himmlische [From.Offmap.Ruler.GetLongChineseEmperorName] hat Euren Gesuch großzügig angenommen. Ein königliches Siegel wurde geliefert, das den Status von [Root.PrimaryTitle.GetFullName] als begünstigten Staat für kaiserliche Waren kennzeichnet.;;[Root.GetGovernorLetterGreeting]. [Root.GetChineseLetterBlessing].\n\nEl Celestial [From.Offmap.Ruler.GetLongChineseEmperorName] os ha concedido graciosamente vuestro deseo. Se ha entregado un sello real indicando la posición del [Root.PrimaryTitle.GetFullName] como estado favorecido de bienes imperiales.;;;;;;;;;x
EVTDESC_JD_30045;My council informs that the Chinese [offmap_china.Ruler.GetTitle] has sent significant forces from the heart of the Middle Kingdom, to support their outlying regions in the West. Leaning over the war table, I can only hope that my silence instills confidence in my advisors. In my own chest, I feel a mild panic rising.;Mon Conseil m'informe que l'[offmap_china.Ruler.GetTitle] chinois[offmap_china.Ruler.Get_E] a envoyé une quantité significative de troupes depuis le coeur du Royaume du Milieu, afin de soutenir les régions éloignées à l'ouest. Penché[Root.Get_E] sur la table de guerre, je ne peux qu'espérer que mon silence inspire la confiance à mes conseillers. Je sens la peur émerger en moi.;Mein Rat informierte mich, dass [offmap_china.Ruler.Getderdie] chinesische [offmap_china.Ruler.GetTitle] viele Truppen aus dem Herzen des Mittleren Königreiches entsendet hat, um die abgelegenen Regionen im Westen zu unterstützen. Ich kann nur hoffen, dass meine Berater Vertrauen in meine Handlung haben. In meiner eigenen Brust zumindest fühle ich, wie eine leichte Panik ansteigt.;;Mi consejo informa que el [offmap_china.Ruler.GetTitle] chino ha enviado un número significativo de fuerzas del corazón del Reino Central para apoyar a sus regiones periféricas el Oeste. Me inclino sobre el tablero de guerra, esperando que mi silencio inspire confianza a mis consejeros, pero por dentro siento crecer el pánico.;;;;;;;;;x
EVTDESC_JD_30045_INDIA;My council informs that the Treasure fleet of the Middle Kingdom has been spotted outside of the Bengal Bay carrying a significant land force, to support their outlying regions in the West. Leaning over the war table, I can only hope that my silence instills confidence in my advisors. In my own chest, I feel a mild panic rising.;Mon Conseil m'informe que la Flotte des Trésors de l'Empire du Milieu a été aperçue au large du Golfe du Bengale, transportant une quantité significative de troupes afin de soutenir les régions reculées à l'ouest. Penché[Root.Get_E] sur la table de guerre, je ne peux qu'espérer que mon silence inspire la confiance à mes conseillers. Je sens la peur émerger en moi.;Mein Rat informierte mich, dass die Silberflotte des Mittleren Reiches außerhalb der bengalischen Bucht gesichtet wurde und eine beträchtliche Anzahl Soldaten trägt, um ihre abgelegenen Regionen im Westen zu unterstützen.Ich kann nur hoffen, dass mein Schweigen Vertrauen bei meinen Beratern schafft. In meiner Brust jedoch spüre ich bereits leichte Panik.;;El consejo me informa que se ha visto a las afueras de la bahía de Bengala la flota del tesoro del Reino Central llevando considerables fuerzas terrestres para apoyar a sus regiones exteriores en Occidente. Me inclino sobre el tablero de guerra, esperando que mi silencio inspire confianza a mis consejeros. Por dentro siento crecer un ligero pánico.;;;;;;;;;x
EVTDESC_JD_30047;Through years of careful strategic planning, repeated tactical brilliance, and a measure of luck that makes believers of us all, we have managed to whittle down the enemy armies! I am almost beginning to dream of victory, when my generals inform me that the Chinese [offmap_china.Ruler.GetTitle] has dispatched more forces to the West.;Grâce à des années de planification stratégique minutieuse, de génie tactique répété et d'une dose de chance qui fait de nous tous des croyants, nous avons réussi à réduire les armées ennemies ! Je commence à rêver de la victoire, lorsque mes généraux m'informent que l'[offmap_china.Ruler.GetTitle] chinois[offmap_china.Ruler.Get_E] a envoyé plus de forces à l'Ouest.;Durch jahrelange sorgfältige strategische Planung, wiederholtes taktisches Geschick und einer Portion Glück haben wir es geschafft, die feindlichen Armeen niederzuschlagen! Ich beginne bereits damit, vom Sieg zu träumen, als mein General mich darüber informiert, dass [offmap_china.Ruler.Getderdie] chinesische [offmap_china.Ruler.GetTitle] mehr Truppen in den Westen geschickt hat.;;¡Años de planear estrategias cuidadosamente, brillantez estratégica constante y tal cantidad de suerte que nos hace creer en los milagros, nos permitieron mermar los ejércitos enemigos! Casi estaba soñando con la victoria cuando mis generales me informaron que el [offmap_china.Ruler.GetTitle] de China había enviado más fuerzas a Occidente.;;;;;;;;;x
EVTDESC_JD_32000;The journey to visit the [offmap_china.Ruler.GetEmperorEmpress] of [offmap_china.GetName] and show my subservience will take months if not even years. I take my farewells to my near and dear and prepare the caravan for departure.;Le voyage pour rendre visite à l'[offmap_china.Ruler.GetEmperorEmpress] de l'[offmap_china.GetName] et montrer mon asservissement prendra des mois, si ce n'est des années. Je fais mes adieux à mes proches et prépare la caravane pour le départ.;Die Reise, um [offmap_china.Ruler.Getdemder] [offmap_china.Ruler.GetEmperorEmpress] vom [offmap_china.GetName] meine Unterwürfigkeit zu zeigen, wird Monate, wenn nicht sogar Jahre dauern. Ich nehme noch von meinen Engsten und Liebsten Abschied und bereite die Karawane zur Abreise vor.;;El viaje para visitar al/a la [offmap_china.Ruler.GetEmperorEmpress] de [offmap_china.GetName] y mostrar pleitesía tardará meses, si no años. Me despido de mis familiares y preparo la caravana para partir.;;;;;;;;;x
EVTDESC_JD_32100;Our caravan has been camped by the roadside the whole day. The sky has been pouring over us with unusually heavy rain. The whole situation has brought my thoughts to the memories of my late [Root.target_relative.GetPrevRelation], [target_relative.GetFirstName].;Notre caravane campe le long des routes toute la journée. Nous subissons de fortes pluies. Toute cette situation m'a amené à penser à feu m[target_relative.GetOnA] [Root.target_relative.GetPrevRelation] [target_relative.GetFirstName].;Unsere Karawane hat den ganzen Tag am Straßenrand verbracht. Der Himmel hat uns mit ungewöhnlich hartem Regen gestraft. Die ganze Situation hat meine Gedanken auf meine[target_relative.GetnMale] verstorbene[target_relative.GetnMale] [Root.target_relative.GetPrevRelation], [target_relative.GetFirstName] gelenkt.;;Nuestra caravana lleva todo el día acampada en la cuneta. Está lloviendo con una fuerza inusitada. Esta situación me ha hecho pensar en mi difunto/a [Root.target_relative.GetPrevRelation], [target_relative.GetFirstName].;;;;;;;;;x
EVTDESC_JD_32110;A rider approached the caravan and handed me a letter with the seal of [target_host.GetBestName]. [target_host.GetFirstName] has heard of my travels and invites our party to rest for a while in the warmth of the [target_host.GetCapitalHolding] [target_host.Capital.Capital.GetName].;Un cavalier s'est approché de la caravane et m'a tendu une lettre avec le sceau [target_host.Get_only_du_Title][target_host.GetBestName]. [target_host.GetCeluiCelleCap]-ci a entendu parler de mon voyage et nous invite à nous reposer un moment dans un endroit confortable [target_host.GetCapitalHoldingDuDela] de [target_host.Capital.Capital.GetName].;Ein Reiter näherte sich der Karawane und reichte mir einen Brief mit dem Siegel von [target_host.GetBestName]. [target_host.GetFirstName] hat von meiner Reise erfahren und hat uns eingeladen, uns etwas in [target_host.Capital.Capital.GetName] auszuruhen.;;Un jinete se acerca a la caravana y me entrega una carta con el sello de [target_host.GetBestName]. [target_host.GetFirstName] ha sabido de mis viajes e invita a nuestra partida a descansar un tiempo en la comodidad de [target_host.GetCapitalHolding] [target_host.Capital.Capital.GetName].;;;;;;;;;x
EVTDESC_JD_32112;Regaining my conciousness I find myself in the ditch to the side of the road. In my pocket I discover a letter with the firmest handwriting reading 'This is your last warning, stay out of here!'.;Reprenant conscience, je me trouve dans le fossé au bord de la route. Dans ma poche, je découvre une lettre écrite d'une main ferme: « C'est votre dernier avertissement, restez loin d'ici ! »;Nachdem ich mein Bewusstsein wiedererlangt hatte, fand ich mich in einem Graben an der Straßenseite wieder. In meiner Tasche entdeckte ich einen Brief mit einer kräftigen Handschrift "Das ist die letzte Warnung, haltet Euch fern!";;Recobro el sentido y me encuentro tirado en una cuneta. En mi bolsillo descubro una carta escrita con letra muy firme: 'es el último aviso, ¡aléjate de aquí!'.;;;;;;;;;x
EVTDESC_JD_32200;Our company has finally reached the central lands of the [offmap_china.GetFullName]. The Middle Kingdom in all its magnificence lay before us with so much to experience.;Notre compagnie a finalement atteint les terres au coeur de l'[offmap_china.GetFullName]. L'Empire du Milieu dans toute sa magnificence est juste devant nous avec tant de choses à découvrir.;Unser Gefolge hat endlich das Kernland vom [offmap_china.GetFullName] erreicht. Das Mittlere Königreich liegt mit all seiner Pracht vor uns und es gibt viel zu erleben.;;Nuestra partida por fin ha llegado a las tierras centrales del [offmap_china.GetFullName]. Ante nosotros se abre el Reino Central en toda su magnificencia, con tanto por experimentar.;;;;;;;;;x
EVTDESC_JD_32211;I'm out on a walk in a beautiful park in the Middle Kingdom when I spot a group of people, intensely focused, gathered up around a square board with circular pieces in black and white.;Je me promène dans un magnifique parc dans l'Empire du Milieu quand je repère un groupe de personnes, intensément concentrées, rassemblées autour d'un tableau carré avec des pièces circulaires en noir et blanc.;Ich bin grade auf einem Spaziergang in einem wunderschönen Park im Mittleren Königreich, als ich eine Gruppe von Menschen, die sich intensiv zu konzentrieren schienen und sich um ein quadratisches Brett mit kreisförmigen Steinen in Schwarz und Weiß versammelt hatten, sah.;;Paseo por un hermoso parque del Reino Central cuando veo un grupo de gente muy concentrado, reunido en torno a un tablero cuadrado con fichar redondas negras y blancas.;;;;;;;;;x
EVTDESC_JD_32216;The high priest started the ceremony right as I get inside the Taoist temple. The disciples enter a meditation to bring themselves into harmony with the cosmos.;Le grand prêtre a commencé la cérémonie dès que je suis entré dans le temple taoïste. Les disciples entrent dans une méditation pour s'harmoniser avec le cosmos.;Der Hohepriester beginnt grade mit der Zeremonie, als ich in den taoistischen Tempel komme. Die Jünger meditieren, um sich mit dem Kosmos in Einklang zu bringen.;;El gran sacerdote comienza la ceremonia justo cuando entro en el templo taoísta. Los discípulos meditan para entrar en armonía con el cosmos.;;;;;;;;;x
