#CODE;ENGLISH;FRENCH;GERMAN;;SPANISH;;;;;;;;;x

EVTDESC_JD_50001;[FromFrom.GetEmperorEmpress] [FromFrom.GetDynName], the Chinese '[FromFrom.GetSonDaughterCap] of Heaven', has died and been succeeded by [From.GetDynName]. Like [From.GetPossPronoun] predecessor, the new [From.GetEmperorEmpress] is known to believe in an [From.Offmap.GetPolicy] China. Apparently, [From.GetSubjectPronoun] takes a special interest in [From.Offmap.GetLike] but frowns on [From.Offmap.GetDislike].;L'[FromFrom.GetEmperorEmpress] [FromFrom.GetDynName], '[FromFrom.GetLeLa] [FromFrom.GetSonDaughterCap] du Ciel', a trépassé et [From.GetDynName] a pris sa place. Comme s[FromFrom.GetOnA] prédécesseur, [From.GetLeLa] nouve[From.GetLLle] [From.GetEmperorEmpress] est connu[From.Get_E] pour croire en une Chine [From.Offmap.GetPolicy]. Apparemment, [From.GetIlElle] aime [From.Offmap.GetLike], mais déteste [From.Offmap.GetDislike].;[FromFrom.GetEmperorEmpress] [FromFrom.GetDynName], [FromFrom.Getderdie] chinesische "[FromFrom.GetSonDaughterCap] des Himmels", ist gestorben und wurde von [From.GetDynName] ersetzt. Wie [From.GetHerHis] Vorgänger glaubt auch [From.Getderdie] neue [From.GetEmperorEmpress] an ein China, das [From.Offmap.GetPolicy] ist. [From.GetSheHeCap] hat offenbar ein besonderes Interesse an [From.Offmap.GetLike], missbilligt aber [From.Offmap.GetDislike].;;[FromFrom.GetEmperorEmpress] [FromFrom.GetDynName], [FromFrom.GetSonDaughterCap] del Cielo de China, murió y le sucede [From.GetDynName]. Igual que quien le precedió, se sabe que [From.GetElLa] nuev[From.GetOA] [From.GetEmperorEmpress] cree en una China [From.Offmap.GetPolicy]. Al parecer, siente un especial interés por [From.Offmap.GetLike] pero desaprueba [From.Offmap.GetDislike].;;;;;;;;;x
EVTDESC_JD_50001_NEW_DYN;A new Dynasty has risen in China as the House of [FromFrom.GetOnlyDynastyName] has been supplanted by the House of [From.GetOnlyDynastyName]. However, the new [From.GetEmperorEmpress], [From.GetDynName], apparently seeks to pursue the same [From.Offmap.GetPolicy] Policy as [From.GetPossPronoun] predecessor. [From.GetDynName] likes [From.Offmap.GetLike] and dislikes [From.Offmap.GetDislike].;Une nouvelle dynastie a pris le pouvoir en Chine. La Maison des [FromFrom.GetOnlyDynastyName] a été supplantée par la Maison des [From.GetOnlyDynastyName]. Cependant, [From.GetLeLa] nouve[From.GetLLle] [From.GetEmperorEmpress] [From.GetDynName] cherche apparemment à poursuivre la même politique [From.Offmap.GetPolicy] que son prédécesseur. [From.GetDynName] aime [From.Offmap.GetLike] et déteste [From.Offmap.GetDislike].;Nachdem das Haus von [From.GetOnlyDynastyName] das Haus von [FromFrom.GetOnlyDynastyName] verdrängt hat, ist eine neue Dynastie an die Macht in China gelangt. [From.GetDerDie] neue [From.GetEmperorEmpress] [From.GetDynName] versucht aber offenbar die gleiche Politik, [From.Offmap.GetPolicy], zu verfolgen. [From.GetDynName] mag [From.Offmap.GetLike], aber mag keine [From.Offmap.GetDislike].;;Una nueva dinastía se ha alzado en China ahora que la Casa de [FromFrom.GetOnlyDynastyName] fue reemplazada por la Casa de [From.GetOnlyDynastyName]. Sin embargo, [From.GetElLa] nuev[From.GetOA] [From.GetEmperorEmpress], [From.GetDynName], parece que quiere continuar la misma política [From.Offmap.GetPolicy] de sus predecesores. A [From.GetDynName] le gustan [From.Offmap.GetLike] y le disgustan [From.Offmap.GetDislike].;;;;;;;;;x
EVTDESC_JD_50001_NEW_DYN_NEW_POLICY;A new Dynasty has risen in China as the House of [FromFrom.GetOnlyDynastyName] has been supplanted by the House of [From.GetOnlyDynastyName]. The new [From.GetEmperorEmpress], [From.GetDynName], favors an [From.Offmap.GetPolicy] China, and is abandoning the [From.Offmap.GetPrevPolicy] Policy of [From.GetPossPronoun] predecessor. [From.GetDynName] likes [From.Offmap.GetLike] and dislikes [From.Offmap.GetDislike].;Une nouvelle dynastie a pris le pouvoir en Chine. La Maison [FromFrom.GetOnlyDynastyName] a été supplantée par les [From.GetOnlyDynastyName]. [From.GetLeLaCap] nouve[From.GetLLle] [From.GetEmperorEmpress] [From.GetDynName] favorise une Chine [From.Offmap.GetPolicy] et abandonne la politique [From.Offmap.GetPrevPolicy] de son prédécesseur. [From.GetDynName] aime [From.Offmap.GetLike] et déteste [From.Offmap.GetDislike].;Nachdem das Haus von [From.GetOnlyDynastyName] das Haus von [FromFrom.GetOnlyDynastyName] verdrängt hat, ist eine neue Dynastie an die Macht in China gelangt. [From.GetDerDie] neue [From.GetEmperorEmpress] [From.GetDynName] bevorzugt ein China, das [From.Offmap.GetPolicy] ist und gibt die vorherige Politik [From.Offmap.GetPrevPolicy] auf. [From.GetDynName] mag [From.Offmap.GetLike], aber mag keine [From.Offmap.GetDislike].;;Una nueva dinastía se ha alzado en China ahora que la Casa de [FromFrom.GetOnlyDynastyName] fue reemplazada por la Casa de [From.GetOnlyDynastyName]. [From.GetElLaCap] nuev[From.GetOA] [From.GetEmperorEmpress], [From.GetDynName], favorece una china [From.Offmap.GetPolicy] y abandona la política de [From.Offmap.GetPrevPolicy] de sus predecesores. A [From.GetDynName] le gustan [From.Offmap.GetLike] y le disgustan [From.Offmap.GetDislike].;;;;;;;;;x
EVTDESC_JD_50001_NEW_POLICY;[FromFrom.GetEmperorEmpress] [FromFrom.GetDynName], known for [FromFrom.GetPossPronoun] [From.Offmap.GetPrevPolicy] Policy, has died and [From.GetDynName] now sits upon the Dragon Throne. It is said that [From.GetSubjectPronoun] especially appreciates [From.Offmap.GetLike] but despises [From.Offmap.GetDislike]. Unlike [From.GetPossPronoun] predecessor, the new [From.GetEmperorEmpress] is known to favor the idea of an [From.Offmap.GetPolicy] China.;L'[FromFrom.GetEmperorEmpress] [FromFrom.GetDynName], connu[FromFrom.Get_E] pour sa politique [From.Offmap.GetPrevPolicy], a trépassé et [From.GetDynName] est maintenant assis[From.Get_E] sur le trône du Dragon. Il est dit qu'[From.GetIlElle] apprécie particulièrement [From.Offmap.GetLike] mais méprise [From.Offmap.GetDislike]. Contrairement à son prédécesseur, [From.GetLeLa] nouve[From.GetLLle] [From.GetEmperorEmpress] est connu[From.Get_E] pour favoriser une Chine [From.Offmap.GetPolicy].;[FromFrom.GetEmperorEmpress] [FromFrom.GetDynName], bekannt für [From.GetHerHis]e [From.Offmap.GetPrevPolicy]-Politik, ist gestorben und [From.GetDynName] sitzt jetzt auf dem Drachenthron. Es wird gesagt, dass [FromFrom.GetSheHe] besonders [From.Offmap.GetLike] mag, aber [From.Offmap.GetDislike] verachtet. Im Gegensatz zu [From.GetHerHis]em Vorgänger ist [From.Getderdie] neue [From.GetEmperorEmpress] bekannt, die Idee eines Chinas zu bevorzugen, das [From.Offmap.GetPolicy] ist.;;[FromFrom.GetEmperorEmpress] [FromFrom.GetDynName], célebre por su política [From.Offmap.GetPrevPolicy], murió y ahora [From.GetDynName] se sienta en el trono del Dragón. Se dice que aprecia especialmente [From.Offmap.GetLike] pero desdeña [From.Offmap.GetDislike]. Al contrario que su predecesor, se sabe que [From.GetElLa] nuev[From.GetOA] [From.GetEmperorEmpress] favorece la idea de una china [From.Offmap.GetPolicy].;;;;;;;;;x
EVTDESC_JD_50021_EXP;The great [FromFrom.Ruler.GetEmperorEmpress] [FromFrom.Ruler.GetDynName] of China has suddenly taken a keen interest in the rest of the world, particularly the West. This new Expansionist Policy could bode ill for neighboring rulers who are not in China's good graces.\n\nThe Dragon is awake.;[FromFrom.Ruler.GetLeLaCap] grand[FromFrom.Ruler.Get_E] [FromFrom.Ruler.GetEmperorEmpress] [FromFrom.Ruler.GetDynName] de Chine a soudainement un vif intérêt pour le reste du monde, en particulier l'Ouest. Cette nouvelle politique expansionniste pourrait être de mauvais augure pour les seigneurs voisins qui ne sont pas dans les bonnes grâces de la Chine.\n\nLe Dragon s'est réveillé.;[FromFrom.Ruler.GetDerDie] große [FromFrom.Ruler.GetEmperorEmpress] [FromFrom.Ruler.GetDynName] von China hat plötzlich ein großes Interesse an dem Rest der Welt und vor allem dem Westen genommen. Diese neue Politik der Expansion könnte für benachbarte Herrscher, die nicht in Chinas Gnade stehen, schlecht ausgehen.\n\nDer Drache ist erwacht.;;[FromFrom.GetElLaCap] gran [FromFrom.Ruler.GetEmperorEmpress] [FromFrom.Ruler.GetDynName] de China ha tomado de repente sumo interés en el resto del mundo, especialmente Occidente. Esta nueva política Expansionista podría no presagiar nada bueno para los gobernantes vecinos que no cuentan con la gracia de China.\n\nEl dragón ha despertado.;;;;;;;;;x
EVTDESC_JD_50021_ISO;China has gone from [FromFrom.GetPrevPolicy] to Isolationist. The [FromFrom.Ruler.GetSonDaughterCap] of Heaven, [FromFrom.Ruler.GetDynName], is turning [FromFrom.Ruler.GetPossPronoun] back on the barbarian world that surrounds China's perfection in order to [GetChinaIsolationPastime].;La Chine est passée d'une politique [FromFrom.GetPrevPolicy] à isolationniste. [FromFrom.Ruler.GetLeLaCap] [FromFrom.Ruler.GetSonDaughterCap] du Ciel, [FromFrom.Ruler.GetDynName], se coupe du monde barbare qui entoure la perfection de la Chine afin [GetChinaIsolationPastime].;China ist von [FromFrom.GetPrevPolicy] zu Isolationist gewechselt. [FromFrom.Ruler.GetDerDie] [FromFrom.Ruler.GetSonDaughterCap] des Himmels, [FromFrom.Ruler.GetDynName], wendet sich von der barbarischen Welt, die die Perfektion Chinas umgibt ab, damit [FromFrom.Ruler.GetSheHe] [GetChinaIsolationPastime].;;China ha pasado de [FromFrom.GetPrevPolicy] a aislacionista. [FromFrom.GetElLaCap] [FromFrom.Ruler.GetSonDaughterCap] del Cielo, [FromFrom.Ruler.GetDynName] le da la espalda al mundo bárbaro que rodea la perfección de China para [GetChinaIsolationPastime].;;;;;;;;;x
EVTDESC_JD_50021_OPEN;China has abandoned its [FromFrom.GetPrevPolicy] ways and is now open to trade and business as usual.;La Chine a abandonné sa politique [FromFrom.GetPrevPolicy] et est maintenant ouverte au commerce.;China hat seine Politik [FromFrom.GetPrevPolicy] aufgegeben und ist nun offen für Handel und normale Geschäfte.;;China ha abandonado la vía [FromFrom.GetPrevPolicy] y ahora está abierta al comercio y los negocios como siempre.;;;;;;;;;x
EVTDESC_JD_50031_CW;[FromFrom.GetChinaPreviousStatusEnd]. Civil War now rocks China as a rebellious governor has managed to gather support from the local military officers in [GetRandomChineseRegion]. Silk Road profits are halved and Tributary states can use this opportunity to break free - China will not be able to assist them should they be attacked anyway.;[FromFrom.GetChinaPreviousStatusEnd]. La guerre civile ébranle la Chine alors qu'un gouverneur rebelle a réussi à recueillir le soutien des officiers militaires locaux à [GetRandomChineseRegion]. Les bénéfices de la Route de la Soie se réduisent de moitié et les États tributaires pourraient profiter de cette occasion pour se libérer - la Chine ne pourrait de toute façon pas les aider s'ils étaient attaqués.;[FromFrom.GetChinaPreviousStatusEnd]. Der Bürgerkrieg ist in China ausgebrochen, als es ein rebellischer Gouverneur geschafft hat, Unterstützung des lokalen Militärs von [GetRandomChineseRegion] zu erlangen. Gewinne an der Seidenstraße sind reduziert und Tributstaaten können diese Möglichkeit nutzen, ihre Unabhängigkeit zu fordern. China wird sie außerdem nicht schützen können.;;[FromFrom.GetChinaPreviousStatusEnd]. La guerra civil estremece China cuando un gobernador rebelde se gana el apoyo de los oficiales militares locales de [GetRandomChineseRegion]. Los beneficios de la Ruta de la Seda se reducen a la mitad, los estados tributarios pueden aprovechar esta oportunidad para liberarse y de todos modos China tampoco podrá ayudarlos si son atacados.;;;;;;;;;x
EVTDESC_JD_50031_FAMINE;[FromFrom.GetChinaPreviousStatusEnd]. China has recently been suffering from droughts and the people are starving as a Great Famine upsets the harmony in the Divine Land. The caravans and ships of the Silk Road have virtually ceased and the great Chinese artisans are simply trying to survive. China will not be able to assist its Tributary states.;[FromFrom.GetChinaPreviousStatusEnd]. La Chine a récemment souffert de sécheresse et une grande famine bouleverse l'harmonie de la terre divine. Les caravanes et les navires de la Route de la Soie sont à l'arrêt et les grands artisans chinois essaient simplement de survivre. La Chine ne sera pas en mesure d'aider ses États tributaires.;[FromFrom.GetChinaPreviousStatusEnd]. China leidet an Dürren und die Menschen verhungern an einer großen Hungersnot. Die Karawanen und Schiffe auf der Seidenstraße sind praktisch zum Stillstand gekommen und die großen chinesischen Handwerker versuchen einfach zu überleben. China wird nicht in der Lage sein, seinen Tributstaaten zu helfen.;;[FromFrom.GetChinaPreviousStatusEnd]. China ha estado sufriendo sequías y la gente se muere de hambre cuando la Gran Hambruna trastoca la armonía de la Tierra Divina. Prácticamente han desaparecido las caravanas y barcos de la Ruta de la Seda y los grandes artesanos chinos solo tratan de sobrevivir. China no podrá ayudar a sus estados tributarios.;;;;;;;;;x
EVTDESC_JD_50031_GOLDEN;[FromFrom.GetChinaPreviousStatusEnd]. Harmony and progress are blossoming throughout China under the benevolent rule of [FromFrom.Ruler.GetDynName]. New types of precious silks and other wondrous new wares have started to flow along the increasingly safe routes of the Silk Road, whose wealth has doubled!;[FromFrom.GetChinaPreviousStatusEnd]. L'harmonie et les progrès sont en plein essor dans toute la Chine sous le règne bienveillant de [FromFrom.Ruler.GetDynName]. De nouveaux types de soies précieuses et d'autres nouvelles marchandises merveilleuses ont commencé à transiter via les routes de plus en plus sûres de la Route de la Soie, dont la richesse a doublé!;[FromFrom.GetChinaPreviousStatusEnd]. Harmonie und Fortschritt erblühen in ganz China unter der wohlwollenden Herrschaft von [FromFrom.Ruler.GetDynName]. Es tauchen neue Arten kostbarer Seide und andere wundersame neue Waren nach und nach auf dem immer sichereren Wegen der Seidenstraße auf. Der Reichtum der Seidenstraße hat sich verdoppelt!;;[FromFrom.GetChinaPreviousStatusEnd]. La armonía y progreso florecen por toda China bajo el gobierno benévolo de [FromFrom.Ruler.GetDynName]. ¡Nuevos tipos de sedas preciosas y otros nuevos bienes maravillosos han empezado a fluir por los caminos cada vez más seguros de la Ruta de la Seda, cuya riqueza se ha doblado!;;;;;;;;;x
EVTDESC_JD_50031_JURCHENS;[FromFrom.GetChinaPreviousStatusEnd]. [Root.Religion.GetHighGodNameCap] must have decided to punish the arrogance of the bureaucratic Chinese regime, for a great Jurchen Horde has recently disrupted the harmony of the 'Divine Land'. Led by their great Khagan, numberless fierce riders have crossed the Liao river and invaded Northeastern China, apparently intent on conquering the whole empire. [FromFrom.Ruler.GetEmperorEmpress] [FromFrom.Ruler.GetDynName] is slowly gathering [FromFrom.Ruler.GetPossPronoun] forces in [GetRandomChineseRegion], but many are already questioning whether [FromFrom.Ruler.GetSubjectPronoun] has lost the Mandate of Heaven...\n\nFor tributary states of China this means that their suzerain will be unable to lend them military aid. Others point out that it is an opportune time to break free.;[FromFrom.GetChinaPreviousStatusEnd]. [Root.Religion.GetHighGodNameCap] a certainement décidé de punir l'arrogance du régime bureaucratique chinois, car une grande horde jurchen a récemment interrompu l'harmonie de la « Terre Divine ». Dirigés par leur grand khagan, de nombreux cavaliers féroces ont traversé le fleuve Liao et envahi le nord-est de la Chine, apparemment pour conquérir tout l'empire. L'[FromFrom.Ruler.GetEmperorEmpress] [FromFrom.Ruler.GetDynName] regroupe lentement ses forces en [GetRandomChineseRegion], mais beaucoup se demandent déjà [FromFrom.Ruler.GetSilSielle] n'aurait pas perdu le Mandat du Ciel. Les États tributaires pourraient profiter de cette occasion pour se libérer - la Chine ne pouvant de toute façon pas les aider en cas d'attaque.\n\nLes États tributaires de la Chine ne recevront pas d'aide militaire de la part de leur suzerain et pourraient profiter de cette occasion pour se libérer.;[FromFrom.GetChinaPreviousStatusEnd]. [Root.Religion.GetHighGodNameCap] muss beschlossen haben, die Arroganz des bürokratischen chinesischen Regimes zu bestrafen, denn eine große Jurchen-Armee hat vor kurzen die Harmonie des "Göttlichen Landes" gestört. Angeführt von ihrem Großkhagan, haben unzählige tapfere Reiter den Liao-Fluss überquert und sind in das nordöstliche China eingedrungen, scheinbar um das ganze Reich zu erobern. [FromFrom.Ruler.GetEmperorEmpress] [FromFrom.Ruler.GetDynName] sammelt langsam [FromFrom.Ruler.GetPossPronoun] Truppen in [GetRandomChineseRegion], aber viele fragen sich bereits, ob [FromFrom.Ruler.GetSheHe] das Mandat des Himmels bereits verloren hat...\n\nFür chinesische Tributstaaten bedeutet dies, dass ihr Lehnsherr sie nicht militärisch unterstützen kann. Einige weisen auch darauf hin, dass dies eine gute Gelegenheit ist, um die Unabhängigkeit zu fordern.;;[FromFrom.GetChinaPreviousStatusEnd]. [Root.Religion.GetHighGodNameCap] debe haber decidido castigar la arrogancia del burocrático régimen chino, pues una gran horda yurchen ha perturbado recientemente la armonía de la 'Tierra Divina'. Dirigidos por su gran khagan, innumerables jinetes feroces han cruzado el río Liao e invadido el Noreste de China, queriendo al parecer conquistar el imperio entero. [FromFrom.GetElLaCap] [FromFrom.Ruler.GetEmperorEmpress] [FromFrom.Ruler.GetDynName] reúne lentamente sus fuerzas en [GetRandomChineseRegion], pero algunos se cuestionan si no habrá perdido el Mandato del Cielo…\n\nPara los estados tributarios de China esto significa que su soberano no podrá prestar ayuda militar. Otros se fijaran en que es la oportunidad de liberarse.;;;;;;;;;x
EVTDESC_JD_50031_MONGOLS;[offmap_china.GetChinaPreviousStatusEnd]. [Root.Religion.GetHighGodNameCap] must be displeased with the Dragon Throne, for a great Mongol Horde has managed to cross the mighty fortifications of Northern China, intent on disrupting the harmony and prosperity of the 'Divine Land'. [offmap_china.Ruler.GetEmperorEmpress] [offmap_china.Ruler.GetDynName] is mustering [offmap_china.Ruler.GetHerHis] armies in [GetRandomChineseRegion] for a swift response, but [offmap_china.Ruler.GetSubjectPronoun] could be in for a long war...\n\nFor tributary states of China this means that their suzerain will be unable to lend them military aid. Others point out that it is an opportune time to break free.;[offmap_china.GetChinaPreviousStatusEnd]. [Root.Religion.GetHighGodNameCap] doit être mécontent du Trône du Dragon, car une grande horde mongole a réussi à traverser les puissantes fortifications de la Chine du Nord, visant à perturber la prospérité de la « Terre Divine ». L'[offmap_china.Ruler.GetEmperorEmpress] [offmap_china.Ruler.GetDynName] rassemble ses armées en [GetRandomChineseRegion] pour une réponse rapide, mais elles pourraient être utilisées pour une longue guerre...\n\nLes États tributaires de la Chine ne recevront pas d'aide militaire de la part de leur suzerain et pourraient profiter de cette occasion pour se libérer.;[offmap_china.GetChinaPreviousStatusEnd]. [Root.Religion.GetHighGodNameCap] muss mit dem Drachenthron unzufrieden sein, denn eine große mongolische Horde hat es geschafft, die mächtigen Befestigungen von Nordchina zu überqueren, um die Harmonie und den Wohlstand des "Göttlichen Landes" zu stören. [offmap_china.Ruler.GetEmperorEmpress] [offmap_china.Ruler.GetDynName] sammelt [offmap_china.Ruler.GetHerHis]e Armeen in [GetRandomChineseRegion], um zu einem schnellen Schlag anzusetzen, aber es könnte ein langer Krieg sein...\n\nFür chinesische Tributstaaten bedeutet dies, dass ihr Lehnsherr sie nicht militärisch unterstützen kann. Einige weisen auch darauf hin, dass dies eine gute Gelegenheit ist, um die Unabhängigkeit zu fordern.;;[offmap_china.GetChinaPreviousStatusEnd]. [Root.Religion.GetHighGodNameCap] debe estar disgustado con el Trono del Dragón, ya que una gran horda mongola ha sido capaz de atravesar las poderosas fortificaciones del Norte de China, intentando perturbar la armonía y prosperidad de la 'Tierra Divina'. [offmap_china.Ruler.GetElLaCap] [offmap_china.Ruler.GetEmperorEmpress] [offmap_china.Ruler.GetDynName] reúne sus ejércitos en [GetRandomChineseRegion] para dar una respuesta rápida, pero puede que sea una guerra larga… \n\nPara los estados tributarios de China esto significa que su soberano no podrá prestar ayuda militar. Otros se fijaran en que es la oportunidad de liberarse.;;;;;;;;;x
EVTDESC_JD_50031_PLAGUE;[FromFrom.GetChinaPreviousStatusEnd]. The Pale Rider is sowing his deadly seeds in China - a Devastating Plague has broken out in [GetRandomChineseRegion]. No goods travel along the Silk Road as the merchants fear infection. Even so, the deadly scourge is spreading quickly, and the troubles of China could soon be ours... China will not be able to assist its Tributary states.;[FromFrom.GetChinaPreviousStatusEnd]. La Faucheuse ensemence ses graines mortelles en Chine - une peste dévastatrice a éclaté à [GetRandomChineseRegion]. Aucune marchandise ne transite via la Route de la Soie, puisque les commerçants craignent une infection. Même ainsi, le fléau mortel se répand rapidement, et les problèmes de la Chine pourraient bientôt être les nôtres... La Chine ne pourra pas aider ses États tributaires.;[FromFrom.GetChinaPreviousStatusEnd]. Der fahle Reiter sät seine tödlichen Samen in China und eine verheerende Pest ist in [GetRandomChineseRegion] ausgebrochen. Händler fürchten Infektionen und schicken keine Waren mehr auf die Seidenstraße. Trotzdem breitet sich die tödliche Geißel schnell aus und die Probleme Chinas könnten bald auch die unseren sein... China wird nicht in der Lage sein, seinen Tributstaaten zu helfen.;;[FromFrom.GetChinaPreviousStatusEnd]. El Jinete pálido está sembrando sus semillas mortales en China. Ha aparecido un brote de Peste devastadora en [GetRandomChineseRegion]. Los bienes no viajan por la Ruta de la Seda, ya que los mercaderes temen la infección. Aun así, el azote mortal se extiende rápidamente y los problemas de China pronto podrían ser los nuestros… China no podrá ayudar a sus estados tributarios.;;;;;;;;;x
EVTDESC_JD_50031_STABLE;[FromFrom.GetChinaPreviousStatusEnd]. Things are returning to normal and the Middle Kingdom seems stable.;[FromFrom.GetChinaPreviousStatusEnd]. L'Empire du Milieu semble avoir renoué avec la stabilité.;[FromFrom.GetChinaPreviousStatusEnd]. Die Dinge normalisieren sich wieder und das Mittlere Königreich scheint stabil.;;[FromFrom.GetChinaPreviousStatusEnd]. Las cosas vuelven a la normalidad y el Reino Central parece estable.;;;;;;;;;x
EVTDESC_JD_50031_UNREST;[FromFrom.GetChinaPreviousStatusEnd]. Popular uprisings have broken out in [GetRandomChineseRegion] and large groups of disgruntled peasants have taken up arms, led by [GetRandomChineseFaction]. Trade has been halved along the Silk Road and China will not be able to defend its Tributary states.;[FromFrom.GetChinaPreviousStatusEnd]. Des soulèvements populaires ont éclaté à [GetRandomChineseRegion] et de grands groupes de paysans mécontents dirigés par [GetRandomChineseFaction] ont pris les armes. Le commerce a été réduit de moitié le long de la Route de la Soie et la Chine ne pourra pas défendre ses États tributaires.;[FromFrom.GetChinaPreviousStatusEnd]. Aufstände sind in [GetRandomChineseRegion] ausgebrochen und große Gruppen verärgerter Bauern, angeführt von [GetRandomChineseFaction], haben die Waffen ergriffen. Der Handel auf der Seidenstraße ist zum Stillstand gekommen und China wird nicht in der Lage sein, seine Tributstaaten zu schützen.;;[FromFrom.GetChinaPreviousStatusEnd]. Han estallado levantamientos populares en [GetRandomChineseRegion] y grandes grupos de campesinos descontentos han tomado las armas, liderados por [GetRandomChineseFaction]. El comercio en la Ruta de la Seda se reduce a la mitad y China no será capaz de defender a sus estados tributarios.;;;;;;;;;x
EVTDESC_JD_50141_BOOST;With China already suffering from the [offmap_china.GetPrevStatus], a great Mongol Horde has decided to exploit the situation and has crossed into Northern China. Will the fierce horsemen from the endless steppes manage to break the Dragon's back?;Alors que la Chine souffre déjà ([offmap_china.GetPrevStatus]), une grande horde mongole a décidé de profiter de la situation et traversé le nord de la Chine. Les féroces cavaliers des steppes parviendront-ils à briser le dos du Dragon ?;Mit China, das bereits unter [offmap_china.GetPrevStatus] leidet, hat eine große mongolische Armee beschlossen, die Situation zu nutzen und ist in Nordchina eingefallen. Werden die tapferen Reiter der endlosen Steppe in der Lage sein, den Rücken des Drachen zu brechen?;;Con China ya sufriendo por [offmap_china.GetPrevStatus], una gran horda mongola ha decidido aprovechar la situación, entrando en el Norte de China. ¿Conseguirán los feroces jinetes de las estepas infinitas partir el lomo del dragón?;;;;;;;;;x
