EVTDESCHF23204;Apollo takes a very prestigious spot in Hellenic mythology, being associated with reason, arts and medicine. His twin sister [GetArtemisDianaName] on the other hand tends to have humbler, more secretive followers, being associated with night and nature. Finally, [GetHermesMercuryName] is the messenger of the gods, associated with roads, trading and, sometimes, trickery and theft. [GetPrincelyElectorsList];Apollon prend une place très prestigieuse dans la mythologie hellénique, étant associé à la raison, les arts et la médecine. Par ailleurs, sa soeur jumelle, [GetArtemisDianaName], a tendance à avoir des adeptes plus humbles, plus discrets, associés à la nuit et à la nature. Enfin, [GetHermesMercuryName] est le messager des dieux, associé aux routes, au commerce et, parfois, à la tromperie et au vol. [GetPrincelyElectorsList];Apollo hat einen sehr angesehenen Platz in der hellenischen Mythologie und wird mit Vernunft, Kunst und Medizin in Verbindung gebracht. Seine Zwillingsschwester [GetArtemisDianaName] hingegen neigt dazu, bescheidenere und geheimnisvollere Anhänger zu haben, die mit der Nacht und Natur in Verbindung gebracht werden. Schließlich ist [GetHermesMercuryName] der Bote der Götter und wird mit Straßen, Handel und manchmal auch Trick und Diebstahl verbunden. [GetPrincelyElectorsList];;Apolo tiene un lugar muy prestigioso en la mitología helénica, al relacionarse con la razón, las artes y la medicina. Por otra parte, su gemela, [GetArtemisDianaName], tiene unos seguidores más humildes y reservados, al estar relacionada con la noche y la naturaleza. Por último lugar, [GetHermesMercuryName] es el mensajero de los dioses, relacionado con caminos y comercio y en algunas ocasiones, las artimañas y el robo. [GetPrincelyElectorsList];;;;;;;;;x
EVTDESCHF23207;The pillaging of [From.GetName] has been very fruitful. Our warriors have gathered many prisoners amongst the populace that look fit to become good thralls.;Le pillage de [From.GetName] a été très fructueux. Nos guerriers ont fait de nombreux prisonniers et ils semblent aptes à devenir de bons esclaves.;Die Plünderung von [From.GetName] war sehr ertragreich. Unsere Krieger haben viele Gefangene in der Bevölkerung gemacht, die fit genug sind, gute Sklaven zu werden.;;El saqueo de [From.GetName] ha sido muy fructífero. Nuestros guerreros han reunido a muchos prisioneros de la población que parecen aptos para convertirse en buenos esclavos.;;;;;;;;x
EVTDESCHF23208;The monstrous raiders led by [From.GetTitledFirstName] have slaughtered many of the people of [FromFrom.GetName], flooding the streets with blood in order to appease their wicked idols.;Les monstrueux pillards dirigés par [From.Get_le_TitledFirstName] ont massacré les habitants de [FromFrom.GetName], inondant les rues de sang afin d'apaiser leurs idoles pernicieuses.;Die monströsen Plünderer von [From.GetTitledFirstName] haben viele der Menschen von [FromFrom.GetName] abgeschlachtet und die Straßen im Blut getränkt, um ihre bösen Götzen zu beschwichtigen.;;Los monstruosos saqueadores dirigidos por [From.GetTitledFirstName] han masacrado a gran parte de las gentes de [FromFrom.GetName], inundando de sangre las calles para apaciguar a sus ídolos malignos.;;;;;;;;x
EVTDESCHF23209;[From.GetName] was filled with horses and cattle. Our raiders have rounded up a large flock in the main square so that I can decide which ones to pick for myself and what to do with them.;Les terres de [From.GetName] étaient remplies de chevaux et de bétail. Nos pilleurs ont rassemblé un grand troupeau sur la place principale afin que je puisse décider lesquels choisir pour moi et que faire avec eux.;[From.GetName] war voller Pferde und Vieh. Unsere Plünderer haben eine große Herde auf dem Hauptplatz zusammengetrieben, damit ich entscheiden kann, welche ich für mich selbst nehme und was mit dem Rest passieren soll.;;[From.GetName] estaba lleno de caballos y ganado. Nuestros hombres han reunido un gran rebaño en la plaza principal para que decida cuáles me quedo y qué hago con ellos.;;;;;;;;x
EVTDESCHF23210;My raiders have stormed the walls of [From.GetName] and overwhelmed the local garrison. With the defenders dead or forced to retreat, we have gained free access to the entire coast of this province. The many riches of [From.Location.County.GetName] are ours for the taking!;Mes pilleurs ont pris d'assaut les murs de [From.GetName] et ont submergé la garnison locale. Avec les défenseurs morts ou forcés de battre en retraite, nous avons un libre accès à toute la côte de cette province. Les nombreuses richesses de [From.Location.County.GetName] sont les nôtres !;Meine Plünderer haben die Mauern von [From.GetName] gestürmt und die lokale Garnison überwältigt. Jetzt, wo die Verteidiger tot oder zum Rückzug gezwungen sind, haben wir freien Zugang zur gesamten Küste dieser Provinz. Die vielen Reichtümer von [From.Location.County.GetName] müssen nur noch von uns genommen werden!;;Mis saqueadores asaltaron las murallas de [From.GetName] y superaron a la guarnición local. Con sus defensores muertos u obligados a retirarse, hemos conseguido acceso libre a toda la costa de esta provincia. ¡Las muchas riquezas de [From.Location.County.GetName] están a nuestra disposición!;;;;;;;;x
EVTDESCHF23211;The vile raider [From.GetTitledFirstName] has pillaged [FromFrom.GetName] to the ground. Many of his warriors, taken by greed and a bloodthirsty frenzy have destroyed several buildings and killed scores of people in their search for riches.;L'infâme pilleu[From.GetRSe] [From.GetTitledFirstName] a saccagé [FromFrom.GetName]. Ses guerriers, guidés par la cupidité et une frénésie sanguinaire, ont détruit plusieurs bâtiments et tué des dizaines de personnes dans leur recherche de richesses.;Der niederträchtigen Plünderer [From.GetTitledFirstName] hat [FromFrom.GetName] bis zum letzten Stein geplündert. Viele seiner Krieger, die von Gier und Blutrausch ergriffen wurden, haben mehrere Gebäude zerstört und Dutzende Menschen auf der Suche nach Reichtum getötet.;;El vil saqueador de [FromFrom.GetName] ha rapiñado [From.Location.County.GetName] hasta los cimientos. Muchos de sus guerreros, poseídos por la codicia y un frenesí sanguinario han destruido numerosos edificios y matado a muchísima gente en busca de riquezas.;;;;;;;;x
EVTDESCHF23213;There are many raiders plaguing our shores, but none have become as infamous as [From.GetFirstNameWithNick]. Common folks are afraid to even mention [From.GetHerHis] name, thinking of this [From.GetManWoman] as some sort of sea-demon, stalking the cold depths of seas and rivers, waiting to strike at unsuspecting preys. \nAccording to the stories, this ravager leads an army of drowned men and controls a giant wyrm. [From.GetSheHeCap] is said to have killed thousands and burned entire realms to the ground.;Il y a beaucoup de pilleurs qui sévissent sur nos rivages, mais aucun n'est devenu aussi tristement célèbre que [From.GetFirstNameWithNick]. Les roturiers ont même peur de mentionner son nom, se [From.GetLeLa] représentant comme une sorte de démon des mers régnant sur les profondeurs froides des océans et des fleuves, attendant d'attaquer des proies sans méfiance.\nD'après ce qui se raconte, c[From.GetEEtte] ravageu[From.GetRSe] mène une armée d'hommes noyés et contrôle un dragon des mers. [From.GetIlElleCap] aurait tué des milliers de personnes et brûlé des royaumes entiers.;Es gibt viele Plünderer, die unsere Küsten plagen, doch keiner ist so berüchtigt wie [From.GetFirstNameWithNick]. Gewöhnliche Leute haben Angst auch nur [From.GetHerHis]en Namen auszusprechen und halten diese[From.GetnMale] [From.GetManWoman] für eine Art Dämon des Ozeans, der in den kalten Tiefen der Meere und Flüsse darauf wartet, ahnungslose Beute zu packen.\nGeschichten zu Folge führt dieser Plünderer eine Armee ertrunkener Männer an und kontrolliert eine riesige Seeschlange. Man sagt, dass [From.GetSheHe] Tausende getötet und ganze Reiche niedergebrannt haben soll.;;Muchos saqueadores plagan nuestras costas, pero ninguno tan famos[From.GetOA] como [From.GetFirstNameWithNick]. El vulgo tiene miedo hasta de decir su nombre, creyendo que es una especie de demonio marino que acecha las profundidades de mares y fríos, esperando para atacar a sus confiadas presas.\nSegún las historias, este expoliador manda un ejército de ahogados y controla una serpiente marina gigante. Se dice que ha matado a miles de personas y arrasado reinos enteros.;;;;;;;;x
EVTDESCHF23777;In order to ensure the divine purity of their bloodline, [From.GetTitledFirstName] and [From.GetPossPronoun] [GetFromVsNewRelation] [New.GetTitledFirstName] have gotten married under the blessed auspices of [From.Religion.GetHighGodName], ensuring fullness and Order. We can collect a Royal Aid Duty to pay for the ceremonies.;Afin de garantir la pureté divine de leur lignée, [From.Get_le_TitledFirstName] et s[New.GetOnA] [GetFromVsNewRelation], [New.Get_le_TitledFirstName], se sont mariés sous les auspices [From.Get_du_HighGod], assurant la plénitude et l'ordre. Nous pourrions lever un impôt royal pour financer la cérémonie.;Um die göttliche Reinheit ihrer Blutlinie zu gewährleisten, haben [From.GetTitledFirstName] und [From.GetPossPronoun](e) [GetFromVsNewRelation] [New.GetTitledFirstName] unter dem gesegneten Schutz von [From.Religion.GetHighGodName] gehreitet und gewährleisten so Fülle und Ordnung. Wir können eine Adligengebühr verlangen, um die Zeremonie zu bezahlen.;;Para conseguir la pureza divina de su linaje, [From.GetTitledFirstName] y su [GetFromVsNewRelation] [New.GetTitledFirstName] se casan bajo los auspicios benditos de [From.Religion.GetHighGodName], garantizando plenitud y orden. Podemos reunir un impuesto de ayuda real para pagar la ceremonia;;;;;;;;;x

EVTDESCHHF23025;After making the proper calculations, I have determined that I was born under the sign of the Pisces, a constellation commonly associated with introversion and compassion.;Après avoir fait les bons calculs, j'ai déterminé que je suis né[Root.Get_E] sous le signe du Poisson, une constellation communément associée à l'introversion et à la compassion.;Nachdem ich die richtigen Berechnungen angestellt habe, habe ich herausgefunden, dass ich im Zeichen des Fisches geboren wurde, einer Sternkonstellation, die gewöhnlich Introvertiertheit und Mitgefühl ausdrückt.;;Tras realizar los cálculos pertinentes, he determinado que nací bajo el signo de Piscis, una constelación normalmente asociada con la introversión y la compasión.;;;;;;;;x
EVTDESCHHF23470;By carving this great monument, the fires of the [Root.Religion.GetName] faith have been stoked, bringing a bit of life to the spirits of our old and benevolent gods. The first offerings are already being presented at the feet of the new sacred monument of [From.GetName].;En sculptant ce grand monument, les feux de la foi [Root.Religion.GetName] ont été nourris, apportant un peu de vie aux esprits de nos dieux anciens et bienveillants. Les premières offrandes sont déjà présentées aux pieds du nouveau monument sacré de [From.GetName].;Durch das Schnitzen dieses großen Monuments wurden die Feuer des [Root.Religion.GetName]en Glaubens entfacht und den Geistern unserer alten und wilden Götter ein wenig Leben eingehaucht. Die ersten Opfer wurden bereits zu Füßen des neuen heiligen Denkmals von [From.GetName] gemacht.;;Al tallar este gran monumento, se han avivado las llamas del credo [Root.Religion.GetName], trayendo un poco de vida a los espíritus de nuestros viejos dioses y benevolentes. Ya se están presentando las primeras ofrendas a los pies del nuevo monumento sagrado de [From.GetName].;;;;;;;;x
EVTDESCHHF23761;My [GetFromRelation] has spent a few weeks tutoring me on matters of war, hoping to share [From.GetHerHis] extensive tactical knowledge with me. [From.GetTitledFirstName] helped me learn how to drill my troops better and how to engage in complex mock-skirmishes to refine both the soldiers' and my own readiness. I could not believe that there was still so much to learn about strategy...;M[From.GetOnA] [GetFromRelation] a passé quelques semaines à me conseiller en matière de guerre, espérant me transmettre ses vastes connaissances tactiques. [From.Get_Le_TitledFirstName] m'a aidé à mieux entraîner mes troupes et à effectuer des simulations d'escarmouches complexes. Je ne pensais pas qu'il y avait encore autant à apprendre sur la stratégie...;M[From.Geteineine] [GetFromRelation] hat die letzten Wochen damit verbracht mir die Kriegsführung beizubringen und hofft dadurch [From.GetHerHis] umfassendes Wissen über Taktik mit mir teilen zu können. [From.GetTitledFirstName] hat mir dabei geholfen meine Truppen besser zu drillen und mir gezeigt, wie Übungskämpfe sowohl die Bereitschaft meiner Soldaten als auch meine eigene verfeinern können. Ich kann kaum glauben, dass es noch so viel über Strategie zu lernen gab.;;Mi [GetFromRelation] ha pasado unas semanas dándome clases sobre asuntos bélicos, esperando compartir conmigo sus enormes conocimientos tácticos. [From.GetTitledFirstName] me ayudó a aprender como instruir mejor a mis tropas y como celebrar simulacros de refriegas para pulir la disposición de mis tropas y la mía propia. No me imaginaba que tuviera que aprender tanto de estrategia…;;;;;;;;;x
EVTDESCHHF23762;I feel my temples pulsating under my fingertips as I sit down in the middle of the training grounds, holding my head and searching for a slice of peace after another day wasted yelling at my troops. At first, I was excited when [From.GetTitledFirstName] offered me [From.GetHerHis] help to become a better commander, yet I simply cannot keep up with [From.GetHerHim].;Je sens mes tempes palpiter sous mes doigts tandis que je m'assieds au milieu du terrain d'entraînement, me tenant la tête et cherchant un moment de paix après avoir passé une autre journée à hurler sur mes troupes. J'étais excité[Root.Get_E] lorsque [From.Get_le_TitledFirstName] m'a offert son aide pour devenir un[Root.Get_E] meilleur[Root.Get_E] commandant[Root.Get_E], mais je ne peux tout simplement pas suivre le rythme.;Ich spürte, wie meine Schläfen pulsierten, als ich mich in der Mitte des Übungsplatzes hinsetze, meinen Kopf hielt und nach Ruhe suchte. All dieses vergebliche Anschreien meiner Truppen, um eine neue Taktik zu erproben, hat mich sichtlich mitgenommen. Zuerst war ich begeistert, doch ich kann einfach nicht mit [From.GetTitledFirstName] mithalten.;;Me siento en medio del campo de entrenamiento mientras las sienes me palpitan bajo los dedos, me agarro la cabeza y busco un poco de paz después de otro día malgastado gritando a mis tropas. Al principio me emocionó que [From.GetTitledFirstName] se ofreciese a ayudarme para ser mejor comandante, pero no puedo seguir su ritmo.;;;;;;;;;x

EVTDESCIHF23025;After making the proper calculations, I have determined that I was born under the sign of the Sagittarius, a constellation commonly associated with dynamism and charisma.;Après avoir fait les bons calculs, j'ai déterminé que je suis né[Root.Get_E] sous le signe du Sagittaire, une constellation communément associée au dynamisme et au charisme.;Nachdem ich die richtigen Berechnungen angestellt habe, habe ich herausgefunden, dass ich im Zeichen des Schützen geboren wurde, einer Sternkonstellation, die gewöhnlich Dynamik und Charisma ausdrückt.;;Tras realizar los cálculos pertinentes, he determinado que nací bajo el signo de Sagitario, una constelación normalmente asociada con el dinamismo y el carisma.;;;;;;;;x
EVTDESCIHF23470;By carving this opulent shrine to the Sun, the fires of the [Root.Religion.GetName] faith have been stoked. The first offerings are already being presented at the feet of the new sacred monument of [From.GetName].;En sculptant ce sanctuaire somptueux en l'honneur du soleil, les feux de la foi [Root.Religion.GetName] ont été nourris. Les premières offrandes sont déjà présentées aux pieds du nouveau monument sacré de [From.GetName].;Durch das Erbauen dieses opulenten Sonnenschreins wurden die Feuer des [Root.Religion.GetName]en Glaubens entfacht und den Geistern unserer alten und wilden Götter ein wenig Leben eingehaucht. Die ersten Opfer wurden bereits zu Füßen des neuen heiligen Denkmals von [From.GetName] gemacht.;;Al tallar este santuario opulento al sol, se han avivado las llamas del credo [Root.Religion.GetName]. Ya se están presentando las primeras ofrendas a los pies del nuevo monumento sagrado de [From.GetName].;;;;;;;;x
EVTDESCIHF23761;My [GetFromRelation] has insisted that I spend some time with [From.GetHerHim], learning how to better defend myself. We trained and dueled for days, and I ended up being pleasantly surprised by the level of skill shown by my opponent. [From.GetTitledFirstName] was an exquisite training partner and a wonderful mentor. I am marveled at how much I have learned about combat in such a short time.;M[From.GetOnA] [GetFromRelation] a insisté pour que je passe du temps avec [From.GetLuiElle] pour apprendre à mieux me défendre. Nous nous sommes entraînés pendant des jours et j'ai été agréablement surpris[Root.Get_E] par le niveau de compétence de mon adversaire. [From.Get_Le_TitledFirstName] a été un partenaire de formation exquis et un mentor formidable. Je suis émerveillé[Root.Get_E] par tout ce que j'ai appris sur le combat en si peu de temps.;M[From.Geteineine] [GetFromRelation] hat darauf bestanden, dass ich etwas Zeit mit [From.GetHerHim] verbringe und so lerne, wie ich mich besser verteidigen kann. Wir trainierten und duellierten uns tagelang und ich war angenehm überrascht von dem Geschickt, das mir mein Gegner zeigte. [From.GetTitledFirstName] war ein hervorragender Trainingspartner und ein wunderbarer Mentor. Ich bin erstaunt, wie viel ich in so kurzer Zeit über den Kampf lernen konnte.;;Mi [GetFromRelation] ha insistido que pase algo de tiempo con [From.GetElElla], aprendiendo cómo defenderme mejor. Entrenamos y nos batimos durante días y acabé sorprendid[Root.GetOA] por el nivel de habilidad que mi oponente muestra. [From.GetTitledFirstName] fue un[From.GetXA] compañero de entrenamiento exquisito y un mentor maravillos[From.GetOA]. Me maravilla cuánto he aprendido de combate en tan poco tiempo.;;;;;;;;;x
EVTDESCIHF23762;I let out a loud swear and ask [From.GetTitledFirstName] to stop, faltering for a few steps before finally finding my balance again. My [GetFromRelation] invites me to resume our training, but I simply shake my head. [From.GetHerHisCap] attempt to turn me into a better fighter by an intensive training was not as fruitful as either of us hoped.;Je laisse échapper un juron et demande [From.Get_au_TitledFirstName] de s'arrêter, chancelant un instant avant de retrouver mon équilibre. M[From.GetOnA] [GetFromRelation] m'invite à reprendre notre entraînement, mais je me contente de secouer la tête. Sa tentative de faire de moi un[Root.Get_E] meilleur[Root.Get_E] combattant[Root.Get_E] par un entraînement intensif n'a pas été aussi fructueuse que nous l'espérions.;Ich stieß einen lauten Fluch aus und bat [From.GetTitledFirstName] inne zuhalten, während ich versuchte mein Gleichgewicht zu finde. M[From.Geteineine] [GetFromRelation] lud mich dazu ein weiterzumachen, doch ich schüttle nur den Kopf. [From.GetHerHisCap] Versuch mich durch intensives Training zu einem besseren Kämpfer zu machen waren nicht sonderlich fruchtbar.;;Suelto un fuerte juramento y pido a [From.GetTitledFirstName] que se pare, vacilando unos pocos pasos antes de volver a encontrar el equilibrio otra vez. Mi [GetFromRelation] me invita a reanudar el entrenamiento, pero niego con la cabeza. Su intento de convertirme en un[Root.GetXA] guerrer[Root.GetOA] mejor mediante entrenamientos intensivos no está siendo tan fructífero como esperábamos.;;;;;;;;;x

EVTDESCLHF23025;After making the proper calculations, I have determined that I was born under the sign of the Scorpio, a constellation commonly associated with secretiveness and stubbornness.;Après avoir fait les bons calculs, j'ai déterminé que je suis né[Root.Get_E] sous le signe du Scorpion, une constellation communément associée à la discrétion et à l'acharnement.;Nachdem ich die richtigen Berechnungen angestellt habe, habe ich herausgefunden, dass ich im Zeichen des Skorpions geboren wurde, einer Sternkonstellation, die gewöhnlich Verschwiegenheit und Starrsinn ausdrückt.;;Tras realizar los cálculos pertinentes, he determinado que nací bajo el signo de Escorpio, una constelación normalmente asociada con la reserva y la obstinación.;;;;;;;;x
EVTDESCLHF23470;By carving this imposing [GetZeusJupiterName] Column, the fires of the [Root.Religion.GetName] faith have been stoked, bringing a bit of life to the spirits of our old and dignified gods. The first offerings are already being presented at the feet of the new sacred monument of [From.GetName].;En sculptant cette imposante colonne de [GetZeusJupiterName], les feux de la foi [Root.Religion.GetName] ont été nourris, apportant un peu de vie aux esprits de nos anciens et dignes dieux. Les premières offrandes sont déjà présentées aux pieds du nouveau monument sacré de [From.GetName].;Durch den Bau dieser imposanten [GetZeusJupiterName]säule wurden die Feuer des [Root.Religion.GetName]en Glaubens entfacht und den Geistern unserer alten und wilden Götter ein wenig Leben eingehaucht. Die ersten Opfer wurden bereits zu Füßen des neuen heiligen Denkmals von [From.GetName] gemacht.;;Al tallar esta imponente columna de [GetZeusJupiterName] se han avivado las llamas del credo [Root.Religion.GetName], trayendo un poco de vida a los espíritus de nuestros viejos dioses y dignos. Ya se están presentando las primeras ofrendas a los pies del nuevo monumento sagrado de [From.GetName].;;;;;;;;x
EVTDESCLHF23761;My [GetFromRelation] is of the opinion that I need to learn more about the responsibilities of a [Root.GetTitle]. [From.GetTitledFirstName] helped me to better understand some of the most commonly avoided duties associated with reviewing reports and administrating justice in the realm. Thanks to [From.GetHerHis] generous help, I have become a much more responsible ruler.;M[From.GetOnA] [GetFromRelation] est d'avis que j'ai besoin d'en savoir plus sur les responsabilités d'un[Root.Get_E] [Root.GetTitle]. [From.Get_Le_TitledFirstName] m'a aidé à mieux comprendre certaines des tâches les plus couramment évitées associées à la révision des rapports et à l'administration de la justice dans le pays. Grâce à son aide généreuse, je suis devenu[Root.Get_E] un[Root.Get_E] dirigeant[Root.Get_E] beaucoup plus responsable.;M[From.Geteineine] [GetFromRelation] ist der Meinung, dass ich mehr über die Verantwortlichkeiten [Root.Geteineseiner] [Root.GetTitle][Root.GetsMale] lernen muss. [From.GetTitledFirstName] half mir dabei einige der am häufigsten vermiedenen Aufgaben besser zu verstehen, der Prüfung von Berichten und Justizverwaltung im Reich. Dank [From.GetHerHis]er großzügigen Hilfe bin ich ein viel verantwortungsvollerer Herrscher geworden.;;Mi [GetFromRelation] sostiene que debo aprender más sobre las responsabilidades de un[Root.GetXA] [Root.GetTitle]. [From.GetTitledFirstName] me ayudó a comprender mejor los deberes que se suelen asociar a la revisión de informes y administrar justicia en el reino. Gracias a su generosa ayuda, me he convertido en un[Root.GetXA] gobernante mucho mejor.;;;;;;;;;x
EVTDESCLHF23762;I angrily crumple another paper and throw it away from me, trying to avoid [From.GetTitledFirstName]'s gaze. My [GetFromRelation] has been trying to teach me how to better organize and rule over my lands, but I have barely been able to follow half of the concepts [From.GetSheHe] keeps saddling my mind with.;Je déchire avec colère un autre papier et le jette loin de moi, essayant d'éviter le regard [From.Get_du_TitledFirstName]. M[From.GetOnA] [GetFromRelation] a essayé de m'apprendre à mieux administrer mes terres, mais j'ai à peine réussi à suivre la moitié des concepts avec lesquels [From.GetIlElle] me remplit la tête.;Ich zerknülle zornig ein weiteres Stück Papier und werfe es von mir weg, während ich den Blick von [From.GetTitledFirstName] meide. M[From.Geteineine] [GetFromRelation] hat versucht mir beizubringen, wie ich besser über mein Land herrschen kann, doch ich konnte der Hälfte der Konzepte kaum folgen.;;Arrugo con enfado otro papel y lo tiro bien lejos, intentando evitar la mirada de [From.GetTitledFirstName]. Mi [GetFromRelation] intenta enseñarme cómo organizar y gobernar mejor mis tierras, pero apenas he logrado seguir la mitad de los conceptos que me sigue lanzando.;;;;;;;;;x

EVTDESCMHF23025;After making the proper calculations, I have determined that I was born under the sign of the Taurus, a constellation commonly associated with perseverance and determination.;Après avoir fait les bons calculs, j'ai déterminé que je suis né[Root.Get_E] sous le signe du Taureau, une constellation communément associée à la persévérance et à la détermination.;Nachdem ich die richtigen Berechnungen angestellt habe, habe ich herausgefunden, dass ich im Zeichen des Stieres geboren wurde, einer Sternkonstellation, die gewöhnlich Beharrlichkeit und Entschlossenheit ausdrückt.;;Tras realizar los cálculos pertinentes, he determinado que nací bajo el signo de Tauro, una constelación normalmente asociada con la perseverancia y la determinación.;;;;;;;;x
