EVTDESCCHF23025;After making the proper calculations, I have determined that I was born under the sign of the Cancer, a constellation commonly associated with tenacity and introspection.;Après avoir fait les bons calculs, j'ai déterminé que je suis né[Root.Get_E] sous le signe du Cancer, une constellation communément associée à la ténacité et à l'introspection.;Nachdem ich die richtigen Berechnungen angestellt habe, habe ich herausgefunden, dass ich im Zeichen des Krebses geboren wurde, einer Sternkonstellation, die gewöhnlich Zähigkeit und Introspektion ausdrückt.;;Tras realizar los cálculos pertinentes, he determinado que nací bajo el signo de Cáncer, una constelación normalmente asociada con la tenacidad y la introspección.;;;;;;;;x
EVTDESCCHF23101;Centuries ago, the Galileans, in order to hide their crimes, falsely accused one of my predecessors of burning Rome to the ground. Perhaps it is time I returned them the favor and cleansed the Empire's old capital of the wretched temples scourging its Seven Hills...;Il y a des siècles, les Galiléens, pour cacher leurs crimes, ont accusé à tort un de mes prédécesseurs de brûler Rome. Il est peut-être temps que je leur rende la pareille et nettoie l'ancienne capitale de l'Empire des maudits temples qui ternissent ses sept collines...;Vor Jahrhunderten beschuldigten die Gallier, um ihre Verbrechen zu verbergen, fälschlicherweise einen meiner Vorfahren, Rom niedergebrannt zu haben. Vielleicht ist es an der Zeit, dass ich ihren Gefallen erwidere und die alte Hauptstadt des Reiches von den elenden Tempeln säubere, die seine Sieben Hügel geißeln...;;Hace siglos los galileos acusaron falsamente a uno de mis predecesores de quemar Roma hasta los cimientos para ocultar sus crímenes. Quizás ya es hora de devolverles el favor y purgar la antigua capital del Imperio de los miserables templos que plagan las siete colinas…;;;;;;;;x
EVTDESCCHF23102;Living up the reputation of the heathen Emperors of old, [From.GetTitledFirstName] has ordered the ruthless destruction of the Holy See itself, in an attempt to undermine Christendom. After forcefully locking priests and cardinals within their own churches, [From.Culture.GetName] soldiers consigned the holy buildings to the flames.\nThis abominable act is certain to permanently cripple the authority of the Catholic Church for centuries to come.;Fidèle à la réputation des anciens empereurs païens, [From.GetTitledFirstName] a ordonné la destruction impitoyable du Saint-Siège, dans une tentative de miner la chrétienté. Après avoir enfermé de force les prêtres et les cardinaux dans leurs propres églises, les soldats [From.GetCultureMascPl] ont livré les bâtiments sacrés aux flammes.\nCet acte abominable va fortement affecter l'autorité de l'Église catholique pour les siècles à venir.;Um den Ruf des heidnischen Kaisers von einst wiederaufleben zu lassen, hat [From.GetTitledFirstName] in einem Versuch das Christentum zu untergraben, die Zerstörung des Heiligen Stuhls selbst angeordnet. Nachdem Priester und Kardinäle ihre Kirchen in Eile verlassen haben und ihnen kaum genug Zeit blieb, um Reliquien und Bücher zu retten, brannten [From.Culture.GetName]e Soldaten alle heiligen Gebäude nieder.\nDiese abscheuliche Tat wird die Autorität der katholischen Kirche für die kommenden Jahrhunderte mit Sicherheit lähmen;;Queriendo estar a la altura de los emperadores del pasado, [From.GetTitledFirstName] ha ordenado la destrucción de la misma Santa Sede buscando socavar la Cristiandad. Después de que sacerdotes y prelados abandonaran las iglesias apresuradamente, con apenas tiempo para rescatar reliquias y libros, los soldados [From.Culture.GetName]s entregaron los edificios sagrados a las llamas.\nNo cabe duda que este acto abominable dañará permanentemente la autoridad de la Iglesia Católica durante siglos.;;;;;;;;x
EVTDESCCHF23119;The higher standards of living that many of my subjects have had access to since the restoration of the Empire appear to have caused the anger of some Christian priests. A group of petitioners from the Church's clergy has pleaded me to put a stop to these new, luxurious customs, as they are detrimental to my people's salvation.;Les niveaux de vie plus élevés auxquels beaucoup de mes sujets ont accès depuis la restauration de l'Empire semblent avoir causé la colère de quelques prêtres chrétiens. Un groupe de pétitionnaires du clergé m'a prié[Root.Get_E] de mettre un terme à ces nouvelles coutumes luxueuses, car elles sont préjudiciables au salut de mon peuple.;Der höhere Lebensstandard, den viele meiner Untertanen seit der Wiederherstellung des Reichs genießen, hat unter einigen christlichen Priestern für Ärger gesorgt. Eine Gruppe von Bittstellern aus dem Klerus der Kirche hat mich nun gebeten, diesen neuen und ausschweifenden Bräuchen Einhalt zu gebieten, da sie der Erlösung meines Volkes im Wege stehen.;;El alto nivel de vida al que muchos de mis súbditos han tenido acceso desde la restauración del Imperio parece haber causado la ira de algunos sacerdotes cristianos. Un grupo de solicitantes del clero de la Iglesia me ha suplicado que ponga fin a estas nuevas y lujosas costumbres, ya que son perjudiciales para la salvación de mi pueblo.;;;;;;;;x
EVTDESCCHF23212;Many raiders plague the coasts of the civilized realms, scraping by robbing traders and fishermen. Only a few are skilled enough to make a name for themselves and become notorious pirates, but even their stories pale in comparison to mine. \nMy palace is filled with the countless trophies I have gathered through a lifetime of endless plundering. I have laid waste of scores of towns, killed thousands, brought entire realms to their knees... \nThe land-dwellers scare children by telling stories about my exploits, talking of me as some sort of demon risen from the cold abyss of the ocean to drag their entire civilization towards a cold and terrifying end.;De nombreux pillards hantent les côtes des royaumes civilisés, volant des commerçants et des pêcheurs. Seuls quelques-uns sont assez doués pour devenir des pirates notoires, mais même les histoires de ceux-là pâlissent en comparaison des miennes. Mon palais est rempli d'innombrables trophées que j'ai recueillis au cours d'une vie de pillages innombrables. J'ai dévasté des dizaines de villes, tué des milliers de gens, mis à genoux des pays entiers...\nLes habitants font peur aux enfants en racontant des histoires sur mes exploits, parlant de moi comme d'une sorte de démon ressuscité des profondeurs froides de l'océan pour entraîner toute leur civilisation vers une fin froide et terrifiante.;Viele Plünderer plagen die Küsten zivilisierter Reiche und machen ihren Gewinn, indem sie Händler und Fischer ausrauben. Nur wenige sind geschickt genug, um sich einen Namen zu machen und berüchtigte Piraten zu werden, aber selbst deren Geschichten sind nichts im Vergleich zu den meinen.\nMein Palast ist mit den zahllosen Trophäen gefüllt, die ich durch ein Leben voll endloser Plünderungen gesammelt habe. Ich habe Dutzende Städte verwüstet, Tausende getötet und ganze Reiche in die Knie gezwungen...\nDie Bewohner des Landes erschrecken Kinder mit Geschichten meiner Heldentaten und sprechen von mir als eine Art Dämon, der aus dem kalten Abgrund des Ozeans gekommen ist, um ihre gesamte Zivilisation zu einem kalten und schrecklichen Ende zu bringen.;;Muchos saqueadores plagan las costas de los reinos civilizados, riñendo por robar a comerciantes y pescadores. Solo unos pocos tienen el talento suficiente como para labrarse un nombre y convertirse en piratas famosos, pero incluso sus historias empalidecen en comparación con la mía. \nMi palacio está lleno con los incontables trofeos que he reunido en una vida de saqueos sin fin. He arrasado cientos de pueblos, matado a miles, hecho arrodillarse a reinos enteros… \nLos que viven en tierra firme asustan a sus hijos con historias de mis hazañas, considerándome una especie de demonio que salió de las frías profundidades del océano para llevar a toda la civilización a un final frío y aterrador.;;;;;;;;x
EVTDESCCHF23219;There must be some way to get into [From.GetName]. Our opponents are nothing but priests, and we have control over both land and sea. We have a distinct advantage over our enemies... If only I could think of a plan to get us past their walls.;Il doit y avoir un moyen d'entrer dans [From.GetName]. Nos adversaires ne sont que des prêtres et nous contrôlons la terre et la mer. Nous avons un net avantage sur nos ennemis... Si seulement je pouvais trouver un plan pour nous faire franchir leurs murs.;Es muss einen Weg geben, um nach [From.GetName] zu gelangen. Unsere Gegner sind nichts als Priester und wir haben die Kontrolle über das Land und das Meer. Wir haben einen deutlichen Vorteil gegenüber unseren Feinden... Wenn mir doch nur ein Plan einfallen würde, um uns an ihren Mauern vorbeizubringen...;;Debe de haber un modo de entrar en [From.GetName]. Nuestros oponentes solo son sacerdotes y controlamos tanto tierra como mar. Tenemos una clara ventaja sobre nuestros enemigos… Si se me ocurriera un plan para atravesar sus murallas…;;;;;;;;x
EVTDESCCHF23400;Despite having consulted with some of the world's most respected diviners and having analyzed sightings from several realms, I have yet to come to a conclusion regarding the future of our world. \nThe omens have been ambiguous and contradictory at every turn, and none of us has been able to give a clear interpretation of the message hidden in the heavens above. \nBeing the [Root.GetTitle], it is my duty to warn the notable [Root.Religion.GetName] rulers that misfortune might be imminent.;Après avoir consulté quelques-uns des devins les plus respectés du monde et avoir analysé des observations provenant de plusieurs pays, je n'ai pas encore tiré de conclusion sur l'avenir de notre monde.\nLes présages ont été ambigus et contradictoires à chaque fois, et aucun d'entre nous n'a été capable de donner une interprétation claire du message caché dans les cieux.\nÉtant [Root.GetTitle], il est de mon devoir d'avertir les dirigeants [Root.GetReligionMascPl] notables que le malheur pourrait être imminent.;Obwohl ich einige der angesehensten Wahrsager der Welt gesprochen und Sichtungen aus verschiedenen Bereichen analysiert habe, muss ich noch zu einer Schlussfolgerung bezüglich der Zukunft unserer Welt kommen.\nDie Zeichen waren bei jeder Gelegenheit zweideutig und widersprüchlich und niemand von uns war in der Lage die im Himmel verborgene Botschaft klar zu deuten. Als [Root.GetTitle] ist es meine Pflicht alle großen [Root.Religion.GetName]en Herrscher zu warnen, dass das Unglück unmittelbar bevorsteht.;;A pesar de haber consultado con los adivinos más respetados del mundo y analizar los avistamientos en muchos reinos, aún no he llegado a ninguna conclusión sobre el futuro de nuestro mundo.\nLos presagios han sido ambiguos y contradictorios en cada ocasión y ninguno de nosotros ha sido capaz de dar una clara interpretación del mensaje que esconden los cielos. \nComo [Root.GetTitle], mi deber es avisar a todos los gobernantes [Root.Religion.GetName]s importantes de que la desgracia puede ser inminente.;;;;;;;;x
EVTDESCCHF23401;We are receiving scants reports from [From.PrimaryTitle.GetName] about infighting amongst our most illustrious diviners. \nIt appears that a series of ambiguous and contradictory sightings that have confused our priests as well as the [From.GetTitle] [From.GetHerselfHimself]. \nWith the heavens hiding our future, many amongst us are being beset by doubt and fearfulness.;Nous recevons de maigres rapports en provenance [From.PrimaryTitle.Get_du_Realm] à propos des querelles entre nos divinateurs les plus illustres.\nIl semble qu'une série d'observations ambiguës et contradictoires aient embrouillé nos prêtres ainsi que [From.Get_only_le_Title][From.GetTitle].\nLes cieux cachent notre avenir et de nombreuses personnes sont assaillis par les doutes et la peur.;Wir erhalten  kurze Berichte von [From.PrimaryTitle.GetName] über Streitigkeiten zwischen unseren berühmtesten Wahrsagern.\nEs scheint, dass eine Reihe von mehrdeutigen und widersprüchlichen Sichtungen unsere Priester und [From.Getdendie] [From.GetTitle] selbst verwirrt hat.\nMit einem Himmel, der unsere Zukunft verschleiert, sind viele unter uns voller Zweifel und Angst.;;Recibimos escasas noticias de [From.PrimaryTitle.GetName] sobre discusiones entre nuestros adivinos más ilustres. \nSe ve que una serie presagios ambiguos y contradictorios han confundido a nuestros sacerdotes, así como al mism[From.GetOA] la misma [From.GetTitle].\nSi los cielos esconden nuestro futuro, a muchos entre nosotros les acosan las dudas y el temor.;;;;;;;;x
EVTDESCCHF23402;It is such a hot day in [Root.Capital.GetName]. I can barely breathe. I am discussing some menial theological issue with one of my clerics, when the [Root.GetManWoman] suddenly shrieks and jumps away from me. I look down, suddenly realizing that I am on fire.;Il fait chaud à [Root.Capital.GetName]. Je peux à peine respirer. Je discute d'un problème théologique sans intérêt avec un de mes ecclésiastiques, lorsque l'homme crie soudain et s'éloigne de moi. Je baisse les yeux et réalise que je suis en feu.;Es ist so ein heißer Tag in [Root.Capital.GetName]. Ich kann kaum atmen und während ich mit meinem meiner Priester eine theologische Frage ausdiskutiere, fängt [Root.Getderdie] [Root.GetManWoman] plötzlich zu schreien an und springt von mir weg. Ich sehe nach unten und erkenne plötzlich, dass ich brenne.;;Hace tanto calor en [Root.Capital.GetName], apenas puedo respirar. Estoy discutiendo un asunto teológico de poca importancia con uno de mis clérigos, cuando este grita de repente y se aleja de mí de un salto. Miro hacia abajo, y me doy cuenta de repente de que estoy ardiendo.;;;;;;;;x
EVTDESCCHF23403;The most disturbing news is spreading through the realm. Our revered [From.GetTitledFirstName] has recently spontaneously combusted during a theological debate. \nPeople are clamoring that this is surely a sign of divine wrath towards [From.PrimaryTitle.GetName].;Une nouvelle des plus inquiétantes se répand dans le pays. Notre vénéré[From.Get_E] [From.GetTitledFirstName] a récemment pris feu spontanément lors d'un débat théologique.\nLes gens disent que c'est certainement un signe de la colère divine vis-à-vis [From.PrimaryTitle.Get_du_Realm].;Eine sehr beunruhigende Nachricht verbreitet sich im ganzen Reich. [From.GetUnserUnsere] verehrte[From.GetrMale] [From.GetTitledFirstName] hat kürzlich während einer theologischen Debatte Feuer gefangen und ist verstorben.\nDas Volk mahnt, dass dies sicher ein Zeigen des göttlichen Zorn gegenüber [From.PrimaryTitle.GetName] ist.;;Se extienden las noticias más perturbadoras por el reino. Nuestr[From.GetOA] venerad[From.GetOA] [From.GetTitledFirstName] ardió espontáneamente durante un debate teológico.\nEl pueblo afirma que es una señal clara de la ira divina contra [From.PrimaryTitle.GetName].;;;;;;;;x
EVTDESCCHF23404;After spending the last year scrutinizing the stars, looking for divine signs, I have come to the conclusion that a period of doom and misfortune is approaching our realm. I should inform my liege about my findings.;Après avoir passé l'année dernière à scruter les étoiles, à la recherche de signes divins, j'en suis venu à la conclusion qu'une période de malheur va frapper notre pays. Je devrais informer m[Root.Liege.GetOnA] [Root.Liege.GetLordLady] lige de mes découvertes.;Nachdem ich das letzte Jahr damit verbracht habe, die Sterne zu deuten und nach göttlichen Zeichen Ausschau zu halten, bin ich zu dem Schluss gekommen, dass uns eine Zeit des Unglücks erwartet. Ich sollte meinen Lehnsherrn über diese Erkenntnisse informieren.;;Tras pasar el año pasado estudiando las estrellas en busca de señales divinas, he llegado a la conclusión de que se acerca un periodo de fatalidad y desgracia a nuestro reino. Debo informar a mi señor de mis descubrimientos.;;;;;;;;x
EVTDESCCHF23405;[From.GetTitledFirstName] informed me that, after a careful analysis of the celestial bodies, [From.GetSheHe] has come to the conclusion that our realm is unfavored by the stars and will soon enter a period of misfortune and bad luck.;[From.Get_Le_TitledFirstName] m'a informé qu'après une analyse minutieuse des corps célestes, [From.GetIlElle] est arrivé[From.Get_E] à la conclusion que notre pays est défavorisé par les étoiles et qu'il va bientôt entrer dans une période de malheurs et de malchance.;[From.GetTitledFirstName] informierte mich, dass [From.GetSheHe] nach gründlicher Analyse der Sterne zu dem Schluss gekommen ist, dass unser Reich von den Sternen nicht begünstigt wird und bald in eine Zeit des Unglücks und Unheils eintreten wird.;;[From.GetTitledFirstName] me informa que, tras un estudio cuidadoso de los cuerpos celestiales, ha llegado a la conclusión de que las estrellas no son favorables a nuestro reino y que pronto entraremos en un periodo de mala suerte y desgracias.;;;;;;;;x
EVTDESCCHF23406;It is such a hot day in [Root.Capital.GetName]. I can barely breathe. I am discussing some menial issue with one of my courtiers, when the [Root.GetManWoman] suddenly shrieks and jumps away from me. I look down, suddenly realizing that I am on fire.;Il fait chaud à [Root.Capital.GetName]. Je peux à peine respirer. Je discute d'un problème sans intérêt avec un de mes courtisans, lorsque l'homme crie soudain et s'éloigne de moi. Je baisse les yeux et réalise que je suis en feu.;Es ist so ein heißer Tag in [Root.Capital.GetName]. Ich kann kaum atmen und während ich mit einem meiner Höflinge eine Angelegenheit diskutiere, fängt [Root.Getderdie] [Root.GetManWoman] plötzlich zu schreien an und springt von mir weg. Ich sehe nach unten und erkenne plötzlich, dass ich brenne.;;Hace tanto calor en[Root.Capital.GetName], apenas puedo respirar. Estoy discutiendo un asunto teológico de poca importancia con uno de mis clérigos, cuando este grita de repente y se aleja de mí de un salto. Miro hacia abajo, y me doy cuenta de repente de que estoy ardiendo.;;;;;;;;x
EVTDESCCHF23470;By carving our new Great Pillar, the fires of the [Root.Religion.GetName] faith have been stoked, bringing a bit of life to the spirits of our old and unyielding gods. The first offerings are already being presented at the feet of the new sacred monument of [From.GetName].;En sculptant notre nouvelle grande colonne, les feux de la foi [Root.Religion.GetName] ont été nourris, apportant un peu de vie aux esprits de nos anciens et inflexibles dieux. Les premières offrandes sont déjà présentées aux pieds du nouveau monument sacré de [From.GetName].;Durch das Schnitzen unserer neuen großen Säule wurden die Feuer des [Root.Religion.GetName]en Glaubens entfacht und den Geistern unserer alten und wilden Götter ein wenig Leben eingehaucht. Die ersten Opfer wurden bereits zu Füßen des neuen heiligen Denkmals von [From.GetName] gemacht.;;Al tallar nuestro nuevo gran pilar, se han avivado las llamas del credo [Root.Religion.GetName], trayendo un poco de vida a los espíritus de nuestros viejos dioses e inflexibles. Ya se están presentando las primeras ofrendas a los pies del nuevo monumento sagrado de [From.GetName].;;;;;;;;x
EVTDESCCHF23760;Stability in [Root.PrimaryTitle.GetName] can only be maintained as long as all the strands of the great tapestry which makes up this great realm of ours are weaved properly. I fear that [scoped_improvement_target.GetFirstName] has yet to reach the full extent of [scoped_improvement_target.GetHerHis] potential. [scoped_improvement_target.GetSheHeCap] might use some help to improve [scoped_improvement_target.GetHerselfHimself].;La stabilité [Root.PrimaryTitle.Get_du_Realm] ne peut être maintenue que si chaque élément qui compose notre grand pays est à la hauteur. Je crains que [scoped_improvement_target.GetFirstName] n'ait pas encore atteint son plein potentiel. [scoped_improvement_target.GetIlElleCap] pourrait s'améliorer avec un peu d'aide.;Die Stabilität in [Root.PrimaryTitle.GetName] kann nur aufrechterhalten werden, solange alle Stränge der großen Tapisserie richtig gewebt sind. Ich befürchte, dass [scoped_improvement_target.GetFirstName] erst noch [scoped_improvement_target.GetHerHis] volles Potenzial ergründen muss. [scoped_improvement_target.GetSheHeCap] wird sicher etwas Hilfe brauchen, um sich selbst zu verbessern. ;;La estabilidad en [Root.PrimaryTitle.GetName] solo se puede mantener si se tejen bien todos los hilos del gran tapiz que conforma nuestro gran reino. Me temo que [scoped_improvement_target.GetFirstName] todavía tiene que alcanzar todo su potencial. Puede que le venga bien algo de ayuda para mejorar.;;;;;;;;;x
EVTDESCCHF23761;All these days of harsh training and mock-duels have finally paid off. Thanks to my relentless efforts, I have become a better commander than I ever thought possible. When war comes to [Root.PrimaryTitle.GetName], I will be ready to lead my troops in battle and uphold the name of my dynasty without shame nor fear.;Tous ces jours de dur entraînement et de duels simulés ont finalement porté leurs fruits. Grâce à mes efforts inlassables, je suis devenu[Root.Get_E] un[Root.Get_E] meilleur[Root.Get_E] commandant[Root.Get_E] à un point que je n'aurais jamais cru possible. Quand la guerre sera venue, je serai prêt[Root.Get_E] à mener mes troupes au combat et à défendre le nom de ma dynastie sans honte ni peur.;All diese Tage mit hartem Training und Übungsduellen haben sich endlich ausgezahlt. Dank meiner unermüdlichen Bemühungen wurde ich ein besserer Kommandant, als ich es jemals für möglich gehalten hätte. Wenn der Krieg nach [Root.PrimaryTitle.GetName] kommt, werde ich bereit dazu sein meine Truppen in den Kampf zu führen und den Namen meiner Dynastie ohne Scham oder Furcht zu wahren.;;Tantos días de entrenamiento duro y batallas simuladas han acabado dando fruto. Gracias a un trabajo incansable, me he convertido en un[Root.GetXA] comandante mucho mejor de lo que nunca creí posible. Cuando llegue la guerra a [Root.PrimaryTitle.GetName], estaré list[Root.GetOA] para dirigir a mis tropas en combate y defender el nombre de mi dinastía sin vergüenza ni miedo.;;;;;;;;;x
EVTDESCCHF23762;I let out a loud swear and order my training partner to stop, faltering for a few steps before finally finding my balance again. The soldier asks if we should resume our training, but I simply dismiss him with a grunt while rubbing my sore wrist. I have been trying my best to refine my dueling skills in the past few days, yet I am still unsatisfied with the results.;Je hurle à mon partenaire d'entraînement de s'arrêter, chancelant un court instant avant de retrouver mon équilibre. Le soldat demande si nous devrions reprendre notre entraînement, mais je le renvoie simplement par un grognement tandis que je frotte mon poignet douloureux. J'ai fait de mon mieux pour affiner mes compétences en duel ces derniers jours, mais je ne suis toujours pas satisfait[Root.Get_E] du résultat.;Ich stieß einen lauten Fluch aus und bat meinen Trainingspartner inne zuhalten, während mein Gleichgewicht suchte. Der Soldat fragt, ob wir weitermachen sollen, doch ich entlasse ihn mit einem einfach Grunzen, während ich meine schmerzenden Handgelenke reibe. Ich habe mein Bestes gegeben, um meine Duellierkünste zu verbessern, doch bin in keinster Weise zufrieden mit dem Ergebnis.;;Suelto un fuerte juramento y ordeno detenerse a mi pareja de entrenamiento, vacilando unos pocos pasos antes de volver a encontrar el equilibrio otra vez. El soldado pregunta si reanudamos el entrenamiento, pero lo rechazo con un gruñido mientras me froto la muñeca dolorida. Estos últimos días he estado haciendo todo lo posible para perfeccionar mis habilidades de duelo pero los resultados aún no me satisfacen.;;;;;;;;;x
EVTDESCCHF23774;The little group of relatives and acquaintances awaits in the great hall, chanting and waiting for me to emerge as a grown [Root.GetManWoman]. The shamans warned me that this is a delicate and dangerous transition when the spirits roam closer to the world of the living, and that I should be careful not to anger the wrong ones.;Le petit groupe de proches parents et de connaissances attend dans la grande salle, en train de chanter et d'attendre de me voir devenir adulte. Les chamanes m'ont prévenu[Root.Get_E] qu'il s'agissait d'une transition délicate et dangereuse, car les esprits se rapprochaient du monde des vivants et qu'il fallait veiller à ne pas irriter les mauvais.;Die kleine Gruppe von Verwandten und Bekannten wartet in der großen Halle darauf, dass ich als erwachsener[Root.GetrMale] [Root.GetManWoman] vor ihnen auftauche. Die Schamanen waren mich davor, dass dies ein heikler und gefährlicher Ritus ist, da die Geister näher an die Welt der Lebenden herangelockt werden und ich darauf achten sollte, nicht die falschen zu verärgern.;;El pequeño grupo de parientes y conocidos espera en el gran salón cantando, esperando que aparezca como un[Root.GetXA] [Root.GetManWoman] adult[Root.GetOA]. El sonido de cantos, platillos y tambores resuene hasta mis aposentos mientras me preparo. Los chamanes me han advertido que es una transición delicada y peligrosa, cuando los espíritus deambulan más cerca del mundo de los vivos y que debo tener cuidado de no enfurecer a los equivocados.;;;;;;;;;x

