EVTDESCHF23802;It would not be appropriate to continue celebrations after the death of [From.GetTitledFirstName]. The festival has been therefore canceled to allow the [From.GetTitle]'s close ones to properly mourn [From.GetHerHis] loss.;Il ne serait pas approprié de continuer les célébrations après la mort [From.Get_du_TitledFirstName]. Les festivités ont donc été annulées pour permettre aux proches [From.Get_only_du_Title][From.GetTitle] de pleurer convenablement sa perte.;Es wäre nicht angemessen die Feierlichkeiten nach dem Tod von [From.GetTitledFirstName] fortzusetzen. Das Fest wurde abgesagt, damit die nahen Verwandten [From.GetHerHis]en Verlust beklagen können.;;No sería apropiado seguir con las celebraciones tras la muerte de [From.GetTitledFirstName]. Así pues, el festival se ha cancelado para que los familiares de puedan llorar su pérdida como es debido.;;;;;;;;x
EVTDESCHF23804;With a war brewing on the horizon, we must set aside all frivolous activities and prepare for battle. I must therefore regretfully cancel the festival of [Root.Capital.GetName].;Puisqu'une guerre se prépare, nous devons mettre de côté toutes les activités frivoles. J'annule donc les festivités à [Root.Capital.GetName].;Mit einem Krieg am Horizont müssen wir alle Festivitäten aussetzen und uns auf den Kampf vorbereiten. Ich muss das Fest in [Root.Capital.GetName] daher leider absagen.;;Ahora que se avecina una guerra, debemos prescindir de todas las actividades frívolas y prepararnos para el combate. Por lo tanto, con gran pesar, cancelo el festival de [Root.Capital.GetName];;;;;;;;x
EVTDESCHF23805;With a war brewing on the horizon, we must set aside all frivolous activities and prepare for battle. In light of this troubling new event, [From.GetTitledFirstName] has had to regretfully cancel the festival of [From.Capital.GetName].;Puisqu'une guerre se prépare, nous devons mettre de côté toutes les activités frivoles. À la lumière de ce nouvel événement troublant, [From.Get_le_TitledFirstName] a dû malheureusement annuler les festivités à [From.Capital.GetName].;Mit einem Krieg am Horizont müssen wir alle Festivitäten aussetzen und uns auf den Kampf vorbereiten. Angesichts dieser beunruhigenden neuen Ereignisse musste [From.GetTitledFirstName] leider das Fest in [From.Capital.GetName] absagen.;;Ahora que se avecina una guerra, debemos prescindir de todas las actividades frívolas y prepararnos para el combate. A la vista de este nuevo evento preocupante, [From.GetTitledFirstName], con gran pesar, ha tenido que cancelar el festival de [From.Capital.GetName];;;;;;;;x
EVTDESCHF23806;A great festival is exactly what the people of [Root.PrimaryTitle.GetName] need to strengthen the bonds with their fellow tribesmen. It will also be a great opportunity for the Chieftains to bring offerings to our ancestors, bringing prosperity to our lands.;Une grande fête est exactement ce dont les membres [Root.PrimaryTitle.Get_du_Realm] ont besoin pour renforcer leurs liens. Ce sera également une excellente occasion pour les chefs de faire des offrandes à nos ancêtres, ce qui apportera la prospérité à nos terres.;Ein großes Fest ist genau das, was das Volk von [Root.PrimaryTitle.GetName] benötigt, um die Bande mit ihren Stammesgenossen zu stärken. Es wird außerdem eine großartige Gelegenheit für die Häuptlinge sein, um ihren Vorfahren Opfergaben zu bringen und unserem Land so den Wohlstand zu garantieren.;;El pueblo de [Root.PrimaryTitle.GetName] necesita precisamente un gran festival para reforzar los vínculos con sus compañeros de tribus. También será una gran oportunidad para que los jefes de tribus traigan ofrendas a nuestros antepasados, trayendo prosperidad a nuestras tierras.;;;;;;;;x
EVTDESCHF23808;I will be glad to join you for the §YGreat Festival§!, my liege.;Je serai heureu[Root.GetXSe] de me joindre à vous pour la §Ygrande fête§!, M[Root.Liege.GetOnA][Root.Liege.GetLordLady].;Ich würde mich freuen an eurem §YGroßen Fest§! teilzunehmen, mein Lehnsherr.;;Me encantará unirme a vos en el §Ygran festival§!, mi señor.;;;;;;;;x
EVTDESCHF23812;The celebrations have finally begun. [Root.Capital.GetName] is bustling with activity: people from every corner of [Root.PrimaryTitle.GetName] have traveled here to pay their respects to me and my ancestors, exchange tales and goods, and have a good time.;Les célébrations ont enfin commencé. [Root.Capital.GetName] déborde d'activité : des gens des quatre coins du pays sont venus ici pour nous rendre hommage, à moi et à mes ancêtres, parler de choses et d'autres et échanger des biens, et passer un bon moment.;Die Feierlichkeiten haben endlich begonnen. In [Root.Capital.GetName] findet ein reges Treiben statt. Leute aus allen Ecken von [Root.PrimaryTitle.GetName] sind hergereist, um mir und meinen Vorfahren ihre Aufwartung zu machen, tauschen Geschichten und Waren aus und haben eine gute Zeit.;;Por fin han empezado los festejos [Root.Capital.GetName] bulle de actividad: gente de todos los rincones de [Root.PrimaryTitle.GetName] han venido hasta aquí para presentar sus respetos a mis antepasados y a mí, intercambiando historias y bienes y pasándolo bien.;;;;;;;;x
EVTDESCHF23813;The celebrations have finally begun. [From.Capital.GetName] is bustling with activity: people from every corner of [From.PrimaryTitle.GetName] have traveled here to pay their respects to [From.GetTitledFirstName] and [From.GetHerHis] ancestors, exchange tales and goods, and have a good time.;Les célébrations ont enfin commencé. [From.Capital.GetName] déborde d'activité : les gens des quatre coins [From.PrimaryTitle.Get_du_Realm] ont voyagé ici pour rendre hommage à [From.GetTitledFirstName] et à ses ancêtres, parler de choses et d'autres et échanger des biens, et avoir un bon temps.;Die Feierlichkeiten haben endlich begonnen. In [Root.Capital.GetName] findet ein reges Treiben statt. Leute aus allen Ecken von [Root.PrimaryTitle.GetName] sind hergereist, um [From.GetTitledFirstName] und [From.GetHerHis]en Vorfahren ihre Aufwartung zu machen, tauschen Geschichten und Waren aus und haben eine gute Zeit.;;Por fin han empezado los festejos [From.Capital.GetName] bulle de actividad: gente de todos los rincones de [From.PrimaryTitle.GetName] han venido hasta aquí para presentar sus respetos a [From.GetTitledFirstName] y sus antepasados, intercambiando historias y bienes y pasándolo bien.;;;;;;;;x

EVTDESCHFA23807;Greetings,\n[Root.GetTitledFirstName]\nA great festival is being held at [From.Capital.GetName]. You are hereby invited to join us alongside your family to celebrate our fortune and bring our offerings to our great ancestors.\nSigned,\n\n[From.GetFullName];Salutations,\n[Root.GetTitledFirstName]\nUne grande fête a lieu à [From.Capital.GetName]. Vous êtes invité[Root.Get_E] à nous rejoindre aux côtés de votre famille pour célébrer notre bonne fortune et apporter nos offrandes à nos ancêtres.\nSigné,\n\n[From.GetFullName];Grüße,\n[Root.GetTitledFirstName]\nEin großes Fest findet in [From.Capital.GetName] statt. Ihr werdet hiermit eingeladen uns mit eurer Familie beizuwohnen und so unser Glück zu feiern und unseren großen Vorfahren Opfer darzulegen.\nGezeichnet,\n\n[From.GetFullName];;Saludos, \n[Root.GetTitledFirstName]\nSe celebra un gran festival en [From.Capital.GetName] y por la presente se os invita a ti y a tu familia a celebrar nuestra fortuna y traer ofrendas a nuestros grandes antepasados.\n\nFirmado, [From.GetTitledFirstName];;;;;;;;x
EVTDESCHFA23810;Hail, [Root.GetSocietyRank]!\n\nI have heard news of the great celebration you are preparing for your fellow tribesmen. I wager you'd enjoy the company of a fellow warrior to exchange stories with.\n\nSigned, [warrior_lodge_guest.GetFullName];Salutations, [Root.GetSocietyRank] !\n\nJ'ai reçu des nouvelles de la grande célébration que vous préparez pour vos compagnons tribaux. Je parie que vous apprécieriez la compagnie d'un compagnon de guerre pour bavarder.\n\nSigné, [warrior_lodge_guest.GetFullName];Hoch lebe [Root.GetSocietyRank]!\n\nIch habe die Neuigkeiten von eurem Fest gehört, dass ihr für eure Stammesgenossen vorbereitet. Ich wette, dass ihr die Gesellschaft eines Kriegers genießen würdet, mit dem ihr Geschichten austauschen könntet.\n\nGezeichnet, [warrior_lodge_guest.GetFullName];;¡Salve, [Root.GetSocietyRank]!\n\nMe he enterado de los grandes festejos que estás preparado para los de tu tribu. Seguro que apreciarás la compañía de un colega guerrero con el que intercambiar historias.\n\nFirmado, [warrior_lodge_guest.GetFullName];;;;;;;;x
EVTDESCHFA23811;The period of festivities is about to start. All sorts of peddlers, bards and fortunetellers are gathering in [great_tribal_festival_host.Capital.GetName], bringing their tales and offerings. I should make sure to prepare myself before traveling to meet my tribesmen.;La période des festivités est sur le point de commencer. Toutes sortes de colporteurs, bardes et diseurs de bonne aventure se rassemblent à [great_tribal_festival_host.Capital.GetName], apportant leurs histoires et leurs offrandes. Je devrais me préparer avant d'aller à la rencontre des membres de la tribu.;Die Zeit der Festlichkeiten beginnt. Alle Arten von Hausierern, Barden und Wahrsagern versammeln sich in [great_tribal_festival_host.Capital.GetName] und bringen ihre Geschichten und Waren mit. Ich sollte sicherstellen, dass ich mich genügend vorbereitet habe, bevor ich zu meinen Stammesgenossen reise. ;;El periodo de fiestas está a punto de comenzar. Vendedores, bardos y adivinos de toda clase se reúnen en [great_tribal_festival_host.Capital.GetName] trayendo sus cuentos y ofrendas. Debería asegurarme de estar preparado antes de viajar para ver a la gente de mi tribu.;;;;;;;;x
EVTDESCHFA23814;A hoarse voice calls for my name from the crowd of peddlers, catching my attention. An old Seer is waiting for me sitting near an old runic stone. He claims that he will read my future for a small price.;Une voix rauque prononce mon nom depuis la foule des colporteurs, attirant mon attention. Un vieux voyant m'attend près d'une vieille pierre runique. Il prétend qu'il lira mon avenir pour un petit prix.;Eine heisere Stimme ruft nach meinem Namen aus der Menge der Hausierer um meine Aufmerksamkeit zu erregen. Ein alte Seher wartet darauf, dass ich neben einem alten Runenstein Platz nehme. Er behauptet, dass er für einen kleines Preis meine Zukunft lesen wird.;;Una voz ronca me llama entre una multitud de vendedores, llamándome la atención. Un vidente anciano me espera sentado cerca de una vieja piedra rúnica. Dice que me leerá el futuro por muy poco.;;;;;;;;x
EVTDESCHFA23815;The fortuneteller surprises me by predicting that extraordinary opportunities are about to present themselves to me in my near future, and I need only to pay close attention to find my good fortune.;La diseuse de bonne aventure me surprend en prédisant que des occasions extraordinaires sont sur le point de se présenter à moi dans un proche avenir et que je n'ai qu'à y prêter attention pour trouver la bonne fortune.;Der Wahrsager überrascht mich, indem er vorhersagt, dass sich mir in naher Zukunft eine außergewöhnliche Gelegenheit bieten wird und ich nur genau aufpassen muss, um mein Glück zu finden.;;El adivino me sorprende prediciendo que están a punto de presentárseme oportunidades extraordinarias en un futuro cercano y solo necesito prestar mucha atención para encontrar la buena fortuna.;;;;;;;;x
EVTDESCHFA23816;The fortuneteller assures me that a period of good luck is just around the corner, and that I need only look for the right opportunities in order to change my life for the better.;La diseuse de bonne aventure m'assure que la bonne fortune est à portée de main et que j'ai simplement besoin de saisir les bonnes occasions.;Der Wahrsager versicherte mir, dass eine vom Glück bestimmte Zeit voraus liegt und dass ich nur nach der richtigen Gelegenheit suchen muss, um mein Leben zum Besseren zu verändern.;;El adivino me dice que tengo un periodo de buena suerte a la vuelta de la esquina y que solo necesito buscar las oportunidades adecuadas para cambiar mi vida a mejor.;;;;;;;;x
EVTDESCHFA23817;After giving a thorough look to the signs, the fortuneteller warns me that my future looks grim and I should be very careful about my next choices to avoid any calamity befalling upon me and my family.;Après avoir jeté un coup d'oeil attentif aux signes, la diseuse de bonne aventure m'avertit que mon avenir est sombre et que je devrais faire très attention à mes prochains choix pour éviter toute calamité qui s'abattrait sur moi et ma famille.;Nach einem gründlichen Blick auf meine Zeichen warnt mich der Wahrsager davor, dass meine Zukunft düster aussieht und ich sehr vorsichtig mit meinen nächsten Entscheidungen sein sollte, um zu vermeiden, dass das Unheil über mich und meine Familie hereinbricht.;;Tras echar un vistazo cuidadoso a las señales, el adivino me advierte que mi futuro parece sombrío y que debo tener cuidado con las próximas elecciones para evitar que el desastre caiga sobre mí o mi familia.;;;;;;;;x
EVTDESCHFA23818;As I walk around the crowded streets of [great_tribal_festival_host.Capital.GetName], a strange aroma catches my attention, leading me to the obscure stand of an old alchemist. Seeing my curiosity, the man shows me some of his wares and their prodigious effects.;Alors que je me promène dans les rues bondées de [great_tribal_festival_host.Capital.GetName], un arôme étrange attire mon attention, me menant aux étals obscurs d'un vieil alchimiste. Voyant ma curiosité, l'homme me montre certaines de ses marchandises et leurs effets prodigieux.;Während ich in den überfüllten Straßen von [great_tribal_festival_host.Capital.GetName] herumlaufe, rieche ich ein seltsames Aroma, das mich zu einem düsteren Stand eines alten Alchemisten führt. Der Mann sieht meine Neugier und zeigt mir einige seiner Waren und ihre erstaunlichen Wirkungen.;;Cuando caminaba por las calles abarrotadas de [great_tribal_festival_host.Capital.GetName], un aroma extraño me llama la atención, llevándome al puesto recóndito de un anciano alquimista. Al ver mi curiosidad, me muestra algunos de sus productos y sus efectos fabulosos.;;;;;;;;x
EVTDESCHFA23819;As I walk around the crowded streets of [great_tribal_festival_host.Capital.GetName], a strange aroma catches my attention, leading me to the obscure stand of an old alchemist. Seeing my curiosity, the man shows me some of his wares and their prodigious effects.;Alors que je me promène dans les rues bondées de [great_tribal_festival_host.Capital.GetName], un arôme étrange attire mon attention, me menant aux étals obscurs d'un vieil alchimiste. Voyant ma curiosité, l'homme me montre certaines de ses marchandises et leurs effets prodigieux.;Während ich in den überfüllten Straßen von [great_tribal_festival_host.Capital.GetName] herumlaufe, rieche ich ein seltsames Aroma, das mich zu einem düsteren Stand eines alten Alchemisten führt. Der Mann sieht meine Neugier und zeigt mir einige seiner Waren und ihre erstaunlichen Wirkungen.;;Cuando caminaba por las calles abarrotadas de [great_tribal_festival_host.Capital.GetName], un aroma extraño me llama la atención, llevándome al puesto recóndito de un anciano alquimista. Al ver mi curiosidad, me muestra algunos de sus productos y sus efectos fabulosos.;;;;;;;;x
EVTDESCHFA23820;An old merchant has set up a large stand in the middle of [great_tribal_festival_host.Capital.GetName] this year, selling all sorts of amulets and trinkets to use at the end of the festival as offerings to the gods of our ancestors. I wonder if I should buy something to burn myself...;Un vieux marchand a installé un grand étal au milieu de [great_tribal_festival_host.Capital.GetName] cette année, vendant toutes sortes d'amulettes et de babioles à utiliser à la fin des festivités comme offrandes aux dieux de nos ancêtres. Je me demande si je devrais acheter quelque chose à brûler moi-même...;Ein alter Händler hat dieses Jahr einen großen Stand inmitten von [great_tribal_festival_host.Capital.GetName] errichtet und verkauft alle Arten von Amuletten und Schmuckstücken, die am Ende des Festes als Opfergaben für die Götter unserer Vorfahren verwendet werden können. Ich frage mich, ob ich etwas kaufen sollte um es selbst zu verbrennen?;;Este año un anciano mercader ha levantado un puesto en medio de [great_tribal_festival_host.Capital.GetName] donde vende toda clase de amuletos y alhajas que usar como ofrendas a nuestros antepasados al final del festival. No sé si debería comprar algo para quemarlo yo…;;;;;;;;x
EVTDESCHFA23821;I stumbled on [tribal_festival_potential_friend_1.GetTitledFirstName] in the main hall with a group of other distinguished guests. I have heard quite a few good things about [tribal_festival_potential_friend_1.GetHerHim] in the past, and I wonder if this festival is the right occasion to earn [tribal_festival_potential_friend_1.GetHerHis] friendship.;Je suis tombé[Root.Get_E] sur [tribal_festival_potential_friend_1.Get_le_TitledFirstName] dans la salle de réception, ainsi que d'autres invités de marque. J'ai entendu pas mal de choses positives à son sujet dans le passé et je me demande si ces festivités sont la bonne occasion pour gagner son amitié.;Ich traf in der Haupthalle [tribal_festival_potential_friend_1.GetTitledFirstName] zusammen mit einer Gruppe anderer berühmter Gäste. Ich habe in der Vergangenheit einige gute Dinge über [tribal_festival_potential_friend_1.Getihnsie] gehört und frage mich, ob dieses Fest die richtige Gelegenheit wäre, um [tribal_festival_potential_friend_1.GetHerHis]e Freundschaft zu verdienen.;;Me tropiezo con [tribal_festival_potential_friend_1.GetTitledFirstName] en el salón principal con un grupo de más invitados. He oído unas cuantas cosas buenas de [tribal_festival_potential_friend_1.GetElElla] y me pregunto si este festival es la ocasión adecuada para ganarme su amistad.;;;;;;;;x
EVTDESCHFA23822;[From.GetTitledFirstName] and I spent the evening telling old tales of our clans to each other, having a very good time alongside the other guests of [great_tribal_festival_host.GetTitledFirstName]'s feast. I never noticed how likable [From.GetFirstName] was before...;[From.Get_Le_TitledFirstName] et moi avons passé la soirée à raconter de vieux contes de nos clans, partageant un très bon moment avec les autres invités de la fête [great_tribal_festival_host.Get_du_TitledFirstName]. Je n'avais jamais remarqué à quel point [From.GetFirstName] était sympathique...;[From.GetTitledFirstName] und ich haben den Abend damit verbracht, uns alte Geschichten über unsere Klans zu erzählen und wir hatten zusammen mit den anderen Gästen auf dem Fest von [great_tribal_festival_host.GetTitledFirstName] eine gute Zeit. Ich habe vorher nie bemerkt, wie liebenswert [From.GetFirstName] ist...;;[From.GetTitledFirstName] nos pasamos la velada contando viejas historias de nuestro clanes y pasándolo bien con los demás invitados al festín de [great_tribal_festival_host.GetTitledFirstName]. No había caído hasta ahora en lo agradable que era [From.GetFirstName].;;;;;;;;x
EVTDESCHFA23823;For some reason, [tribal_festival_potential_friend_1.GetFirstName] has entirely rejected my offer of friendship. I think [tribal_festival_potential_friend_1.GetHerHis] paranoid nature might have gotten the best of [tribal_festival_potential_friend_1.GetHerHim]...;[tribal_festival_potential_friend_1.GetFirstName] a rejeté ma proposition d'amitié. Je pense que sa nature paranoïaque a eu raison d[tribal_festival_potential_friend_1.GetEluiElle]...;Aus irgendeinem Grund hat [tribal_festival_potential_friend_1.GetFirstName] mein Freundschaftsangebot abgelehnt. Ich denke, dass  [tribal_festival_potential_friend_1.Getihnsie] [tribal_festival_potential_friend_1.GetHerHim]e paranoide Natur überkommen hat...;;Poe el motivo que sea, [From.GetTitledFirstName] ha rechazado totalmente mi oferta de amistad. Puede que su naturaleza paranoica se haya apoderado de [From.GetElElla].;;;;;;;;x
EVTDESCHFA23824;[tribal_festival_potential_friend_1.GetFirstName] spent a great evening in the long-house, telling old legends and drinking with the other tribesmen. When finally leaving, right before dawn, we swore an oath of friendship.;[tribal_festival_potential_friend_1.GetFirstName] a passé une bonne soirée dans la maison longue, à raconter de vieilles légendes et à boire avec les autres membres de la tribu. Quand nous sommes partis, juste avant l'aube, nous avons fait un serment d'amitié.;[tribal_festival_potential_friend_1.GetFirstName] verbrachte einen schönen Abend im Langhaus, erzählte Legenden und trank mti den anderen Stammesangehörigen. Als wir schließlich kurz vor Sonnenaufgang gingen, schworen wir einen Eid der Freundschaft.;;[tribal_festival_potential_friend_1.GetFirstName] pasamos una gran velada en el pabellón, contando viejas leyendas y bebiendo con gente de la tribu. Cuando nos acabamos separando antes del amanecer, realizamos un juramento de amistad.;;;;;;;;x
EVTDESCHFA23825;[tribal_festival_potential_friend_1.GetFirstName] and I spent a very pleasant evening in the long-house, telling old legends and drinking with the other tribesmen. We left the hall at dawn, both glad to have had this opportunity to strengthen our relation.;[tribal_festival_potential_friend_1.GetFirstName] et moi avons passé une très agréable soirée dans la maison longue, à raconter de vieilles légendes et à boire avec les autres membres de la tribu. Nous avons quitté la salle à l'aube, tous deux heureux d'avoir eu cette occasion de renforcer notre relation.;[tribal_festival_potential_friend_1.GetFirstName] und ich verbrachten einen sehr angenehmen Abend im Langhaus, erzählten Legenden und tranken mit den anderen Stammesangehörigen. Wir verließen die Hallte im Morgengrauen und waren beide froh, dass diese Gelegenheit unsere Beziehungen gestärkt hat.;;[tribal_festival_potential_friend_1.GetFirstName] pasamos una velada muy agradable en el pabellón, contando viejas leyendas y bebiendo con gente de la tribu. Dejamos el salón al amanecer, contentos de haber tenido esta oportunidad para reforzar nuestra relación.;;;;;;;;x
EVTDESCHFA23826;I was busy exchanging tales with some of the other tribesmen, when [From.GetTitledFirstName] approaches me with a smile, offering me a drink, claiming that [From.GetSheHe] wishes to make a toast to new friendships.;Tandis que je parle de choses et d'autres avec d'autres membres de la tribu, [From.Get_le_TitledFirstName] s'approche de moi le sourire aux lèvres. [From.GetIlElleCap] m'offre un verre, affirmant vouloir trinquer à de nouvelles amitiés.;Ich war damit beschäftigt Geschichten mit meinen anderen Stammesmitgliedern auszutauschen, als [From.GetTitledFirstName] mich mit einem Lächeln ansprach und mir einen Drink anbot, bei dem [From.GetSheHe] sagte, [From.GetSheHe] würde auf neue Freundschaften anstoßen.;;Estaba hablando con otra gente de la tribu cuando [From.GetTitledFirstName] se acerca sonriendo, ofreciéndome una bebida, diciendo que desea brindar por las nuevas amistades.;;;;;;;;x
EVTDESCHFA23828;Seeing [tribal_festival_potential_enemy_1.GetTitledFirstName] having such a good time with the other tribesmen, laughing and drinking in the long-house, is an unbearable sight. I wish I could do something to bring [tribal_festival_potential_enemy_1.GetHerHis] insufferable merriment to an end.;Voir [tribal_festival_potential_enemy_1.Get_le_TitledFirstName] s'amuser avec les autres membres de la tribu, rire et boire dans la maison longue, est insupportable. J'aimerais mettre fin à sa gaieté.;Es ist ein unerträglicher Anblick zu sehen, dass [tribal_festival_potential_enemy_1.GetTitledFirstName] mit den anderen Stammesmitgliedern im Langhaus Spaß hat, lacht und trinkt. Ich wünschte, dass ich etwas tun könnte, das [tribal_festival_potential_enemy_1.GetHerHis]e unerträgliche Heiterkeit beendet.;;Ver a [tribal_festival_potential_enemy_1.GetTitledFirstName] pasárselo bien con los otros miembros de la tribu algo que no puedo soportar. Ojalá pudiera hacer algo para poner fin a su alegría insufrible.;;;;;;;;x
EVTDESCHFA23830;It looks like [tribal_festival_potential_enemy_1.GetFirstName] is smarter than [tribal_festival_potential_enemy_1.GetSheHe] looks. [tribal_festival_potential_enemy_1.GetSheHeCap] was able to see through my deception and reject my false offer of friendship.;Il semble que [tribal_festival_potential_enemy_1.GetFirstName] soit plus intelligent[tribal_festival_potential_enemy_1.Get_E] qu'[tribal_festival_potential_enemy_1.GetIlElle] n'en a l'air. [tribal_festival_potential_enemy_1.GetIlElleCap] a pu déceler ma ruse et rejeter ma fausse proposition d'amitié.;Es scheint so, als ob [tribal_festival_potential_enemy_1.GetFirstName] schlauer ist als [tribal_festival_potential_enemy_1.GetSheHe] aussieht. [tribal_festival_potential_enemy_1.GetSheHeCap] konnte meine Täuschung durchschauen und hat mein falsches Freundschaftsangebot abgelehnt.;;Parece que [tribal_festival_potential_enemy_1.GetFirstName] es más inteligente de lo que parece. Me caló las intenciones y rechazó mi oferta de amistad falsa.;;;;;;;;x
