EVTDESC_HFP_41057;[Root.GetTitledName]\nI know we have had our differences, but it pleases me to hear you have decided to join our rightful cause. I have made the preparations to recant your excommunication from the church.\n\nSigned,\n[From.GetTitledName];[Root.GetTitledName]\nJe sais que nous avons eu des différends, mais cela me fait plaisir d'entendre que vous avez décidé de vous joindre à notre juste cause. J'ai fait les préparatifs pour mettre fin à votre excommunication de l'Église.\n\nSigné,\n[From.GetTitledName];[Root.GetTitledName]\nIch weiß, dass wir unsere Differenzen hatten, aber es freut mich zu hören, dass ihr euch entschieden habt der gerechten Sache anzuschließen. Ich habe bereits die nötigen Vorbereitungen getroffen, um eure Exkommunikation aus der Kirche zu widerrufen.\n\nGezeichnet,\n[From.GetTitledName];;[Root.GetTitledName]\nSé que hemos tenido nuestras diferencias, pero me place saber que has decidido unirte a nuestra causa justa. He hecho los preparativos para deshacer tu excomunión de la Iglesia.\n\nFirmado,\n[From.GetTitledName];;;;;x
EVTDESC_HFP_41061;The victories against the infidels were hard-fought, but things have finally settled down and the titles I fought for were given to [beneficiary_check_crusader_beneficiary.GetDynName]. It will surely be difficult to be a part of the new Kingdom, but I wish [beneficiary_check_crusader_beneficiary.GetHerHim] luck in [beneficiary_check_crusader_beneficiary.GetHerHis] future endeavors.\n\nI look back one last time as my men and I leave [beneficiary_check_crusader_beneficiary.PrimaryTitle.GetName]. I wonder what life would have been like if it had been me staying here, rather than [beneficiary_check_crusader_beneficiary.GetDynName].;Les victoires contre les infidèles ont été acharnées, mais les choses se sont finalement calmées et les titres pour lesquels j'ai combattu ont été donnés à [beneficiary_check_crusader_beneficiary.GetDynName]. Ce sera sûrement difficile de faire partie du nouveau Royaume, mais je lui souhaite bonne chance dans ses futures entreprises.\n\nJe regarde en arrière une dernière fois tandis que mes hommes et moi quittons [beneficiary_check_crusader_beneficiary.PrimaryTitle.Get_le_Realm]. Je me demande ce que la vie aurait été si j'étais resté[Root.Get_E] ici à la place de [beneficiary_check_crusader_beneficiary.GetDynName].;Die Siege gegen die Ungläubigen waren hart umkämpft, doch die Dinge haben sich schließlich beruhigt und die Titel, für die ich gekämpft habe, wurden an [beneficiary_check_crusader_beneficiary.GetDynName] übergeben. Es wird sicherlich schwierig sein ein Teil dieses neuen Königreichs zu sein, aber ich wünsche [beneficiary_check_crusader_beneficiary.GetHerHim] Glück bei [beneficiary_check_crusader_beneficiary.GetHerHis]en künftigen Bemühungen.\n\nIch schaue ein letztes Mal zurück, als meine Männer und ich [beneficiary_check_crusader_beneficiary.PrimaryTitle.GetName] verlassen. Ich frage mich, wie das Leben gewesen wäre, wenn ich hier geblieben wäre anstatt [beneficiary_check_crusader_beneficiary.GetDynName].;;Las victorias contra los infieles fueron reñidas, pero al final todo se resolvió y los títulos por los que luché se entregaron a [beneficiary_check_crusader_beneficiary.GetDynName]. Seguro que será duro formar parte del nuevo reino, pero [beneficiary_check_crusader_beneficiary.GetLoLa] deseo buena suerte en sus empresas futuras.\n\nVuelvo a echar la vista atrás una última vez mientras mis hombres y yo nos marchamos de [beneficiary_check_crusader_beneficiary.PrimaryTitle.GetName]. Me pregunto cómo hubiera sido la vida si yo me hubiera quedado aquí en lugar de [beneficiary_check_crusader_beneficiary.GetDynName].;;;;;x
EVTDESC_HFP_41075;Greetings, [Root.GetTitledName]\n\nI was informed the heathen Pope have declared a will to bring a Crusade to your doorsteps. As a fellow [From.Religion.GetName], I pledge to stand by your side when the unfaithful come to take your lands.\n\nSigned,\n[From.GetTitledName];Salutations, [Root.GetTitledName]\nJ'ai été informé[From.Get_E] que le pape païen a déclaré vouloir faire une croisade à vos portes. En tant que [From.GetReligionMascFem], je m'engage à rester à vos côtés lorsque les infidèles viendront pour prendre vos terres.\n\nSigné,\n[From.GetTitledName];[Root.GetTitledName]\nIch wurde informiert, dass der heidnische Papst plant einen Kreuzzug an eure Tür zu bringen. Als gleichgesinnter [From.Religion.GetName]er Anhänger verspreche ich, dass ich an eurer Seite stehen werde, wenn diese Ungläubigen kommen, um euer Land zu nehmen.\n\nGezeichnet,\n[From.GetTitledName];;[Root.GetTitledName]\nMe han informado que el papa infiel desea llevar una cruzada a tus fronteras. Como otro [From.Religion.GetName], prometo estar a tu lado cuando los infieles vengan a quitarte las tierras.\n\nFirmado,\n[From.GetTitledName];;;;;x
EVTDESC_HFP_41088;How much gold should I donate to the Crusade?;Combien d'or devrais-je donner à la croisade ?;Wie viel Gold sollte ich dem Kreuzzug spenden?;;¿Cuánto oro debo donar a la cruzada?;;;;;x
EVTDESC_HFP_41091;I need to make a decision, if I should comply with Papal will, or go my own way when it comes to the distribution of the titles in the case of a victory in the Crusades.;Je dois prendre une décision. Dois-je me plier à la volonté du pape ou faire à ma façon quand il s'agira de distribuer des titres en cas de victoire de la croisade.;Ich muss eine Entscheidung treffen, ob ich dem päpstlichen Willen folge oder meinen eigenen Weg gehe, wenn es darum geht die Titel im Fall eines Sieges des Kreuzzugs zu verteilen.;;Tengo que tomar una decisión a la hora de repartir los títulos en caso de una victoria en la cruzada. Cumplir con la voluntad papal, o seguir mi propio camino.;;;;;x
EVTDESC_HFP_41111;Sadly, my beneficiary §Y[old_crusade_beneficiary.GetDynName]§! seems to have died, I need to find a new one.;Malheureusement, m[old_crusade_beneficiary.GetOnA] bénéficiaire §Y[old_crusade_beneficiary.GetDynName]§! a trépassé. Je dois trouver quelqu'un pour [old_crusade_beneficiary.GetLeLa] remplacer.;Leider scheint mein Begünstigter §Y[old_crusade_beneficiary.GetDynName]§! gestorben zu sein und ich muss einen neuen finden.;;Por desgracia, parece que mi beneficiario, §Y[old_crusade_beneficiary.GetDynName]§!, ha fallecido y tengo que encontrar otro.;;;;;x
EVTDESC_HFP_41112;My beneficiary §Y[old_crusade_beneficiary.GetDynName]§! seems to have gained land, and is no longer an appropriate beneficiary.;§Y[old_crusade_beneficiary.GetDynName]§! possède des terres et n'est donc plus un[old_crusade_beneficiary.Get_E] bénéficiaire convenable.;Mein Begünstigter §Y[old_crusade_beneficiary.GetDynName]§! scheint Land erhalten zu haben und kann daher nicht länger begünstigt werden.;;Parece que mi beneficiario, §Y[old_crusade_beneficiary.GetDynName]§!, ha conseguido tierras y ya no es un beneficiario válido.;;;;;x
EVTDESC_HFP_41113;My beneficiary §Y[old_crusade_beneficiary.GetDynName]§! seems to have become an heir for a landed title, and is no longer an appropriate beneficiary.;§Y[old_crusade_beneficiary.GetDynName]§! est devenu[old_crusade_beneficiary.Get_E] l'hériti[old_crusade_beneficiary.GetErEre] de terres et n'est donc plus un[old_crusade_beneficiary.Get_E] bénéficiaire convenable.;Mein Begünstigter §Y[old_crusade_beneficiary.GetDynName]§! scheint Erbe eines Titels geworden zu sein und kann daher nicht länger begünstigt werden.;;Parece que mi beneficiario, §Y[old_crusade_beneficiary.GetDynName]§!, se ha convertido en heredero de un título con tierras y ya no es un beneficiario válido.;;;;;x
EVTDESC_HFP_41114;My beneficiary §Y[old_crusade_beneficiary.GetDynName]§! seems to have become a mercenary, and is no longer an appropriate beneficiary.;§Y[old_crusade_beneficiary.GetDynName]§! est devenu[old_crusade_beneficiary.Get_E] un[old_crusade_beneficiary.Get_E] mercenaire et n'est donc plus un[old_crusade_beneficiary.Get_E] bénéficiaire convenable.;Mein Begünstigter §Y[old_crusade_beneficiary.GetDynName]§! scheint ein Söldner geworden zu sein und kann daher nicht länger begünstigt werden.;;Parece que mi beneficiario, §Y[old_crusade_beneficiary.GetDynName]§!, se ha convertido en mercenario y ya no es un beneficiario válido.;;;;;x
EVTDESC_HFP_41115;My beneficiary §Y[old_crusade_beneficiary.GetDynName]§! seems to have joined a holy order, and is no longer an appropriate beneficiary.;§Y[old_crusade_beneficiary.GetDynName]§! a rejoint un ordre sacré et n'est donc plus un[old_crusade_beneficiary.Get_E] bénéficiaire convenable.;Mein Begünstigter §Y[old_crusade_beneficiary.GetDynName]§! scheint einem Ritterorden beigetreten zu sein und kann daher nicht länger begünstigt werden.;;Parece que mi beneficiario, §Y[old_crusade_beneficiary.GetDynName]§!, se ha unido a una orden sagrada y ya no es un beneficiario válido.;;;;;x
EVTDESC_HFP_41116;My beneficiary §Y[old_crusade_beneficiary.GetDynName]§! is not old enough, and is therefore not an appropriate beneficiary.;§Y[old_crusade_beneficiary.GetDynName]§! n'est pas assez âgé[old_crusade_beneficiary.Get_E] pour être un bénéficiaire convenable.;Mein Begünstigter §Y[old_crusade_beneficiary.GetDynName]§! ist nicht alt genug, um begünstigt zu werden.;;Mi beneficiario, §Y[old_crusade_beneficiary.GetDynName]§!, no es lo bastante mayor, así que no es un beneficiario válido.;;;;;x
EVTDESC_HFP_41117;My beneficiary §Y[old_crusade_beneficiary.GetDynName]§! is not healthy enough to be an appropriate beneficiary.;§Y[old_crusade_beneficiary.GetDynName]§! n'est plus en assez bonne santé pour être un[old_crusade_beneficiary.Get_E] bénéficiaire convenable.;Mein Begünstigter §Y[old_crusade_beneficiary.GetDynName]§! ist nicht gesund genug, um begünstigt zu werden.;;Mi beneficiario, §Y[old_crusade_beneficiary.GetDynName]§!, no está lo bastante sano para ser un beneficiario válido.;;;;;x
EVTDESC_HFP_41118;My beneficiary §Y[old_crusade_beneficiary.GetDynName]§! have become a [old_crusade_beneficiary.GetAscetic], and is no longer an appropriate beneficiary.;§Y[old_crusade_beneficiary.GetDynName]§! est devenu[old_crusade_beneficiary.Get_E] un[old_crusade_beneficiary.GetAscetic] et n'est donc plus un[old_crusade_beneficiary.Get_E] bénéficiaire convenable.;Mein Begünstigter §Y[old_crusade_beneficiary.GetDynName]§! ist ein [old_crusade_beneficiary.GetAscetic] geworden und kann daher nicht länger begünstigt werden.;;Mi beneficiario, §Y[old_crusade_beneficiary.GetDynName]§!, se ha convertido en [old_crusade_beneficiary.GetAscetic] y ya no es un beneficiario válido.;;;;;x
EVTDESC_HFP_41120_1;[Root.GetTitledName]\nI write to inform you that the Holy See no longer supports [old_crusade_recipient.GetDynName] for the lands of [current_crusade_target_title.GetName], but rather [new_crusade_recipient.GetDynName].\n\nSigned,\n[From.GetTitledName];[Root.GetTitledName]\nJe vous informe que le Saint-Siège ne soutient plus [old_crusade_recipient.GetDynName] pour les terres [current_crusade_target_title.Get_du_Realm] et lui préfère [new_crusade_recipient.GetDynName].\n\nSigné,\n[From.GetTitledName];[Root.GetTitledName]\nIch schreibe euch um euch mitzuteilen, dass der Heilige Stuhl nicht länger [old_crusade_recipient.GetDynName] für die Ländereien von [current_crusade_target_title.GetName] begünstigt, sondern [new_crusade_recipient.GetDynName].\n\nGezeichnet,\n[From.GetTitledName];;[Root.GetTitledName]\nOs escribo para deciros que la Santa Sede ya no apoya a [old_crusade_recipient.GetDynName] para recibir las tierras de [current_crusade_target_title.GetName], sino a [new_crusade_recipient.GetDynName]. \n\nFirmado,\n[From.GetTitledName];;;;;x
EVTDESC_HFP_41120_2;[Root.GetTitledName]\nI write to inform you that the Holy See can no longer support [old_crusade_recipient.GetDynName] for the lands of [current_crusade_target_title.GetName], as [old_crusade_recipient.GetSheHe] has passed away. The Holy See now support [new_crusade_recipient.GetDynName] to be granted the titles.\n\nSigned,\n[From.GetTitledName];[Root.GetTitledName]\nJe vous informe que le Saint-Siège ne peut plus soutenir [old_crusade_recipient.GetDynName] pour les terres [current_crusade_target_title.Get_du_Realm], puisqu'[old_crusade_recipient.GetIlElle] a trépassé. Le Saint-Siège soutient à présent [new_crusade_recipient.GetDynName] pour recevoir les titres.\n\nSigné,\n[From.GetTitledName];[Root.GetTitledName]\nIch schreibe euch um euch mitzuteilen, dass der Heilige Stuhl nicht länger [old_crusade_recipient.GetDynName] für die Ländereien von [current_crusade_target_title.GetName] begünstigt, da [old_crusade_recipient.GetSheHe] verstorben ist. Der Heilige Stuhl unterstützt nun [new_crusade_recipient.GetDynName].\n\nGezeichnet,\n[From.GetTitledName];;[Root.GetTitledName]\nOs escribo para deciros que, al morir [old_crusade_recipient.GetDynName], la Santa Sede ya no puede seguir apoyándo[old_crusade_recipient.GetLoLa] para las tierras de [current_crusade_target_title.GetName]. De modo que ahora apoya que [new_crusade_recipient.GetDynName] reciba los títulos.\n\nFirmado,\n[From.GetTitledName];;;;;x
EVTDESC_HFP_41120_3;[Root.GetTitledName]\nI write to inform you that the Holy See can no longer support [old_crusade_recipient.GetDynName] for the lands of [current_crusade_target_title.GetName], as [old_crusade_recipient.GetSheHe] has passed away. The Holy See now supports [old_crusade_recipient.GetHerHis] heir [new_crusade_recipient.GetDynName] for the throne.\n\nSigned,\n[From.GetTitledName];[Root.GetTitledName]\nJe vous informe que le Saint-Siège ne peut plus soutenir [old_crusade_recipient.GetDynName] pour les terres [current_crusade_target_title.Get_du_Realm], puisqu'[old_crusade_recipient.GetIlElle] a trépassé. Le Saint-Siège soutient à présent son hériti[new_crusade_recipient.GetErEre] [new_crusade_recipient.GetDynName] pour le trône.\n\nSigné,\n[From.GetTitledName];[Root.GetTitledName]\nIch schreibe euch um euch mitzuteilen, dass der Heilige Stuhl nicht länger [old_crusade_recipient.GetDynName] für die Ländereien von [current_crusade_target_title.GetName] begünstigt, da [old_crusade_recipient.GetSheHe] verstorben ist. Der Heilige Stuhl unterstützt nun [old_crusade_recipient.GetHerHis]en Erben [new_crusade_recipient.GetDynName] für den Thron.\n\nGezeichnet,\n[From.GetTitledName];;[Root.GetTitledName]\nOs escribo para deciros que, al morir [old_crusade_recipient.GetDynName], la Santa Sede ya no puede seguir apoyándo[old_crusade_recipient.GetLoLa] para las tierras de [current_crusade_target_title.GetName]. De modo que ahora apoya a su heredero al trono.\n\nFirmado,\n[From.GetTitledName];;;;;x
EVTDESC_HFP_41120_4;[Root.GetTitledName]\nI write to inform you that the Holy See has decided to start supporting you as the recipient for the lands of [current_crusade_target_title.GetName], after the death of [old_crusade_recipient.GetDynName].\n\nSigned,\n[From.GetTitledName];[Root.GetTitledName]\nJe vous informe que le Saint-Siège a décidé de vous soutenir comme bénéficiaire des terres [current_crusade_target_title.Get_du_Realm], après la mort de [old_crusade_recipient.GetDynName].\n\nSigné,\n[From.GetTitledName];[Root.GetTitledName]\nIch schreibe euch um euch mitzuteilen, dass der Heilige Stuhl nun EUCH nach dem Tod von [old_crusade_recipient.GetDynName] als Begünstigter für die Ländereien von [current_crusade_target_title.GetName] unterstützt.\n\nGezeichnet,\n[From.GetTitledName];;[Root.GetTitledName]\nOs escribo para deciros que tras la muerte de [current_crusade_target_title.GetName], la Santa Sede ha decidido empezar a apoyaros como receptor de las tierras de [current_crusade_target_title.GetName]. \n\nFirmado,\n[From.GetTitledName];;;;;x
EVTDESC_HFP_41120_5;[Root.GetTitledName]\nI write to inform you that the Holy See has decided to start supporting you as the recipient for the lands of [current_crusade_target_title.GetName].\n\nSigned,\n[From.GetTitledName];[Root.GetTitledName]\nJe vous informe que le Saint-Siège a décidé de vous soutenir comme bénéficiaire des terres [current_crusade_target_title.Get_du_Realm].\n\nSigné,\n[From.GetTitledName];[Root.GetTitledName]\nIch schreibe euch um euch mitzuteilen, dass der Heilige Stuhl nun EUCH als Begünstigter für die Ländereien von [current_crusade_target_title.GetName] unterstützt.\n\nGezeichnet,\n[From.GetTitledName];;[Root.GetTitledName]\nOs escribo para deciros que la Santa Sede ha decidido empezar a apoyaros como receptor de las tierras de [current_crusade_target_title.GetName]. \n\nFirmado,\n[From.GetTitledName];;;;;x
EVTDESC_HFP_41121_1;[Root.GetTitledName]\nI write to inform you that the Holy See no longer supports [old_crusade_recipient.GetDynName] for the lands of [current_crusade_target_title.GetName]. With no fitting ruler, I will let you faithful men and women of the Cross decide who these titles might befit.\n\nSigned,\n[From.GetTitledName];[Root.GetTitledName]\nJe vous informe que le Saint-Siège ne soutient plus [old_crusade_recipient.GetDynName] pour les terres [current_crusade_target_title.Get_du_Realm]. Puisque je n'ai pas de dirigeant qui convienne, je vous laisse, vous, fidèles hommes et femmes de la Croix, décider qui recevra ces titres.\n\nSigné,\n[From.GetTitledName];[Root.GetTitledName]\nIch schreibe euch um euch mitzuteilen, dass der Heilige Stuhl nicht länger [old_crusade_recipient.GetDynName] für die Ländereien von [current_crusade_target_title.GetName] unterstützt. Ohne geeigneten Herrscher werde ich euch glaubenstreue Männer und Frauen des Kreuzes entscheiden lassen, wem diese Titel gebühren.\n\nGezeichnet,\n[From.GetTitledName];;[Root.GetTitledName]\nEscribo para informarte que la Santa Sede ya no apoya a [old_crusade_recipient.GetDynName] para las tierras de [current_crusade_target_title.GetName]. Al carecer de un gobernante apropiado, dejaré que los fieles hombres y mujeres de la cruz decidáis a quién deben pertenecer estos títulos.\n\nFirmado,\n[From.GetTitledName];;;;;x
EVTDESC_HFP_41121_2;[Root.GetTitledName]\nI write to inform you that the Holy See can no longer support [old_crusade_recipient.GetDynName] for the lands of [current_crusade_target_title.GetName], as [old_crusade_recipient.GetSheHe] has passed away. With no fitting ruler available, I will let you faithful men and women of the Cross decide who will receive these titles.\n\nSigned,\n[From.GetTitledName];[Root.GetTitledName]\nJe vous informe que le Saint-Siège ne peut plus soutenir [old_crusade_recipient.GetDynName] pour les terres [current_crusade_target_title.Get_du_Realm], puisqu'[old_crusade_recipient.GetIlElle] a trépassé. Puisque je n'ai pas de dirigeant qui convienne, je vous laisse, vous, fidèles hommes et femmes de la Croix, décider qui recevra ces titres.\n\nSigné,\n[From.GetTitledName];[Root.GetTitledName]\nIch schreibe euch um euch mitzuteilen, dass der Heilige Stuhl nicht länger [old_crusade_recipient.GetDynName] für die Ländereien von [current_crusade_target_title.GetName] unterstützt, da [old_crusade_recipient.GetSheHe] verstorben ist. Ohne geeigneten Herrscher werde ich euch glaubenstreue Männer und Frauen des Kreuzes entscheiden lassen, wem diese Titel gebühren.\n\nGezeichnet,\n[From.GetTitledName];;[Root.GetTitledName]\nEscribo para informarte que la Santa Sede ya no puede apoyar a [old_crusade_recipient.GetDynName] para las tierras de [current_crusade_target_title.GetName], puesto que ha fallecido. al carecer de un gobernante apropiado, dejaré que los fieles hombres y mujeres de la cruz decidáis a quién deben pertenecer estos títulos.\n\nFirmado,\n[From.GetTitledName];;;;;x
EVTDESC_HFP_41131;[Root.GetTitledFirstName]\nThe Vatican is deeply disappointed in your decision to not join the Crusade. Your lack of faith is shocking, and I thought one could think better of a ruler such as you. \n\nSigned,\n[From.GetTitledFirstName];[Root.GetTitledFirstName]\nLe Vatican est profondément déçu par votre décision de ne pas rejoindre la croisade. Votre manque de foi est choquant et je pensais qu'on pouvait attendre mieux de quelqu'un comme vous.\n\nSigné,\n[From.GetTitledFirstName];[Root.GetTitledFirstName]\nDer Vatikan ist tief enttäuscht von eurer Entscheidung nicht dem Kreuzzug beizutreten. Euer Mangel an Glaube ist schockierend und ich dachte, man könnte sich auf einen Herrscher wie euch verlassen.\n\nGezeichnet,\n[From.GetTitledFirstName];;[Root.GetTitledFirstName]\nEl Vaticano está sumamente decepcionado con tu decisión de no unirte a la cruzada. Tu falta de fe es escandalosa y habría esperado algo mejor de un[Root.GetXA] gobernante como tú.\n\nFirmado,\n[From.GetTitledName];;;;;x
EVTDESC_HFP_41144;[Root.GetTitledFirstName]\nI have noticed that neither you nor your troops have partaken in the Crusade you pledged to join. I am disgusted that you would dare to lie about something like this, and expect your troops to show up soon.\n\nSigned,\n[From.GetTitledName];[Root.GetTitledFirstName]\nJ'ai remarqué que ni vous ni vos troupes n'avez participé à la croisade que vous vous étiez engagé à rejoindre. Je suis écoeuré[Root.Get_E] que vous osiez mentir sur ce genre de sujet et suis dans l'attente de voir vos troupes bientôt.\n\nSigné,\n[From.GetTitledName];[Root.GetTitledFirstName]\nIch habe bemerkt, dass weder ihr, noch eure Truppen am Kreuzzug teilgenommen haben, zu dem ihr euch verpflichtet habt. Ich bin angewidert, dass ihr über so etwas lügen könnt und erwarte, dass eure Truppen bald auftauchen.\n\nGezeichnet,\n[From.GetTitledName];;[Root.GetTitledName]\nHe notado que ni tus tropas ni tú habéis tomado parte en la cruzada en la que os comprometisteis a formar parte. Me disgusta que te hayas atrevido a mentir sobre algo como esto y espero que tus tropas aparezcan pronto.\n\nFirmado,\n[From.GetTitledName];;;;;x
EVTDESC_HFP_41147;[Root.GetTitledFirstName]\nYou have already received one warning, and clearly not taken heed. I consider your lack of faith and interest in keeping your promise to be unbecoming of a Christian ruler.\n\nSigned,\n[From.GetTitledName].;[Root.GetTitledFirstName]\nVous avez déjà reçu un avertissement et vous n'en avez manifestement pas tenu compte. Je considère votre manque de foi et de volonté à tenir votre promesse indigne d'un dirigeant chrétien.\n\nSigné,\n[From.GetTitledName].;[Root.GetTitledFirstName]\nIhr habt bereits eine Warnung erhalten und diese offensichtlich nicht beachtet. Ich werte euren Mangel an Glauben und Interesse daran, dass euer gebrochenes Versprechen es unwürdig macht ein christlicher Herrscher zu bleiben.\n\nGezeichnet,\n[From.GetTitledName].;;[Root.GetTitledName]\nYa has recibido una advertencia y es obvio que no la escuchaste. Considero que tu falta de fe e interés en mantener la promesa es impropia de un gobernante cristiano.\n\nFirmado,\n[From.GetTitledName];;;;;x
EVTDESC_HFP_41160;[From.Religion.GetHighGodName] has granted [new_crusade_most_participating_member.GetTitledName] victory in the Crusade for [new_crusade_title.GetBaseName]. [new_crusade_target_char.GetTitledName] has been beaten at every turn through the war, and [new_crusade_target_char.GetSheHe] has finally had to give up on [new_crusade_target_char.GetHerHis] holdings in [new_crusade_title.GetBaseName].\n\n[Root.GetCrusadeSelfishOrNot]\n\nWith the [new_crusade_target_char.Religion.GetGroupName]s being pushed out of their old lands, there are certainly more conflicts to come.;La victoire a été accordée par [From.Get_le_HighGod] [new_crusade_most_participating_member.Get_au_TitledName] dans la croisade pour [new_crusade_title.GetBaseName]. [new_crusade_target_char.Get_Le_TitledName] a été battu[new_crusade_target_char.Get_E] à chaque occasion durant la guerre et a finalement dû renoncer à ses propriétés.\n\n[Root.GetCrusadeSelfishOrNot]\n\nMaintenant que les [new_crusade_target_char.GetReligiousGroupMascPl] ont été chassés de leurs terres, on peut s'attendre à plus de conflits dans les prochains temps.;[From.Religion.GetHighGodName] hat [new_crusade_most_participating_member.GetTitledName] im Kreuzzug um [new_crusade_title.GetBaseName] den Sieg gewährt. [new_crusade_target_char.GetTitledName] wurde bei jeder Phase des Krieges besiegt und musste schließlich auf [new_crusade_target_char.GetHerHis]e Besitztümer in [new_crusade_title.GetBaseName] verzichten.\n\n[Root.GetCrusadeSelfishOrNot]\n\nJetzt, wo die Anhänger des [new_crusade_target_char.Religion.GetGroupName]en Glaubens aus ihren alten Ländern verdrängt wurden, gibt es sichere weitere Konflikte.;;[From.Religion.GetHighGodName] ha concedido a [new_crusade_most_participating_member.GetTitledName] la victoria en la cruzada por [new_crusade_title.GetBaseName]. [new_crusade_target_char.GetTitledName] fue totalmente derrotado en todas las fases de la guerra, y finalmente ha tenido que renunciar a sus dominios en [new_crusade_title.GetBaseName]. \n\n[Root.GetCrusadeSelfishOrNot]\n\nCon el pueblo [new_crusade_target_char.Religion.GetGroupName] expulsado de sus viejas tierras, está claro que habrá más conflictos por llegar.;;;;;x

EVTOPTA_HFP_41004;I should consider preparing my men.;Je devrais préparer mes hommes.;Ich sollte meine Männer vorbereiten.;;Debo pensar en preparar a mis hombres.;;;;;x
EVTOPTA_HFP_41004_TT;The preparations for the next Crusade begins.;Les préparatifs pour la prochaine croisade commencent.;Die Vorbereitungen für den nächsten Kreuzzug beginnen.;;Comienzan los preparativos para la próxima cruzada.;;;;;x
EVTOPTA_HFP_41009;Deus Vult!;Deus Vult !;Deus Vult!;;Deus Vult!;;;;;x
EVTOPTA_HFP_41009_TT;The Crusade for [crusade_title.GetName] begins.;La croisade pour [crusade_title.Get_le_Realm] commence.;Der Kreuzzug um [crusade_title.GetName] beginnt.;;Empieza la cruzada por [crusade_title.GetName];;;;;x
