#CODE;ENGLISH;FRENCH;GERMAN;;SPANISH;;;;;;;;;x
sarira_desc;This is a small crystal like bead that was once retrieved from the ashes of a cremated spiritual master. It is an object of some power and is believed to be able to ward off evil and convey blessings upon those that possess it.;Petit cristal ressemblant à une perle autrefois extrait des cendres d'un maître spirituel incinéré. C'est un objet doté du pouvoir de guérir du mal et de transmettre des bénédictions à ceux qui le possèdent.;Der kleine Kristall, der an eine Perle erinnert, wurde einst aus der Asche eines eingeäscherten spirituellen Meisters geborgen. Er gilt als magisch und soll das Böse fernhalten sowie den Besitzer segnen können.;;Este cristal del tamaño de una cuenta se recuperó de entre las cenizas de un maestro espiritual incinerado. Es un objeto de poder y se cree que es capaz de proteger del mal y bendecir a aquellos que lo posean.;;;;;;;;;x
sariraka_actual_body_part;Sariraka Bone;Os Sariraka;Sarirakaknochen;;Hueso Sariraka;;;;;;;;;x
sariraka_actual_body_part_desc;This is a bone that once belonged to the Buddha himself. They serve as Cetiya, or a reminder of the great Gautama Buddha.;C'est un os qui appartenait autrefois à Bouddha. Ils servent de « cetiya », ou un mémorial du grand Bouddha Gautama.;Hierbei handelt es sich um einen Knochen, der von Buddha selbst stammen soll. Seine Funktion ist die eines Cetiya, eines Erinnerungsstücks an den großen Gautama Buddha.;;"Este hueso perteneció al mismísimo Buda. Sirve de "cetiya", o como recordatorio del gran Buda Gautama.";;;;;;;;;x
satyric_blessing;Satyric Blessing;Bénédiction satyrique;Satyrsegen;;Bendición satírica;;;;;;;;;x
satyric_blessing_desc;This man has been favored with the virility and animal magnetism of satyrs.;Cet homme a été favorisé par la virilité et le magnétisme animal des satyres.;Dieser Mann ist mit der Potenz und der animalischen Anziehungskraft eines Satyrs gesegnet.;;Este hombre ha sido bendecido con la virilidad y el magnetismo animal de los sátiros.;;;;;;;;;x
SAVE_FILTERS;Save Filters;Sauvegarder les filtres;Filter speichern;;Guardar filtros;;;;;;;;;x
SAVE_RULES;Save Rules;Sauv. règles;Speichern;;Guardar reglas;;;;;;;;;x
scepter;Scepter;Sceptre;Zepter;;Cetro;;;;;;;;;x
scimitar_tier_1;Scimitar;Cimeterre;Krummsäbel;;Cimitarra;;;;;;;;;x
scimitar_tier_1_desc;A scimitar of finer quality than your common blade.;Un cimeterre de meilleure qualité que la lame commune.;Ein Krummsäbel in besserer Qualität als die normale Blankwaffe.;;Una cimitarra de mejor calidad que una espada común.;;;;;;;;;x
scimitar_tier_2;Fine Scimitar;Cimeterre supérieur;Guter Krummsäbel;;Cimitarra refinada;;;;;;;;;x
scimitar_tier_2_desc;A well-forged blade that can stand against most weapons.;Une lame bien forgée qui peut résister à la plupart des armes.;Eine kompetent geschmiedete Klinge, die mit den meisten Waffen mithalten kann.;;Una hoja bien forjada que puede resistir contra casi cualquier arma.;;;;;;;;;x
scimitar_tier_3_conquest;Scimitar of Conquest;Le Cimeterre de Conquête;Säbel der Eroberung;;Cimitarra de Conquista;;;;;;;;;x
scimitar_tier_3_conquest_desc;Forged by the best of craftsmen, the Scimitar of Conquest is a blade of victory and triumph. Both handle and hilt are covered in diamonds.;Forgé par le meilleur des artisans, le Cimeterre de Conquête est une lame de victoire et de triomphe. La poignée est recouverte de diamants.;Der von den Meistern ihres Faches geschmiedete Krummsäbel der Eroberung ist eine Klinge, die für Sieg und Triumph steht. Knauf und Heft sind von Diamanten bedeckt.;;Forjada por el mejor artesano, la Cimitarra de Conquista es una hoja hecha para la victoria y el triunfo. Tanto el pomo como el puño están cubiertos de diamantes.;;;;;;;;;x
scimitar_tier_3_fortune;Scimitar of Fortune;Le Cimeterre de Fortune;Krummsäbel des Glücks;;Cimitarra de la Fortuna;;;;;;;;;x
scimitar_tier_3_fortune_desc;A blade of the finest steel and a handle inlaid with gold. Named the Scimitar of Fortune, it is said to bestow the owner with luck.;Une lame du meilleur acier et une poignée incrustée d'or. Nommé le Cimeterre de Fortune, il est réputé conférer de la chance à son détenteur.;Eine Klinge aus bestem Stahl, in deren Heft Gold eingearbeitet wurde. Wie es heißt, soll der Träger dieses Säbels das Glück auf seiner Seite haben.;;Una hoja del acero más refinado y una empuñadura taraceada con oro. Se dice que esta Cimitarra de Fortuna trae suerte a su propietario.;;;;;;;;;x
scimitar_tier_3_golden;The Golden Scimitar;Le Cimeterre d'Or;Goldener Krummsäbel;;La Cimitarra Dorada;;;;;;;;;x
scimitar_tier_3_golden_desc;Named The Golden Scimitar, it is a weapon of exceptional quality forged by a master craftsman. The handle is adorned with ornaments made of gold and jewels.;Nommé le Cimeterre d'Or, c'est une arme d'une qualité exceptionnelle forgée par un maître-artisan. Les ornements du manche sont faits d'or et de joyaux.;Diese Waffe namens "Goldener Krummsäbel" wurde in außerordentlicher Qualität von einem Meister seines Faches geschmiedet. Heft und Knauf sind mit Ornamenten aus Gold und Edelsteinen verziert.;;Esta arma, llamada la Cimitarra Dorada, es de una calidad excepcional y está forjada por un maestro artesano. La empuñadura está adornada con oro y joyas.;;;;;;;;;x
seal_of_mohammad;Seal of Mohammad;Sceau de Mahomet;Siegel von Mohammed;;Sello de Mahoma;;;;;;;;;x
seal_of_mohammad_desc;This is the seal the Prophet used to sign and seal any letters sent by him, so that none would doubt the author's identity.;C'est le sceau que le Prophète a utilisé pour signer et sceller toutes ses lettres, de sorte que personne ne douterait de l'identité de l'auteur.;Das ist das Siegel des Propheten, mit dem er seine Briefe versiegelte, sodass unzweifelhaft feststand, von wem sie stammten.;;Este es el sello que el profeta usó para firmar y sellar cualquier carta enviada por él para que nadie dudase de la identidad del autor.;;;;;;;;;x
seal_of_solomon;Seal of Solomon;Sceau de Salomon;Siegel von Salomon;;Sello de Salomón;;;;;;;;;x
seal_of_solomon_desc;This engraved, brass and iron signet ring sports the Seal of Solomon: a hexagram or Star of David. According to legend, it allows its possessor to command demons!;Cette chevalière gravée, en laiton et en fer arbore le Sceau de Salomon: un hexagramme appelé « étoile de David ». Selon la légende, elle permet à son possesseur de commander des démons !;Dieser gravierte Siegelring aus Eisen und Bronze trägt das Siegel Salomons: ein Hexagramm, auch Davidstern genannt. Der Legende nach erhält der Besitzer Macht über Dämonen.;;Este sello grabado de bronce y de hierro lleva el sello de Salomón: un hexagrama o estrella de David. ¡Según la leyenda, permite que su poseedor domine a los demonios!;;;;;;;;;x
seamless_robe_of_jesus;Seamless Robe of Jesus;Tunique de Jésus;Heiliger Rock;;Santa túnica;;;;;;;;;x
seamless_robe_of_jesus_desc;The woven tunic that Jesus wore before his crucifixion. Rather than divide it into four parts, like Christ's other garments, the tunic was without seams, and so was kept whole by the soldiers who had crucified him.;La tunique tissée que Jésus portait avant sa crucifixion. Plutôt que de la diviser en quatre parties, comme les autres vêtements du Christ, la tunique était sans coutures, et a ainsi été gardée entière par les soldats qui l'avait crucifié.;Das Untergewand, das Jesus vor seiner Kreuzigung trug. Anders als der Rest seiner Kleidung, der in vier Teile geteilt wurde, blieb es in einem Stück erhalten, da es ohne Naht durchgewebt war und einem der Soldaten als Ganzes zugelost wurde.;;La túnica de tela que Jesús llevó antes de su crucifixión. En lugar de dividirla en cuatro partes al igual que las demás vestimentas de Cristo, la túnica carecía de costuras, así que los soldados que lo crucificaron la mantuvieron entera.;;;;;;;;;x
search_for_artifact;Search for Artifact;Recherche d'artefact;Nach Artefakt suchen;;Buscar el artefacto;;;;;;;;;x
search_for_artifact_allow_tt;§Y[Root.GetTitledFirstName]§! is a councilor of §Y[From.GetTitledFirstName]§!.\n;[Root.Get_Le_TitledFirstNameJ] est membre du Conseil [From.Get_du_TitledFirstNameJ].\n;§Y[Root.GetTitledFirstName]§! ist ein Ratsmitglied von §Y[From.GetTitledFirstName]§!.\n;;§Y[Root.GetTitledFirstName]§! forma parte del consejo de §Y[From.GetTitledFirstName]§!.\n;;;;;;;;;x
search_for_artifact_desc;Because §Y[From.GetTitledFirstName]§! has heard of the rumors of a lost artifact [From.GetSheHe] can order [From.GetHerHis] [Root.GetJobTitle], §Y[Root.GetTitledFirstName]§!, to arrange a search for it.;Puisque [From.Get_le_TitledFirstNameJ] a entendu parler d'un artefact perdu, [From.GetIlElle] peut ordonner à s[Root.Get_on_JobTitle], [Root.Get_le_TitledFirstNameJ], d'organiser une recherche à ce sujet.;§Y[From.GetTitledFirstName]§! hat Gerüchte über ein verlorenes Artefakt gehört und [From.GetSheHe] kann [From.GetHerHis]en [Root.GetJobTitle] §Y[Root.GetTitledFirstName]§! beauftragen, eine Suche zu organisieren.;;§Y[From.GetTitledFirstName]§! ha oído hablar de un artefacto perdido y puede ordenarle a §Y[Root.GetTitledFirstName]§!, su [Root.GetJobTitle], que organice la búsqueda.;;;;;;;;;x
search_for_artifact_effect_progress_tt;Some of the previously made progress is lost.\n;Une partie des progrès effectués est perdue.\n;Ein Teil des zuvor erzielten Fortschritts geht verloren.\n;;Se pierden parte de los progresos.\n;;;;;;;;;x
search_for_artifact_effect_replace_tt;The previous artifact hunter is replaced.\n;Le précédent chasseur d'artefact est remplacé.\n;Der vorherige Artefaktjäger wird ersetzt.\n;;Se sustituye al buscador de artefactos.\n;;;;;;;;;x
search_for_artifact_effect_tt;§Y[Root.GetTitledFirstName]§! arranges a search for the rumored artifact.\n;[Root.Get_Le_TitledFirstNameJ] organise une recherche de l'artefact supposé.\n;§Y[Root.GetTitledFirstName]§! organisiert eine Suche nach dem angeblichen Artefakt.\n;;§Y[Root.GetTitledFirstName]§! organiza la búsqueda del supuesto artefacto.\n;;;;;;;;;x
secret_religion_recruit_allow_tt;Is also a secret follower of the [From.TrueReligion.GetName] faith.;Est aussi secrètement fidèle à la foi [From.TrueReligion.GetName].;Ist ebenfalls ein heimlicher Anhänger des [From.TrueReligion.GetName]en Glaubens.;;También sigue en secreto el credo [From.TrueReligion.GetName].;;;;;;;;;x
secret_religions_blend_in;Blend In;Se fondre;Integrieren;;Mezclarse;;;;;;;;;x
secret_religions_blend_in_desc;§Y[Root.GetTitledFirstName]§! can make an effort to blend into the religious society of the realm in order to keep [Root.GetHerHis] society safely hidden.;[Root.Get_Le_TitledFirstNameJ] peut faire un effort pour se fondre dans la société religieuse du pays afin de garder sa société pleinement secrète.;§Y[Root.GetTitledFirstName]§! kann sich bemühen, sich in den religiösen Zirkel des Reichs zu integrieren, damit [Root.GetHerHis] Zirkel geheim bleibt.;;§Y[Root.GetTitledFirstName]§! puede tomar la iniciativa de mezclarse con la sociedad religiosa de su reino para mantener a su sociedad oculta y a salvo.;;;;;;;;;x
secret_religions_conduct_secret_ceremony;Prepare Secret Ceremony;Préparer une cérémonie secrète;Geheime Zeremonie vorbereiten;;Preparar ceremonia secreta;;;;;;;;;x
secret_religions_conduct_secret_ceremony_desc;As a secret worshiper of [Root.TrueReligion.GetHighGodName], you may prepare a small ceremony to honor your true religion.;En tant que fidèle secret [Root.Get_du_HighGodTrue], vous pourriez préparer une petite cérémonie pour honorer votre vraie religion.;Als ein geheimer Anhänger von [Root.TrueReligion.GetHighGodName] könnt Ihr eine kleine Zeremonie zu Ehren Eurer wahren Religion vorbereiten.;;Como adorador/a en secreto de [Root.TrueReligion.GetHighGodName], puedes preparar una pequeña ceremonia para honrar a tu auténtica religión.;;;;;;;;;x
secret_religions_evoke_sympathy;Evoke Sympathy for [From.GetTrueReligionGroupPersons];Susciter la sympathie pour les [From.GetTrueReligionGroupPersons];Sympathie für [From.GetTrueReligionGroupPersons] erwecken;;Despertar simpatía por los [From.GetTrueReligionGroupPersons].;;;;;;;;;x
secret_religions_evoke_sympathy_cd_tt;Has not been approached to be made sympathetic to people of other religions recently, or is the target of §Y[From.GetTitledFirstName]§!'s mission\n;N'a pas été approché récemment pour être rendu sympathique envers les personnes d'autres religions, ou est la cible de la mission [From.Get_du_TitledFirstNameJ]\n;Wurde in letzter Zeit noch nicht angesprochen, um Sympathie für die Anhänger anderer Religionen zu entwickeln, oder ist das Ziel der Mission von §Y[From.GetTitledFirstName]§!\n;;No se le han acercado para intentar que simpatice con gente de otras religiones últimamente, o es el objetivo de la misión de §Y[From.GetTitledFirstName]§!.\n;;;;;;;;;x
secret_religions_evoke_sympathy_desc;Approach §Y[Root.GetTitledFirstName]§! and attempt to make [Root.GetHerHim] sympathize with [From.GetTrueReligionGroupPersons].;Approcher [Root.Get_le_TitledFirstNameJ] et tenter de [Root.GetLeLa] faire sympathiser avec [From.GetTrueReligionGroupPersons].;Sprecht §Y[Root.GetTitledFirstName]§! an und versucht, [Root.GetFirstName] dazu zu bringen, Sympathie für [From.GetTrueReligionGroupPersons] zu entwickeln.;;Acércate a §Y[Root.GetTitledFirstName]§! e intenta que simpatice con los [From.GetTrueReligionGroupPersons].;;;;;;;;;x
secret_religions_evoke_sympathy_power_desc;Enables you to evoke the sympathy of characters in other religion groups than your true religion by right-clicking their portraits.;Vous permet de susciter la sympathie de personnages d'autres groupes religieux en cliquant avec le bouton droit de la souris sur leurs portraits.;Ermöglicht Euch, bei Charakteren, die anderen religiösen Gruppen als Eurer wahren Religion angehören, Sympathie zu wecken, indem Ihr auf ihre Porträts rechtsklickt.;;Te permite despertar la simpatía de personajes de otros grupos religiosos por tu verdadera religión haciendo clic con el botón secundario sobre sus retratos.;;;;;;;;;x
secret_religions_evoke_sympathy_tt;§Y[From.GetTitledFirstName]§! attempts to find a way to approach §Y[Root.GetTitledFirstName]§! and talk about [From.GetTrueReligionGroupPersons]. If successful, [Root.GetSheHe] may help to convert the realm.\n;[From.Get_Le_TitledFirstNameJ] tente d'approcher [Root.Get_le_TitledFirstNameJ] pour parler des [From.GetTrueReligionGroupPersons]. Si c'est une réussite, [Root.GetIlElle] pourrait aider à la conversion du pays.\n;§Y[From.GetTitledFirstName]§! versucht, einen Weg zu finden, um §Y[Root.GetTitledFirstName]§! anzusprechen und über [From.GetTrueReligionGroupPersons] zu reden. Falls dies gelingt, wird [Root.GetSheHe] vielleicht helfen, das Reich zu bekehren.\n;;§Y[From.GetTitledFirstName]§! intenta encontrar el modo de acercarse a §Y[Root.GetTitledFirstName]§! y hablarle sobre [From.GetTrueReligionGroupPersons]. Si tiene éxito, podría ayudar a convertir al reino.\n;;;;;;;;;x
secret_religions_falsely_confess_faith;Falsely Confess Faith;Proclamer faussement sa foi;Legt ein falsches Glaubensbekenntnis ab;;Confesar fe falsa;;;;;;;;;x
secret_religions_falsely_confess_faith_desc;Confess to your liege's faith for political reasons while still practicing your true faith in private. This will allow you to join or found your secret faith's Society.;Vous vous proclamez de la foi de votre seigneur lige pour des raisons politiques, tout en pratiquant votre vraie foi en privé. Ceci vous permettra de rejoindre ou fonder la société de votre foi secrète.;Bekennt Euch aus politischen Motiven zum Glauben Eures Lehnsherrn, während Ihr hinter verschlossenen Türen Euren wahren Glauben praktiziert. Dies wird es Euch ermöglichen, dem Zirkel Eures geheimen Glaubens beizutreten oder einen solchen Zirkel zu gründen.;;Confiesa tu fe a tu señor feudal por razones políticas mientras sigues practicando tu verdadera fe en privado. Esto te permitirá unirte a una sociedad de tu fe secreta o fundar una propia.;;;;;;;;;x
secret_religions_found_secret_religious_society;Found Religious Cult;Fonder une secte religieuse;Religiösen Kult gründen;;Fundar una secta religiosa;;;;;;;;;x
secret_religions_found_secret_religious_society_desc;Create a following enabling you to sow seeds of the true faith in the darkness until you have enough followers to emerge from the shadows.;Trouver des fidèles vous permettant de semer les graines de la vraie foi dans les Ténèbres jusqu'à ce que vous ayez assez de disciples pour sortir de l'ombre.;Schart Anhänger um Euch und sät im Verborgenen die Saat des wahren Glaubens, bis Ihr genug Gefolgsleute habt, um aus dem Schatten ins Licht treten zu können.;;Reúne seguidores que te permitan recoger los frutos de la fe verdadera en la clandestinidad hasta que adquieras suficientes para salir a la luz.;;;;;;;;;x
secret_religions_induct_character;Induct Into the [From.TrueReligion.GetName] Faith;Initier à la foi [From.TrueReligion.GetName];Zum [From.TrueReligion.GetName]en Glauben bekehren;;Iniciar en el credo [From.TrueReligion.GetName];;;;;;;;;x
secret_religions_induct_character_cd_tt;Has not been approached to be inducted into another faith recently\n;N'a pas été approché récemment pour être amené à une autre foi\n;Wurde in letzter Zeit noch nicht angesprochen, um zu einem anderen Glauben bekehrt zu werden\n;;No se le han acercado para iniciarlo/a en otra fe últimamente.\n;;;;;;;;;x
secret_religions_induct_character_desc;Attempt to make [Root.GetTitledFirstName] a secret believer of the [From.TrueReligion.GetName] Faith.;Tenter de faire [Root.Get_du_TitledFirstName] un[Root.Get_E] croyant[Root.Get_E] méconnu[Root.Get_E] de la foi [From.TrueReligion.GetName].;Versucht, [Root.GetTitledFirstName] zu einem heimlichen Anhänger des [From.TrueReligion.GetName]en Glaubens zu bekehren.;;Intenta que [Root.GetTitledFirstName] se inicie en secreto en el credo [From.TrueReligion.GetName].;;;;;;;;;x
secret_religions_induct_character_effect_tt;§Y[From.GetTitledFirstName]§! attempts to find a way to make §Y[Root.GetTitledFirstName]§! contemplate the [From.TrueReligion.GetName] Faith.\n;[From.Get_Le_TitledFirstNameJ] tente d'amener [Root.Get_le_TitledFirstNameJ] à considérer avec attention la foi [From.TrueReligion.GetName].\n;§Y[From.GetTitledFirstName]§! versucht, einen Weg zu finden, um §Y[Root.GetTitledFirstName]§! dazu zu bewegen, über den [From.TrueReligion.GetName]en Glauben nachzudenken.\n;;§Y[From.GetTitledFirstName]§! intenta encontrar el modo de hacer que §Y[Root.GetTitledFirstName]§! considere el credo [From.TrueReligion.GetName].\n;;;;;;;;;x
secret_religions_induct_character_power_desc;Enables you to secretly induct characters into your true religion by right-clicking their portraits.;Vous permet d'introduire en secret des personnages à votre vraie religion en cliquant avec le bouton droit de la souris sur leurs portraits.;Ermöglicht Euch, Charaktere heimlich zu Eurer wahren Religion zu bekehren, indem Ihr auf ihre Porträts rechtsklickt.;;Te permite iniciar en secreto a personajes en tu verdadera religión haciendo clic con el botón secundario sobre sus retratos.;;;;;;;;;x
secret_religions_induct_child;Induct Child Into the [From.TrueReligion.GetName] Faith;Initier l'enfant à la foi [From.TrueReligion.GetName];Kind zum [From.TrueReligion.GetName]en Glauben bekehren;;Iniciar a niño/a en el credo [From.TrueReligion.GetName];;;;;;;;;x
secret_religions_induct_child_allow_tt;Is not a secret believer in the [From.TrueReligion.GetName] faith\n;N'est pas fidèle secrètement à la foi [From.TrueReligion.GetName]\n;Ist kein heimlicher Anhänger des [From.TrueReligion.GetName]en Glaubens.\n;;No profesa en secreto el credo [From.TrueReligion.GetName].\n;;;;;;;;;x
secret_religions_induct_child_desc;As someone who has influence over the upbringing of §Y[Root.GetTitledFirstName]§!, §Y[From.GetTitledFirstName]§! can make an attempt to secretly induct [Root.GetHerHim] into the [From.TrueReligion.GetName] Faith.;Puisque [From.Get_le_TitledFirstNameJ] a une influence sur l'éducation [Root.Get_du_TitledFirstNameJ], §Y[From.GetIlElle]§! peut faire une tentative de l'introduire à la foi [From.TrueReligion.GetName].;Als eine Person, die Einfluss auf die Erziehung von §Y[Root.GetTitledFirstName]§! hat, kann §Y[From.GetTitledFirstName]§! einen Versuch unternehmen, das Kind heimlich zum [From.TrueReligion.GetName]en Glauben zu bekehren.;;Como alguien con influencia sobre la educación de §Y[Root.GetTitledFirstName]§!, §Y[From.GetTitledFirstName]§! puede intentar iniciarlo/a en secreto en el credo [From.TrueReligion.GetName].;;;;;;;;;x
secret_religions_induct_child_effect;§Y[From.GetTitledFirstName]§! will approach §Y[Root.GetTitledFirstName]§! and attempt to teach [Root.GetHerHim] about the [From.TrueReligion.GetName] faith.;[From.Get_Le_TitledFirstNameJ] approchera [Root.Get_le_TitledFirstNameJ] et tentera de lui transmettre la foi [From.TrueReligion.GetName].;§Y[From.GetTitledFirstName]§! spricht §Y[Root.GetTitledFirstName]§! an und versucht, [Root.GetFirstName] den [From.TrueReligion.GetName]en Glauben zu lehren.;;§Y[From.GetTitledFirstName]§! se acercará a §Y[Root.GetTitledFirstName]§! e intentará enseñarle sobre el credo[From.TrueReligion.GetName].;;;;;;;;;x
secret_religions_induct_child_power_desc;Enables you to induct children in your court to your true religion by right-clicking their portraits.;Vous permet d'introduire des enfants de votre cour à votre religion en cliquant avec le bouton droit de la souris sur leurs portraits.;Ermöglicht Euch, Kinder an Eurem Hof zur wahren Religion zu bekehren, indem Ihr auf ihre Porträts rechtsklickt.;;Te permite iniciar a niños de tu corte en tu verdadera religión haciendo clic con el botón secundario sobre sus retratos.;;;;;;;;;x
secret_religions_openly_adopt_faith;Openly Adopt Faith;Adopter ouvertement sa foi;Glauben öffentlich annehmen;;Adoptar fe abiertamente;;;;;;;;;x
secret_religions_openly_adopt_faith_desc;The followers of [Root.Society.GetNameCap] has for too long lurked in the shadows. The time has finally come to reveal our true beliefs now that we are so many that we can no longer be ignored.;Les adeptes [Root.Get_du_Society] se sont terrés pendant trop longtemps. Le temps est enfin venu de révéler nos vraies croyances maintenant que nous sommes tellement nombreux que nous ne pouvons plus être ignorés.;Die Anhänger von [Root.Society.GetNameCap] verheimlichen ihre Gesinnung schon viel zu lange. Nun ist es an der Zeit, unsere wahren Überzeugungen zu offenbaren, denn nun ist unsere Zahl so groß, dass man uns nicht mehr ignorieren kann.;;Los seguidores de [Root.Society.GetNameCap] llevan demasiado tiempo escondiéndose. Por fin ha llegado la hora de proclamar nuestras creencias, pues somos tantos que ya no pueden ignorarnos.;;;;;;;;;x
secret_religions_openly_adopt_faith_power_desc;Enables you to openly adopt your true faith. The other secretly religious characters and counties of your true faith in the realm will convert with you. This power is available in the Intrigue Screen.;Vous permet d'adopter ouvertement votre vraie foi. Les autres personnages et les comtés secrètement de votre vraie foi dans le pays se convertiront aussi. Ce pouvoir est disponible dans l'écran Intrigue.;Ermöglicht Euch, offen Euren wahren Glauben anzunehmen. Die anderen im Geheimen religiösen Charaktere und Grafschaften Eures wahren Glaubens im Reich werden sich Eurer Bekehrung anschließen. Diese Macht ist auf der Intrigenseite verfügbar.;;Te permite abrazar abiertamente tu verdadera fe. Los demás personajes y condados que comparten tu verdadera fe en secreto en el reino se convertirán también. Este poder está en el menú Intriga.;;;;;;;;;x
secret_religions_personally_adopt_secret_religion;Personally Adopt Faith;Adopter officiellement la foi;Glauben persönlich annehmen;;Adoptar fe personal;;;;;;;;;x
secret_religions_personally_adopt_secret_religion_desc;Give up the charade of your the false religion you've acted upon and openly declare your true faith.;Vous cessez de faire semblant de croire en cette fausse religion et vous déclarez ouvertement votre vraie foi.;Beendet das Versteckspiel um Eure vorgebliche religiöse Zugehörigkeit und erklärt offen, woran Ihr wirklich glaubt.;;Destapa la farsa de la religión que has estado siguiendo y declara tu verdadera fe abiertamente.;;;;;;;;;x
secret_religions_prepare_grounds;Prepare Ground;Préparer le terrain;Dem Glauben den Boden bereiten;;Preparar el terreno;;;;;;;;;x
secret_religions_prepare_grounds_desc;Order a loyal agent to secretly spread our teachings in a target province.;Ordonner à un agent fidèle de répandre secrètement nos enseignements dans une province cible.;Befehlt einem getreuen Agenten, die Lehren Eures Glaubens im Geheimen in einer bestimmten Provinz zu verbreiten.;;Ordena a un agente leal que corra la voz sobre nuestras enseñanzas en secreto en una provincia objetivo.;;;;;;;;;x
secret_religions_prepare_grounds_effect_tooltip;A loyal servant is sent to found a community of the true faith in [Root.GetName];Un serviteur loyal est envoyé pour établir une communauté de la vraie foi en [Root.GetName];Ein treuer Diener wird losgeschickt, um in [Root.GetName] eine Gemeinschaft des wahren Glaubens aufzubauen.;;Un criado leal es enviado a fundar una comunidad de la fe verdadera en [Root.GetName].;;;;;;;;;x
