#CODE;ENGLISH;FRENCH;GERMAN;;SPANISH;;;;;;;;;x
MAPMODE_DRAG;§GDrag this button to the custom slots below for easy access§!;§GGlisser ce bouton vers les modes de cartes ci-dessous pour y accéder plus facilement§!;§GZieht diese Schaltfläche für leichteren Zugriff unten in den benutzerdefinierten Platz §!;;§GArrastra este botón al hueco personalizado para un acceso fácil§!;;;;;;;;;x
MAPMODE_TRADE_REGIONS;§YTrade Regions§!;§YRégions marchandes§!;§YHandelsregionen§!;;§YRegiones Comerciales§!;;;;;;;;;x
MAPMODE_TRADE_REGIONS_DESC;Building Trade Posts in regions where you dont have Holdings is more expensive;Il est plus onéreux d'établir des comptoirs dans des régions où vous n'avez pas de propriétés;Der Bau von Handelsposten in Regionen, in denen Ihr keine Besitztümer habt, ist teurer;;Construir Puestos Comerciales en regiones en las que no tienes Pertenencias es más caro;;;;;;;;;x
MODIFIER_RETINUESIZE;Retinue Size;Taille de l'escorte ;Gefolgegröße;;Tamaño de Séquito;;;;;;;;;x
MODIFIER_TRADEVALUE;Trade Value;Valeur commerciale ;Handelswert;;Valor Comercial;;;;;;;;;x
NEW_DOGE_ELECTED_LOG;§Y$NEW_DOGE$§! has been elected the new $RULER_TITLE$ of the great Republic of §Y$TITLE$§!;§Y$NEW_DOGE$§! a été élu nouveau $RULER_TITLE$ de la puissante République de §Y$TITLE$§!;§Y$NEW_DOGE$§! wurde zum neuen $RULER_TITLE$ der großen Republik von §Y$TITLE$§! gewählt.;;§Y$NEW_DOGE$§! Ha sido elegido como el nuevo $RULER_TITLE$ de la gran república de §Y$TITLE$§!;;;;;;;;;x
NEW_DOGE_ELECTED_SETUP;Merchant Republic Election;Élection républicaine;Handelsrepublik-Wahl;;Elección de la República Mercante;;;;;;;;;x
no_ball_tooltip;You stay at home, fiddling your thumbs.;Vous restez chez vous à vous tourner les pouces.;Ihr bleibt zu Hause und dreht Däumchen.;;Te quedas en casa, contando las horas.;;;;;;;;;x
NO_BANKRUPT;You are not bankrupt;Vous n'êtes pas en faillite;Ihr seid nicht bankrott;;No estás en bancarrota;;;;;;;;;x
no_battle_tooltip;You tell your crew to give the other ship the right of way.;Vous dites à votre équipage d'accorder le droit de passage à l'autre navire.;Ihr befehlt Eurer Mannschaft, dem anderen Schiff Vorfahrt zu gewähren.;;Das órdenes a tu tripulación de ceder el paso al otro barco.;;;;;;;;;x
no_own_ball_tooltip;You decide to just forget about this whole thing.;Vous décidez de tirer un trait sur cette affaire.;Ihr entschließt Euch, die ganze Angelegenheit einfach zu vergessen.;;Decides simplemente ignorar toda esta historia.;;;;;;;;;x
PALACE_NAME;$DYNASTY$ Palace;Palais de $DYNASTY$;$DYNASTY$-Palast;;Palacio de $DYNASTY$;;;;;;;;;x
PATRICIAN_DYNASTY_FALLS_LOG;With the death of §Y$PATRICIAN$§!, the illustrious House §Y$DYNASTY$§! has become extinct.;Avec la mort du §Y$PATRICIAN$§!, l'illustre Maison §Y$DYNASTY$§! s'est éteinte.;Mit dem Tod von §Y$PATRICIAN$§! ist das illustre Haus §Y$DYNASTY$§! ausgestorben.;;Con la muerte de §Y$PATRICIAN$§!, la ilustre casa de §Y$DYNASTY$§! Se extingue.;;;;;;;;;x
PATRICIAN_DYNASTY_FALLS_SETUP;Patrician Family Falls;Une famille patricienne disparaît;Patrizierfamilie stürzt;;Caida de Familia Patricia;;;;;;;;;x
PATRICIAN_DYNASTY_RISES_LOG;A new great House has risen to the forefront of $TITLE_ADJ$ politics, under §Y$PATRICIAN$§!.;Une nouvelle Maison patricienne s'est hissée au premier plan politique, avec à sa tête le §Y$PATRICIAN$§!.;Ein neues, großes Haus hat sich unter §Y$PATRICIAN$§! an die Spitze der $TITLE_ADJ$en Politik erhoben.;;Una nueva gran Casa ha ascendido al frente de la política de $TITLE_ADJ$, bajo §Y$PATRICIAN$§!.;;;;;;;;;x
PATRICIAN_DYNASTY_RISES_SETUP;Patrician Family Rises;Une famille patricienne apparaît;Die Patrizierfamilie erhebt sich;;Ascenso de Familia Patricia;;;;;;;;;x
patrician_elective;Patrician Elective;Élection patricienne;Patrizierfolge;;Patricio Electo;;;;;;;;;x
permit_hansa_tooltip;You permit the formation of the Hanseatic League.;Vous permettez la création de la Ligue hanséatique.;Ihr bewilligt die Bildung der Hanse;;Autorizas la constitución de la Liga Hanseática.;;;;;;;;;x
permit_love_tooltip;Despite your previous anger, you decide to not to forbid this young couple from seeing each other.;Malgré votre accès de colère, vous décidez de ne pas empêcher ces jeunes gens de se fréquenter.;Trotz Eures vorherigen Ärgers entschließt Ihr Euch, diesem jungen Paar nicht zu verbieten, sich sehen zu dürfen.;;A pesar de tu enfado inicial, decides no prohibir los encuentros de esta joven pareja.;;;;;;;;;x
plot_seize_trade_post_decision;[Root.GetPlot];[Root.GetPlot];[Root.GetPlot];;[Root.GetPlot];;;;;;;;;x
plot_seize_trade_post_decision_desc;Put the plot into motion by attempting to seize the Trade Post.;Mettez votre plan à exécution et essayez de vous emparer du comptoir.;Setzt das Komplott in Bewegung, indem Ihr den Versuch unternehmt, den Handelsposten zu beschlagnahmen.;;Poner la conspiración en marca e intentar sitiar el Puesto Comercial.;;;;;;;;;x
refuse_plan_tooltip;You disapprove of your son's plan.;Vous désapprouvez le plan de votre fils.;Ihr lehnt den Plan Eures Sohnes ab.;;Desapruebas el plan de tu hijo.;;;;;;;;;x
region_baltic;Baltic Trade Region;Région marchande de la Baltique;Baltische Handelsregion;;Zona Comercial del Báltico;;;;;;;;;x
region_east_med;East Mediterranean Trade Region;Région marchande de la Méditerrannée orientale;Ost-mediterrane Handelsregion;;Zona Comercial del Mediterráneo Oriental;;;;;;;;;x
region_north_atlantic;North Atlantic Trade Region;Région marchande de l'Atlantique Nord;Nordatlantische Handelsregion;;Zona Comercial del Atlántico Norte;;;;;;;;;x
region_west_med;West Mediterranean Trade Region;Région marchande de la Méditerrannée occidentale;West-mediterrane Handelsregion;;Zona Comercial del Mediterráneo Occidental;;;;;;;;;x
REL_CAPTOR;Captor;Ravisseur;Entführer;;Captor;;;;;;;;;x
REPUBLICAN;Republican;(République);Republikanisch;;Republicano;;;;;;;;;x
rescue_rival_tooltip;You decide not to abandon your former rival to the mercy of these pirates.;Vous n'avez pas l'intention d'abandonner votre ancien rival aux mains des pirates. ;Ihr entschließt Euch dazu, Euren früheren Rivalen nicht der Gnade dieser Piraten auszuliefern.;;Decides no abandonar a tu antiguo rival a merced de estos piratas.;;;;;;;;;x
RESPECT;Respect;Respect;Respekt;;Respeto;;;;;;;;;x
RESPECT_DESC;Respect is a value based on the Age and Prestige of a Patrician, determining how likely he is to be elected Doge. It can be increased by investing money in the Campaign Fund, but women and children can never be elected.;Le respect est une valeur basée sur l'âge et le prestige d'un patricien, et détermine ses chances d'être élu doge. Le respect peut être accru en investissant de l'argent dans le fonds de campagne. Mais les femmes et les enfants ne pourront jamais être élus.;Respekt ist ein Wert, der auf dem Alter und Prestige eines Patriziers basiert und bestimmt, wie wahrscheinlich es ist, dass er zum Dogen ernannt wird. Es kann erhöht werden, indem Geld in den Wahlkampffonds investiert wird, doch Frauen und Kinder können niemals gewählt werden.;;El respeto es un valor basado en la Edad y Prestigio de un Patricio, determinando qué posibilidades tiene de ser elegido Dux. Se puede incrementar gastando dinero en Fondos de Campaña, pero mujeres y niños no pueden ser elegidos.;;;;;;;;;x
SEIZE_TRADE_POST_EFFECT;§Y$TAKER$§! seizes the Trade Post in §Y$PROV$§!;§Y$TAKER$§! s'empare du comptoir en §Y$PROV$§!;§Y$TAKER$§! beschlagnahmt den §Y$PROV$§!-Handelsposten;;§Y$TAKER$§! se apodera del Puesto Comercial de §Y$PROV$§!;;;;;;;;;x
SET_FATHER_OF_UNBORN_KNOWN;The Father of the Unborn Baby is Revealed\n;Le nom du père de l'enfant à naître est révélé\n;Der Vater des ungeborenen Kindes wurde entlarvt\n;;Se Revela el Padre del Nonato\n;;;;;;;;;x
SET_FATHER_OF_UNBORN_NOT_KNOWN;The Father of the Unborn Baby is Unknown\n;Le nom du père l'enfant à naître est inconnu\n;Der Vater des ungeborenen Kindes ist unbekannt\n;;Se Desconoce el Padre del Nonato\n;;;;;;;;;x
SHORTCUT_DESC;Shortcut: §G$SHORTCUT$§!;Raccourci : §G$SHORTCUT$§!;Verknüpfung: §G$SHORTCUT$§!;;Atajo: §G$SHORTCUT$§!;;;;;;;;;x
SHOW_MAPMODES_TOGGLE;Toggle the map modes interface;Modifier les modes de cartes;Kartenmodi einblenden/ausblenden;;Cambia el interfaz de modo de mapas;;;;;;;;;x
succ_patrician_elective;Patrician Elective;Élection patricienne;Patrizierfolge;;Patricio Electo;;;;;;;;;x
succ_patrician_elective_desc;This is the succession type in the great naval Merchant Republics. The next Doge is determined from among the heads of the five grand Patrician families depending on Age, Prestige, and invested Campaign Funds.;C'est le type de succession en vigueur dans les grandes républiques thalassocratique marchandes. Le prochain doge est choisi pami les chefs des cinq grandes familles de la ville selon des critères d'âge, de prestige et des fonds investis dans le fonds de campagne.;Dies ist der Erbfolge-Typ in der großen Marinehandels-Republik. Der nächste Doge wird unter den fünf großen Patrizierfamilien bestimmt, abhängig von Alter, Prestige und den investierten Wahlkampffonds.;;Es el tipo de sucesión de las grandes Repúblicas Mercantes navales. El próximo Dux se elige de entre los jefes de las cinco grandes familias patricias en función de su Edad, Prestigio, y Fondos de Campaña.;;;;;;;;;x
THE_REPUBLIC;The Republic;La République;Die Republik;;La República;;;;;;;;;x
TheRepublicDLC;The Republic;La République (The Republic);The Republic;;La República;;;;;;;;;x
TOTAL_COST;Total Cost: §Y$COST$§!;Coût total : §Y$COST$§!;Gesamtkosten: §Y$COST$§!;;Coste Total: §Y$COST$§!;;;;;;;;;x
TOTAL_TRADE_FAMILY;Family Total:;Total Famille : ;Familie Gesamt;;Total Familiar:;;;;;;;;;x
TRADE;Trade;Commerce;Handel;;Comerciar;;;;;;;;;x
TRADE_CONNECTED_BONUS;Connected to Capital;Relié à la capitale;Mit der Hauptstadt verbunden;;Conectada a la Capital;;;;;;;;;x
TRADE_COST_DIST;Distance to Republic held Province ( §Y$PROVINCE$§! ): §Y$COST$§!;Éloignement de §Y$PROVINCE$§!, la capitale de la République : §Y$COST$§!;Distanz zur von der Republik gehaltenen Provinz ( §Y$PROVINCE$§! ): §Y$COST$§!;;Distancia a la Provincia propiedad de la República ( §Y$PROVINCE$§! ): §Y$COST$§!;;;;;;;;;x
TRADE_COST_DIST_TOTAL;Distance Penalty: §Y+$PENALTY$%§! ( §Y$MULT$%§! of total Distance );Pénalité pour la distance : §Y$PENALTY$%§! ( §Y$MULT$%§! de la distance totale);Distanz-Strafe: §Y+$PENALTY$%§! ( §Y$MULT$%§! der Gesamtentfernung );;Penalización de Distancia: §Y+$PENALTY$%§! ( §Y$MULT$%§! de Distancia total );;;;;;;;;x
TRADE_COST_MULT;Distance to Cost-increate Multiplier: §Y$MULT$%§!;Modif. de coût selon distance : §Y$MULT$%§!;Distanz zu Kosten-Zuwachs-Multiplizierer: §Y$MULT$%§!;;Distancia a Coste-Multiplicador: §Y$MULT$%§!;;;;;;;;;x
TRADE_COST_REGION_PEN;Different Trade Region: §Y+$PENALTY$§!;Région marchande différente : §Y+$PENALTY$§!;Unterschiedliche Handelsregion: §Y+$PENALTY$§!;;Distinta Región Comercial: §Y+$PENALTY$§!;;;;;;;;;x
TRADE_INCOME;Trade Income;Revenus commerciaux;Handelseinkommen;;Ingreso Comercial;;;;;;;;;x
TRADE_ZONE;Trade Zone:;Zone marchande : ;Handelszone:;;Zona Comercial:;;;;;;;;;x
TRADE_ZONE_BONUS;Trade Zone Bonus;Bonus de la zone marchande;Handelszonen-Bonus;;Bonificación de Zona Comercial;;;;;;;;;x
TRADEFAMILY_INCOME;Total Family Income;Revenu total de la famille;Gesamtes Familieneinkommen;;Ingreso Familiar Total;;;;;;;;;x
TRADEFAMILY_INCOME_DESC;Total Income from all Trade Posts owned by the §Y$FAMILY$§! Family: §Y$INCOME$§!¤;Revenu total de tous les comptoirs appartenant à la famille §Y$FAMILY$§! : §Y$INCOME$§!¤;Gesamteinkommen aller Handelsposten, die im Besitz der §Y$FAMILY$§!-Familie sind: §Y$INCOME$§!¤;;Ingreso total de todos los Puestos Comerciales propiedad de la Familia §Y$FAMILY$§! : §Y$INCOME$§!¤;;;;;;;;;x
TRADEFAMILY_SIZE;Total Family Size;Nombre de comptoirs de la famille;Gesamte Familiengröße;;Tamaño Total de la Familia;;;;;;;;;x
TRADEFAMILY_SIZE_DESC;The number of Trade Posts owned by the §Y$FAMILY$§! Family;Le nombre de comptoirs que possède la famille §Y$FAMILY$§!;Die Anzahl der Handelsposten, die im Besitz der §Y$FAMILY$§!-Familie sind;;Número de Puestos Comerciales propiedad de la Familia §Y$FAMILY$§! ;;;;;;;;;x
TRADEPOST_FINISHED_LOG;A Trade Post has been built by the §Y$FAMILY$§! Family of §Y$REPUBLIC$§! in §Y$PROVINCE$§!.;Un comptoir a été fondé en §Y$PROVINCE$§! par la famille §Y$FAMILY$§! de §Y$REPUBLIC$§!.;Ein Handelsposten wurde von der §Y$FAMILY$§!-Familie von §Y$REPUBLIC$§! in §Y$PROVINCE$§! gebaut.;;Se ha construido un puesto comercial por la Familia §Y$FAMILY$§! de §Y$REPUBLIC$§! en §Y$PROVINCE$§!.;;;;;;;;;x
TRADEPOST_FINISHED_SETUP;Trade Post Construction Finished;Comptoir achevé;Bau des Handelspostens beendet;;Finalizada Construcción de Puesto Comercial;;;;;;;;;x
TRADEPOST_OWNER;Trade Post is owned by the §Y$FAMILY$§! Family;Le comptoir appartient à la famille §Y$FAMILY$§!;Der Handelsposten ist im Besitz der §Y$FAMILY$§!-Familie;;Puesto comercial propiedad de la Familia §Y$FAMILY$§!;;;;;;;;;x
TRADEPOST_PROV;Trade Post of $PROV$;Comptoir de $PROV$;Handelsposten von $PROV$;;Puesto comercial de $PROV$;;;;;;;;;x
TRADEPOST_PROV_LONG;Trade Post of $PROV$ - §Y$REPUBLIC$§! ( §Y$FAMILY$§! );Comptoir de $PROV$ - §Y$REPUBLIC$§! ( §Y$FAMILY$§! );Handelsposten von $PROV$ - §Y$REPUBLIC$§! ( §Y$FAMILY$§! );;Puesto Comercial de $PROV$ - §Y$REPUBLIC$§! (¡§Y$FAMILY$§! );;;;;;;;;x
TRADEREGION_DESC;This county belongs to §YThe $REGION$§!;Ce comté appartient à §Y$REGION$§!;Diese Provinz gehört §Y$REGION$§!;;Esta provincia pertenece a §YLa $REGION$§!;;;;;;;;;x
TRADEZONE_INCOME;Trade Zone Income;Revenus des impôts de la zone;Handelszonen-Einkommen ;;Ingresos de Zona Comercial;;;;;;;;;x
TRADEZONE_INCOME_DESC;Total Income from all Trade Posts in this Trade Zone: §Y$INCOME$§!¤;Revenu total de tous les comptoirs de cette zone marchande : §Y$INCOME$§!¤;Gesamteinkommen aller Handelsposten in dieser Handelszone: §Y$INCOME$§!¤;;Ingreso total de todos los Puestos Comerciales en esta Zona Comercial: §Y$INCOME$§!¤;;;;;;;;;x
TRADEZONE_SIZE;Trade Zone Size;Taille de la zone marchande;Größe der Handelszone;;Tamaño de Zona Comercial;;;;;;;;;x
TRADEZONE_SIZE_DESC;The number of Trade Posts in the Trade Zone this Trade Post is part of.;Le nombre de comptoirs de la zone marchande à laquelle ce comptoir appartient;Die Anzahl der Handelsposten in der Handelszone, von der dieser Handelsposten ein Teil ist;;El número de Puestos Comerciales de la Zona Comercial de la que forma parte este Puesto Comercial;;;;;;;;;x
TRADEZONE_VALUE;Trade Zone Value;Valeur de la zone marchande;Handelszonen-Wert;;Valor de Zona Comercial;;;;;;;;;x
TRADEZONE_VALUE_DESC;The value of all Holdings in this trade zone\nIncreases the value of Trade Posts and Cities in this Trade Zone:\nTrade Posts: §Y$TPBONUS$§!\nCities: §Y$CTBONUS$§!;La valeur de toutes les propriétés de cette zone marchande\naugmente la valeur de tous les comptoirs et des cités de cette zone marchande\nComptoirs : §Y$TPBONUS$§!\nCités : §Y$CTBONUS$§!;Der Wert aller Besitztümer in dieser Handelszone\nErhöht den Wert der Handelsposten und Städte in dieser Handelszone:\nHandelsposten: §Y$TPBONUS$§!\nStädte: §Y$CTBONUS$§!;;El valor de todas las Pertenencias en esta zona comercial.\nIncrementa el valor de los Puestos Comerciales y Ciudades en esta Zona Comercial:\nPuestos Comerciales: §Y$TPBONUS$§!\nCiudades: §Y$CTBONUS$§!;;;;;;;;;x
TRIGGER_CAPITAL_HOLDING;Capital Holding;La propriété doit être une capitale;Hauptbesitztum;;Propiedad de Capital;;;;;;;;;x
TRIGGER_PLOT_TARGET_PROVINCE;Plot Target Province;Province ciblée par le complot;Anschlag auf Zielprovinz verüben;;Provincia Objetivo del Complot;;;;;;;;;x
TRIGGER_SEA_ZONE;Trade Post Owner;Propriétaire du comptoir;Besitzer des Handelspostens;;Propietario del Puesto de Comercial;;;;;;;;;x
TRIGGER_TRADE_POST_OWNER;Trade Post Owner;Propriétaire du comptoir;Besitzer des Handelspostens;;Propietario del Puesto Comercial;;;;;;;;;x
VASSAL_RELEASED_LETTER;Esteemed $VASSAL$, for political reasons I have decided to release you from your vassalage and grant you full independence. Good luck!\n\n$LIEGE$;Honorable $VASSAL$, j'ai décidé, pour des raisons politiques, de vous libérer de votre serment de vassalité et de vous accorder l'indépendance. Bonne chance !\n\n$LIEGE$;Werter $VASSAL$, aus politischen Gründen habe ich mich dazu entschlossen, Euch aus Eurem Vasallentum zu entlassen und Euch vollständige Unabhängigkeit zu gewähren. Viel Glück!\n\n$LIEGE$;;Estimado $VASSAL$: Debido a razones políticas, he decidido liberaros de vuestro vasallaje y concederos la plena independencia. ¡Buena suerte!\n\n$LIEGE$;;;;;;;;;x
VASSAL_RELEASED_LOG;§Y$LIEGE$§! has granted independence to §Y$VASSAL$§!;§Y$LIEGE$§! a accordé l'indépendance à §Y$VASSAL$§!;§Y$LIEGE$§! hat §Y$VASSAL$§! Unabhängigkeit gewährt.;;¡El §Y$LIEGE$§! ha concedido la independencia a §Y$VASSAL$§!;;;;;;;;;x
VASSAL_RELEASED_SETUP;Vassalage Ended;Vassalité abrogée;Vasallentum beendet;;El vasallaje ha finalizado;;;;;;;;;x
WAS_CONCEIVED_A_BASTARD;Was conceived a Bastard;Est un bâtard;Wurde als Bastard gezeugt;;Fue concebido como Bastardo;;;;;;;;;x
WAS_NOT_CONCEIVED_A_BASTARD;Was NOT conceived a Bastard;N'est pas un bâtard;Wurde NICHT als Bastard gezeugt;;NO fue concebido como Bastardo;;;;;;;;;x