#CODE;ENGLISH;FRENCH;GERMAN;;SPANISH;;;;;;;;;x
AGE_FACTOR;Age Factor;Critère d'âge;Alters-Faktor;;Factor de Edad;;;;;;;;;x
AN_UNKNOWN_FATHER;an unknown father;un père inconnu;eines unbekannten Vaters;;padre desconocido;;;;;;;;;x
approve_plan_tooltip;You approve of your son's plan.;Vous approuvez le plan de votre fils.;Ihr stimmt dem Plan Eures Sohnes zu.;;Apruebas el plan de tu hijo.;;;;;;;;;x
battle_tooltip;This time he has gone too far. You will sink his precious ship.;Cette fois il est allé trop loin. Vous allez couler son précieux navire.;Diesmal ist er zu weit gegangen. Ihr werdet sein kostbares Schiff versenken.;;Esta vez ha ido demasiado lejos. Hundirás su precioso barco.;;;;;;;;;x
CAMPAIGN_FUND;Campaign Fund;Fonds de campagne;Wahlkampffonds;;Fondos de Campaña;;;;;;;;;x
CAMPAIGN_FUND_DESC;Money in the Campaign Fund will increase your Respect in the senate and make your candidate more likely to be elected the next $RULER_TITLE$. You can freely adjust the amount until the current $RULER_TITLE$ dies, when the Fund will be used up in the election campaign.;L'argent que vous placez dans le fonds de campagne augmentera votre côte de respect auprès du Sénat ainsi que les chances de votre candidat d'être élu comme $RULER_TITLE$. Vous pouvez librement ajuster le montant investi, jusqu'au décès du $RULER_TITLE$ actuel. Ensuite, ce fond sera utilisé pour la campagne électorale.;Geld des Wahlkampffonds wird Euren Respekt im Senat erhöhen und die Wahrscheinlichkeit erhöhen, dass Euer Kandidat zum nächsten $RULER_TITLE$ gewählt wird. Ihr könnt den Betrag frei anpassen, bis der gegenwärtige $RULER_TITLE$ stirbt, dann wird Euer Fond für den Wahlkampf verbraucht.;;El Dinero en los Fondos de Campaña incrementará tu Respeto en el senado y hará que tu candidato tenga más posibilidades de ser elegido el próximo $RULER_TITLE$. Puedes ajustar libremente la cantidad hasta que el actual $RULER_TITLE$ muera, entonces los Fondos se utilizarán en la campaña de elección.;;;;;;;;;x
CANT_BUILD_TRADEPOST_COASTAL;Is Coastal;La province est côtière;An der Küste gelegen;;Es Costero;;;;;;;;;x
CANT_BUILD_TRADEPOST_EMBARGO;Is not Embargoed by $WHO$;Ne subit pas l'embargo de $WHO$;Nicht von $WHO$ unter Embargo;;No está embargado por $WHO$;;;;;;;;;x
continue_feud_tooltip;You blame the rival family for the death of your child.;Vous reprochez la mort de votre fils à la famille rivale.;Ihr macht die rivalisierende Familie für den Tod Eures Kindes verantwortlich.;;Culpas a la familia rival de la muerte de tu hijo.;;;;;;;;;x
CURRENT_INCOME;Current base income: §Y$INCOME$§!;Revenus des impôts de base : §Y$INCOME$§!;Gegenwärtiges Grundeinkommen: §Y$INCOME$§!;;Ingreso base actual: §Y$INCOME$§!;;;;;;;;;x
CUSTOM_MAPMODE_DESC;§YCustom map mode slot§!\nDrag map modes here for easy access;§YParamètres des cartes§!\nGlisser les modes de cartes ici pour un accès plus facile;§YBenutzerdefinierter Kartenmodus-Platz§!\nZieht den Kartenmodus für leichteren Zugriff hierhin;;§YHueco de modo de mapa personalizado§!\nArrastra modos de mapa aquí para acceso fácil;;;;;;;;;x
deny_hansa_tooltip;You refuse the formation of the Hanseatic League.;Vous refusez la création de la Ligue hanséatique.;Ihr lehnt die Bildung der Hanse ab.;;Deniegas la constitución de la Liga Hanseática.;;;;;;;;;x
EMBARGO_EFFECT;Embargo §Y$WHO$§! and gain §G$GOLD$§!¤ from razing §Y$NUM$§! Trade posts\n;Embargo contre §Y$WHO$§! et gain de §G$GOLD$§!¤ grâce au saccage de §Y$NUM$§! comptoirs\n;Errichtet ein Embargo gegen §Y$WHO$§! und gewinnt §G$GOLD$§!¤, indem Ihr §Y$NUM$§! Handelsposten niederreißt\n;;Embargar a §Y$WHO$§! Y ganar §G$GOLD$§!¤ por arrasar §Y$NUM$§! Puestos Comerciales\n;;;;;;;;;x
end_feud_tooltip;You decide that enough lives have been lost - this feud between your families must come to an end.;Vous décidez qu'assez de vies ont été perdues, cette vendetta entre vos familles a assez duré.;Ihr habt beschlossen, dass genug Leben verloren gegangen sind - diese Fehde zwischen Euren Familien muss zu einem Ende kommen.;;Decides que ya se han perdido bastantes vidas, esta pelea entre familias debe llegar a su fin.;;;;;;;;;x
EXPECTED_SUCCESSOR;Expected Successor;Successeur potentiel ;Erwarteter Nachfolger;;Sucesor Esperado;;;;;;;;;x
EXPECTED_SUCCESSOR_DESC;§Y$HEIR$§! is widely expected to succeed §Y$RULER$§!. However, there is always a degree of uncertainty in the elections - to make sure of success, you might want to invest more money than the strict minimum in your campaign fund.;§Y$HEIR$§! est probablement celui qui succèdera au §Y$RULER$§!. Toutefois, il y a toujours une part d'incertitude dans les élections. Pour mettre toutes les chances de votre côté, vous devriez peut-être investir davantage que le strict minimum dans votre fonds de campagne.;Es wird weitgehend erwartet, dass §Y$HEIR$§! §Y$RULER$§! beerben wird. Allerdings gibt es immer einen Grad von Unsicherheit in den Wahlkämpfen - um den Erfolg sicherzustellen, solltet Ihr eventuell mehr Geld als das Minimum in Euren Wahlkampffonds investieren.;;Se espera que §Y$HEIR$§! suceda a §Y$RULER$§!. Aún así, siempre hay un cierto grado de incertidumbre en las elecciones - para asegurarte el éxito, puede que quieras invertir más dinero que el mínimo indispensable en tus fondos de campaña.;;;;;;;;;x
EXPENSE_FAMILY_DUES;Family Dues;Rentes familiales;Familiäre Abgaben;;Deudas de Familia;;;;;;;;;x
FAM_REAL_FATHER;Real Father;Père biologique;Tatsächlicher Vater;;Padre Verdadero;;;;;;;;;x
family_palace_baron_deed;Chair of;Siège de;Sitz von;;Consejo de;;;;;;;;;x
family_palace_baron_foa;Sir;Messire;Sir;;Señor;;;;;;;;;x
FATHER_OF_UNBORN_KNOWN;The Father of the Unborn Baby is NOT Known;Le père de l'enfant à naître n'est pas connu;Der Vater des ungeborenen Kindes ist NICHT bekannt;;El padre del nonato NO es conocido;;;;;;;;;x
FATHER_OF_UNBORN_NOT_KNOWN;The Father of the Unborn Baby is Known;Le père de l'enfant à naître est connu;Der Vater des ungeborenen Kindes ist bekannt;;El padre del nonato es conocido;;;;;;;;;x
FC_FIND_CHARACTERS;Find Characters;Trouver des personnages;Charakter suchen;;Encontrar personajes ;;;;;;;;;x
feud_begins_tooltip;This will be the start of a great vendetta between your two families...;Ce sera le début d'une sanglante vendetta entre vos deux familles...;Dies ist der Beginn einer großen Fehde zwischen unseren zwei Familien ...;;Esto será el comienzo de una gran vendetta entre vuestras dos familias...;;;;;;;;;x
feud_continues_tooltip;You cannot forgive the crimes committed against your family.;Vous ne pouvez pas pardonner les crimes qui ont été commis à l'encontre de votre famille.;Ihr könnt ihm die Verbrechen nicht verzeihen, die er gegen Eure Familie begangen hat.;;No puedes perdonar los crímenes cometidos contra tu familia.;;;;;;;;;x
feud_over_tooltip;You shake his hand, ending the feud.;Vous lui serrez la main, mettant ainsi un terme à votre vendetta.;Ihr schüttelt seine Hand und beendet die Fehde.;;Estrechas su mano y pones fin al enfrentamiento.;;;;;;;;;x
flagship_plan_approved_tooltip;You approve the plan.;Vous approuvez le plan.;Ihr stimmt dem Plan zu.;;Apruebas el plan.;;;;;;;;;x
flagship_plan_refused_tooltip;You reject the plan as being too risky.;Vous rejetez le plan car il est trop risqué.;Ihr lehnt den Plan als zu riskant ab.;;Rechazas el plan por considerarlo demasiado arriesgado.;;;;;;;;;x
flee_ship_tooltip;You leap over the railing and swim to the safety of the shore.;Vous sautez par-dessus la rambade et nagez jusqu'à la terre ferme. ;Ihr springt über die Reling und schwimmt zur sicheren Küste.;;Saltas por la borda y nadas en busca de la seguridad de la orilla.;;;;;;;;;x
flotsam_tooltip;As the only survivors of the battle, the two of you drift aimlessly on the sea...;Seuls survivants de la bataille, vous dévirez tout deux sur la mer, sans but...;Als einzige Überlebende des Kampfes, treibt ihr zwei ziellos im Meer ...;;Únicos supervivientes de la batalla, ambos vais a la deriva en mar abierto, sin rumbo...;;;;;;;;;x
fobid_daughter_tooltip;You make it clear to your daughter that continuing this relationship is out of the question.;Vous mettez les choses au clair avec votre fille, il est hors de question qu'elle continue cette relation.;Ihr macht Eurer Tochter deutlich, dass es außer Frage steht, diese Beziehung weiterzuführen.;;Le dejas claro a tu hija que no piensas tolerar esta relación.;;;;;;;;;x
forbid_son_tooltip;You make it clear to your son that continuing this relationship is out of the question.;Vous mettez les choses au clair avec votre fils, il est hors de question qu'il continue cette relation.;Ihr macht Eurem Sohn deutlich, dass es außer Frage steht, diese Beziehung weiterzuführen.;;Le dejas claro a tu hijo que no piensas tolerar esta relación.;;;;;;;;;x
FROM_HOLDINGS;From Holdings: §G$AMOUNT$§!\n;Des propriétés : §G$AMOUNT$§!\n;Von Besitztümern: §G$AMOUNT$§!\n;;De Pertenencias: §G$AMOUNT$§!\n;;;;;;;;;x
FROM_MANPOWER;From Manpower: §G$AMOUNT$§!\n;Des effectifs : §G$AMOUNT$§!\n;An Arbeitskräften: §G$AMOUNT$§!\n;;De Mano de Obra: §G$AMOUNT$§!\n;;;;;;;;;x
FROM_TRADEPOSTS;From Trade Posts: §G$AMOUNT$§!\n;Des comptoirs : §G$AMOUNT$§!\n;An Handelsposten: §G$AMOUNT$§!\n;;De Puestos Comerciales: §G$AMOUNT$§!\n;;;;;;;;;x
GREAT_DUKE;Great Duke;Grand duc;Großherzog;;Gran Duque;;;;;;;;;x
HAD_DYNASTY_FLAG_AT_LEAST;Had dynasty flag '§Y$FLAG$§!' for at least §Y$DAYS$§! days;A eu le sceau de la famille '§Y$FLAG$§!' pendant au moins §Y$DAYS$§! jours;Besaß die dynastische Kennzeichnung "§Y$FLAG$§!" für mindestens §Y$DAYS$§! Tage;;Ha tenido la bandera '§Y$FLAG$§!' durante al menos §Y$DAYS$§! días;;;;;;;;;x
HAD_DYNASTY_FLAG_LESS_THAN;Had dynasty flag '§Y$FLAG$§!' for less than §Y$DAYS$§! days;A eu le sceau de la famille '§Y$FLAG$§!' pendant moins de §Y$DAYS$§! jours;Besaß die dynastische Kennzeichnung "§Y$FLAG$§!" für weniger als §Y$DAYS$§! Tage;;Ha tenido la bandera '§Y$FLAG$§!' durante menos de §Y$DAYS$§! días;;;;;;;;;x
HAVE_DYNASTY_FLAG;Has dynasty flag;A le sceau de la famille;Besitzt eine dynastische Kennzeichnung;;Tiene bandera dinástica;;;;;;;;;x
HAVE_NOT_DYNASTY_FLAG;Does not have dynasty flag;N'a pas le sceau de la famille;Besitzt keine dynastische Kennzeichnung;;No tiene bandera dinástica;;;;;;;;;x
HINT_CHAR_VIEW_TEXT_1;Clicking any portrait will take you to the Character View. This screen contains detailed information about a character - skills, traits, titles and close relations. You can also select an Ambition for your own character.;Cliquer sur un portrait ouvre la fenêtre du personnage qui indique ses compétences, ses traits, ses titres et ses relations. Pour votre propre personnage, vous pouvez aussi choisir une ambition.;Der Klick auf ein Porträts öffnet die Charakteransicht, die Informationen den Charakter enthält - Fertigkeiten, Eigenschaften, Titel, Beziehungen, Ambitionen und Fokus (letztere wählbar).;;Pinchar en un retrato lleva a la vista Personaje, donde se te informará de sus habilidades, rasgos, títulos y relaciones. También podrás elegir una ambición para tu personaje.;;;;;;;;;x
HINT_FACTIONS_VIEW_TEXT_1;Here you can see an overview of the Factions active within your realm. Vassals will create Factions against their Liege with a specific goal in mind, such as lowering crown authority or placing a pretender on the throne. Other Vassals may then join the Faction if they agree with its stated goal.;Vous pouvez avoir ici une vue d'ensemble des factions actives au sein de votre pays. Les vassaux vont créer des factions contre leur seigneur lige avec un but précis en tête, tel que diminuer l'autorité exercée par la Couronne ou placer un prétendant sur le trône. D'autres vassaux pourront aussi se joindre à la faction s'ils approuvent le but affiché.;Hier könnt Ihr eine Übersicht der in Eurem Reich aktiven Fraktionen sehen. Vasallen werden Fraktionen gegen ihren Lehnsherrn begründen und ein bestimmtes Ziel im Kopf haben, wie zum Beispiel die Reduzierung der Autorität der Krone oder die Einsetzung eines Heuchlers auf dem Thron. Andere Vasallen können der Fraktion beitreten, wenn sie den genannten Zielen zustimmen.;;Aquí puedes consultar una visión general de las facciones activas en tus dominios. Los vasallos crean facciones contra su Señor con un objetivo específico en mente, como reducir la autoridad o instaurar un pretendiente en el trono. Otros vasallos pueden unirse a la facción si están de acuerdo con el objetivo declarado.;;;;;;;;;x
HINT_FACTIONS_VIEW_TEXT_2;Once a Faction becomes powerful enough, its members will present their Liege with an ultimatum. If this is refused, it could spark a Civil War.;Lorsqu'une faction devient suffisamment puissante, ses membres lancent au seigneur lige un ultimatum. Le rejet de cet ultimatum peut déclencher une guerre civile.;Sobald eine Fraktion mächtig genug wird, werden ihre Mitglieder ihrem Lehnsherren ein Ultimatum stellen. Sollte dies abgelehnt werden, könnte es zu einem Bürgerkrieg kommen.;;Tan pronto como una facción sea lo suficientemente potente, sus miembros presentarán un ultimátum a su Señor. Si se les deniega, podría estallar una guerra civil.;;;;;;;;;x
HINT_FACTIONS_VIEW_TEXT_3;There are a number of ways to make Vassals leave their Faction: you can dispatch your Spymaster to Scheme in their territory, you can increase their opinion of you with bribes, or you can simply hope for the best and have them assassinated. Note that if there are several Members in a faction, one of them will always take the Faction Leader's place if he or she leaves the Faction for any reason.;Il existe plusieurs méthodes pour faire en sorte que des vassaux abandonnent leur Faction : vous pouvez envoyer votre maître-espion sonder leur territoire, vous pouvez les rendre favorable à votre égard en les soudoyant, ou vous pouvez simplement les faire assassiner et vous en remettre au destin. À noter que s'il y a plusieurs membres dans une faction, l'un d'eux remplacera la place du chef dans le cas où ce dernier quitte la faction pour une raison ou une autre. ;Es gibt eine Reihe von Möglichkeiten, einen Vasallen dazu zu bringen, seine Fraktion zu verlassen: Ihr könnt Euren Chef-Spion entsenden, um Ränke in ihrem Territorium zu schmieden, Ihr könnt ihre Meinung über Euch mit Bestechungen verbessern, oder einfach das Beste hoffen und sie ermorden lassen. Beachtet, dass bei mehreren vorhandenen Mitgliedern in einer Fraktion, einer von ihnen immer den Platz des Fraktionsführers einnehmen wird, wenn er oder sie die Fraktion aus irgendeinem Grund verlassen sollte. ;;Hay varias maneras de conseguir que los vasallos abandonen su facción: puedes enviar a tu Maestro de Espías para que maquine en su territorio, puedes incrementar su opinión sobre ti mediante sobornos o puedes simplemente desearles lo mejor y ordenarlos matar. Ten en cuenta que si hay varios miembros en una facción, siempre uno de ellos asumirá el liderato si el líder la abandona por cualquier motivo.;;;;;;;;;x
HINT_FACTIONS_VIEW_TEXT_4;The upper section of this screen lists the Factions that your Vassals have formed against you, their Liege. If you have a Liege of your own, the lower section will show the Factions that you or your fellow Vassals have formed.;Le haut de cet écran liste les factions que vos vassaux ont formées contre vous, leur seigneur lige. Si vous avez votre propre seigneur lige, le bas de l'écran montrera les factions que vous ou vos fidèles vassaux auront formées.;Der obere Bereich dieser Ansicht listet die Fraktionen auf, die Eure Vasallen gegen Euch, ihren Lehnsherren, gebildet haben. Falls Ihr selbst einen Lehnsherren habt, zeigt Euch der untere Bereich, welche Fraktionen Ihr oder Eure Mit-Vasallen gebildet haben. ;;En la sección superior de esta pantalla se enumeran las facciones que han formado tus vasallos contra ti, su Señor. Si tú mismo dependes de un Señor, la sección inferior mostrará las facciones formadas por ti o por tus vasallos.;;;;;;;;;x
HINT_FACTIONS_VIEW_TITLE;The Faction View;Vue des factions;Die Fraktionsansicht;;Vista de Facciones;;;;;;;;;x
HINT_PLOT_VIEW_TEXT_1;This screen allows you to start a Plot, and there are also various other Decisions you can take here. Finally there are convenient lists of known plots and rebellious vassals, as well as your current prisoners.;Cet écran vous permet de déclencher des complots. D'autres décisions peuvent également être prises ici. Enfin, on y trouve des listes pratiques de complots et de vassaux rebelles connus, ainsi que de vos prisonniers actuels.;Diese Übersicht erlaubt es Euch, ein Komplott zu schmieden, und es gibt eine Reihe anderer Entscheidungen, die Ihr hier wählen könnt. Abschließend gibt es übersichtliche Listen bekannter Komplotte und rebellischer Vasallen sowie Eurer derzeitigen Gefangenen. ;;Esta pantalla te permite iniciar una conspiración, así como tomar determinadas decisiones. Por último, encontrarás listas útiles de conspiraciones conocidas y vasallos rebeldes, además de una relación de tus prisioneros actuales.;;;;;;;;;x
HINT_PLOT_VIEW_TEXT_2;The Decisions available to you depend on a number of factors, such as your character's religion. There are many different Decisions that cover everything from inviting new nobles to holding grand tournaments.;Les décisions disponibles dépendent de certains facteurs comme la religion de votre personnage. Elles influencent tout, depuis l'invitation de nouveaux nobles jusqu'à l'organisation de grandioses joutes.;Die möglichen Entscheidungen, wie Tuniere, Jagden oder einladen von Adligen hängen von unter anderem von Eurer Kultur und Religion ab.;;Las decisiones disponibles para ti dependerán de varios factores, tales como la religión de tu personaje. Hay muchas decisiones diferentes que abarcan desde invitaciones para nuevos nobles hasta la celebración de grandes torneos.;;;;;;;;;x
HINT_REPUBLIC_VIEW_TEXT_1;This screen is available only to Merchant Republics, and it gives you an overview of the Republic's five Patrician Families. The ruler of a Maritime Republic is elected for life, but the office will not necessarily be inherited by his heir.;Cet écran est disponible seulement pour les républiques maritimes. Il permet une vue d'ensemble des cinq familles patriciennes de la république en question. Le dirigeant d'une république maritime est élu à vie mais ce poste ne sera pas nécessairement légué à son héritier.;Diese Ansicht ist nur für Handelsrepubliken verfügbar und gibt Euch einen Überblick über die fünf Patrizierfamilien der Republik. Der Herrscher einer maritimen Republik wird auf Lebenszeit gewählt, doch das Amt wird nicht zwangsläufig an seine Nachkommen weitervererbt. ;;Esta pantalla solo está disponible para repúblicas mercantes y ofrece una visión general de las cinco familias patricias de la República. El gobernante de una república marítima es elegido de por vida, pero su mandato no es necesariamente heredado por su sucesor.;;;;;;;;;x
HINT_REPUBLIC_VIEW_TEXT_2;Every Patrician has a Respect value that is determined by a combination of their Age, their Prestige, and the amount of money they have contributed to their Campaign Fund. The Patrician with the highest Respect value becomes the Expected Successor, but that is still not a guarantee that he will be elected when the time comes for the Republic to choose a new ruler.;Chaque patricien possède une valeur de respect déterminée par la combinaison de son âge, de son prestige et du montant d'argent versé dans son fonds de campagne. Le patricien dont le prestige est le plus élevé devient le successeur désigné, mais rien ne garantit qu'il soit élu lorsque la République devra se choisir un nouveau dirigeant.;Jeder Patrizier besitzt einen Respekt-Wert, der durch eine Kombination ihres Alters, ihres Prestiges und der Geldmenge, die sie zu den Wahlkampffonds beigesteuert haben, bestimmt wird. Der Patrizier mit dem höchsten Respekt-Wert wird der Erwartete Nachfolger, doch dies garantiert noch immer nicht, dass er gewählt wird, wenn die Zeit gekommen ist, einen neuen Herrscher zu wählen. ;;Cada patricio tiene un valor de respeto determinado por la combinación de su edad, su prestigio y la cantidad de dinero con que ha contribuido a la fundación de su campaña. El patricio con mayor valor de respeto se convierte en el sucesor previsto, pero ello no garantiza su elección llegada la hora de que la República designe su nuevo gobernante.;;;;;;;;;x
HINT_REPUBLIC_VIEW_TEXT_3;The Family Palace is a holding that will remain with the dynasty who owns it until that dynasty dies out. It does not exist on the map and so can never be conquered by an enemy. In stark contrast to a feudal lord, this enables Patricians to continue playing even if they don't own land.;Le palais familial est une demeure qui restera la propriété de la famille qui la détient tant que la dynastie perdure. Ce palais n'existe pas sur la carte et ne peut donc pas être conquis par l'ennemi. Ainsi, contrairement aux seigneurs féodaux, les patriciens peuvent continuer à jouer même s'ils ne possèdent aucun territoire.;Der Familienpalast ist ein Besitztum, der in der Dynastie verbleibt, die ihn besitzt, bis diese Dynastie ausstirbt. Er existiert auf keiner Karte und kann somit niemals von Feinden eingenommen werden. Im krassen Kontrast zu einem feudalen Lord erlaubt dies Patriziern weiterzuspielen, auch wenn sie kein eigenes Land besitzen.;;El Palacio Familiar es una pertenencia que conserva la dinastía que lo posee hasta que se extingue. No figura en el mapa y, por tanto, no puede ser nunca conquistado por un enemigo. En marcado contraste con los señores feudales, esto permite a los patricios seguir jugando incluso aunque no posean tierras.;;;;;;;;;x
HINT_REPUBLIC_VIEW_TEXT_4;Below the palace is a list of all Trade Posts owned by this family and the income they provide. Trade Posts can be built in both foreign and domestic provinces, and they are a vital component in the building of a successful trade empire.;On trouve sous le palais une liste de tous les comptoirs détenus par cette famille ainsi que les revenus qu'ils procurent. Les comptoirs peuvent être construits dans des provinces étrangères comme dans les provinces intérieures et ils sont un élément crucial au succès d'un empire thalassocratique.;Unterhalb des Palastes ist eine Liste aller Handelsposten, die von dieser Familie besessen werden, und das Einkommen, das diese bereitstellen. Handelsposten können sowohl in ausländischen als auch in inländischen Provinzen gebaut werden und sind eine wichtige Komponente, um ein erfolgreiches Handelsreich zu erbauen.;;Bajo el palacio se muestra una lista con todos los puestos comerciales propiedad de esta familia y los ingresos que proporcionan. Los puestos comerciales pueden crearse tanto en provincias extranjeras como nacionales y son un componente vital en la construcción de un imperio comercial de éxito.;;;;;;;;;x
HINT_REPUBLIC_VIEW_TITLE;The Republic View;Vue de la République;Die republikanische Ansicht;;Vista de República;;;;;;;;;x
IN_FAVOR_OF;in favor of §Y$NAME$§!;en faveur de §Y$NAME$§!;zugunsten von §Y$NAME$§!;;a favor de §Y$NAME$§!;;;;;;;;;x
INTERACTION_REPUBLICS_NEED_REVOKE_REASON;Ruler of Republic has a valid revocation reason;Le dirigeant de la République a une raison valide de révocation;Der Herrscher der Republik hat einen gültigen Annullierungs-Grund;;El Gobernante de la República tiene una razón de revocación válida;;;;;;;;;x
INTERACTION_REQUIRES_PATRICIAN_DOWRY;Can afford the Bride Price of §Y$DOWRY$§!¤ for marriage with a noblewoman;A les moyens de payer la dot de §Y$DOWRY$§!¤ pour épouser une noble femme;Kann sich den Brautpreis von §Y$DOWRY$§!¤ für die Eheschließung mit einer Adeligen leisten;;Puede permitirse el precio de la dote de §Y$DOWRY$§!¤ por un matrimonio con una mujer noble;;;;;;;;;x
INTERACTION_REQUIRES_RECIPIENT_NO_CONTESTED_TITLES;§Y[Recipient.GetTitledFirstName]§! has no titles currently contested in a war;[Recipient.Get_Le_TitledFirstNameJ] n'a pas de titres contestés par une guerre;§Y[Recipient.GetTitledFirstName]§! besitzt derzeit keine Titel, die in einem Krieg streitig gemacht werden;;§Y[Recipient.GetTitledFirstName]§! no tiene títulos actualmente en disputa en una guerra;;;;;;;;;x
IS_EMBARGOING;Is Embargoing §Y$OTHER$§!;Décrète l'embargo contre §Y$OTHER$§!;Erhebt ein Embargo auf §Y$OTHER$§!;;Está embargando a §Y$OTHER$§!;;;;;;;;;x
IS_MERCHANT_REPUBLIC;Is Merchant Republic;Est une république maritime;Ist eine Handelsrepublik;;Es República Mercante;;;;;;;;;x
IS_NOT_EMBARGOING;Is NOT Embargoing §Y$OTHER$§!;Ne décrète pas d'embargo contre §Y$OTHER$§!;Stellt §Y$OTHER$§! NICHT unter Embargo;;NO Embarga a §Y$OTHER$§!;;;;;;;;;x
IS_OLDER_THAN;Is Older than ;Est plus âgé que ;Ist älter als ;;Es Mayor que ;;;;;;;;;x
IS_PATRICIAN;Is Patrician;Est patricien;Ist Patrizier;;es Patricio;;;;;;;;;x
IS_YOUNGER_THAN;Is Younger than ;Est plus jeune que ;Ist jünger als ;;Es más joven que ;;;;;;;;;x
ISNT_MERCHANT_REPUBLIC;Is NOT Merchant Republic;N'est pas une république maritime;Ist KEINE Handelsrepublik;;NO es República Mercante;;;;;;;;;x
ISNT_PATRICIAN;Is NOT Patrician;N'est pas patricien;Ist KEIN Patrizier;;NO es Patricio;;;;;;;;;x
LIFT_EMBARGO_EFFECT;Lift Embargo against $WHO$\n;Lever l'embargo contre $WHO$\n;Hebt das Embargo gegen $WHO$ auf\n;;Levantar embargo contra $WHO$\n;;;;;;;;;x
