#CODE;ENGLISH;FRENCH;GERMAN;;SPANISH;;;;;;;;;x
ATTACHED_TO_UNIT;£5£;£5£;£5£;;£5£;;;;;;;;;x
ATTACHED_UNIT;£4£;£4£;£4£;;£4£;;;;;;;;;x
attempting_suicide_tooltip;Has not attempted to commit suicide recently.;N'a pas tenté de se suicider récemment.;Hat in letzter Zeit nicht versucht, Selbstmord zu begehen.;;No ha tratado de suicidarse últimamente.;;;;;x
CHESS_BAD_MOVE;you making a bad move.;vous faites un mauvais coup.;Ihr macht einen schlechten Zug.;;estás haciendo una mala jugada.;;;;;x
CHESS_BAD_TRICK;of you botching the attempt to cheat.;votre tentative de tricherie avorte.;wie Ihr Euren Schummelversuch verpatzt.;;la trampa te sale como un churro.;;;;;x
CHESS_GOOD_MOVE;you making a good move.;vous faites un bon coup.;Ihr macht einen guten Zug.;;estás haciendo una buena jugada.;;;;;x
CHESS_GOOD_TRICK;of you cheating successfully.;vous trichez avec succès.;wie Ihr erfolgreich schummelt.;;haces trampas y funciona.;;;;;x
CHESS_GREAT_MOVE;you making a great move.;vous faites un coup génial.;Ihr macht einen tollen Zug.;;estás haciendo una gran jugada.;;;;;x
CHESS_NEUTRAL_MOVE;you making a neutral move.;vous faites un coup moyen.;Ihr macht einen neutralen Zug.;;estás haciendo una jugada ni buena ni mala.;;;;;x
chess_score_number;[Root.chess_score.GetValue];[Root.chess_score.GetValue];[Root.chess_score.GetValue];;[Root.chess_score.GetValue];;;;;x
CHESS_TERRIBLE_MOVE;you making a terrible move.;vous faites une gaffe.;Ihr macht einen katastrophalen Zug.;;estás haciendo una malísima jugada.;;;;;x
commit_suicide_allow_tooltip;§Y[Root.GetTitledFirstName]§! must have a reason to commit suicide.\n;[Root.Get_Le_TitledFirstNameJ] doit avoir une raison de commettre un suicide.\n;§Y[Root.GetTitledFirstName]§! muss einen Grund haben, um Selbstmord zu begehen.\n;;§Y[Root.GetTitledFirstName]§! debe de tener una razón para querer suicidarse.\n;;;;;x
CONVERTING;CONVERTING;CONVERSION;KONVERTIERUNG;;CONVERSIÓN;;;;;;;;;x
crazymurderdog_court_tooltip;The Court is shocked! ;La Cour est sous le choc ! ;Der Hof ist schockiert!;;¡La Corte está conmocionada!;;;;;;;;;x
crazymurderdog_tooltip;Their family will be rather upset. ;Sa famille sera très contrariée. ;Seine Familie wird ziemlich sauer sein.;;Su familia se disgustará.;;;;;;;;;x
DEATH_PLATYPUS;was horribly killed by the platypuses of $KILLER$;a été horriblement tué[Get_E] par les ornithorynques de $KILLER$;wurde auf schreckliche Weise von den Entenschnäbeln von $KILLER$ getötet;;sufrió una muerte horrible a manos de los ornitorrincos de $KILLER$;;;;;;;;;x
DEATH_PLATYPUS_NO_KILLER;was horribly killed by platypuses;a été horriblement tué[Get_E] par des ornithorynques;wurde auf schreckliche Weise von Entenschnäbeln getötet;;sufrió una muerte horrible a manos de los ornitorrincos;;;;;;;;;x
GOV_LANDED_CAN_NOT_INHERIT;Landed characters can not inherit;Les personnages possédant des terres ne peuvent pas hériter;Begüterte Charaktere können nicht erben.;;Los personajes hacendados no pueden heredar;;;;;;;;;x
immortal_hunter_tooltip;You are, or you believe yourself to be, a great hunter and trainer of unusual creatures. Creatures which get hungry... ;Vous êtes, ou vous croyez être, un grand chasseur et dompteur d'animaux rares. Des créatures qui ont faim... ;Sie sind, oder Sie glauben, ein großer Jäger zu sein und ein Dompteur von ungewöhnlichen Kreaturen. Kreaturen, die Hunger bekommen... ;;Usted es, o que creen que son, un gran cazador y entrenador de criaturas inusuales. Criaturas, que da hambre... ;;;;;;;;;x
IMMORTAL_RIVAL_COMING_TOOLTIP;How ominous.;Cela ne présage rien de bon.;Wie bedrohlich.;;¿Cómo de mal agüero.;;;;;;;;;x
pick_main_deity_timer_tooltip;Has not picked a patron deity for 10 years.\n;N'a pas choisi de divinité protectrice depuis 10 ans.\n;Hat seit 10 Jahren keine Schutzgottheit ausgewählt.\n;;No ha elegido a una deidad protectora en 10 años.\n;;;;;;x
pick_main_deity_tooltip;§Y[Root.GetTitledFirstName]§! gets to pick a new patron deity to worship.;[Root.Get_Le_TitledFirstNameJ] a à choisir une divinité protectrice à adorer.;§Y[Root.GetTitledFirstName]§! darf eine neue Schutzgottheit zum Anbeten auswählen.;;§Y[Root.GetTitledFirstName]§! puede elegir a una nueva deidad protectora a la que adorar.;;;;;;x